=== INICI DAILY SCRAPER (UTC): 2026-01-03 22:19:56 ===
2026-01-03 22:19:56 - ============================================================
2026-01-03 22:19:56 - 🌤️  DAILY WEATHER SCRAPER - VERSIÓ UTC
2026-01-03 22:19:56 - ============================================================
2026-01-03 22:19:56 - 
==================================================
2026-01-03 22:19:56 - 📡 Processant: Fornells de la Selva [UO]
2026-01-03 22:19:56 - 
🌐 Connectant a Fornells de la Selva...
2026-01-03 22:19:58 - 📊 Total files trobades a la taula: 45
2026-01-03 22:19:58 -    ✅ Període UTC: 00:00 - 00:30 | TX: 4.2 | TN: 3.8 | Pluja: 0.0
2026-01-03 22:19:58 -    ✅ Període UTC: 00:30 - 01:00 | TX: 4.3 | TN: 4.2 | Pluja: 0.0
2026-01-03 22:19:58 -    ✅ Període UTC: 01:00 - 01:30 | TX: 4.2 | TN: 3.9 | Pluja: 0.0
2026-01-03 22:19:58 -    ✅ Període UTC: 01:30 - 02:00 | TX: 3.9 | TN: 3.3 | Pluja: 0.0
2026-01-03 22:19:58 -    ✅ Període UTC: 02:00 - 02:30 | TX: 3.7 | TN: 3.0 | Pluja: 0.0
2026-01-03 22:19:58 -    ✅ Període UTC: 02:30 - 03:00 | TX: 3.3 | TN: 3.0 | Pluja: 0.0
2026-01-03 22:19:58 -    ✅ Període UTC: 03:00 - 03:30 | TX: 3.3 | TN: 3.2 | Pluja: 0.0
2026-01-03 22:19:58 -    ✅ Període UTC: 03:30 - 04:00 | TX: 3.6 | TN: 3.1 | Pluja: 0.0
2026-01-03 22:19:58 -    ✅ Període UTC: 04:00 - 04:30 | TX: 4.0 | TN: 3.6 | Pluja: 0.0
2026-01-03 22:19:58 -    ✅ Període UTC: 04:30 - 05:00 | TX: 4.3 | TN: 4.0 | Pluja: 0.0
2026-01-03 22:19:58 -    ✅ Període UTC: 05:00 - 05:30 | TX: 4.6 | TN: 4.3 | Pluja: 0.0
2026-01-03 22:19:58 -    ✅ Període UTC: 05:30 - 06:00 | TX: 4.6 | TN: 4.4 | Pluja: 0.0
2026-01-03 22:19:58 -    ✅ Període UTC: 06:00 - 06:30 | TX: 4.5 | TN: 4.4 | Pluja: 0.0
2026-01-03 22:19:58 -    ✅ Període UTC: 06:30 - 07:00 | TX: 4.6 | TN: 4.5 | Pluja: 0.0
2026-01-03 22:19:58 -    ✅ Període UTC: 07:00 - 07:30 | TX: 4.7 | TN: 4.5 | Pluja: 0.0
2026-01-03 22:19:58 -    ✅ Període UTC: 07:30 - 08:00 | TX: 5.1 | TN: 4.8 | Pluja: 0.0
2026-01-03 22:19:58 -    ✅ Període UTC: 08:00 - 08:30 | TX: 5.5 | TN: 5.1 | Pluja: 0.0
2026-01-03 22:19:58 -    ✅ Període UTC: 08:30 - 09:00 | TX: 6.4 | TN: 5.6 | Pluja: 0.0
2026-01-03 22:19:58 -    ✅ Període UTC: 09:00 - 09:30 | TX: 7.9 | TN: 6.4 | Pluja: 0.0
2026-01-03 22:19:58 -    ✅ Període UTC: 09:30 - 10:00 | TX: 8.9 | TN: 7.8 | Pluja: 0.0
2026-01-03 22:19:58 -    ✅ Període UTC: 10:00 - 10:30 | TX: 10.0 | TN: 8.9 | Pluja: 0.0
2026-01-03 22:19:58 -    ✅ Període UTC: 10:30 - 11:00 | TX: 10.3 | TN: 9.7 | Pluja: 0.0
2026-01-03 22:19:58 -    ✅ Període UTC: 11:00 - 11:30 | TX: 10.2 | TN: 9.9 | Pluja: 0.0
2026-01-03 22:19:58 -    ✅ Període UTC: 11:30 - 12:00 | TX: 10.2 | TN: 10.0 | Pluja: 0.0
2026-01-03 22:19:58 -    ✅ Període UTC: 12:00 - 12:30 | TX: 10.5 | TN: 9.9 | Pluja: 0.0
2026-01-03 22:19:58 -    ✅ Període UTC: 12:30 - 13:00 | TX: 10.0 | TN: 9.8 | Pluja: 0.0
2026-01-03 22:19:58 -    ✅ Període UTC: 13:00 - 13:30 | TX: 9.9 | TN: 9.8 | Pluja: 0.0
2026-01-03 22:19:58 -    ✅ Període UTC: 13:30 - 14:00 | TX: 9.8 | TN: 9.7 | Pluja: 0.0
2026-01-03 22:19:58 -    ✅ Període UTC: 14:00 - 14:30 | TX: 9.8 | TN: 9.7 | Pluja: 0.0
2026-01-03 22:19:58 -    ✅ Període UTC: 14:30 - 15:00 | TX: 9.7 | TN: 9.6 | Pluja: 0.0
2026-01-03 22:19:58 -    ✅ Període UTC: 15:00 - 15:30 | TX: 9.6 | TN: 9.5 | Pluja: 0.0
2026-01-03 22:19:58 -    ✅ Període UTC: 15:30 - 16:00 | TX: 9.4 | TN: 9.0 | Pluja: 0.0
2026-01-03 22:19:58 -    ✅ Període UTC: 16:00 - 16:30 | TX: 9.1 | TN: 8.7 | Pluja: 0.0
2026-01-03 22:19:58 -    ✅ Període UTC: 16:30 - 17:00 | TX: 8.7 | TN: 8.4 | Pluja: 0.0
2026-01-03 22:19:58 -    ✅ Període UTC: 17:00 - 17:30 | TX: 8.6 | TN: 8.4 | Pluja: 0.0
2026-01-03 22:19:58 -    ✅ Període UTC: 17:30 - 18:00 | TX: 8.5 | TN: 8.2 | Pluja: 0.0
2026-01-03 22:19:58 -    ✅ Període UTC: 18:00 - 18:30 | TX: 8.3 | TN: 7.9 | Pluja: 0.0
2026-01-03 22:19:58 -    ✅ Període UTC: 18:30 - 19:00 | TX: 8.2 | TN: 8.0 | Pluja: 0.0
2026-01-03 22:19:58 -    ✅ Període UTC: 19:00 - 19:30 | TX: 8.1 | TN: 7.8 | Pluja: 0.0
2026-01-03 22:19:58 -    ✅ Període UTC: 19:30 - 20:00 | TX: 7.9 | TN: 7.4 | Pluja: 0.0
2026-01-03 22:19:58 -    ✅ Període UTC: 20:00 - 20:30 | TX: 7.6 | TN: 7.4 | Pluja: 0.0
2026-01-03 22:19:58 -    ✅ Període UTC: 20:30 - 21:00 | TX: 7.6 | TN: 7.4 | Pluja: 0.0
2026-01-03 22:19:58 -    ✅ Període UTC: 21:00 - 21:30 | TX: 7.4 | TN: 7.2 | Pluja: 0.0
2026-01-03 22:19:58 -    ✅ Període UTC: 21:30 - 22:00 | TX: 7.3 | TN: 7.1 | Pluja: 0.0
2026-01-03 22:19:58 - 📈 Total períodes vàlids trobats: 44
2026-01-03 22:19:58 - 📊 RESUM CALCULAT:
2026-01-03 22:19:58 -    • Màxima del dia: 10.5°C
2026-01-03 22:19:58 -    • Mínima del dia: 3.0°C
2026-01-03 22:19:58 -    • Pluja acumulada: 0.0mm
2026-01-03 22:19:58 -    • Últim període: 21:30 - 22:00 UTC
2026-01-03 22:19:58 -    • Hora actualització: 22:19
2026-01-03 22:19:58 - 💾 Dades guardades a data/UO_20260103.csv (44 registres)
2026-01-03 22:19:58 - ✅ Fornells de la Selva: 44 períodes processats
2026-01-03 22:19:58 - 
==================================================
2026-01-03 22:19:58 - 📡 Processant: Girona [XJ]
2026-01-03 22:19:58 - 
🌐 Connectant a Girona...
2026-01-03 22:19:59 - 📊 Total files trobades a la taula: 45
2026-01-03 22:19:59 -    ✅ Període UTC: 00:00 - 00:30 | TX: 3.7 | TN: 3.2 | Pluja: 0.0
2026-01-03 22:19:59 -    ✅ Període UTC: 00:30 - 01:00 | TX: 3.9 | TN: 3.6 | Pluja: 0.0
2026-01-03 22:19:59 -    ✅ Període UTC: 01:00 - 01:30 | TX: 3.9 | TN: 3.6 | Pluja: 0.0
2026-01-03 22:19:59 -    ✅ Període UTC: 01:30 - 02:00 | TX: 4.0 | TN: 3.5 | Pluja: 0.0
2026-01-03 22:19:59 -    ✅ Període UTC: 02:00 - 02:30 | TX: 3.5 | TN: 2.9 | Pluja: 0.0
2026-01-03 22:19:59 -    ✅ Període UTC: 02:30 - 03:00 | TX: 3.1 | TN: 2.8 | Pluja: 0.0
2026-01-03 22:19:59 -    ✅ Període UTC: 03:00 - 03:30 | TX: 3.0 | TN: 2.9 | Pluja: 0.0
2026-01-03 22:19:59 -    ✅ Període UTC: 03:30 - 04:00 | TX: 3.5 | TN: 3.0 | Pluja: 0.0
2026-01-03 22:19:59 -    ✅ Període UTC: 04:00 - 04:30 | TX: 3.6 | TN: 3.5 | Pluja: 0.0
2026-01-03 22:19:59 -    ✅ Període UTC: 04:30 - 05:00 | TX: 3.6 | TN: 3.6 | Pluja: 0.0
2026-01-03 22:19:59 -    ✅ Període UTC: 05:00 - 05:30 | TX: 3.8 | TN: 3.6 | Pluja: 0.0
2026-01-03 22:19:59 -    ✅ Període UTC: 05:30 - 06:00 | TX: 3.9 | TN: 3.7 | Pluja: 0.0
2026-01-03 22:19:59 -    ✅ Període UTC: 06:00 - 06:30 | TX: 3.8 | TN: 3.7 | Pluja: 0.0
2026-01-03 22:19:59 -    ✅ Període UTC: 06:30 - 07:00 | TX: 3.9 | TN: 3.8 | Pluja: 0.0
2026-01-03 22:19:59 -    ✅ Període UTC: 07:00 - 07:30 | TX: 3.9 | TN: 3.7 | Pluja: 0.0
2026-01-03 22:19:59 -    ✅ Període UTC: 07:30 - 08:00 | TX: 4.3 | TN: 3.8 | Pluja: 0.0
2026-01-03 22:19:59 -    ✅ Període UTC: 08:00 - 08:30 | TX: 5.2 | TN: 4.3 | Pluja: 0.0
2026-01-03 22:19:59 -    ✅ Període UTC: 08:30 - 09:00 | TX: 6.5 | TN: 5.2 | Pluja: 0.0
2026-01-03 22:19:59 -    ✅ Període UTC: 09:00 - 09:30 | TX: 8.3 | TN: 6.6 | Pluja: 0.0
2026-01-03 22:19:59 -    ✅ Període UTC: 09:30 - 10:00 | TX: 9.5 | TN: 8.2 | Pluja: 0.2
2026-01-03 22:19:59 -    ✅ Període UTC: 10:00 - 10:30 | TX: 9.9 | TN: 9.2 | Pluja: 0.0
2026-01-03 22:19:59 -    ✅ Període UTC: 10:30 - 11:00 | TX: 10.0 | TN: 9.4 | Pluja: 0.0
2026-01-03 22:19:59 -    ✅ Període UTC: 11:00 - 11:30 | TX: 10.4 | TN: 9.9 | Pluja: 0.0
2026-01-03 22:19:59 -    ✅ Període UTC: 11:30 - 12:00 | TX: 10.3 | TN: 9.9 | Pluja: 0.0
2026-01-03 22:19:59 -    ✅ Període UTC: 12:00 - 12:30 | TX: 10.4 | TN: 9.9 | Pluja: 0.0
2026-01-03 22:19:59 -    ✅ Període UTC: 12:30 - 13:00 | TX: 10.0 | TN: 9.9 | Pluja: 0.0
2026-01-03 22:19:59 -    ✅ Període UTC: 13:00 - 13:30 | TX: 9.9 | TN: 9.6 | Pluja: 0.0
2026-01-03 22:19:59 -    ✅ Període UTC: 13:30 - 14:00 | TX: 9.7 | TN: 9.6 | Pluja: 0.0
2026-01-03 22:19:59 -    ✅ Període UTC: 14:00 - 14:30 | TX: 9.7 | TN: 9.7 | Pluja: 0.0
2026-01-03 22:19:59 -    ✅ Període UTC: 14:30 - 15:00 | TX: 9.8 | TN: 9.7 | Pluja: 0.0
2026-01-03 22:19:59 -    ✅ Període UTC: 15:00 - 15:30 | TX: 9.9 | TN: 9.7 | Pluja: 0.0
2026-01-03 22:19:59 -    ✅ Període UTC: 15:30 - 16:00 | TX: 9.6 | TN: 9.3 | Pluja: 0.0
2026-01-03 22:19:59 -    ✅ Període UTC: 16:00 - 16:30 | TX: 9.3 | TN: 9.0 | Pluja: 0.0
2026-01-03 22:19:59 -    ✅ Període UTC: 16:30 - 17:00 | TX: 9.0 | TN: 8.8 | Pluja: 0.0
2026-01-03 22:19:59 -    ✅ Període UTC: 17:00 - 17:30 | TX: 8.9 | TN: 8.7 | Pluja: 0.0
2026-01-03 22:19:59 -    ✅ Període UTC: 17:30 - 18:00 | TX: 8.7 | TN: 8.4 | Pluja: 0.0
2026-01-03 22:19:59 -    ✅ Període UTC: 18:00 - 18:30 | TX: 8.4 | TN: 7.6 | Pluja: 0.0
2026-01-03 22:19:59 -    ✅ Període UTC: 18:30 - 19:00 | TX: 7.7 | TN: 7.4 | Pluja: 0.0
2026-01-03 22:19:59 -    ✅ Període UTC: 19:00 - 19:30 | TX: 7.4 | TN: 7.3 | Pluja: 0.0
2026-01-03 22:19:59 -    ✅ Període UTC: 19:30 - 20:00 | TX: 7.4 | TN: 7.3 | Pluja: 0.0
2026-01-03 22:19:59 -    ✅ Període UTC: 20:00 - 20:30 | TX: 7.4 | TN: 7.1 | Pluja: 0.0
2026-01-03 22:19:59 -    ✅ Període UTC: 20:30 - 21:00 | TX: 7.3 | TN: 7.2 | Pluja: 0.0
2026-01-03 22:19:59 -    ✅ Període UTC: 21:00 - 21:30 | TX: 7.3 | TN: 7.2 | Pluja: 0.0
2026-01-03 22:19:59 -    ✅ Període UTC: 21:30 - 22:00 | TX: 7.2 | TN: 7.0 | Pluja: 0.0
2026-01-03 22:19:59 - 📈 Total períodes vàlids trobats: 44
2026-01-03 22:19:59 - 📊 RESUM CALCULAT:
2026-01-03 22:19:59 -    • Màxima del dia: 10.4°C
2026-01-03 22:19:59 -    • Mínima del dia: 2.8°C
2026-01-03 22:19:59 -    • Pluja acumulada: 0.2mm
2026-01-03 22:19:59 -    • Últim període: 21:30 - 22:00 UTC
2026-01-03 22:19:59 -    • Hora actualització: 22:19
2026-01-03 22:19:59 - 💾 Dades guardades a data/XJ_20260103.csv (44 registres)
2026-01-03 22:19:59 - ✅ Girona: 44 períodes processats
2026-01-03 22:19:59 - 💾 Dades guardades a data/weather_daily_20260103.json
2026-01-03 22:19:59 - 💾 Dades guardades a data/weather_summary.json
2026-01-03 22:19:59 - 
============================================================
2026-01-03 22:19:59 - 📋 RESUM FINAL DEL DIA (UTC)
2026-01-03 22:19:59 - ============================================================
2026-01-03 22:19:59 - 
📍 Fornells de la Selva:
2026-01-03 22:19:59 -    • Períodes: 44
2026-01-03 22:19:59 -    • Màxima: 10.5°C
2026-01-03 22:19:59 -    • Mínima: 3.0°C
2026-01-03 22:19:59 -    • Pluja: 0.0mm
2026-01-03 22:19:59 -    • Últim període: 21:30 - 22:00 UTC
2026-01-03 22:19:59 -    • Actualització: 22:19
2026-01-03 22:19:59 - 
📍 Girona:
2026-01-03 22:19:59 -    • Períodes: 44
2026-01-03 22:19:59 -    • Màxima: 10.4°C
2026-01-03 22:19:59 -    • Mínima: 2.8°C
2026-01-03 22:19:59 -    • Pluja: 0.2mm
2026-01-03 22:19:59 -    • Últim període: 21:30 - 22:00 UTC
2026-01-03 22:19:59 -    • Actualització: 22:19
2026-01-03 22:19:59 - 
💾 Fitxers generats:
2026-01-03 22:19:59 -    • data/weather_summary.json (per HTML)
2026-01-03 22:19:59 -    • data/weather_daily_YYYYMMDD.json (complet)
2026-01-03 22:19:59 -    • data/XX_YYYYMMDD.csv (per estació)
2026-01-03 22:19:59 - 
✅ PROCÉS COMPLETAT
2026-01-03 22:19:59 - ============================================================
