=== INICI DAILY SCRAPER (UTC): 2026-01-26 20:49:57 ===
2026-01-26 20:49:57 - ============================================================
2026-01-26 20:49:57 - 🌤️  DAILY WEATHER SCRAPER - VERSIÓ UTC
2026-01-26 20:49:57 - ============================================================
2026-01-26 20:49:57 - 
==================================================
2026-01-26 20:49:57 - 📡 Processant: Fornells de la Selva [UO]
2026-01-26 20:49:57 - 
🌐 Connectant a Fornells de la Selva...
2026-01-26 20:49:59 - 📊 Total files trobades a la taula: 42
2026-01-26 20:49:59 -    ✅ Període UTC: 00:00 - 00:30 | TX: 1.6 | TN: 1.0 | Pluja: 0.0
2026-01-26 20:49:59 -    ✅ Període UTC: 00:30 - 01:00 | TX: 1.8 | TN: 1.4 | Pluja: 0.0
2026-01-26 20:49:59 -    ✅ Període UTC: 01:00 - 01:30 | TX: 2.0 | TN: 1.4 | Pluja: 0.0
2026-01-26 20:49:59 -    ✅ Període UTC: 01:30 - 02:00 | TX: 2.1 | TN: 1.6 | Pluja: 0.0
2026-01-26 20:49:59 -    ✅ Període UTC: 02:00 - 02:30 | TX: 2.1 | TN: 1.8 | Pluja: 0.0
2026-01-26 20:49:59 -    ✅ Període UTC: 02:30 - 03:00 | TX: 1.9 | TN: 1.3 | Pluja: 0.0
2026-01-26 20:49:59 -    ✅ Període UTC: 03:00 - 03:30 | TX: 1.5 | TN: 0.7 | Pluja: 0.0
2026-01-26 20:49:59 -    ✅ Període UTC: 03:30 - 04:00 | TX: 1.1 | TN: 0.5 | Pluja: 0.0
2026-01-26 20:49:59 -    ✅ Període UTC: 04:00 - 04:30 | TX: 1.0 | TN: 0.7 | Pluja: 0.0
2026-01-26 20:49:59 -    ✅ Període UTC: 04:30 - 05:00 | TX: 1.0 | TN: 0.2 | Pluja: 0.0
2026-01-26 20:49:59 -    ✅ Període UTC: 05:00 - 05:30 | TX: 0.9 | TN: 0.1 | Pluja: 0.0
2026-01-26 20:49:59 -    ✅ Període UTC: 05:30 - 06:00 | TX: 0.5 | TN: -0.1 | Pluja: 0.0
2026-01-26 20:49:59 -    ✅ Període UTC: 06:00 - 06:30 | TX: 1.0 | TN: 0.4 | Pluja: 0.1
2026-01-26 20:49:59 -    ✅ Període UTC: 06:30 - 07:00 | TX: 0.6 | TN: 0.2 | Pluja: 0.0
2026-01-26 20:49:59 -    ✅ Període UTC: 07:00 - 07:30 | TX: 1.3 | TN: 0.3 | Pluja: 0.0
2026-01-26 20:49:59 -    ✅ Període UTC: 07:30 - 08:00 | TX: 2.9 | TN: 1.2 | Pluja: 0.0
2026-01-26 20:49:59 -    ✅ Període UTC: 08:00 - 08:30 | TX: 6.9 | TN: 2.5 | Pluja: 0.0
2026-01-26 20:49:59 -    ✅ Període UTC: 08:30 - 09:00 | TX: 8.4 | TN: 6.9 | Pluja: 0.0
2026-01-26 20:49:59 -    ✅ Període UTC: 09:00 - 09:30 | TX: 9.8 | TN: 7.6 | Pluja: 0.0
2026-01-26 20:49:59 -    ✅ Període UTC: 09:30 - 10:00 | TX: 10.3 | TN: 9.3 | Pluja: 0.0
2026-01-26 20:49:59 -    ✅ Període UTC: 10:00 - 10:30 | TX: 11.6 | TN: 10.4 | Pluja: 0.0
2026-01-26 20:49:59 -    ✅ Període UTC: 10:30 - 11:00 | TX: 12.2 | TN: 11.6 | Pluja: 0.0
2026-01-26 20:49:59 -    ✅ Període UTC: 11:00 - 11:30 | TX: 12.8 | TN: 12.2 | Pluja: 0.0
2026-01-26 20:49:59 -    ✅ Període UTC: 11:30 - 12:00 | TX: 13.3 | TN: 12.3 | Pluja: 0.0
2026-01-26 20:49:59 -    ✅ Període UTC: 12:00 - 12:30 | TX: 13.3 | TN: 12.7 | Pluja: 0.0
2026-01-26 20:49:59 -    ✅ Període UTC: 12:30 - 13:00 | TX: 14.0 | TN: 13.3 | Pluja: 0.0
2026-01-26 20:49:59 -    ✅ Període UTC: 13:00 - 13:30 | TX: 14.2 | TN: 13.5 | Pluja: 0.0
2026-01-26 20:49:59 -    ✅ Període UTC: 13:30 - 14:00 | TX: 14.1 | TN: 12.0 | Pluja: 0.0
2026-01-26 20:49:59 -    ✅ Període UTC: 14:00 - 14:30 | TX: 12.6 | TN: 12.0 | Pluja: 0.0
2026-01-26 20:49:59 -    ✅ Període UTC: 14:30 - 15:00 | TX: 12.4 | TN: 11.5 | Pluja: 0.0
2026-01-26 20:49:59 -    ✅ Període UTC: 15:00 - 15:30 | TX: 11.7 | TN: 11.1 | Pluja: 0.0
2026-01-26 20:49:59 -    ✅ Període UTC: 15:30 - 16:00 | TX: 11.2 | TN: 10.2 | Pluja: 0.0
2026-01-26 20:49:59 -    ✅ Període UTC: 16:00 - 16:30 | TX: 10.3 | TN: 9.6 | Pluja: 0.0
2026-01-26 20:49:59 -    ✅ Període UTC: 16:30 - 17:00 | TX: 9.4 | TN: 8.5 | Pluja: 0.0
2026-01-26 20:49:59 -    ✅ Període UTC: 17:00 - 17:30 | TX: 8.6 | TN: 8.2 | Pluja: 0.0
2026-01-26 20:49:59 -    ✅ Període UTC: 17:30 - 18:00 | TX: 8.6 | TN: 8.2 | Pluja: 0.0
2026-01-26 20:49:59 -    ✅ Període UTC: 18:00 - 18:30 | TX: 8.6 | TN: 7.1 | Pluja: 0.0
2026-01-26 20:49:59 -    ✅ Període UTC: 18:30 - 19:00 | TX: 7.5 | TN: 6.8 | Pluja: 0.0
2026-01-26 20:49:59 -    ✅ Període UTC: 19:00 - 19:30 | TX: 6.9 | TN: 6.5 | Pluja: 0.0
2026-01-26 20:49:59 -    ✅ Període UTC: 19:30 - 20:00 | TX: 6.9 | TN: 6.2 | Pluja: 0.0
2026-01-26 20:49:59 -    ✅ Període UTC: 20:00 - 20:30 | TX: 7.0 | TN: 6.1 | Pluja: 0.0
2026-01-26 20:49:59 - 📈 Total períodes vàlids trobats: 41
2026-01-26 20:49:59 - 📊 RESUM CALCULAT:
2026-01-26 20:49:59 -    • Màxima del dia: 14.2°C
2026-01-26 20:49:59 -    • Mínima del dia: -0.1°C
2026-01-26 20:49:59 -    • Pluja acumulada: 0.1mm
2026-01-26 20:49:59 -    • Últim període: 20:00 - 20:30 UTC
2026-01-26 20:49:59 -    • Hora actualització: 20:49
2026-01-26 20:49:59 - 💾 Dades guardades a data/UO_20260126.csv (41 registres)
2026-01-26 20:49:59 - ✅ Fornells de la Selva: 41 períodes processats
2026-01-26 20:49:59 - 
==================================================
2026-01-26 20:49:59 - 📡 Processant: Girona [XJ]
2026-01-26 20:49:59 - 
🌐 Connectant a Girona...
2026-01-26 20:50:00 - 📊 Total files trobades a la taula: 42
2026-01-26 20:50:00 -    ✅ Període UTC: 00:00 - 00:30 | TX: 1.8 | TN: 0.9 | Pluja: 0.0
2026-01-26 20:50:00 -    ✅ Període UTC: 00:30 - 01:00 | TX: 2.4 | TN: 1.6 | Pluja: 0.0
2026-01-26 20:50:00 -    ✅ Període UTC: 01:00 - 01:30 | TX: 2.8 | TN: 2.2 | Pluja: 0.0
2026-01-26 20:50:00 -    ✅ Període UTC: 01:30 - 02:00 | TX: 2.5 | TN: 2.3 | Pluja: 0.0
2026-01-26 20:50:00 -    ✅ Període UTC: 02:00 - 02:30 | TX: 2.3 | TN: 2.0 | Pluja: 0.0
2026-01-26 20:50:00 -    ✅ Període UTC: 02:30 - 03:00 | TX: 2.3 | TN: 1.6 | Pluja: 0.0
2026-01-26 20:50:00 -    ✅ Període UTC: 03:00 - 03:30 | TX: 1.8 | TN: 0.8 | Pluja: 0.0
2026-01-26 20:50:00 -    ✅ Període UTC: 03:30 - 04:00 | TX: 1.0 | TN: 0.6 | Pluja: 0.0
2026-01-26 20:50:00 -    ✅ Període UTC: 04:00 - 04:30 | TX: 1.6 | TN: 0.8 | Pluja: 0.0
2026-01-26 20:50:00 -    ✅ Període UTC: 04:30 - 05:00 | TX: 1.2 | TN: 0.8 | Pluja: 0.0
2026-01-26 20:50:00 -    ✅ Període UTC: 05:00 - 05:30 | TX: 1.0 | TN: 0.5 | Pluja: 0.0
2026-01-26 20:50:00 -    ✅ Període UTC: 05:30 - 06:00 | TX: 1.2 | TN: 0.6 | Pluja: 0.0
2026-01-26 20:50:00 -    ✅ Període UTC: 06:00 - 06:30 | TX: 1.2 | TN: 0.4 | Pluja: 0.0
2026-01-26 20:50:00 -    ✅ Període UTC: 06:30 - 07:00 | TX: 1.7 | TN: 0.5 | Pluja: 0.0
2026-01-26 20:50:00 -    ✅ Període UTC: 07:00 - 07:30 | TX: 2.6 | TN: 1.4 | Pluja: 0.0
2026-01-26 20:50:00 -    ✅ Període UTC: 07:30 - 08:00 | TX: 3.8 | TN: 1.9 | Pluja: 0.0
2026-01-26 20:50:00 -    ✅ Període UTC: 08:00 - 08:30 | TX: 5.8 | TN: 4.1 | Pluja: 0.0
2026-01-26 20:50:00 -    ✅ Període UTC: 08:30 - 09:00 | TX: 9.2 | TN: 5.9 | Pluja: 0.0
2026-01-26 20:50:00 -    ✅ Període UTC: 09:00 - 09:30 | TX: 10.7 | TN: 9.3 | Pluja: 0.0
2026-01-26 20:50:00 -    ✅ Període UTC: 09:30 - 10:00 | TX: 11.5 | TN: 10.5 | Pluja: 0.5
2026-01-26 20:50:00 -    ✅ Període UTC: 10:00 - 10:30 | TX: 12.4 | TN: 11.4 | Pluja: 0.0
2026-01-26 20:50:00 -    ✅ Període UTC: 10:30 - 11:00 | TX: 12.0 | TN: 11.3 | Pluja: 0.1
2026-01-26 20:50:00 -    ✅ Període UTC: 11:00 - 11:30 | TX: 12.1 | TN: 11.4 | Pluja: 0.0
2026-01-26 20:50:00 -    ✅ Període UTC: 11:30 - 12:00 | TX: 12.9 | TN: 12.1 | Pluja: 0.0
2026-01-26 20:50:00 -    ✅ Període UTC: 12:00 - 12:30 | TX: 14.1 | TN: 13.0 | Pluja: 0.1
2026-01-26 20:50:00 -    ✅ Període UTC: 12:30 - 13:00 | TX: 13.9 | TN: 13.4 | Pluja: 0.0
2026-01-26 20:50:00 -    ✅ Període UTC: 13:00 - 13:30 | TX: 14.4 | TN: 13.5 | Pluja: 0.0
2026-01-26 20:50:00 -    ✅ Període UTC: 13:30 - 14:00 | TX: 14.7 | TN: 13.2 | Pluja: 0.0
2026-01-26 20:50:00 -    ✅ Període UTC: 14:00 - 14:30 | TX: 14.1 | TN: 13.2 | Pluja: 0.0
2026-01-26 20:50:00 -    ✅ Període UTC: 14:30 - 15:00 | TX: 13.4 | TN: 12.6 | Pluja: 0.0
2026-01-26 20:50:00 -    ✅ Període UTC: 15:00 - 15:30 | TX: 12.5 | TN: 12.1 | Pluja: 0.0
2026-01-26 20:50:00 -    ✅ Període UTC: 15:30 - 16:00 | TX: 12.1 | TN: 11.5 | Pluja: 0.0
2026-01-26 20:50:00 -    ✅ Període UTC: 16:00 - 16:30 | TX: 11.6 | TN: 10.8 | Pluja: 0.0
2026-01-26 20:50:00 -    ✅ Període UTC: 16:30 - 17:00 | TX: 11.3 | TN: 10.8 | Pluja: 0.0
2026-01-26 20:50:00 -    ✅ Període UTC: 17:00 - 17:30 | TX: 10.8 | TN: 10.2 | Pluja: 0.0
2026-01-26 20:50:00 -    ✅ Període UTC: 17:30 - 18:00 | TX: 10.2 | TN: 9.7 | Pluja: 0.0
2026-01-26 20:50:00 -    ✅ Període UTC: 18:00 - 18:30 | TX: 9.7 | TN: 8.8 | Pluja: 0.0
2026-01-26 20:50:00 -    ✅ Període UTC: 18:30 - 19:00 | TX: 9.2 | TN: 8.9 | Pluja: 0.0
2026-01-26 20:50:00 -    ✅ Període UTC: 19:00 - 19:30 | TX: 9.0 | TN: 8.2 | Pluja: 0.0
2026-01-26 20:50:00 -    ✅ Període UTC: 19:30 - 20:00 | TX: 8.6 | TN: 8.3 | Pluja: 0.0
2026-01-26 20:50:00 -    ✅ Període UTC: 20:00 - 20:30 | TX: 8.4 | TN: 7.6 | Pluja: 0.0
2026-01-26 20:50:00 - 📈 Total períodes vàlids trobats: 41
2026-01-26 20:50:00 - 📊 RESUM CALCULAT:
2026-01-26 20:50:00 -    • Màxima del dia: 14.7°C
2026-01-26 20:50:00 -    • Mínima del dia: 0.4°C
2026-01-26 20:50:00 -    • Pluja acumulada: 0.7mm
2026-01-26 20:50:00 -    • Últim període: 20:00 - 20:30 UTC
2026-01-26 20:50:00 -    • Hora actualització: 20:50
2026-01-26 20:50:00 - 💾 Dades guardades a data/XJ_20260126.csv (41 registres)
2026-01-26 20:50:00 - ✅ Girona: 41 períodes processats
2026-01-26 20:50:00 - 💾 Dades guardades a data/weather_daily_20260126.json
2026-01-26 20:50:00 - 💾 Dades guardades a data/weather_summary.json
2026-01-26 20:50:00 - 
============================================================
2026-01-26 20:50:00 - 📋 RESUM FINAL DEL DIA (UTC)
2026-01-26 20:50:00 - ============================================================
2026-01-26 20:50:00 - 
📍 Fornells de la Selva:
2026-01-26 20:50:00 -    • Períodes: 41
2026-01-26 20:50:00 -    • Màxima: 14.2°C
2026-01-26 20:50:00 -    • Mínima: -0.1°C
2026-01-26 20:50:00 -    • Pluja: 0.1mm
2026-01-26 20:50:00 -    • Últim període: 20:00 - 20:30 UTC
2026-01-26 20:50:00 -    • Actualització: 20:49
2026-01-26 20:50:00 - 
📍 Girona:
2026-01-26 20:50:00 -    • Períodes: 41
2026-01-26 20:50:00 -    • Màxima: 14.7°C
2026-01-26 20:50:00 -    • Mínima: 0.4°C
2026-01-26 20:50:00 -    • Pluja: 0.7mm
2026-01-26 20:50:00 -    • Últim període: 20:00 - 20:30 UTC
2026-01-26 20:50:00 -    • Actualització: 20:50
2026-01-26 20:50:00 - 
💾 Fitxers generats:
2026-01-26 20:50:00 -    • data/weather_summary.json (per HTML)
2026-01-26 20:50:00 -    • data/weather_daily_YYYYMMDD.json (complet)
2026-01-26 20:50:00 -    • data/XX_YYYYMMDD.csv (per estació)
2026-01-26 20:50:00 - 
✅ PROCÉS COMPLETAT
2026-01-26 20:50:00 - ============================================================
