=== INICI DAILY SCRAPER (UTC): 2025-12-22 14:38:09 ===
2025-12-22 14:38:09 - ============================================================
2025-12-22 14:38:09 - 🌤️  DAILY WEATHER SCRAPER - VERSIÓ UTC
2025-12-22 14:38:09 - ============================================================
2025-12-22 14:38:09 - 
==================================================
2025-12-22 14:38:09 - 📡 Processant: Fornells de la Selva [UO]
2025-12-22 14:38:09 - 
🌐 Connectant a Fornells de la Selva...
2025-12-22 14:38:11 - 📊 Total files trobades a la taula: 30
2025-12-22 14:38:11 -    ✅ Període UTC: 00:00 - 00:30 | TX: 9.6 | TN: 9.4 | Pluja: 4.8
2025-12-22 14:38:11 -    ✅ Període UTC: 00:30 - 01:00 | TX: 10.0 | TN: 9.6 | Pluja: 1.5
2025-12-22 14:38:11 -    ✅ Període UTC: 01:00 - 01:30 | TX: 9.7 | TN: 9.6 | Pluja: 2.0
2025-12-22 14:38:11 -    ✅ Període UTC: 01:30 - 02:00 | TX: 9.6 | TN: 9.5 | Pluja: 1.4
2025-12-22 14:38:11 -    ✅ Període UTC: 02:00 - 02:30 | TX: 9.5 | TN: 9.5 | Pluja: 0.1
2025-12-22 14:38:11 -    ✅ Període UTC: 02:30 - 03:00 | TX: 9.5 | TN: 9.4 | Pluja: 0.1
2025-12-22 14:38:11 -    ✅ Període UTC: 03:00 - 03:30 | TX: 9.5 | TN: 9.4 | Pluja: 0.2
2025-12-22 14:38:11 -    ✅ Període UTC: 03:30 - 04:00 | TX: 9.4 | TN: 9.3 | Pluja: 0.1
2025-12-22 14:38:11 -    ✅ Període UTC: 04:00 - 04:30 | TX: 9.4 | TN: 9.2 | Pluja: 0.0
2025-12-22 14:38:11 -    ✅ Període UTC: 04:30 - 05:00 | TX: 9.6 | TN: 9.4 | Pluja: 0.2
2025-12-22 14:38:11 -    ✅ Període UTC: 05:00 - 05:30 | TX: 9.5 | TN: 9.4 | Pluja: 0.2
2025-12-22 14:38:11 -    ✅ Període UTC: 05:30 - 06:00 | TX: 9.5 | TN: 9.4 | Pluja: 0.7
2025-12-22 14:38:11 -    ✅ Període UTC: 06:00 - 06:30 | TX: 9.5 | TN: 8.9 | Pluja: 1.2
2025-12-22 14:38:11 -    ✅ Període UTC: 06:30 - 07:00 | TX: 8.8 | TN: 8.3 | Pluja: 1.8
2025-12-22 14:38:11 -    ✅ Període UTC: 07:00 - 07:30 | TX: 8.3 | TN: 8.0 | Pluja: 1.8
2025-12-22 14:38:11 -    ✅ Període UTC: 07:30 - 08:00 | TX: 8.0 | TN: 7.8 | Pluja: 1.3
2025-12-22 14:38:11 -    ✅ Període UTC: 08:00 - 08:30 | TX: 7.8 | TN: 7.5 | Pluja: 0.7
2025-12-22 14:38:11 -    ✅ Període UTC: 08:30 - 09:00 | TX: 7.5 | TN: 7.3 | Pluja: 0.6
2025-12-22 14:38:11 -    ✅ Període UTC: 09:00 - 09:30 | TX: 7.6 | TN: 7.3 | Pluja: 0.2
2025-12-22 14:38:11 -    ✅ Període UTC: 09:30 - 10:00 | TX: 7.6 | TN: 7.4 | Pluja: 0.4
2025-12-22 14:38:11 -    ✅ Període UTC: 10:00 - 10:30 | TX: 7.6 | TN: 7.5 | Pluja: 0.5
2025-12-22 14:38:11 -    ✅ Període UTC: 10:30 - 11:00 | TX: 7.9 | TN: 7.6 | Pluja: 0.4
2025-12-22 14:38:11 -    ✅ Període UTC: 11:00 - 11:30 | TX: 8.2 | TN: 8.0 | Pluja: 0.5
2025-12-22 14:38:11 -    ✅ Període UTC: 11:30 - 12:00 | TX: 8.1 | TN: 7.8 | Pluja: 0.5
2025-12-22 14:38:11 -    ✅ Període UTC: 12:00 - 12:30 | TX: 7.8 | TN: 7.6 | Pluja: 0.4
2025-12-22 14:38:11 -    ✅ Període UTC: 12:30 - 13:00 | TX: 7.7 | TN: 7.3 | Pluja: 0.2
2025-12-22 14:38:11 -    ✅ Període UTC: 13:00 - 13:30 | TX: 7.3 | TN: 7.2 | Pluja: 0.1
2025-12-22 14:38:11 -    ✅ Període UTC: 13:30 - 14:00 | TX: 7.1 | TN: 6.9 | Pluja: 0.1
2025-12-22 14:38:11 - 📈 Total períodes vàlids trobats: 28
2025-12-22 14:38:11 - 📊 RESUM CALCULAT:
2025-12-22 14:38:11 -    • Màxima del dia: 10.0°C
2025-12-22 14:38:11 -    • Mínima del dia: 6.9°C
2025-12-22 14:38:11 -    • Pluja acumulada: 21.999999999999996mm
2025-12-22 14:38:11 -    • Últim període: 13:30 - 14:00 UTC
2025-12-22 14:38:11 -    • Hora actualització: 14:38
2025-12-22 14:38:11 - 💾 Dades guardades a data/UO_20251222.csv (28 registres)
2025-12-22 14:38:11 - ✅ Fornells de la Selva: 28 períodes processats
2025-12-22 14:38:11 - 
==================================================
2025-12-22 14:38:11 - 📡 Processant: Girona [XJ]
2025-12-22 14:38:11 - 
🌐 Connectant a Girona...
2025-12-22 14:38:12 - 📊 Total files trobades a la taula: 30
2025-12-22 14:38:12 -    ✅ Període UTC: 00:00 - 00:30 | TX: 9.2 | TN: 8.8 | Pluja: 5.6
2025-12-22 14:38:12 -    ✅ Període UTC: 00:30 - 01:00 | TX: 9.3 | TN: 9.2 | Pluja: 2.5
2025-12-22 14:38:12 -    ✅ Període UTC: 01:00 - 01:30 | TX: 9.3 | TN: 9.2 | Pluja: 2.2
2025-12-22 14:38:12 -    ✅ Període UTC: 01:30 - 02:00 | TX: 9.3 | TN: 9.2 | Pluja: 1.5
2025-12-22 14:38:12 -    ✅ Període UTC: 02:00 - 02:30 | TX: 9.2 | TN: 9.2 | Pluja: 0.2
2025-12-22 14:38:12 -    ✅ Període UTC: 02:30 - 03:00 | TX: 9.3 | TN: 9.2 | Pluja: 0.1
2025-12-22 14:38:12 -    ✅ Període UTC: 03:00 - 03:30 | TX: 9.4 | TN: 9.3 | Pluja: 0.1
2025-12-22 14:38:12 -    ✅ Període UTC: 03:30 - 04:00 | TX: 9.3 | TN: 9.2 | Pluja: 0.1
2025-12-22 14:38:12 -    ✅ Període UTC: 04:00 - 04:30 | TX: 9.4 | TN: 9.2 | Pluja: 0.0
2025-12-22 14:38:12 -    ✅ Període UTC: 04:30 - 05:00 | TX: 9.5 | TN: 9.4 | Pluja: 0.2
2025-12-22 14:38:12 -    ✅ Període UTC: 05:00 - 05:30 | TX: 9.5 | TN: 9.5 | Pluja: 0.2
2025-12-22 14:38:12 -    ✅ Període UTC: 05:30 - 06:00 | TX: 9.5 | TN: 9.2 | Pluja: 0.5
2025-12-22 14:38:12 -    ✅ Període UTC: 06:00 - 06:30 | TX: 9.2 | TN: 8.9 | Pluja: 2.0
2025-12-22 14:38:12 -    ✅ Període UTC: 06:30 - 07:00 | TX: 8.9 | TN: 8.6 | Pluja: 1.9
2025-12-22 14:38:12 -    ✅ Període UTC: 07:00 - 07:30 | TX: 8.6 | TN: 8.3 | Pluja: 1.7
2025-12-22 14:38:12 -    ✅ Període UTC: 07:30 - 08:00 | TX: 8.3 | TN: 7.8 | Pluja: 1.5
2025-12-22 14:38:12 -    ✅ Període UTC: 08:00 - 08:30 | TX: 7.8 | TN: 7.7 | Pluja: 1.3
2025-12-22 14:38:12 -    ✅ Període UTC: 08:30 - 09:00 | TX: 7.7 | TN: 7.5 | Pluja: 0.6
2025-12-22 14:38:12 -    ✅ Període UTC: 09:00 - 09:30 | TX: 7.6 | TN: 7.5 | Pluja: 0.1
2025-12-22 14:38:12 -    ✅ Període UTC: 09:30 - 10:00 | TX: 7.9 | TN: 7.5 | Pluja: 0.5
2025-12-22 14:38:12 -    ✅ Període UTC: 10:00 - 10:30 | TX: 8.1 | TN: 7.9 | Pluja: 0.6
2025-12-22 14:38:12 -    ✅ Període UTC: 10:30 - 11:00 | TX: 8.3 | TN: 8.1 | Pluja: 0.6
2025-12-22 14:38:12 -    ✅ Període UTC: 11:00 - 11:30 | TX: 8.3 | TN: 7.8 | Pluja: 0.4
2025-12-22 14:38:12 -    ✅ Període UTC: 11:30 - 12:00 | TX: 7.9 | TN: 7.6 | Pluja: 0.6
2025-12-22 14:38:12 -    ✅ Període UTC: 12:00 - 12:30 | TX: 7.7 | TN: 7.4 | Pluja: 0.4
2025-12-22 14:38:12 -    ✅ Període UTC: 12:30 - 13:00 | TX: 7.4 | TN: 7.1 | Pluja: 0.3
2025-12-22 14:38:12 -    ✅ Període UTC: 13:00 - 13:30 | TX: 7.2 | TN: 6.9 | Pluja: 0.1
2025-12-22 14:38:12 -    ✅ Període UTC: 13:30 - 14:00 | TX: 7.0 | TN: 6.7 | Pluja: 0.1
2025-12-22 14:38:12 - 📈 Total períodes vàlids trobats: 28
2025-12-22 14:38:12 - 📊 RESUM CALCULAT:
2025-12-22 14:38:12 -    • Màxima del dia: 9.5°C
2025-12-22 14:38:12 -    • Mínima del dia: 6.7°C
2025-12-22 14:38:12 -    • Pluja acumulada: 25.900000000000006mm
2025-12-22 14:38:12 -    • Últim període: 13:30 - 14:00 UTC
2025-12-22 14:38:12 -    • Hora actualització: 14:38
2025-12-22 14:38:12 - 💾 Dades guardades a data/XJ_20251222.csv (28 registres)
2025-12-22 14:38:12 - ✅ Girona: 28 períodes processats
2025-12-22 14:38:12 - 💾 Dades guardades a data/weather_daily_20251222.json
2025-12-22 14:38:12 - 💾 Dades guardades a data/weather_summary.json
2025-12-22 14:38:12 - 
============================================================
2025-12-22 14:38:12 - 📋 RESUM FINAL DEL DIA (UTC)
2025-12-22 14:38:12 - ============================================================
2025-12-22 14:38:12 - 
📍 Fornells de la Selva:
2025-12-22 14:38:12 -    • Períodes: 28
2025-12-22 14:38:12 -    • Màxima: 10.0°C
2025-12-22 14:38:12 -    • Mínima: 6.9°C
2025-12-22 14:38:12 -    • Pluja: 21.999999999999996mm
2025-12-22 14:38:12 -    • Últim període: 13:30 - 14:00 UTC
2025-12-22 14:38:12 -    • Actualització: 14:38
2025-12-22 14:38:12 - 
📍 Girona:
2025-12-22 14:38:12 -    • Períodes: 28
2025-12-22 14:38:12 -    • Màxima: 9.5°C
2025-12-22 14:38:12 -    • Mínima: 6.7°C
2025-12-22 14:38:12 -    • Pluja: 25.900000000000006mm
2025-12-22 14:38:12 -    • Últim període: 13:30 - 14:00 UTC
2025-12-22 14:38:12 -    • Actualització: 14:38
2025-12-22 14:38:12 - 
💾 Fitxers generats:
2025-12-22 14:38:12 -    • data/weather_summary.json (per HTML)
2025-12-22 14:38:12 -    • data/weather_daily_YYYYMMDD.json (complet)
2025-12-22 14:38:12 -    • data/XX_YYYYMMDD.csv (per estació)
2025-12-22 14:38:12 - 
✅ PROCÉS COMPLETAT
2025-12-22 14:38:12 - ============================================================
