=== INICI DAILY SCRAPER (UTC): 2026-01-29 15:50:22 ===
2026-01-29 15:50:22 - ============================================================
2026-01-29 15:50:22 - 🌤️  DAILY WEATHER SCRAPER - VERSIÓ UTC
2026-01-29 15:50:22 - ============================================================
2026-01-29 15:50:22 - 
==================================================
2026-01-29 15:50:22 - 📡 Processant: Fornells de la Selva [UO]
2026-01-29 15:50:22 - 
🌐 Connectant a Fornells de la Selva...
2026-01-29 15:50:24 - 📊 Total files trobades a la taula: 32
2026-01-29 15:50:24 -    ✅ Període UTC: 00:00 - 00:30 | TX: 0.7 | TN: -0.1 | Pluja: 0.0
2026-01-29 15:50:24 -    ✅ Període UTC: 00:30 - 01:00 | TX: 0.7 | TN: 0.4 | Pluja: 0.0
2026-01-29 15:50:24 -    ✅ Període UTC: 01:00 - 01:30 | TX: 0.7 | TN: 0.4 | Pluja: 0.0
2026-01-29 15:50:24 -    ✅ Període UTC: 01:30 - 02:00 | TX: 0.8 | TN: 0.7 | Pluja: 0.0
2026-01-29 15:50:24 -    ✅ Període UTC: 02:00 - 02:30 | TX: 0.9 | TN: 0.4 | Pluja: 0.0
2026-01-29 15:50:24 -    ✅ Període UTC: 02:30 - 03:00 | TX: 0.4 | TN: -0.1 | Pluja: 0.0
2026-01-29 15:50:24 -    ✅ Període UTC: 03:00 - 03:30 | TX: 0.0 | TN: -0.6 | Pluja: 0.0
2026-01-29 15:50:24 -    ✅ Període UTC: 03:30 - 04:00 | TX: -0.4 | TN: -0.8 | Pluja: 0.0
2026-01-29 15:50:24 -    ✅ Període UTC: 04:00 - 04:30 | TX: -0.6 | TN: -1.0 | Pluja: 0.0
2026-01-29 15:50:24 -    ✅ Període UTC: 04:30 - 05:00 | TX: -0.5 | TN: -0.9 | Pluja: 0.0
2026-01-29 15:50:24 -    ✅ Període UTC: 05:00 - 05:30 | TX: -0.8 | TN: -1.0 | Pluja: 0.0
2026-01-29 15:50:24 -    ✅ Període UTC: 05:30 - 06:00 | TX: -0.7 | TN: -1.1 | Pluja: 0.0
2026-01-29 15:50:24 -    ✅ Període UTC: 06:00 - 06:30 | TX: -0.3 | TN: -0.7 | Pluja: 0.0
2026-01-29 15:50:24 -    ✅ Període UTC: 06:30 - 07:00 | TX: 0.0 | TN: -0.3 | Pluja: 0.0
2026-01-29 15:50:24 -    ✅ Període UTC: 07:00 - 07:30 | TX: 0.0 | TN: -0.1 | Pluja: 0.0
2026-01-29 15:50:24 -    ✅ Període UTC: 07:30 - 08:00 | TX: 0.1 | TN: -0.3 | Pluja: 0.0
2026-01-29 15:50:24 -    ✅ Període UTC: 08:00 - 08:30 | TX: 0.8 | TN: 0.0 | Pluja: 0.0
2026-01-29 15:50:24 -    ✅ Període UTC: 08:30 - 09:00 | TX: 1.8 | TN: 0.9 | Pluja: 0.0
2026-01-29 15:50:24 -    ✅ Període UTC: 09:00 - 09:30 | TX: 3.4 | TN: 1.9 | Pluja: 0.0
2026-01-29 15:50:24 -    ✅ Període UTC: 09:30 - 10:00 | TX: 4.7 | TN: 3.4 | Pluja: 0.0
2026-01-29 15:50:24 -    ✅ Període UTC: 10:00 - 10:30 | TX: 7.5 | TN: 4.8 | Pluja: 0.0
2026-01-29 15:50:24 -    ✅ Període UTC: 10:30 - 11:00 | TX: 9.4 | TN: 7.3 | Pluja: 0.0
2026-01-29 15:50:24 -    ✅ Període UTC: 11:00 - 11:30 | TX: 11.2 | TN: 9.4 | Pluja: 0.0
2026-01-29 15:50:24 -    ✅ Període UTC: 11:30 - 12:00 | TX: 12.2 | TN: 11.0 | Pluja: 0.0
2026-01-29 15:50:24 -    ✅ Període UTC: 12:00 - 12:30 | TX: 11.9 | TN: 10.6 | Pluja: 0.0
2026-01-29 15:50:24 -    ✅ Període UTC: 12:30 - 13:00 | TX: 14.0 | TN: 11.9 | Pluja: 0.0
2026-01-29 15:50:24 -    ✅ Període UTC: 13:00 - 13:30 | TX: 14.0 | TN: 13.1 | Pluja: 0.0
2026-01-29 15:50:24 -    ✅ Període UTC: 13:30 - 14:00 | TX: 14.0 | TN: 13.1 | Pluja: 0.0
2026-01-29 15:50:24 -    ✅ Període UTC: 14:00 - 14:30 | TX: 13.3 | TN: 12.6 | Pluja: 0.0
2026-01-29 15:50:24 -    ✅ Període UTC: 14:30 - 15:00 | TX: 12.8 | TN: 12.4 | Pluja: 0.0
2026-01-29 15:50:24 -    ✅ Període UTC: 15:00 - 15:30 | TX: 12.8 | TN: 12.5 | Pluja: 0.0
2026-01-29 15:50:24 - 📈 Total períodes vàlids trobats: 31
2026-01-29 15:50:24 - 📊 RESUM CALCULAT:
2026-01-29 15:50:24 -    • Màxima del dia: 14.0°C
2026-01-29 15:50:24 -    • Mínima del dia: -1.1°C
2026-01-29 15:50:24 -    • Pluja acumulada: 0.0mm
2026-01-29 15:50:24 -    • Últim període: 15:00 - 15:30 UTC
2026-01-29 15:50:24 -    • Hora actualització: 15:50
2026-01-29 15:50:24 - 💾 Dades guardades a data/UO_20260129.csv (31 registres)
2026-01-29 15:50:24 - ✅ Fornells de la Selva: 31 períodes processats
2026-01-29 15:50:24 - 
==================================================
2026-01-29 15:50:24 - 📡 Processant: Girona [XJ]
2026-01-29 15:50:24 - 
🌐 Connectant a Girona...
2026-01-29 15:50:26 - 📊 Total files trobades a la taula: 32
2026-01-29 15:50:26 -    ✅ Període UTC: 00:00 - 00:30 | TX: 1.8 | TN: 1.1 | Pluja: 0.0
2026-01-29 15:50:26 -    ✅ Període UTC: 00:30 - 01:00 | TX: 1.7 | TN: 1.2 | Pluja: 0.0
2026-01-29 15:50:26 -    ✅ Període UTC: 01:00 - 01:30 | TX: 1.7 | TN: 1.3 | Pluja: 0.0
2026-01-29 15:50:26 -    ✅ Període UTC: 01:30 - 02:00 | TX: 1.6 | TN: 1.2 | Pluja: 0.0
2026-01-29 15:50:26 -    ✅ Període UTC: 02:00 - 02:30 | TX: 1.2 | TN: 0.6 | Pluja: 0.0
2026-01-29 15:50:26 -    ✅ Període UTC: 02:30 - 03:00 | TX: 0.6 | TN: 0.0 | Pluja: 0.0
2026-01-29 15:50:26 -    ✅ Període UTC: 03:00 - 03:30 | TX: 0.1 | TN: -0.3 | Pluja: 0.0
2026-01-29 15:50:26 -    ✅ Període UTC: 03:30 - 04:00 | TX: -0.2 | TN: -0.7 | Pluja: 0.0
2026-01-29 15:50:26 -    ✅ Període UTC: 04:00 - 04:30 | TX: -0.7 | TN: -0.9 | Pluja: 0.0
2026-01-29 15:50:26 -    ✅ Període UTC: 04:30 - 05:00 | TX: -0.7 | TN: -0.9 | Pluja: 0.0
2026-01-29 15:50:26 -    ✅ Període UTC: 05:00 - 05:30 | TX: -0.5 | TN: -1.1 | Pluja: 0.0
2026-01-29 15:50:26 -    ✅ Període UTC: 05:30 - 06:00 | TX: 0.0 | TN: -0.8 | Pluja: 0.0
2026-01-29 15:50:26 -    ✅ Període UTC: 06:00 - 06:30 | TX: -0.1 | TN: -0.4 | Pluja: 0.0
2026-01-29 15:50:26 -    ✅ Període UTC: 06:30 - 07:00 | TX: 0.2 | TN: -0.1 | Pluja: 0.0
2026-01-29 15:50:26 -    ✅ Període UTC: 07:00 - 07:30 | TX: 0.3 | TN: 0.0 | Pluja: 0.0
2026-01-29 15:50:26 -    ✅ Període UTC: 07:30 - 08:00 | TX: 0.8 | TN: -0.2 | Pluja: 0.0
2026-01-29 15:50:26 -    ✅ Període UTC: 08:00 - 08:30 | TX: 1.5 | TN: 0.5 | Pluja: 0.0
2026-01-29 15:50:26 -    ✅ Període UTC: 08:30 - 09:00 | TX: 2.9 | TN: 1.6 | Pluja: 0.0
2026-01-29 15:50:26 -    ✅ Període UTC: 09:00 - 09:30 | TX: 4.4 | TN: 2.9 | Pluja: 0.0
2026-01-29 15:50:26 -    ✅ Període UTC: 09:30 - 10:00 | TX: 5.8 | TN: 4.5 | Pluja: 0.0
2026-01-29 15:50:26 -    ✅ Període UTC: 10:00 - 10:30 | TX: 7.6 | TN: 5.9 | Pluja: 0.0
2026-01-29 15:50:26 -    ✅ Període UTC: 10:30 - 11:00 | TX: 10.0 | TN: 7.5 | Pluja: 0.0
2026-01-29 15:50:26 -    ✅ Període UTC: 11:00 - 11:30 | TX: 12.1 | TN: 9.9 | Pluja: 0.0
2026-01-29 15:50:26 -    ✅ Període UTC: 11:30 - 12:00 | TX: 12.5 | TN: 11.7 | Pluja: 0.0
2026-01-29 15:50:26 -    ✅ Període UTC: 12:00 - 12:30 | TX: 13.1 | TN: 11.8 | Pluja: 0.0
2026-01-29 15:50:26 -    ✅ Període UTC: 12:30 - 13:00 | TX: 14.1 | TN: 12.8 | Pluja: 0.0
2026-01-29 15:50:26 -    ✅ Període UTC: 13:00 - 13:30 | TX: 14.2 | TN: 13.8 | Pluja: 0.0
2026-01-29 15:50:26 -    ✅ Període UTC: 13:30 - 14:00 | TX: 14.3 | TN: 13.9 | Pluja: 0.0
2026-01-29 15:50:26 -    ✅ Període UTC: 14:00 - 14:30 | TX: 14.1 | TN: 13.4 | Pluja: 0.0
2026-01-29 15:50:26 -    ✅ Període UTC: 14:30 - 15:00 | TX: 13.4 | TN: 13.2 | Pluja: 0.0
2026-01-29 15:50:26 -    ✅ Període UTC: 15:00 - 15:30 | TX: 13.3 | TN: 12.9 | Pluja: 0.0
2026-01-29 15:50:26 - 📈 Total períodes vàlids trobats: 31
2026-01-29 15:50:26 - 📊 RESUM CALCULAT:
2026-01-29 15:50:26 -    • Màxima del dia: 14.3°C
2026-01-29 15:50:26 -    • Mínima del dia: -1.1°C
2026-01-29 15:50:26 -    • Pluja acumulada: 0.0mm
2026-01-29 15:50:26 -    • Últim període: 15:00 - 15:30 UTC
2026-01-29 15:50:26 -    • Hora actualització: 15:50
2026-01-29 15:50:26 - 💾 Dades guardades a data/XJ_20260129.csv (31 registres)
2026-01-29 15:50:26 - ✅ Girona: 31 períodes processats
2026-01-29 15:50:26 - 💾 Dades guardades a data/weather_daily_20260129.json
2026-01-29 15:50:26 - 💾 Dades guardades a data/weather_summary.json
2026-01-29 15:50:26 - 
============================================================
2026-01-29 15:50:26 - 📋 RESUM FINAL DEL DIA (UTC)
2026-01-29 15:50:26 - ============================================================
2026-01-29 15:50:26 - 
📍 Fornells de la Selva:
2026-01-29 15:50:26 -    • Períodes: 31
2026-01-29 15:50:26 -    • Màxima: 14.0°C
2026-01-29 15:50:26 -    • Mínima: -1.1°C
2026-01-29 15:50:26 -    • Pluja: 0.0mm
2026-01-29 15:50:26 -    • Últim període: 15:00 - 15:30 UTC
2026-01-29 15:50:26 -    • Actualització: 15:50
2026-01-29 15:50:26 - 
📍 Girona:
2026-01-29 15:50:26 -    • Períodes: 31
2026-01-29 15:50:26 -    • Màxima: 14.3°C
2026-01-29 15:50:26 -    • Mínima: -1.1°C
2026-01-29 15:50:26 -    • Pluja: 0.0mm
2026-01-29 15:50:26 -    • Últim període: 15:00 - 15:30 UTC
2026-01-29 15:50:26 -    • Actualització: 15:50
2026-01-29 15:50:26 - 
💾 Fitxers generats:
2026-01-29 15:50:26 -    • data/weather_summary.json (per HTML)
2026-01-29 15:50:26 -    • data/weather_daily_YYYYMMDD.json (complet)
2026-01-29 15:50:26 -    • data/XX_YYYYMMDD.csv (per estació)
2026-01-29 15:50:26 - 
✅ PROCÉS COMPLETAT
2026-01-29 15:50:26 - ============================================================
