=== INICI DAILY SCRAPER (UTC): 2026-02-12 20:20:23 ===
2026-02-12 20:20:23 - ============================================================
2026-02-12 20:20:23 - 🌤️  DAILY WEATHER SCRAPER - VERSIÓ UTC
2026-02-12 20:20:23 - ============================================================
2026-02-12 20:20:23 - 
==================================================
2026-02-12 20:20:23 - 📡 Processant: Fornells de la Selva [UO]
2026-02-12 20:20:23 - 
🌐 Connectant a Fornells de la Selva...
2026-02-12 20:20:24 - 📊 Total files trobades a la taula: 41
2026-02-12 20:20:24 -    ✅ Període UTC: 00:00 - 00:30 | TX: 10.5 | TN: 9.1 | Pluja: 0.0
2026-02-12 20:20:24 -    ✅ Període UTC: 00:30 - 01:00 | TX: 16.9 | TN: 9.0 | Pluja: 0.0
2026-02-12 20:20:24 -    ✅ Període UTC: 01:00 - 01:30 | TX: 16.6 | TN: 16.1 | Pluja: 0.0
2026-02-12 20:20:24 -    ✅ Període UTC: 01:30 - 02:00 | TX: 16.3 | TN: 15.8 | Pluja: 0.0
2026-02-12 20:20:24 -    ✅ Període UTC: 02:00 - 02:30 | TX: 16.2 | TN: 15.1 | Pluja: 0.0
2026-02-12 20:20:24 -    ✅ Període UTC: 02:30 - 03:00 | TX: 15.8 | TN: 15.3 | Pluja: 0.0
2026-02-12 20:20:24 -    ✅ Període UTC: 03:00 - 03:30 | TX: 15.5 | TN: 14.8 | Pluja: 0.0
2026-02-12 20:20:24 -    ✅ Període UTC: 03:30 - 04:00 | TX: 15.3 | TN: 14.7 | Pluja: 0.0
2026-02-12 20:20:24 -    ✅ Període UTC: 04:00 - 04:30 | TX: 15.2 | TN: 13.6 | Pluja: 0.0
2026-02-12 20:20:24 -    ✅ Període UTC: 04:30 - 05:00 | TX: 14.1 | TN: 12.4 | Pluja: 0.0
2026-02-12 20:20:24 -    ✅ Període UTC: 05:00 - 05:30 | TX: 12.8 | TN: 11.2 | Pluja: 0.0
2026-02-12 20:20:24 -    ✅ Període UTC: 05:30 - 06:00 | TX: 12.1 | TN: 9.9 | Pluja: 0.0
2026-02-12 20:20:24 -    ✅ Període UTC: 06:00 - 06:30 | TX: 13.8 | TN: 11.9 | Pluja: 0.0
2026-02-12 20:20:24 -    ✅ Període UTC: 06:30 - 07:00 | TX: 13.8 | TN: 12.0 | Pluja: 0.0
2026-02-12 20:20:24 -    ✅ Període UTC: 07:00 - 07:30 | TX: 12.6 | TN: 11.6 | Pluja: 0.0
2026-02-12 20:20:24 -    ✅ Període UTC: 07:30 - 08:00 | TX: 13.9 | TN: 12.5 | Pluja: 0.0
2026-02-12 20:20:24 -    ✅ Període UTC: 08:00 - 08:30 | TX: 14.5 | TN: 13.8 | Pluja: 0.0
2026-02-12 20:20:24 -    ✅ Període UTC: 08:30 - 09:00 | TX: 15.3 | TN: 14.6 | Pluja: 0.0
2026-02-12 20:20:24 -    ✅ Període UTC: 09:00 - 09:30 | TX: 16.5 | TN: 15.3 | Pluja: 0.0
2026-02-12 20:20:24 -    ✅ Període UTC: 09:30 - 10:00 | TX: 17.4 | TN: 16.5 | Pluja: 0.0
2026-02-12 20:20:24 -    ✅ Període UTC: 10:00 - 10:30 | TX: 18.3 | TN: 17.2 | Pluja: 0.0
2026-02-12 20:20:24 -    ✅ Període UTC: 10:30 - 11:00 | TX: 19.1 | TN: 18.2 | Pluja: 0.0
2026-02-12 20:20:24 -    ✅ Període UTC: 11:00 - 11:30 | TX: 19.5 | TN: 18.9 | Pluja: 0.0
2026-02-12 20:20:24 -    ✅ Període UTC: 11:30 - 12:00 | TX: 20.1 | TN: 18.9 | Pluja: 0.0
2026-02-12 20:20:24 -    ✅ Període UTC: 12:00 - 12:30 | TX: 20.7 | TN: 19.9 | Pluja: 0.0
2026-02-12 20:20:24 -    ✅ Període UTC: 12:30 - 13:00 | TX: 21.1 | TN: 20.7 | Pluja: 0.0
2026-02-12 20:20:24 -    ✅ Període UTC: 13:00 - 13:30 | TX: 21.0 | TN: 20.8 | Pluja: 0.0
2026-02-12 20:20:24 -    ✅ Període UTC: 13:30 - 14:00 | TX: 21.2 | TN: 20.5 | Pluja: 0.0
2026-02-12 20:20:24 -    ✅ Període UTC: 14:00 - 14:30 | TX: 20.6 | TN: 20.3 | Pluja: 0.0
2026-02-12 20:20:24 -    ✅ Període UTC: 14:30 - 15:00 | TX: 20.4 | TN: 20.2 | Pluja: 0.0
2026-02-12 20:20:24 -    ✅ Període UTC: 15:00 - 15:30 | TX: 20.4 | TN: 19.8 | Pluja: 0.0
2026-02-12 20:20:24 -    ✅ Període UTC: 15:30 - 16:00 | TX: 19.9 | TN: 18.6 | Pluja: 0.0
2026-02-12 20:20:24 -    ✅ Període UTC: 16:00 - 16:30 | TX: 18.6 | TN: 17.4 | Pluja: 0.0
2026-02-12 20:20:24 -    ✅ Període UTC: 16:30 - 17:00 | TX: 17.3 | TN: 16.3 | Pluja: 0.0
2026-02-12 20:20:24 -    ✅ Període UTC: 17:00 - 17:30 | TX: 16.4 | TN: 15.4 | Pluja: 0.0
2026-02-12 20:20:24 -    ✅ Període UTC: 17:30 - 18:00 | TX: 15.7 | TN: 15.4 | Pluja: 0.0
2026-02-12 20:20:24 -    ✅ Període UTC: 18:00 - 18:30 | TX: 15.5 | TN: 14.7 | Pluja: 0.0
2026-02-12 20:20:24 -    ✅ Període UTC: 18:30 - 19:00 | TX: 15.1 | TN: 14.6 | Pluja: 0.0
2026-02-12 20:20:24 -    ✅ Període UTC: 19:00 - 19:30 | TX: 14.9 | TN: 14.0 | Pluja: 0.0
2026-02-12 20:20:24 -    ✅ Període UTC: 19:30 - 20:00 | TX: 14.3 | TN: 13.2 | Pluja: 0.0
2026-02-12 20:20:24 - 📈 Total períodes vàlids trobats: 40
2026-02-12 20:20:24 - 📊 RESUM CALCULAT:
2026-02-12 20:20:24 -    • Màxima del dia: 21.2°C
2026-02-12 20:20:24 -    • Mínima del dia: 9.0°C
2026-02-12 20:20:24 -    • Pluja acumulada: 0.0mm
2026-02-12 20:20:24 -    • Últim període: 19:30 - 20:00 UTC
2026-02-12 20:20:24 -    • Hora actualització: 20:20
2026-02-12 20:20:24 - 💾 Dades guardades a data/UO_20260212.csv (40 registres)
2026-02-12 20:20:24 - ✅ Fornells de la Selva: 40 períodes processats
2026-02-12 20:20:24 - 
==================================================
2026-02-12 20:20:24 - 📡 Processant: Girona [XJ]
2026-02-12 20:20:24 - 
🌐 Connectant a Girona...
2026-02-12 20:20:26 - 📊 Total files trobades a la taula: 41
2026-02-12 20:20:26 -    ✅ Període UTC: 00:00 - 00:30 | TX: 15.7 | TN: 13.6 | Pluja: 0.0
2026-02-12 20:20:26 -    ✅ Període UTC: 00:30 - 01:00 | TX: 16.6 | TN: 13.5 | Pluja: 0.0
2026-02-12 20:20:26 -    ✅ Període UTC: 01:00 - 01:30 | TX: 16.6 | TN: 16.3 | Pluja: 0.0
2026-02-12 20:20:26 -    ✅ Període UTC: 01:30 - 02:00 | TX: 16.4 | TN: 15.8 | Pluja: 0.0
2026-02-12 20:20:26 -    ✅ Període UTC: 02:00 - 02:30 | TX: 15.8 | TN: 15.5 | Pluja: 0.0
2026-02-12 20:20:26 -    ✅ Període UTC: 02:30 - 03:00 | TX: 15.7 | TN: 15.4 | Pluja: 0.0
2026-02-12 20:20:26 -    ✅ Període UTC: 03:00 - 03:30 | TX: 15.4 | TN: 14.9 | Pluja: 0.0
2026-02-12 20:20:26 -    ✅ Període UTC: 03:30 - 04:00 | TX: 15.1 | TN: 14.8 | Pluja: 0.0
2026-02-12 20:20:26 -    ✅ Període UTC: 04:00 - 04:30 | TX: 14.8 | TN: 14.2 | Pluja: 0.0
2026-02-12 20:20:26 -    ✅ Període UTC: 04:30 - 05:00 | TX: 14.5 | TN: 13.8 | Pluja: 0.0
2026-02-12 20:20:26 -    ✅ Període UTC: 05:00 - 05:30 | TX: 14.3 | TN: 13.8 | Pluja: 0.0
2026-02-12 20:20:26 -    ✅ Període UTC: 05:30 - 06:00 | TX: 14.1 | TN: 13.7 | Pluja: 0.0
2026-02-12 20:20:26 -    ✅ Període UTC: 06:00 - 06:30 | TX: 14.0 | TN: 13.6 | Pluja: 0.0
2026-02-12 20:20:26 -    ✅ Període UTC: 06:30 - 07:00 | TX: 13.8 | TN: 13.5 | Pluja: 0.0
2026-02-12 20:20:26 -    ✅ Període UTC: 07:00 - 07:30 | TX: 14.0 | TN: 13.5 | Pluja: 0.0
2026-02-12 20:20:26 -    ✅ Període UTC: 07:30 - 08:00 | TX: 14.6 | TN: 13.9 | Pluja: 0.0
2026-02-12 20:20:26 -    ✅ Període UTC: 08:00 - 08:30 | TX: 15.0 | TN: 14.6 | Pluja: 0.0
2026-02-12 20:20:26 -    ✅ Període UTC: 08:30 - 09:00 | TX: 16.0 | TN: 15.1 | Pluja: 0.0
2026-02-12 20:20:26 -    ✅ Període UTC: 09:00 - 09:30 | TX: 16.8 | TN: 16.0 | Pluja: 0.0
2026-02-12 20:20:26 -    ✅ Període UTC: 09:30 - 10:00 | TX: 17.3 | TN: 16.7 | Pluja: 0.0
2026-02-12 20:20:26 -    ✅ Període UTC: 10:00 - 10:30 | TX: 17.9 | TN: 17.2 | Pluja: 0.0
2026-02-12 20:20:26 -    ✅ Període UTC: 10:30 - 11:00 | TX: 19.4 | TN: 17.9 | Pluja: 0.0
2026-02-12 20:20:26 -    ✅ Període UTC: 11:00 - 11:30 | TX: 20.2 | TN: 19.0 | Pluja: 0.0
2026-02-12 20:20:26 -    ✅ Període UTC: 11:30 - 12:00 | TX: 21.1 | TN: 20.0 | Pluja: 0.0
2026-02-12 20:20:26 -    ✅ Període UTC: 12:00 - 12:30 | TX: 21.3 | TN: 20.6 | Pluja: 0.0
2026-02-12 20:20:26 -    ✅ Període UTC: 12:30 - 13:00 | TX: 22.4 | TN: 21.1 | Pluja: 0.0
2026-02-12 20:20:26 -    ✅ Període UTC: 13:00 - 13:30 | TX: 22.2 | TN: 21.3 | Pluja: 0.0
2026-02-12 20:20:26 -    ✅ Període UTC: 13:30 - 14:00 | TX: 21.6 | TN: 21.1 | Pluja: 0.0
2026-02-12 20:20:26 -    ✅ Període UTC: 14:00 - 14:30 | TX: 21.6 | TN: 21.1 | Pluja: 0.0
2026-02-12 20:20:26 -    ✅ Període UTC: 14:30 - 15:00 | TX: 21.2 | TN: 20.9 | Pluja: 0.0
2026-02-12 20:20:26 -    ✅ Període UTC: 15:00 - 15:30 | TX: 21.2 | TN: 20.4 | Pluja: 0.0
2026-02-12 20:20:26 -    ✅ Període UTC: 15:30 - 16:00 | TX: 20.4 | TN: 19.4 | Pluja: 0.0
2026-02-12 20:20:26 -    ✅ Període UTC: 16:00 - 16:30 | TX: 19.4 | TN: 18.2 | Pluja: 0.0
2026-02-12 20:20:26 -    ✅ Període UTC: 16:30 - 17:00 | TX: 18.1 | TN: 17.2 | Pluja: 0.0
2026-02-12 20:20:26 -    ✅ Període UTC: 17:00 - 17:30 | TX: 17.1 | TN: 16.1 | Pluja: 0.0
2026-02-12 20:20:26 -    ✅ Període UTC: 17:30 - 18:00 | TX: 16.4 | TN: 15.9 | Pluja: 0.0
2026-02-12 20:20:26 -    ✅ Període UTC: 18:00 - 18:30 | TX: 16.0 | TN: 15.5 | Pluja: 0.0
2026-02-12 20:20:26 -    ✅ Període UTC: 18:30 - 19:00 | TX: 15.6 | TN: 15.1 | Pluja: 0.0
2026-02-12 20:20:26 -    ✅ Període UTC: 19:00 - 19:30 | TX: 15.3 | TN: 14.9 | Pluja: 0.0
2026-02-12 20:20:26 -    ✅ Període UTC: 19:30 - 20:00 | TX: 15.1 | TN: 14.3 | Pluja: 0.0
2026-02-12 20:20:26 - 📈 Total períodes vàlids trobats: 40
2026-02-12 20:20:26 - 📊 RESUM CALCULAT:
2026-02-12 20:20:26 -    • Màxima del dia: 22.4°C
2026-02-12 20:20:26 -    • Mínima del dia: 13.5°C
2026-02-12 20:20:26 -    • Pluja acumulada: 0.0mm
2026-02-12 20:20:26 -    • Últim període: 19:30 - 20:00 UTC
2026-02-12 20:20:26 -    • Hora actualització: 20:20
2026-02-12 20:20:26 - 💾 Dades guardades a data/XJ_20260212.csv (40 registres)
2026-02-12 20:20:26 - ✅ Girona: 40 períodes processats
2026-02-12 20:20:26 - 💾 Dades guardades a data/weather_daily_20260212.json
2026-02-12 20:20:26 - 💾 Dades guardades a data/weather_summary.json
2026-02-12 20:20:26 - 
============================================================
2026-02-12 20:20:26 - 📋 RESUM FINAL DEL DIA (UTC)
2026-02-12 20:20:26 - ============================================================
2026-02-12 20:20:26 - 
📍 Fornells de la Selva:
2026-02-12 20:20:26 -    • Períodes: 40
2026-02-12 20:20:26 -    • Màxima: 21.2°C
2026-02-12 20:20:26 -    • Mínima: 9.0°C
2026-02-12 20:20:26 -    • Pluja: 0.0mm
2026-02-12 20:20:26 -    • Últim període: 19:30 - 20:00 UTC
2026-02-12 20:20:26 -    • Actualització: 20:20
2026-02-12 20:20:26 - 
📍 Girona:
2026-02-12 20:20:26 -    • Períodes: 40
2026-02-12 20:20:26 -    • Màxima: 22.4°C
2026-02-12 20:20:26 -    • Mínima: 13.5°C
2026-02-12 20:20:26 -    • Pluja: 0.0mm
2026-02-12 20:20:26 -    • Últim període: 19:30 - 20:00 UTC
2026-02-12 20:20:26 -    • Actualització: 20:20
2026-02-12 20:20:26 - 
💾 Fitxers generats:
2026-02-12 20:20:26 -    • data/weather_summary.json (per HTML)
2026-02-12 20:20:26 -    • data/weather_daily_YYYYMMDD.json (complet)
2026-02-12 20:20:26 -    • data/XX_YYYYMMDD.csv (per estació)
2026-02-12 20:20:26 - 
✅ PROCÉS COMPLETAT
2026-02-12 20:20:26 - ============================================================
