=== INICI DAILY SCRAPER (UTC): 2025-12-29 20:50:12 ===
2025-12-29 20:50:12 - ============================================================
2025-12-29 20:50:12 - 🌤️  DAILY WEATHER SCRAPER - VERSIÓ UTC
2025-12-29 20:50:12 - ============================================================
2025-12-29 20:50:12 - 
==================================================
2025-12-29 20:50:12 - 📡 Processant: Fornells de la Selva [UO]
2025-12-29 20:50:12 - 
🌐 Connectant a Fornells de la Selva...
2025-12-29 20:50:13 - 📊 Total files trobades a la taula: 42
2025-12-29 20:50:13 -    ✅ Període UTC: 00:00 - 00:30 | TX: 9.0 | TN: 8.9 | Pluja: 0.0
2025-12-29 20:50:13 -    ✅ Període UTC: 00:30 - 01:00 | TX: 9.2 | TN: 9.0 | Pluja: 0.0
2025-12-29 20:50:13 -    ✅ Període UTC: 01:00 - 01:30 | TX: 9.2 | TN: 9.0 | Pluja: 0.0
2025-12-29 20:50:13 -    ✅ Període UTC: 01:30 - 02:00 | TX: 9.4 | TN: 9.1 | Pluja: 0.0
2025-12-29 20:50:13 -    ✅ Període UTC: 02:00 - 02:30 | TX: 9.6 | TN: 9.4 | Pluja: 0.0
2025-12-29 20:50:13 -    ✅ Període UTC: 02:30 - 03:00 | TX: 9.6 | TN: 9.5 | Pluja: 0.0
2025-12-29 20:50:13 -    ✅ Període UTC: 03:00 - 03:30 | TX: 9.7 | TN: 9.6 | Pluja: 2.7
2025-12-29 20:50:13 -    ✅ Període UTC: 03:30 - 04:00 | TX: 9.7 | TN: 9.5 | Pluja: 0.5
2025-12-29 20:50:13 -    ✅ Període UTC: 04:00 - 04:30 | TX: 9.5 | TN: 9.4 | Pluja: 0.7
2025-12-29 20:50:13 -    ✅ Període UTC: 04:30 - 05:00 | TX: 9.4 | TN: 9.4 | Pluja: 0.3
2025-12-29 20:50:13 -    ✅ Període UTC: 05:00 - 05:30 | TX: 9.4 | TN: 9.3 | Pluja: 0.2
2025-12-29 20:50:13 -    ✅ Període UTC: 05:30 - 06:00 | TX: 9.4 | TN: 9.3 | Pluja: 0.6
2025-12-29 20:50:13 -    ✅ Període UTC: 06:00 - 06:30 | TX: 9.4 | TN: 9.3 | Pluja: 0.0
2025-12-29 20:50:13 -    ✅ Període UTC: 06:30 - 07:00 | TX: 9.4 | TN: 9.4 | Pluja: 0.3
2025-12-29 20:50:13 -    ✅ Període UTC: 07:00 - 07:30 | TX: 9.4 | TN: 9.4 | Pluja: 0.1
2025-12-29 20:50:13 -    ✅ Període UTC: 07:30 - 08:00 | TX: 9.5 | TN: 9.4 | Pluja: 0.0
2025-12-29 20:50:13 -    ✅ Període UTC: 08:00 - 08:30 | TX: 9.6 | TN: 9.5 | Pluja: 0.0
2025-12-29 20:50:13 -    ✅ Període UTC: 08:30 - 09:00 | TX: 9.7 | TN: 9.6 | Pluja: 0.0
2025-12-29 20:50:13 -    ✅ Període UTC: 09:00 - 09:30 | TX: 10.0 | TN: 9.7 | Pluja: 0.0
2025-12-29 20:50:13 -    ✅ Període UTC: 09:30 - 10:00 | TX: 10.2 | TN: 10.0 | Pluja: 0.0
2025-12-29 20:50:13 -    ✅ Període UTC: 10:00 - 10:30 | TX: 10.5 | TN: 10.1 | Pluja: 0.0
2025-12-29 20:50:13 -    ✅ Període UTC: 10:30 - 11:00 | TX: 10.8 | TN: 10.5 | Pluja: 0.0
2025-12-29 20:50:13 -    ✅ Període UTC: 11:00 - 11:30 | TX: 11.0 | TN: 10.8 | Pluja: 0.0
2025-12-29 20:50:13 -    ✅ Període UTC: 11:30 - 12:00 | TX: 11.4 | TN: 11.0 | Pluja: 0.0
2025-12-29 20:50:13 -    ✅ Període UTC: 12:00 - 12:30 | TX: 11.6 | TN: 11.4 | Pluja: 0.0
2025-12-29 20:50:13 -    ✅ Període UTC: 12:30 - 13:00 | TX: 12.3 | TN: 11.6 | Pluja: 0.0
2025-12-29 20:50:13 -    ✅ Període UTC: 13:00 - 13:30 | TX: 12.3 | TN: 12.0 | Pluja: 0.0
2025-12-29 20:50:13 -    ✅ Període UTC: 13:30 - 14:00 | TX: 12.6 | TN: 12.3 | Pluja: 0.0
2025-12-29 20:50:13 -    ✅ Període UTC: 14:00 - 14:30 | TX: 12.6 | TN: 12.4 | Pluja: 0.0
2025-12-29 20:50:13 -    ✅ Període UTC: 14:30 - 15:00 | TX: 12.7 | TN: 12.2 | Pluja: 0.0
2025-12-29 20:50:13 -    ✅ Període UTC: 15:00 - 15:30 | TX: 12.8 | TN: 12.5 | Pluja: 0.0
2025-12-29 20:50:13 -    ✅ Període UTC: 15:30 - 16:00 | TX: 12.5 | TN: 11.6 | Pluja: 0.0
2025-12-29 20:50:13 -    ✅ Període UTC: 16:00 - 16:30 | TX: 11.6 | TN: 10.1 | Pluja: 0.0
2025-12-29 20:50:13 -    ✅ Període UTC: 16:30 - 17:00 | TX: 10.0 | TN: 8.5 | Pluja: 0.0
2025-12-29 20:50:13 -    ✅ Període UTC: 17:00 - 17:30 | TX: 8.4 | TN: 8.0 | Pluja: 0.0
2025-12-29 20:50:13 -    ✅ Període UTC: 17:30 - 18:00 | TX: 8.5 | TN: 7.3 | Pluja: 0.0
2025-12-29 20:50:13 -    ✅ Període UTC: 18:00 - 18:30 | TX: 7.6 | TN: 7.0 | Pluja: 0.0
2025-12-29 20:50:13 -    ✅ Període UTC: 18:30 - 19:00 | TX: 7.1 | TN: 6.8 | Pluja: 0.0
2025-12-29 20:50:13 -    ✅ Període UTC: 19:00 - 19:30 | TX: 6.9 | TN: 5.9 | Pluja: 0.0
2025-12-29 20:50:13 -    ✅ Període UTC: 19:30 - 20:00 | TX: 6.0 | TN: 5.7 | Pluja: 0.0
2025-12-29 20:50:13 -    ✅ Període UTC: 20:00 - 20:30 | TX: 5.8 | TN: 5.4 | Pluja: 0.0
2025-12-29 20:50:13 - 📈 Total períodes vàlids trobats: 41
2025-12-29 20:50:13 - 📊 RESUM CALCULAT:
2025-12-29 20:50:13 -    • Màxima del dia: 12.8°C
2025-12-29 20:50:13 -    • Mínima del dia: 5.4°C
2025-12-29 20:50:13 -    • Pluja acumulada: 5.3999999999999995mm
2025-12-29 20:50:13 -    • Últim període: 20:00 - 20:30 UTC
2025-12-29 20:50:13 -    • Hora actualització: 20:50
2025-12-29 20:50:13 - 💾 Dades guardades a data/UO_20251229.csv (41 registres)
2025-12-29 20:50:13 - ✅ Fornells de la Selva: 41 períodes processats
2025-12-29 20:50:13 - 
==================================================
2025-12-29 20:50:13 - 📡 Processant: Girona [XJ]
2025-12-29 20:50:13 - 
🌐 Connectant a Girona...
2025-12-29 20:50:14 - 📊 Total files trobades a la taula: 42
2025-12-29 20:50:14 -    ✅ Període UTC: 00:00 - 00:30 | TX: 8.7 | TN: 8.6 | Pluja: 0.0
2025-12-29 20:50:14 -    ✅ Període UTC: 00:30 - 01:00 | TX: 8.8 | TN: 8.6 | Pluja: 0.0
2025-12-29 20:50:14 -    ✅ Període UTC: 01:00 - 01:30 | TX: 9.0 | TN: 8.8 | Pluja: 0.0
2025-12-29 20:50:14 -    ✅ Període UTC: 01:30 - 02:00 | TX: 9.1 | TN: 9.0 | Pluja: 0.0
2025-12-29 20:50:14 -    ✅ Període UTC: 02:00 - 02:30 | TX: 9.2 | TN: 9.0 | Pluja: 0.0
2025-12-29 20:50:14 -    ✅ Període UTC: 02:30 - 03:00 | TX: 9.3 | TN: 9.2 | Pluja: 0.0
2025-12-29 20:50:14 -    ✅ Període UTC: 03:00 - 03:30 | TX: 9.8 | TN: 9.3 | Pluja: 0.0
2025-12-29 20:50:14 -    ✅ Període UTC: 03:30 - 04:00 | TX: 9.8 | TN: 9.5 | Pluja: 1.9
2025-12-29 20:50:14 -    ✅ Període UTC: 04:00 - 04:30 | TX: 9.5 | TN: 9.2 | Pluja: 0.6
2025-12-29 20:50:14 -    ✅ Període UTC: 04:30 - 05:00 | TX: 9.2 | TN: 9.2 | Pluja: 0.1
2025-12-29 20:50:14 -    ✅ Període UTC: 05:00 - 05:30 | TX: 9.2 | TN: 9.1 | Pluja: 0.2
2025-12-29 20:50:14 -    ✅ Període UTC: 05:30 - 06:00 | TX: 9.2 | TN: 9.1 | Pluja: 0.0
2025-12-29 20:50:14 -    ✅ Període UTC: 06:00 - 06:30 | TX: 9.2 | TN: 9.1 | Pluja: 0.0
2025-12-29 20:50:14 -    ✅ Període UTC: 06:30 - 07:00 | TX: 9.3 | TN: 9.1 | Pluja: 0.0
2025-12-29 20:50:14 -    ✅ Període UTC: 07:00 - 07:30 | TX: 9.2 | TN: 9.2 | Pluja: 0.0
2025-12-29 20:50:14 -    ✅ Període UTC: 07:30 - 08:00 | TX: 9.3 | TN: 9.3 | Pluja: 0.0
2025-12-29 20:50:14 -    ✅ Període UTC: 08:00 - 08:30 | TX: 9.4 | TN: 9.3 | Pluja: 0.1
2025-12-29 20:50:14 -    ✅ Període UTC: 08:30 - 09:00 | TX: 9.7 | TN: 9.4 | Pluja: 0.0
2025-12-29 20:50:14 -    ✅ Període UTC: 09:00 - 09:30 | TX: 9.9 | TN: 9.7 | Pluja: 0.0
2025-12-29 20:50:14 -    ✅ Període UTC: 09:30 - 10:00 | TX: 10.4 | TN: 9.9 | Pluja: 0.0
2025-12-29 20:50:14 -    ✅ Període UTC: 10:00 - 10:30 | TX: 10.6 | TN: 10.4 | Pluja: 0.0
2025-12-29 20:50:14 -    ✅ Període UTC: 10:30 - 11:00 | TX: 10.8 | TN: 10.6 | Pluja: 0.0
2025-12-29 20:50:14 -    ✅ Període UTC: 11:00 - 11:30 | TX: 11.2 | TN: 10.8 | Pluja: 0.0
2025-12-29 20:50:14 -    ✅ Període UTC: 11:30 - 12:00 | TX: 11.8 | TN: 11.2 | Pluja: 0.0
2025-12-29 20:50:14 -    ✅ Període UTC: 12:00 - 12:30 | TX: 12.0 | TN: 11.8 | Pluja: 0.0
2025-12-29 20:50:14 -    ✅ Període UTC: 12:30 - 13:00 | TX: 12.7 | TN: 11.8 | Pluja: 0.0
2025-12-29 20:50:14 -    ✅ Període UTC: 13:00 - 13:30 | TX: 13.1 | TN: 12.5 | Pluja: 0.0
2025-12-29 20:50:14 -    ✅ Període UTC: 13:30 - 14:00 | TX: 13.1 | TN: 12.9 | Pluja: 0.0
2025-12-29 20:50:14 -    ✅ Període UTC: 14:00 - 14:30 | TX: 13.3 | TN: 13.1 | Pluja: 0.0
2025-12-29 20:50:14 -    ✅ Període UTC: 14:30 - 15:00 | TX: 13.5 | TN: 13.1 | Pluja: 0.0
2025-12-29 20:50:14 -    ✅ Període UTC: 15:00 - 15:30 | TX: 13.6 | TN: 13.2 | Pluja: 0.0
2025-12-29 20:50:14 -    ✅ Període UTC: 15:30 - 16:00 | TX: 13.2 | TN: 12.6 | Pluja: 0.0
2025-12-29 20:50:14 -    ✅ Període UTC: 16:00 - 16:30 | TX: 12.5 | TN: 10.7 | Pluja: 0.0
2025-12-29 20:50:14 -    ✅ Període UTC: 16:30 - 17:00 | TX: 10.7 | TN: 9.4 | Pluja: 0.0
2025-12-29 20:50:14 -    ✅ Període UTC: 17:00 - 17:30 | TX: 9.4 | TN: 8.5 | Pluja: 0.0
2025-12-29 20:50:14 -    ✅ Període UTC: 17:30 - 18:00 | TX: 8.5 | TN: 8.0 | Pluja: 0.0
2025-12-29 20:50:14 -    ✅ Període UTC: 18:00 - 18:30 | TX: 8.0 | TN: 7.4 | Pluja: 0.0
2025-12-29 20:50:14 -    ✅ Període UTC: 18:30 - 19:00 | TX: 7.5 | TN: 6.5 | Pluja: 0.0
2025-12-29 20:50:14 -    ✅ Període UTC: 19:00 - 19:30 | TX: 6.6 | TN: 5.9 | Pluja: 0.0
2025-12-29 20:50:14 -    ✅ Període UTC: 19:30 - 20:00 | TX: 6.1 | TN: 5.3 | Pluja: 0.0
2025-12-29 20:50:14 -    ✅ Període UTC: 20:00 - 20:30 | TX: 5.6 | TN: 4.9 | Pluja: 0.0
2025-12-29 20:50:14 - 📈 Total períodes vàlids trobats: 41
2025-12-29 20:50:14 - 📊 RESUM CALCULAT:
2025-12-29 20:50:14 -    • Màxima del dia: 13.6°C
2025-12-29 20:50:14 -    • Mínima del dia: 4.9°C
2025-12-29 20:50:14 -    • Pluja acumulada: 2.9000000000000004mm
2025-12-29 20:50:14 -    • Últim període: 20:00 - 20:30 UTC
2025-12-29 20:50:14 -    • Hora actualització: 20:50
2025-12-29 20:50:14 - 💾 Dades guardades a data/XJ_20251229.csv (41 registres)
2025-12-29 20:50:14 - ✅ Girona: 41 períodes processats
2025-12-29 20:50:14 - 💾 Dades guardades a data/weather_daily_20251229.json
2025-12-29 20:50:14 - 💾 Dades guardades a data/weather_summary.json
2025-12-29 20:50:14 - 
============================================================
2025-12-29 20:50:14 - 📋 RESUM FINAL DEL DIA (UTC)
2025-12-29 20:50:14 - ============================================================
2025-12-29 20:50:14 - 
📍 Fornells de la Selva:
2025-12-29 20:50:14 -    • Períodes: 41
2025-12-29 20:50:14 -    • Màxima: 12.8°C
2025-12-29 20:50:14 -    • Mínima: 5.4°C
2025-12-29 20:50:14 -    • Pluja: 5.3999999999999995mm
2025-12-29 20:50:14 -    • Últim període: 20:00 - 20:30 UTC
2025-12-29 20:50:14 -    • Actualització: 20:50
2025-12-29 20:50:14 - 
📍 Girona:
2025-12-29 20:50:14 -    • Períodes: 41
2025-12-29 20:50:14 -    • Màxima: 13.6°C
2025-12-29 20:50:14 -    • Mínima: 4.9°C
2025-12-29 20:50:14 -    • Pluja: 2.9000000000000004mm
2025-12-29 20:50:14 -    • Últim període: 20:00 - 20:30 UTC
2025-12-29 20:50:14 -    • Actualització: 20:50
2025-12-29 20:50:14 - 
💾 Fitxers generats:
2025-12-29 20:50:14 -    • data/weather_summary.json (per HTML)
2025-12-29 20:50:14 -    • data/weather_daily_YYYYMMDD.json (complet)
2025-12-29 20:50:14 -    • data/XX_YYYYMMDD.csv (per estació)
2025-12-29 20:50:14 - 
✅ PROCÉS COMPLETAT
2025-12-29 20:50:14 - ============================================================
