=== INICI DAILY SCRAPER (UTC): 2026-01-19 14:56:06 ===
2026-01-19 14:56:06 - ============================================================
2026-01-19 14:56:06 - 🌤️  DAILY WEATHER SCRAPER - VERSIÓ UTC
2026-01-19 14:56:06 - ============================================================
2026-01-19 14:56:06 - 
==================================================
2026-01-19 14:56:06 - 📡 Processant: Fornells de la Selva [UO]
2026-01-19 14:56:06 - 
🌐 Connectant a Fornells de la Selva...
2026-01-19 14:56:07 - 📊 Total files trobades a la taula: 30
2026-01-19 14:56:07 -    ✅ Període UTC: 00:00 - 00:30 | TX: 9.8 | TN: 9.6 | Pluja: None
2026-01-19 14:56:07 -    ✅ Període UTC: 00:30 - 01:00 | TX: 9.8 | TN: 9.8 | Pluja: None
2026-01-19 14:56:07 -    ✅ Període UTC: 01:00 - 01:30 | TX: 9.8 | TN: 9.7 | Pluja: None
2026-01-19 14:56:07 -    ✅ Període UTC: 01:30 - 02:00 | TX: 9.8 | TN: 9.8 | Pluja: None
2026-01-19 14:56:07 -    ✅ Període UTC: 02:00 - 02:30 | TX: 9.8 | TN: 9.8 | Pluja: None
2026-01-19 14:56:07 -    ✅ Període UTC: 02:30 - 03:00 | TX: 9.8 | TN: 9.4 | Pluja: None
2026-01-19 14:56:07 -    ✅ Període UTC: 03:00 - 03:30 | TX: 9.6 | TN: 9.3 | Pluja: None
2026-01-19 14:56:07 -    ✅ Període UTC: 03:30 - 04:00 | TX: 9.7 | TN: 9.5 | Pluja: None
2026-01-19 14:56:07 -    ✅ Període UTC: 04:00 - 04:30 | TX: 9.7 | TN: 9.5 | Pluja: None
2026-01-19 14:56:07 -    ✅ Període UTC: 04:30 - 05:00 | TX: 9.5 | TN: 9.3 | Pluja: None
2026-01-19 14:56:07 -    ✅ Període UTC: 05:00 - 05:30 | TX: 9.3 | TN: 9.1 | Pluja: None
2026-01-19 14:56:07 -    ✅ Període UTC: 05:30 - 06:00 | TX: 9.3 | TN: 8.9 | Pluja: None
2026-01-19 14:56:07 -    ✅ Període UTC: 06:00 - 06:30 | TX: 9.4 | TN: 9.1 | Pluja: None
2026-01-19 14:56:07 -    ✅ Període UTC: 06:30 - 07:00 | TX: 9.1 | TN: 8.9 | Pluja: None
2026-01-19 14:56:07 -    ✅ Període UTC: 07:00 - 07:30 | TX: 8.9 | TN: 8.7 | Pluja: None
2026-01-19 14:56:07 -    ✅ Període UTC: 07:30 - 08:00 | TX: 8.7 | TN: 8.6 | Pluja: None
2026-01-19 14:56:07 -    ✅ Període UTC: 08:00 - 08:30 | TX: 8.6 | TN: 8.5 | Pluja: None
2026-01-19 14:56:07 -    ✅ Període UTC: 08:30 - 09:00 | TX: 8.5 | TN: 8.4 | Pluja: None
2026-01-19 14:56:07 -    ✅ Període UTC: 09:00 - 09:30 | TX: 8.5 | TN: 8.4 | Pluja: None
2026-01-19 14:56:07 -    ✅ Període UTC: 09:30 - 10:00 | TX: 8.6 | TN: 8.5 | Pluja: None
2026-01-19 14:56:07 -    ✅ Període UTC: 10:00 - 10:30 | TX: 8.6 | TN: 8.6 | Pluja: None
2026-01-19 14:56:07 -    ✅ Període UTC: 10:30 - 11:00 | TX: 8.8 | TN: 8.6 | Pluja: None
2026-01-19 14:56:07 -    ✅ Període UTC: 11:00 - 11:30 | TX: 8.8 | TN: 8.8 | Pluja: None
2026-01-19 14:56:07 -    ✅ Període UTC: 11:30 - 12:00 | TX: 8.9 | TN: 8.8 | Pluja: None
2026-01-19 14:56:07 -    ✅ Període UTC: 12:00 - 12:30 | TX: 8.8 | TN: 8.8 | Pluja: None
2026-01-19 14:56:07 -    ✅ Període UTC: 12:30 - 13:00 | TX: 8.8 | TN: 8.7 | Pluja: None
2026-01-19 14:56:07 -    ✅ Període UTC: 13:00 - 13:30 | TX: 8.8 | TN: 8.7 | Pluja: None
2026-01-19 14:56:07 -    ✅ Període UTC: 13:30 - 14:00 | TX: 8.8 | TN: 8.7 | Pluja: None
2026-01-19 14:56:07 -    ✅ Període UTC: 14:00 - 14:30 | TX: 8.8 | TN: 8.8 | Pluja: 0.8
2026-01-19 14:56:07 - 📈 Total períodes vàlids trobats: 29
2026-01-19 14:56:07 - 📊 RESUM CALCULAT:
2026-01-19 14:56:07 -    • Màxima del dia: 9.8°C
2026-01-19 14:56:07 -    • Mínima del dia: 8.4°C
2026-01-19 14:56:07 -    • Pluja acumulada: 0.8mm
2026-01-19 14:56:07 -    • Últim període: 14:00 - 14:30 UTC
2026-01-19 14:56:07 -    • Hora actualització: 14:56
2026-01-19 14:56:07 - 💾 Dades guardades a data/UO_20260119.csv (29 registres)
2026-01-19 14:56:07 - ✅ Fornells de la Selva: 29 períodes processats
2026-01-19 14:56:07 - 
==================================================
2026-01-19 14:56:07 - 📡 Processant: Girona [XJ]
2026-01-19 14:56:07 - 
🌐 Connectant a Girona...
2026-01-19 14:56:09 - 📊 Total files trobades a la taula: 30
2026-01-19 14:56:09 -    ✅ Període UTC: 00:00 - 00:30 | TX: 9.9 | TN: 9.8 | Pluja: 0.0
2026-01-19 14:56:09 -    ✅ Període UTC: 00:30 - 01:00 | TX: 9.9 | TN: 9.9 | Pluja: 0.1
2026-01-19 14:56:09 -    ✅ Període UTC: 01:00 - 01:30 | TX: 9.9 | TN: 9.8 | Pluja: 0.1
2026-01-19 14:56:09 -    ✅ Període UTC: 01:30 - 02:00 | TX: 9.8 | TN: 9.6 | Pluja: 0.0
2026-01-19 14:56:09 -    ✅ Període UTC: 02:00 - 02:30 | TX: 9.7 | TN: 9.6 | Pluja: 0.0
2026-01-19 14:56:09 -    ✅ Període UTC: 02:30 - 03:00 | TX: 9.7 | TN: 8.9 | Pluja: 0.0
2026-01-19 14:56:09 -    ✅ Període UTC: 03:00 - 03:30 | TX: 9.0 | TN: 8.6 | Pluja: 0.1
2026-01-19 14:56:09 -    ✅ Període UTC: 03:30 - 04:00 | TX: 9.2 | TN: 8.6 | Pluja: 0.0
2026-01-19 14:56:09 -    ✅ Període UTC: 04:00 - 04:30 | TX: 9.3 | TN: 9.2 | Pluja: 0.0
2026-01-19 14:56:09 -    ✅ Període UTC: 04:30 - 05:00 | TX: 9.3 | TN: 9.2 | Pluja: 0.0
2026-01-19 14:56:09 -    ✅ Període UTC: 05:00 - 05:30 | TX: 9.2 | TN: 9.1 | Pluja: 0.0
2026-01-19 14:56:09 -    ✅ Període UTC: 05:30 - 06:00 | TX: 9.1 | TN: 9.0 | Pluja: 0.2
2026-01-19 14:56:09 -    ✅ Període UTC: 06:00 - 06:30 | TX: 9.2 | TN: 9.0 | Pluja: 0.9
2026-01-19 14:56:09 -    ✅ Període UTC: 06:30 - 07:00 | TX: 9.0 | TN: 8.8 | Pluja: 0.6
2026-01-19 14:56:09 -    ✅ Període UTC: 07:00 - 07:30 | TX: 8.7 | TN: 8.6 | Pluja: 0.9
2026-01-19 14:56:09 -    ✅ Període UTC: 07:30 - 08:00 | TX: 8.6 | TN: 8.5 | Pluja: 1.4
2026-01-19 14:56:09 -    ✅ Període UTC: 08:00 - 08:30 | TX: 8.5 | TN: 8.5 | Pluja: 3.7
2026-01-19 14:56:09 -    ✅ Període UTC: 08:30 - 09:00 | TX: 8.5 | TN: 8.5 | Pluja: 3.0
2026-01-19 14:56:09 -    ✅ Període UTC: 09:00 - 09:30 | TX: 8.6 | TN: 8.5 | Pluja: 0.7
2026-01-19 14:56:09 -    ✅ Període UTC: 09:30 - 10:00 | TX: 8.7 | TN: 8.6 | Pluja: 3.9
2026-01-19 14:56:09 -    ✅ Període UTC: 10:00 - 10:30 | TX: 8.9 | TN: 8.7 | Pluja: 2.5
2026-01-19 14:56:09 -    ✅ Període UTC: 10:30 - 11:00 | TX: 8.9 | TN: 8.9 | Pluja: 1.8
2026-01-19 14:56:09 -    ✅ Període UTC: 11:00 - 11:30 | TX: 9.0 | TN: 8.9 | Pluja: 2.9
2026-01-19 14:56:09 -    ✅ Període UTC: 11:30 - 12:00 | TX: 8.9 | TN: 8.9 | Pluja: 0.7
2026-01-19 14:56:09 -    ✅ Període UTC: 12:00 - 12:30 | TX: 9.0 | TN: 8.9 | Pluja: 0.7
2026-01-19 14:56:09 -    ✅ Període UTC: 12:30 - 13:00 | TX: 9.0 | TN: 8.9 | Pluja: 2.4
2026-01-19 14:56:09 -    ✅ Període UTC: 13:00 - 13:30 | TX: 8.9 | TN: 8.9 | Pluja: 2.2
2026-01-19 14:56:09 -    ✅ Període UTC: 13:30 - 14:00 | TX: 8.9 | TN: 8.8 | Pluja: 1.2
2026-01-19 14:56:09 -    ✅ Període UTC: 14:00 - 14:30 | TX: 8.9 | TN: 8.8 | Pluja: 0.7
2026-01-19 14:56:09 - 📈 Total períodes vàlids trobats: 29
2026-01-19 14:56:09 - 📊 RESUM CALCULAT:
2026-01-19 14:56:09 -    • Màxima del dia: 9.9°C
2026-01-19 14:56:09 -    • Mínima del dia: 8.5°C
2026-01-19 14:56:09 -    • Pluja acumulada: 30.699999999999996mm
2026-01-19 14:56:09 -    • Últim període: 14:00 - 14:30 UTC
2026-01-19 14:56:09 -    • Hora actualització: 14:56
2026-01-19 14:56:09 - 💾 Dades guardades a data/XJ_20260119.csv (29 registres)
2026-01-19 14:56:09 - ✅ Girona: 29 períodes processats
2026-01-19 14:56:09 - 💾 Dades guardades a data/weather_daily_20260119.json
2026-01-19 14:56:09 - 💾 Dades guardades a data/weather_summary.json
2026-01-19 14:56:09 - 
============================================================
2026-01-19 14:56:09 - 📋 RESUM FINAL DEL DIA (UTC)
2026-01-19 14:56:09 - ============================================================
2026-01-19 14:56:09 - 
📍 Fornells de la Selva:
2026-01-19 14:56:09 -    • Períodes: 29
2026-01-19 14:56:09 -    • Màxima: 9.8°C
2026-01-19 14:56:09 -    • Mínima: 8.4°C
2026-01-19 14:56:09 -    • Pluja: 0.8mm
2026-01-19 14:56:09 -    • Últim període: 14:00 - 14:30 UTC
2026-01-19 14:56:09 -    • Actualització: 14:56
2026-01-19 14:56:09 - 
📍 Girona:
2026-01-19 14:56:09 -    • Períodes: 29
2026-01-19 14:56:09 -    • Màxima: 9.9°C
2026-01-19 14:56:09 -    • Mínima: 8.5°C
2026-01-19 14:56:09 -    • Pluja: 30.699999999999996mm
2026-01-19 14:56:09 -    • Últim període: 14:00 - 14:30 UTC
2026-01-19 14:56:09 -    • Actualització: 14:56
2026-01-19 14:56:09 - 
💾 Fitxers generats:
2026-01-19 14:56:09 -    • data/weather_summary.json (per HTML)
2026-01-19 14:56:09 -    • data/weather_daily_YYYYMMDD.json (complet)
2026-01-19 14:56:09 -    • data/XX_YYYYMMDD.csv (per estació)
2026-01-19 14:56:09 - 
✅ PROCÉS COMPLETAT
2026-01-19 14:56:09 - ============================================================
