=== INICI DAILY SCRAPER (UTC): 2026-01-08 19:30:26 ===
2026-01-08 19:30:26 - ============================================================
2026-01-08 19:30:26 - 🌤️  DAILY WEATHER SCRAPER - VERSIÓ UTC
2026-01-08 19:30:26 - ============================================================
2026-01-08 19:30:26 - 
==================================================
2026-01-08 19:30:26 - 📡 Processant: Fornells de la Selva [UO]
2026-01-08 19:30:26 - 
🌐 Connectant a Fornells de la Selva...
2026-01-08 19:30:27 - 📊 Total files trobades a la taula: 40
2026-01-08 19:30:27 -    ✅ Període UTC: 00:00 - 00:30 | TX: -0.9 | TN: -1.7 | Pluja: 0.0
2026-01-08 19:30:27 -    ✅ Període UTC: 00:30 - 01:00 | TX: -1.1 | TN: -1.5 | Pluja: 0.0
2026-01-08 19:30:27 -    ✅ Període UTC: 01:00 - 01:30 | TX: -1.4 | TN: -1.9 | Pluja: 0.0
2026-01-08 19:30:27 -    ✅ Període UTC: 01:30 - 02:00 | TX: -1.9 | TN: -2.1 | Pluja: 0.0
2026-01-08 19:30:27 -    ✅ Període UTC: 02:00 - 02:30 | TX: -2.0 | TN: -2.3 | Pluja: 0.0
2026-01-08 19:30:27 -    ✅ Període UTC: 02:30 - 03:00 | TX: -2.0 | TN: -2.3 | Pluja: 0.0
2026-01-08 19:30:27 -    ✅ Període UTC: 03:00 - 03:30 | TX: -2.3 | TN: -2.5 | Pluja: 0.0
2026-01-08 19:30:27 -    ✅ Període UTC: 03:30 - 04:00 | TX: -2.0 | TN: -2.5 | Pluja: 0.0
2026-01-08 19:30:27 -    ✅ Període UTC: 04:00 - 04:30 | TX: -1.8 | TN: -2.1 | Pluja: 0.0
2026-01-08 19:30:27 -    ✅ Període UTC: 04:30 - 05:00 | TX: -2.0 | TN: -2.1 | Pluja: 0.0
2026-01-08 19:30:27 -    ✅ Període UTC: 05:00 - 05:30 | TX: -2.2 | TN: -2.7 | Pluja: 0.0
2026-01-08 19:30:27 -    ✅ Període UTC: 05:30 - 06:00 | TX: -2.2 | TN: -2.7 | Pluja: 0.0
2026-01-08 19:30:27 -    ✅ Període UTC: 06:00 - 06:30 | TX: -2.1 | TN: -2.3 | Pluja: 0.0
2026-01-08 19:30:27 -    ✅ Període UTC: 06:30 - 07:00 | TX: -1.9 | TN: -2.2 | Pluja: 0.0
2026-01-08 19:30:27 -    ✅ Període UTC: 07:00 - 07:30 | TX: -1.9 | TN: -2.1 | Pluja: 0.0
2026-01-08 19:30:27 -    ✅ Període UTC: 07:30 - 08:00 | TX: -1.1 | TN: -2.1 | Pluja: 0.0
2026-01-08 19:30:27 -    ✅ Període UTC: 08:00 - 08:30 | TX: -1.0 | TN: -1.3 | Pluja: 0.0
2026-01-08 19:30:27 -    ✅ Període UTC: 08:30 - 09:00 | TX: 1.3 | TN: -0.8 | Pluja: 0.0
2026-01-08 19:30:27 -    ✅ Període UTC: 09:00 - 09:30 | TX: 3.4 | TN: 0.4 | Pluja: 0.0
2026-01-08 19:30:27 -    ✅ Període UTC: 09:30 - 10:00 | TX: 5.6 | TN: 3.6 | Pluja: 0.0
2026-01-08 19:30:27 -    ✅ Període UTC: 10:00 - 10:30 | TX: 8.0 | TN: 5.6 | Pluja: 0.0
2026-01-08 19:30:27 -    ✅ Període UTC: 10:30 - 11:00 | TX: 9.0 | TN: 8.2 | Pluja: 0.0
2026-01-08 19:30:27 -    ✅ Període UTC: 11:00 - 11:30 | TX: 9.7 | TN: 8.9 | Pluja: 0.0
2026-01-08 19:30:27 -    ✅ Període UTC: 11:30 - 12:00 | TX: 10.6 | TN: 9.6 | Pluja: 0.0
2026-01-08 19:30:27 -    ✅ Període UTC: 12:00 - 12:30 | TX: 12.3 | TN: 10.7 | Pluja: 0.0
2026-01-08 19:30:27 -    ✅ Període UTC: 12:30 - 13:00 | TX: 13.2 | TN: 12.1 | Pluja: 0.0
2026-01-08 19:30:27 -    ✅ Període UTC: 13:00 - 13:30 | TX: 14.7 | TN: 13.3 | Pluja: 0.0
2026-01-08 19:30:27 -    ✅ Període UTC: 13:30 - 14:00 | TX: 15.7 | TN: 14.4 | Pluja: 0.0
2026-01-08 19:30:27 -    ✅ Període UTC: 14:00 - 14:30 | TX: 15.5 | TN: 14.6 | Pluja: 0.0
2026-01-08 19:30:27 -    ✅ Període UTC: 14:30 - 15:00 | TX: 14.7 | TN: 14.4 | Pluja: 0.0
2026-01-08 19:30:27 -    ✅ Període UTC: 15:00 - 15:30 | TX: 15.0 | TN: 12.8 | Pluja: 0.0
2026-01-08 19:30:27 -    ✅ Període UTC: 15:30 - 16:00 | TX: 12.6 | TN: 10.9 | Pluja: 0.0
2026-01-08 19:30:27 -    ✅ Període UTC: 16:00 - 16:30 | TX: 11.0 | TN: 9.2 | Pluja: 0.0
2026-01-08 19:30:27 -    ✅ Període UTC: 16:30 - 17:00 | TX: 9.2 | TN: 7.5 | Pluja: 0.0
2026-01-08 19:30:27 -    ✅ Període UTC: 17:00 - 17:30 | TX: 9.2 | TN: 7.6 | Pluja: 0.0
2026-01-08 19:30:27 -    ✅ Període UTC: 17:30 - 18:00 | TX: 8.0 | TN: 7.3 | Pluja: 0.0
2026-01-08 19:30:27 -    ✅ Període UTC: 18:00 - 18:30 | TX: 7.5 | TN: 6.5 | Pluja: 0.0
2026-01-08 19:30:27 -    ✅ Període UTC: 18:30 - 19:00 | TX: 6.9 | TN: 6.4 | Pluja: 0.0
2026-01-08 19:30:27 - 📈 Total períodes vàlids trobats: 38
2026-01-08 19:30:27 - 📊 RESUM CALCULAT:
2026-01-08 19:30:27 -    • Màxima del dia: 15.7°C
2026-01-08 19:30:27 -    • Mínima del dia: -2.7°C
2026-01-08 19:30:27 -    • Pluja acumulada: 0.0mm
2026-01-08 19:30:27 -    • Últim període: 18:30 - 19:00 UTC
2026-01-08 19:30:27 -    • Hora actualització: 19:30
2026-01-08 19:30:27 - 💾 Dades guardades a data/UO_20260108.csv (38 registres)
2026-01-08 19:30:27 - ✅ Fornells de la Selva: 38 períodes processats
2026-01-08 19:30:27 - 
==================================================
2026-01-08 19:30:27 - 📡 Processant: Girona [XJ]
2026-01-08 19:30:27 - 
🌐 Connectant a Girona...
2026-01-08 19:30:29 - 📊 Total files trobades a la taula: 40
2026-01-08 19:30:29 -    ✅ Període UTC: 00:00 - 00:30 | TX: 1.8 | TN: 0.6 | Pluja: 0.0
2026-01-08 19:30:29 -    ✅ Període UTC: 00:30 - 01:00 | TX: 1.8 | TN: 0.7 | Pluja: 0.0
2026-01-08 19:30:29 -    ✅ Període UTC: 01:00 - 01:30 | TX: 1.4 | TN: 0.4 | Pluja: 0.0
2026-01-08 19:30:29 -    ✅ Període UTC: 01:30 - 02:00 | TX: 1.2 | TN: 0.7 | Pluja: 0.0
2026-01-08 19:30:29 -    ✅ Període UTC: 02:00 - 02:30 | TX: 1.2 | TN: 0.6 | Pluja: 0.0
2026-01-08 19:30:29 -    ✅ Període UTC: 02:30 - 03:00 | TX: 1.4 | TN: 0.6 | Pluja: 0.0
2026-01-08 19:30:29 -    ✅ Període UTC: 03:00 - 03:30 | TX: 0.8 | TN: -0.5 | Pluja: 0.0
2026-01-08 19:30:29 -    ✅ Període UTC: 03:30 - 04:00 | TX: 0.4 | TN: -0.7 | Pluja: 0.0
2026-01-08 19:30:29 -    ✅ Període UTC: 04:00 - 04:30 | TX: 0.6 | TN: -0.4 | Pluja: 0.0
2026-01-08 19:30:29 -    ✅ Període UTC: 04:30 - 05:00 | TX: -0.5 | TN: -1.0 | Pluja: 0.0
2026-01-08 19:30:29 -    ✅ Període UTC: 05:00 - 05:30 | TX: -0.1 | TN: -1.1 | Pluja: 0.0
2026-01-08 19:30:29 -    ✅ Període UTC: 05:30 - 06:00 | TX: -0.8 | TN: -1.4 | Pluja: 0.0
2026-01-08 19:30:29 -    ✅ Període UTC: 06:00 - 06:30 | TX: -0.8 | TN: -1.4 | Pluja: 0.0
2026-01-08 19:30:29 -    ✅ Període UTC: 06:30 - 07:00 | TX: -1.3 | TN: -1.7 | Pluja: 0.0
2026-01-08 19:30:29 -    ✅ Període UTC: 07:00 - 07:30 | TX: -0.4 | TN: -1.6 | Pluja: 0.0
2026-01-08 19:30:29 -    ✅ Període UTC: 07:30 - 08:00 | TX: 1.7 | TN: -0.4 | Pluja: 0.0
2026-01-08 19:30:29 -    ✅ Període UTC: 08:00 - 08:30 | TX: 3.1 | TN: 1.3 | Pluja: 0.0
2026-01-08 19:30:29 -    ✅ Període UTC: 08:30 - 09:00 | TX: 5.5 | TN: 3.2 | Pluja: 0.0
2026-01-08 19:30:29 -    ✅ Període UTC: 09:00 - 09:30 | TX: 7.0 | TN: 5.0 | Pluja: 0.0
2026-01-08 19:30:29 -    ✅ Període UTC: 09:30 - 10:00 | TX: 8.4 | TN: 6.9 | Pluja: 0.0
2026-01-08 19:30:29 -    ✅ Període UTC: 10:00 - 10:30 | TX: 9.4 | TN: 8.3 | Pluja: 0.0
2026-01-08 19:30:29 -    ✅ Període UTC: 10:30 - 11:00 | TX: 10.8 | TN: 9.6 | Pluja: 0.0
2026-01-08 19:30:29 -    ✅ Període UTC: 11:00 - 11:30 | TX: 11.1 | TN: 10.1 | Pluja: 0.0
2026-01-08 19:30:29 -    ✅ Període UTC: 11:30 - 12:00 | TX: 12.2 | TN: 11.2 | Pluja: 0.0
2026-01-08 19:30:29 -    ✅ Període UTC: 12:00 - 12:30 | TX: 13.2 | TN: 11.7 | Pluja: 0.0
2026-01-08 19:30:29 -    ✅ Període UTC: 12:30 - 13:00 | TX: 14.0 | TN: 13.1 | Pluja: 0.0
2026-01-08 19:30:29 -    ✅ Període UTC: 13:00 - 13:30 | TX: 14.8 | TN: 13.8 | Pluja: 0.0
2026-01-08 19:30:29 -    ✅ Període UTC: 13:30 - 14:00 | TX: 15.5 | TN: 14.7 | Pluja: 0.0
2026-01-08 19:30:29 -    ✅ Període UTC: 14:00 - 14:30 | TX: 15.9 | TN: 15.0 | Pluja: 0.0
2026-01-08 19:30:29 -    ✅ Període UTC: 14:30 - 15:00 | TX: 14.9 | TN: 13.9 | Pluja: 0.0
2026-01-08 19:30:29 -    ✅ Període UTC: 15:00 - 15:30 | TX: 14.4 | TN: 13.2 | Pluja: 0.0
2026-01-08 19:30:29 -    ✅ Període UTC: 15:30 - 16:00 | TX: 13.2 | TN: 12.6 | Pluja: 0.0
2026-01-08 19:30:29 -    ✅ Període UTC: 16:00 - 16:30 | TX: 12.7 | TN: 12.3 | Pluja: 0.0
2026-01-08 19:30:29 -    ✅ Període UTC: 16:30 - 17:00 | TX: 12.7 | TN: 12.3 | Pluja: 0.0
2026-01-08 19:30:29 -    ✅ Període UTC: 17:00 - 17:30 | TX: 12.6 | TN: 11.9 | Pluja: 0.0
2026-01-08 19:30:29 -    ✅ Període UTC: 17:30 - 18:00 | TX: 12.3 | TN: 11.7 | Pluja: 0.0
2026-01-08 19:30:29 -    ✅ Període UTC: 18:00 - 18:30 | TX: 12.2 | TN: 11.9 | Pluja: 0.0
2026-01-08 19:30:29 -    ✅ Període UTC: 18:30 - 19:00 | TX: 12.4 | TN: 11.7 | Pluja: 0.0
2026-01-08 19:30:29 - 📈 Total períodes vàlids trobats: 38
2026-01-08 19:30:29 - 📊 RESUM CALCULAT:
2026-01-08 19:30:29 -    • Màxima del dia: 15.9°C
2026-01-08 19:30:29 -    • Mínima del dia: -1.7°C
2026-01-08 19:30:29 -    • Pluja acumulada: 0.0mm
2026-01-08 19:30:29 -    • Últim període: 18:30 - 19:00 UTC
2026-01-08 19:30:29 -    • Hora actualització: 19:30
2026-01-08 19:30:29 - 💾 Dades guardades a data/XJ_20260108.csv (38 registres)
2026-01-08 19:30:29 - ✅ Girona: 38 períodes processats
2026-01-08 19:30:29 - 💾 Dades guardades a data/weather_daily_20260108.json
2026-01-08 19:30:29 - 💾 Dades guardades a data/weather_summary.json
2026-01-08 19:30:29 - 
============================================================
2026-01-08 19:30:29 - 📋 RESUM FINAL DEL DIA (UTC)
2026-01-08 19:30:29 - ============================================================
2026-01-08 19:30:29 - 
📍 Fornells de la Selva:
2026-01-08 19:30:29 -    • Períodes: 38
2026-01-08 19:30:29 -    • Màxima: 15.7°C
2026-01-08 19:30:29 -    • Mínima: -2.7°C
2026-01-08 19:30:29 -    • Pluja: 0.0mm
2026-01-08 19:30:29 -    • Últim període: 18:30 - 19:00 UTC
2026-01-08 19:30:29 -    • Actualització: 19:30
2026-01-08 19:30:29 - 
📍 Girona:
2026-01-08 19:30:29 -    • Períodes: 38
2026-01-08 19:30:29 -    • Màxima: 15.9°C
2026-01-08 19:30:29 -    • Mínima: -1.7°C
2026-01-08 19:30:29 -    • Pluja: 0.0mm
2026-01-08 19:30:29 -    • Últim període: 18:30 - 19:00 UTC
2026-01-08 19:30:29 -    • Actualització: 19:30
2026-01-08 19:30:29 - 
💾 Fitxers generats:
2026-01-08 19:30:29 -    • data/weather_summary.json (per HTML)
2026-01-08 19:30:29 -    • data/weather_daily_YYYYMMDD.json (complet)
2026-01-08 19:30:29 -    • data/XX_YYYYMMDD.csv (per estació)
2026-01-08 19:30:29 - 
✅ PROCÉS COMPLETAT
2026-01-08 19:30:29 - ============================================================
