=== INICI DAILY SCRAPER (UTC): 2026-01-27 16:37:39 ===
2026-01-27 16:37:39 - ============================================================
2026-01-27 16:37:39 - 🌤️  DAILY WEATHER SCRAPER - VERSIÓ UTC
2026-01-27 16:37:39 - ============================================================
2026-01-27 16:37:39 - 
==================================================
2026-01-27 16:37:39 - 📡 Processant: Fornells de la Selva [UO]
2026-01-27 16:37:39 - 
🌐 Connectant a Fornells de la Selva...
2026-01-27 16:37:40 - 📊 Total files trobades a la taula: 34
2026-01-27 16:37:40 -    ✅ Període UTC: 00:00 - 00:30 | TX: 9.9 | TN: 5.9 | Pluja: 0.0
2026-01-27 16:37:40 -    ✅ Període UTC: 00:30 - 01:00 | TX: 9.9 | TN: 7.1 | Pluja: 0.0
2026-01-27 16:37:40 -    ✅ Període UTC: 01:00 - 01:30 | TX: 8.1 | TN: 5.7 | Pluja: 0.0
2026-01-27 16:37:40 -    ✅ Període UTC: 01:30 - 02:00 | TX: 7.1 | TN: 5.3 | Pluja: 0.0
2026-01-27 16:37:40 -    ✅ Període UTC: 02:00 - 02:30 | TX: 5.7 | TN: 4.8 | Pluja: 0.0
2026-01-27 16:37:40 -    ✅ Període UTC: 02:30 - 03:00 | TX: 5.6 | TN: 4.8 | Pluja: 0.0
2026-01-27 16:37:40 -    ✅ Període UTC: 03:00 - 03:30 | TX: 6.1 | TN: 4.9 | Pluja: 0.0
2026-01-27 16:37:40 -    ✅ Període UTC: 03:30 - 04:00 | TX: 5.4 | TN: 4.9 | Pluja: 0.0
2026-01-27 16:37:40 -    ✅ Període UTC: 04:00 - 04:30 | TX: 5.5 | TN: 4.8 | Pluja: 0.0
2026-01-27 16:37:40 -    ✅ Període UTC: 04:30 - 05:00 | TX: 5.2 | TN: 4.8 | Pluja: 0.0
2026-01-27 16:37:40 -    ✅ Període UTC: 05:00 - 05:30 | TX: 5.6 | TN: 5.2 | Pluja: 0.0
2026-01-27 16:37:40 -    ✅ Període UTC: 05:30 - 06:00 | TX: 5.4 | TN: 4.8 | Pluja: 0.0
2026-01-27 16:37:40 -    ✅ Període UTC: 06:00 - 06:30 | TX: 5.3 | TN: 4.8 | Pluja: 0.0
2026-01-27 16:37:40 -    ✅ Període UTC: 06:30 - 07:00 | TX: 5.7 | TN: 5.3 | Pluja: 0.0
2026-01-27 16:37:40 -    ✅ Període UTC: 07:00 - 07:30 | TX: 5.3 | TN: 4.6 | Pluja: 0.0
2026-01-27 16:37:40 -    ✅ Període UTC: 07:30 - 08:00 | TX: 7.1 | TN: 4.8 | Pluja: 0.0
2026-01-27 16:37:40 -    ✅ Període UTC: 08:00 - 08:30 | TX: 13.0 | TN: 7.2 | Pluja: 0.0
2026-01-27 16:37:40 -    ✅ Període UTC: 08:30 - 09:00 | TX: 12.4 | TN: 11.2 | Pluja: 0.0
2026-01-27 16:37:40 -    ✅ Període UTC: 09:00 - 09:30 | TX: 12.6 | TN: 12.4 | Pluja: 0.0
2026-01-27 16:37:40 -    ✅ Període UTC: 09:30 - 10:00 | TX: 14.3 | TN: 12.6 | Pluja: 0.0
2026-01-27 16:37:40 -    ✅ Període UTC: 10:00 - 10:30 | TX: 14.8 | TN: 14.1 | Pluja: 0.0
2026-01-27 16:37:40 -    ✅ Període UTC: 10:30 - 11:00 | TX: 15.2 | TN: 14.5 | Pluja: 0.0
2026-01-27 16:37:40 -    ✅ Període UTC: 11:00 - 11:30 | TX: 14.8 | TN: 14.5 | Pluja: 0.0
2026-01-27 16:37:40 -    ✅ Període UTC: 11:30 - 12:00 | TX: 14.8 | TN: 14.5 | Pluja: 0.0
2026-01-27 16:37:40 -    ✅ Període UTC: 12:00 - 12:30 | TX: 14.4 | TN: 14.1 | Pluja: 0.0
2026-01-27 16:37:40 -    ✅ Període UTC: 12:30 - 13:00 | TX: 14.5 | TN: 14.3 | Pluja: 0.0
2026-01-27 16:37:40 -    ✅ Període UTC: 13:00 - 13:30 | TX: 15.9 | TN: 14.5 | Pluja: 0.0
2026-01-27 16:37:40 -    ✅ Període UTC: 13:30 - 14:00 | TX: 16.1 | TN: 15.5 | Pluja: 0.0
2026-01-27 16:37:40 -    ✅ Període UTC: 14:00 - 14:30 | TX: 15.5 | TN: 14.7 | Pluja: 0.0
2026-01-27 16:37:40 -    ✅ Període UTC: 14:30 - 15:00 | TX: 14.9 | TN: 14.6 | Pluja: 0.0
2026-01-27 16:37:40 -    ✅ Període UTC: 15:00 - 15:30 | TX: 14.9 | TN: 14.5 | Pluja: 0.0
2026-01-27 16:37:40 -    ✅ Període UTC: 15:30 - 16:00 | TX: 14.6 | TN: 14.2 | Pluja: 0.0
2026-01-27 16:37:40 - 📈 Total períodes vàlids trobats: 32
2026-01-27 16:37:40 - 📊 RESUM CALCULAT:
2026-01-27 16:37:40 -    • Màxima del dia: 16.1°C
2026-01-27 16:37:40 -    • Mínima del dia: 4.6°C
2026-01-27 16:37:40 -    • Pluja acumulada: 0.0mm
2026-01-27 16:37:40 -    • Últim període: 15:30 - 16:00 UTC
2026-01-27 16:37:40 -    • Hora actualització: 16:37
2026-01-27 16:37:40 - 💾 Dades guardades a data/UO_20260127.csv (32 registres)
2026-01-27 16:37:40 - ✅ Fornells de la Selva: 32 períodes processats
2026-01-27 16:37:40 - 
==================================================
2026-01-27 16:37:40 - 📡 Processant: Girona [XJ]
2026-01-27 16:37:40 - 
🌐 Connectant a Girona...
2026-01-27 16:37:42 - 📊 Total files trobades a la taula: 34
2026-01-27 16:37:42 -    ✅ Període UTC: 00:00 - 00:30 | TX: 8.8 | TN: 7.8 | Pluja: 0.0
2026-01-27 16:37:42 -    ✅ Període UTC: 00:30 - 01:00 | TX: 10.0 | TN: 8.8 | Pluja: 0.0
2026-01-27 16:37:42 -    ✅ Període UTC: 01:00 - 01:30 | TX: 11.1 | TN: 10.0 | Pluja: 0.0
2026-01-27 16:37:42 -    ✅ Període UTC: 01:30 - 02:00 | TX: 10.7 | TN: 7.1 | Pluja: 0.0
2026-01-27 16:37:42 -    ✅ Període UTC: 02:00 - 02:30 | TX: 7.1 | TN: 6.0 | Pluja: 0.0
2026-01-27 16:37:42 -    ✅ Període UTC: 02:30 - 03:00 | TX: 6.0 | TN: 5.1 | Pluja: 0.0
2026-01-27 16:37:42 -    ✅ Període UTC: 03:00 - 03:30 | TX: 5.4 | TN: 5.0 | Pluja: 0.0
2026-01-27 16:37:42 -    ✅ Període UTC: 03:30 - 04:00 | TX: 5.1 | TN: 4.7 | Pluja: 0.0
2026-01-27 16:37:42 -    ✅ Període UTC: 04:00 - 04:30 | TX: 6.1 | TN: 5.0 | Pluja: 0.0
2026-01-27 16:37:42 -    ✅ Període UTC: 04:30 - 05:00 | TX: 5.7 | TN: 5.0 | Pluja: 0.0
2026-01-27 16:37:42 -    ✅ Període UTC: 05:00 - 05:30 | TX: 5.6 | TN: 5.0 | Pluja: 0.0
2026-01-27 16:37:42 -    ✅ Període UTC: 05:30 - 06:00 | TX: 6.2 | TN: 5.6 | Pluja: 0.0
2026-01-27 16:37:42 -    ✅ Període UTC: 06:00 - 06:30 | TX: 10.2 | TN: 6.3 | Pluja: 0.0
2026-01-27 16:37:42 -    ✅ Període UTC: 06:30 - 07:00 | TX: 11.1 | TN: 10.1 | Pluja: 0.0
2026-01-27 16:37:42 -    ✅ Període UTC: 07:00 - 07:30 | TX: 11.7 | TN: 10.8 | Pluja: 0.0
2026-01-27 16:37:42 -    ✅ Període UTC: 07:30 - 08:00 | TX: 11.9 | TN: 10.8 | Pluja: 0.0
2026-01-27 16:37:42 -    ✅ Període UTC: 08:00 - 08:30 | TX: 12.6 | TN: 10.8 | Pluja: 0.0
2026-01-27 16:37:42 -    ✅ Període UTC: 08:30 - 09:00 | TX: 12.7 | TN: 12.0 | Pluja: 0.0
2026-01-27 16:37:42 -    ✅ Període UTC: 09:00 - 09:30 | TX: 12.5 | TN: 12.1 | Pluja: 0.0
2026-01-27 16:37:42 -    ✅ Període UTC: 09:30 - 10:00 | TX: 13.9 | TN: 12.5 | Pluja: 0.0
2026-01-27 16:37:42 -    ✅ Període UTC: 10:00 - 10:30 | TX: 14.1 | TN: 13.5 | Pluja: 0.0
2026-01-27 16:37:42 -    ✅ Període UTC: 10:30 - 11:00 | TX: 15.4 | TN: 13.9 | Pluja: 0.0
2026-01-27 16:37:42 -    ✅ Període UTC: 11:00 - 11:30 | TX: 15.7 | TN: 15.2 | Pluja: 0.0
2026-01-27 16:37:42 -    ✅ Període UTC: 11:30 - 12:00 | TX: 15.3 | TN: 15.1 | Pluja: 0.0
2026-01-27 16:37:42 -    ✅ Període UTC: 12:00 - 12:30 | TX: 15.2 | TN: 14.6 | Pluja: 0.0
2026-01-27 16:37:42 -    ✅ Període UTC: 12:30 - 13:00 | TX: 14.8 | TN: 14.5 | Pluja: 0.0
2026-01-27 16:37:42 -    ✅ Període UTC: 13:00 - 13:30 | TX: 16.2 | TN: 14.6 | Pluja: 0.0
2026-01-27 16:37:42 -    ✅ Període UTC: 13:30 - 14:00 | TX: 17.0 | TN: 16.3 | Pluja: 0.0
2026-01-27 16:37:42 -    ✅ Període UTC: 14:00 - 14:30 | TX: 16.3 | TN: 15.5 | Pluja: 0.0
2026-01-27 16:37:42 -    ✅ Període UTC: 14:30 - 15:00 | TX: 16.1 | TN: 15.4 | Pluja: 0.0
2026-01-27 16:37:42 -    ✅ Període UTC: 15:00 - 15:30 | TX: 16.1 | TN: 15.3 | Pluja: 0.0
2026-01-27 16:37:42 -    ✅ Període UTC: 15:30 - 16:00 | TX: 15.3 | TN: 15.0 | Pluja: 0.0
2026-01-27 16:37:42 - 📈 Total períodes vàlids trobats: 32
2026-01-27 16:37:42 - 📊 RESUM CALCULAT:
2026-01-27 16:37:42 -    • Màxima del dia: 17.0°C
2026-01-27 16:37:42 -    • Mínima del dia: 4.7°C
2026-01-27 16:37:42 -    • Pluja acumulada: 0.0mm
2026-01-27 16:37:42 -    • Últim període: 15:30 - 16:00 UTC
2026-01-27 16:37:42 -    • Hora actualització: 16:37
2026-01-27 16:37:42 - 💾 Dades guardades a data/XJ_20260127.csv (32 registres)
2026-01-27 16:37:42 - ✅ Girona: 32 períodes processats
2026-01-27 16:37:42 - 💾 Dades guardades a data/weather_daily_20260127.json
2026-01-27 16:37:42 - 💾 Dades guardades a data/weather_summary.json
2026-01-27 16:37:42 - 
============================================================
2026-01-27 16:37:42 - 📋 RESUM FINAL DEL DIA (UTC)
2026-01-27 16:37:42 - ============================================================
2026-01-27 16:37:42 - 
📍 Fornells de la Selva:
2026-01-27 16:37:42 -    • Períodes: 32
2026-01-27 16:37:42 -    • Màxima: 16.1°C
2026-01-27 16:37:42 -    • Mínima: 4.6°C
2026-01-27 16:37:42 -    • Pluja: 0.0mm
2026-01-27 16:37:42 -    • Últim període: 15:30 - 16:00 UTC
2026-01-27 16:37:42 -    • Actualització: 16:37
2026-01-27 16:37:42 - 
📍 Girona:
2026-01-27 16:37:42 -    • Períodes: 32
2026-01-27 16:37:42 -    • Màxima: 17.0°C
2026-01-27 16:37:42 -    • Mínima: 4.7°C
2026-01-27 16:37:42 -    • Pluja: 0.0mm
2026-01-27 16:37:42 -    • Últim període: 15:30 - 16:00 UTC
2026-01-27 16:37:42 -    • Actualització: 16:37
2026-01-27 16:37:42 - 
💾 Fitxers generats:
2026-01-27 16:37:42 -    • data/weather_summary.json (per HTML)
2026-01-27 16:37:42 -    • data/weather_daily_YYYYMMDD.json (complet)
2026-01-27 16:37:42 -    • data/XX_YYYYMMDD.csv (per estació)
2026-01-27 16:37:42 - 
✅ PROCÉS COMPLETAT
2026-01-27 16:37:42 - ============================================================
