=== INICI DAILY SCRAPER (UTC): 2026-01-05 22:58:55 ===
2026-01-05 22:58:55 - ============================================================
2026-01-05 22:58:55 - 🌤️  DAILY WEATHER SCRAPER - VERSIÓ UTC
2026-01-05 22:58:55 - ============================================================
2026-01-05 22:58:55 - 
==================================================
2026-01-05 22:58:55 - 📡 Processant: Fornells de la Selva [UO]
2026-01-05 22:58:55 - 
🌐 Connectant a Fornells de la Selva...
2026-01-05 22:58:57 - 📊 Total files trobades a la taula: 46
2026-01-05 22:58:57 -    ✅ Període UTC: 00:00 - 00:30 | TX: 3.6 | TN: 3.2 | Pluja: 0.0
2026-01-05 22:58:57 -    ✅ Període UTC: 00:30 - 01:00 | TX: 3.7 | TN: 3.2 | Pluja: 0.0
2026-01-05 22:58:57 -    ✅ Període UTC: 01:00 - 01:30 | TX: 3.2 | TN: 3.1 | Pluja: 0.0
2026-01-05 22:58:57 -    ✅ Període UTC: 01:30 - 02:00 | TX: 3.3 | TN: 3.2 | Pluja: 0.0
2026-01-05 22:58:57 -    ✅ Període UTC: 02:00 - 02:30 | TX: 3.4 | TN: 3.2 | Pluja: 0.0
2026-01-05 22:58:57 -    ✅ Període UTC: 02:30 - 03:00 | TX: 3.4 | TN: 3.2 | Pluja: 0.0
2026-01-05 22:58:57 -    ✅ Període UTC: 03:00 - 03:30 | TX: 3.3 | TN: 3.1 | Pluja: 0.0
2026-01-05 22:58:57 -    ✅ Període UTC: 03:30 - 04:00 | TX: 3.0 | TN: 2.9 | Pluja: 0.0
2026-01-05 22:58:57 -    ✅ Període UTC: 04:00 - 04:30 | TX: 2.9 | TN: 2.8 | Pluja: 0.0
2026-01-05 22:58:57 -    ✅ Període UTC: 04:30 - 05:00 | TX: 2.8 | TN: 2.8 | Pluja: 0.0
2026-01-05 22:58:57 -    ✅ Període UTC: 05:00 - 05:30 | TX: 2.8 | TN: 2.7 | Pluja: 0.0
2026-01-05 22:58:57 -    ✅ Període UTC: 05:30 - 06:00 | TX: 2.8 | TN: 2.7 | Pluja: 0.0
2026-01-05 22:58:57 -    ✅ Període UTC: 06:00 - 06:30 | TX: 2.8 | TN: 2.7 | Pluja: 0.0
2026-01-05 22:58:57 -    ✅ Període UTC: 06:30 - 07:00 | TX: 2.9 | TN: 2.8 | Pluja: 0.0
2026-01-05 22:58:57 -    ✅ Període UTC: 07:00 - 07:30 | TX: 3.0 | TN: 2.8 | Pluja: 0.0
2026-01-05 22:58:57 -    ✅ Període UTC: 07:30 - 08:00 | TX: 3.1 | TN: 2.9 | Pluja: 0.0
2026-01-05 22:58:57 -    ✅ Període UTC: 08:00 - 08:30 | TX: 3.4 | TN: 3.0 | Pluja: 0.0
2026-01-05 22:58:57 -    ✅ Període UTC: 08:30 - 09:00 | TX: 4.0 | TN: 3.4 | Pluja: 0.0
2026-01-05 22:58:57 -    ✅ Període UTC: 09:00 - 09:30 | TX: 4.1 | TN: 4.0 | Pluja: 0.0
2026-01-05 22:58:57 -    ✅ Període UTC: 09:30 - 10:00 | TX: 4.6 | TN: 4.1 | Pluja: 0.0
2026-01-05 22:58:57 -    ✅ Període UTC: 10:00 - 10:30 | TX: 4.9 | TN: 4.6 | Pluja: 0.0
2026-01-05 22:58:57 -    ✅ Període UTC: 10:30 - 11:00 | TX: 5.2 | TN: 4.8 | Pluja: 0.0
2026-01-05 22:58:57 -    ✅ Període UTC: 11:00 - 11:30 | TX: 6.0 | TN: 5.3 | Pluja: 0.0
2026-01-05 22:58:57 -    ✅ Període UTC: 11:30 - 12:00 | TX: 5.8 | TN: 5.6 | Pluja: 0.0
2026-01-05 22:58:57 -    ✅ Període UTC: 12:00 - 12:30 | TX: 6.5 | TN: 5.8 | Pluja: 0.0
2026-01-05 22:58:57 -    ✅ Període UTC: 12:30 - 13:00 | TX: 7.4 | TN: 6.5 | Pluja: 0.0
2026-01-05 22:58:57 -    ✅ Període UTC: 13:00 - 13:30 | TX: 7.8 | TN: 7.4 | Pluja: 0.0
2026-01-05 22:58:57 -    ✅ Període UTC: 13:30 - 14:00 | TX: 7.5 | TN: 7.3 | Pluja: 0.0
2026-01-05 22:58:57 -    ✅ Període UTC: 14:00 - 14:30 | TX: 7.6 | TN: 7.1 | Pluja: 0.0
2026-01-05 22:58:57 -    ✅ Període UTC: 14:30 - 15:00 | TX: 7.3 | TN: 7.0 | Pluja: 0.0
2026-01-05 22:58:57 -    ✅ Període UTC: 15:00 - 15:30 | TX: 7.3 | TN: 7.1 | Pluja: 0.0
2026-01-05 22:58:57 -    ✅ Període UTC: 15:30 - 16:00 | TX: 7.1 | TN: 6.6 | Pluja: 0.0
2026-01-05 22:58:57 -    ✅ Període UTC: 16:00 - 16:30 | TX: 6.6 | TN: 5.8 | Pluja: 0.0
2026-01-05 22:58:57 -    ✅ Període UTC: 16:30 - 17:00 | TX: 5.7 | TN: 5.1 | Pluja: 0.0
2026-01-05 22:58:57 -    ✅ Període UTC: 17:00 - 17:30 | TX: 5.2 | TN: 4.6 | Pluja: 0.0
2026-01-05 22:58:57 -    ✅ Període UTC: 17:30 - 18:00 | TX: 4.6 | TN: 3.9 | Pluja: 0.0
2026-01-05 22:58:57 -    ✅ Període UTC: 18:00 - 18:30 | TX: 3.9 | TN: 3.4 | Pluja: 0.0
2026-01-05 22:58:57 -    ✅ Període UTC: 18:30 - 19:00 | TX: 3.7 | TN: 3.0 | Pluja: 0.0
2026-01-05 22:58:57 -    ✅ Període UTC: 19:00 - 19:30 | TX: 3.0 | TN: 1.8 | Pluja: 0.0
2026-01-05 22:58:57 -    ✅ Període UTC: 19:30 - 20:00 | TX: 2.2 | TN: 1.6 | Pluja: 0.0
2026-01-05 22:58:57 -    ✅ Període UTC: 20:00 - 20:30 | TX: 1.8 | TN: 1.5 | Pluja: 0.0
2026-01-05 22:58:57 -    ✅ Període UTC: 20:30 - 21:00 | TX: 1.8 | TN: 1.5 | Pluja: 0.0
2026-01-05 22:58:57 -    ✅ Període UTC: 21:00 - 21:30 | TX: 1.8 | TN: 1.3 | Pluja: 0.0
2026-01-05 22:58:57 -    ✅ Període UTC: 21:30 - 22:00 | TX: 1.5 | TN: 1.0 | Pluja: 0.0
2026-01-05 22:58:57 -    ✅ Període UTC: 22:00 - 22:30 | TX: 1.0 | TN: 0.6 | Pluja: 0.0
2026-01-05 22:58:57 - 📈 Total períodes vàlids trobats: 45
2026-01-05 22:58:57 - 📊 RESUM CALCULAT:
2026-01-05 22:58:57 -    • Màxima del dia: 7.8°C
2026-01-05 22:58:57 -    • Mínima del dia: 0.6°C
2026-01-05 22:58:57 -    • Pluja acumulada: 0.0mm
2026-01-05 22:58:57 -    • Últim període: 22:00 - 22:30 UTC
2026-01-05 22:58:57 -    • Hora actualització: 22:58
2026-01-05 22:58:57 - 💾 Dades guardades a data/UO_20260105.csv (45 registres)
2026-01-05 22:58:57 - ✅ Fornells de la Selva: 45 períodes processats
2026-01-05 22:58:57 - 
==================================================
2026-01-05 22:58:57 - 📡 Processant: Girona [XJ]
2026-01-05 22:58:57 - 
🌐 Connectant a Girona...
2026-01-05 22:58:59 - 📊 Total files trobades a la taula: 46
2026-01-05 22:58:59 -    ✅ Període UTC: 00:00 - 00:30 | TX: 3.3 | TN: 3.3 | Pluja: 0.0
2026-01-05 22:58:59 -    ✅ Període UTC: 00:30 - 01:00 | TX: 3.3 | TN: 3.2 | Pluja: 0.0
2026-01-05 22:58:59 -    ✅ Període UTC: 01:00 - 01:30 | TX: 3.2 | TN: 3.1 | Pluja: 0.0
2026-01-05 22:58:59 -    ✅ Període UTC: 01:30 - 02:00 | TX: 3.3 | TN: 3.2 | Pluja: 0.0
2026-01-05 22:58:59 -    ✅ Període UTC: 02:00 - 02:30 | TX: 3.4 | TN: 3.3 | Pluja: 0.0
2026-01-05 22:58:59 -    ✅ Període UTC: 02:30 - 03:00 | TX: 3.4 | TN: 3.1 | Pluja: 0.0
2026-01-05 22:58:59 -    ✅ Període UTC: 03:00 - 03:30 | TX: 3.2 | TN: 2.9 | Pluja: 0.0
2026-01-05 22:58:59 -    ✅ Període UTC: 03:30 - 04:00 | TX: 2.8 | TN: 2.6 | Pluja: 0.0
2026-01-05 22:58:59 -    ✅ Període UTC: 04:00 - 04:30 | TX: 2.8 | TN: 2.6 | Pluja: 0.0
2026-01-05 22:58:59 -    ✅ Període UTC: 04:30 - 05:00 | TX: 2.9 | TN: 2.6 | Pluja: 0.0
2026-01-05 22:58:59 -    ✅ Període UTC: 05:00 - 05:30 | TX: 2.9 | TN: 2.8 | Pluja: 0.0
2026-01-05 22:58:59 -    ✅ Període UTC: 05:30 - 06:00 | TX: 3.0 | TN: 2.8 | Pluja: 0.0
2026-01-05 22:58:59 -    ✅ Període UTC: 06:00 - 06:30 | TX: 2.9 | TN: 2.7 | Pluja: 0.0
2026-01-05 22:58:59 -    ✅ Període UTC: 06:30 - 07:00 | TX: 2.9 | TN: 2.7 | Pluja: 0.0
2026-01-05 22:58:59 -    ✅ Període UTC: 07:00 - 07:30 | TX: 2.9 | TN: 2.8 | Pluja: 0.0
2026-01-05 22:58:59 -    ✅ Període UTC: 07:30 - 08:00 | TX: 3.0 | TN: 2.8 | Pluja: 0.0
2026-01-05 22:58:59 -    ✅ Període UTC: 08:00 - 08:30 | TX: 3.5 | TN: 3.0 | Pluja: 0.0
2026-01-05 22:58:59 -    ✅ Període UTC: 08:30 - 09:00 | TX: 3.9 | TN: 3.5 | Pluja: 0.0
2026-01-05 22:58:59 -    ✅ Període UTC: 09:00 - 09:30 | TX: 4.0 | TN: 3.9 | Pluja: 0.0
2026-01-05 22:58:59 -    ✅ Període UTC: 09:30 - 10:00 | TX: 4.6 | TN: 4.0 | Pluja: 0.0
2026-01-05 22:58:59 -    ✅ Període UTC: 10:00 - 10:30 | TX: 4.9 | TN: 4.6 | Pluja: 0.0
2026-01-05 22:58:59 -    ✅ Període UTC: 10:30 - 11:00 | TX: 5.7 | TN: 4.7 | Pluja: 0.0
2026-01-05 22:58:59 -    ✅ Període UTC: 11:00 - 11:30 | TX: 6.4 | TN: 5.6 | Pluja: 0.0
2026-01-05 22:58:59 -    ✅ Període UTC: 11:30 - 12:00 | TX: 6.6 | TN: 5.9 | Pluja: 0.0
2026-01-05 22:58:59 -    ✅ Període UTC: 12:00 - 12:30 | TX: 6.7 | TN: 6.4 | Pluja: 0.0
2026-01-05 22:58:59 -    ✅ Període UTC: 12:30 - 13:00 | TX: 8.6 | TN: 6.7 | Pluja: 0.0
2026-01-05 22:58:59 -    ✅ Període UTC: 13:00 - 13:30 | TX: 8.3 | TN: 7.6 | Pluja: 0.0
2026-01-05 22:58:59 -    ✅ Període UTC: 13:30 - 14:00 | TX: 7.6 | TN: 7.4 | Pluja: 0.0
2026-01-05 22:58:59 -    ✅ Període UTC: 14:00 - 14:30 | TX: 7.6 | TN: 7.4 | Pluja: 0.0
2026-01-05 22:58:59 -    ✅ Període UTC: 14:30 - 15:00 | TX: 7.5 | TN: 7.4 | Pluja: 0.0
2026-01-05 22:58:59 -    ✅ Període UTC: 15:00 - 15:30 | TX: 7.5 | TN: 7.5 | Pluja: 0.0
2026-01-05 22:58:59 -    ✅ Període UTC: 15:30 - 16:00 | TX: 7.5 | TN: 6.9 | Pluja: 0.0
2026-01-05 22:58:59 -    ✅ Període UTC: 16:00 - 16:30 | TX: 6.9 | TN: 5.9 | Pluja: 0.0
2026-01-05 22:58:59 -    ✅ Període UTC: 16:30 - 17:00 | TX: 6.1 | TN: 5.1 | Pluja: 0.0
2026-01-05 22:58:59 -    ✅ Període UTC: 17:00 - 17:30 | TX: 5.2 | TN: 4.2 | Pluja: 0.0
2026-01-05 22:58:59 -    ✅ Període UTC: 17:30 - 18:00 | TX: 4.2 | TN: 3.6 | Pluja: 0.0
2026-01-05 22:58:59 -    ✅ Període UTC: 18:00 - 18:30 | TX: 4.1 | TN: 3.1 | Pluja: 0.0
2026-01-05 22:58:59 -    ✅ Període UTC: 18:30 - 19:00 | TX: 3.0 | TN: 2.0 | Pluja: 0.0
2026-01-05 22:58:59 -    ✅ Període UTC: 19:00 - 19:30 | TX: 1.9 | TN: 1.5 | Pluja: 0.0
2026-01-05 22:58:59 -    ✅ Període UTC: 19:30 - 20:00 | TX: 1.8 | TN: 1.3 | Pluja: 0.0
2026-01-05 22:58:59 -    ✅ Període UTC: 20:00 - 20:30 | TX: 1.5 | TN: 1.4 | Pluja: 0.0
2026-01-05 22:58:59 -    ✅ Període UTC: 20:30 - 21:00 | TX: 1.4 | TN: 1.2 | Pluja: 0.0
2026-01-05 22:58:59 -    ✅ Període UTC: 21:00 - 21:30 | TX: 1.4 | TN: 1.2 | Pluja: 0.0
2026-01-05 22:58:59 -    ✅ Període UTC: 21:30 - 22:00 | TX: 1.3 | TN: 0.8 | Pluja: 0.0
2026-01-05 22:58:59 -    ✅ Període UTC: 22:00 - 22:30 | TX: 1.0 | TN: 0.6 | Pluja: 0.0
2026-01-05 22:58:59 - 📈 Total períodes vàlids trobats: 45
2026-01-05 22:58:59 - 📊 RESUM CALCULAT:
2026-01-05 22:58:59 -    • Màxima del dia: 8.6°C
2026-01-05 22:58:59 -    • Mínima del dia: 0.6°C
2026-01-05 22:58:59 -    • Pluja acumulada: 0.0mm
2026-01-05 22:58:59 -    • Últim període: 22:00 - 22:30 UTC
2026-01-05 22:58:59 -    • Hora actualització: 22:58
2026-01-05 22:58:59 - 💾 Dades guardades a data/XJ_20260105.csv (45 registres)
2026-01-05 22:58:59 - ✅ Girona: 45 períodes processats
2026-01-05 22:58:59 - 💾 Dades guardades a data/weather_daily_20260105.json
2026-01-05 22:58:59 - 💾 Dades guardades a data/weather_summary.json
2026-01-05 22:58:59 - 
============================================================
2026-01-05 22:58:59 - 📋 RESUM FINAL DEL DIA (UTC)
2026-01-05 22:58:59 - ============================================================
2026-01-05 22:58:59 - 
📍 Fornells de la Selva:
2026-01-05 22:58:59 -    • Períodes: 45
2026-01-05 22:58:59 -    • Màxima: 7.8°C
2026-01-05 22:58:59 -    • Mínima: 0.6°C
2026-01-05 22:58:59 -    • Pluja: 0.0mm
2026-01-05 22:58:59 -    • Últim període: 22:00 - 22:30 UTC
2026-01-05 22:58:59 -    • Actualització: 22:58
2026-01-05 22:58:59 - 
📍 Girona:
2026-01-05 22:58:59 -    • Períodes: 45
2026-01-05 22:58:59 -    • Màxima: 8.6°C
2026-01-05 22:58:59 -    • Mínima: 0.6°C
2026-01-05 22:58:59 -    • Pluja: 0.0mm
2026-01-05 22:58:59 -    • Últim període: 22:00 - 22:30 UTC
2026-01-05 22:58:59 -    • Actualització: 22:58
2026-01-05 22:58:59 - 
💾 Fitxers generats:
2026-01-05 22:58:59 -    • data/weather_summary.json (per HTML)
2026-01-05 22:58:59 -    • data/weather_daily_YYYYMMDD.json (complet)
2026-01-05 22:58:59 -    • data/XX_YYYYMMDD.csv (per estació)
2026-01-05 22:58:59 - 
✅ PROCÉS COMPLETAT
2026-01-05 22:58:59 - ============================================================
