=== INICI DAILY SCRAPER (UTC): 2026-01-19 18:25:01 ===
2026-01-19 18:25:01 - ============================================================
2026-01-19 18:25:01 - 🌤️  DAILY WEATHER SCRAPER - VERSIÓ UTC
2026-01-19 18:25:01 - ============================================================
2026-01-19 18:25:01 - 
==================================================
2026-01-19 18:25:01 - 📡 Processant: Fornells de la Selva [UO]
2026-01-19 18:25:01 - 
🌐 Connectant a Fornells de la Selva...
2026-01-19 18:25:03 - 📊 Total files trobades a la taula: 37
2026-01-19 18:25:03 -    ✅ Període UTC: 00:00 - 00:30 | TX: 9.8 | TN: 9.6 | Pluja: None
2026-01-19 18:25:03 -    ✅ Període UTC: 00:30 - 01:00 | TX: 9.8 | TN: 9.8 | Pluja: None
2026-01-19 18:25:03 -    ✅ Període UTC: 01:00 - 01:30 | TX: 9.8 | TN: 9.7 | Pluja: None
2026-01-19 18:25:03 -    ✅ Període UTC: 01:30 - 02:00 | TX: 9.8 | TN: 9.8 | Pluja: None
2026-01-19 18:25:03 -    ✅ Període UTC: 02:00 - 02:30 | TX: 9.8 | TN: 9.8 | Pluja: None
2026-01-19 18:25:03 -    ✅ Període UTC: 02:30 - 03:00 | TX: 9.8 | TN: 9.4 | Pluja: None
2026-01-19 18:25:03 -    ✅ Període UTC: 03:00 - 03:30 | TX: 9.6 | TN: 9.3 | Pluja: None
2026-01-19 18:25:03 -    ✅ Període UTC: 03:30 - 04:00 | TX: 9.7 | TN: 9.5 | Pluja: None
2026-01-19 18:25:03 -    ✅ Període UTC: 04:00 - 04:30 | TX: 9.7 | TN: 9.5 | Pluja: None
2026-01-19 18:25:03 -    ✅ Període UTC: 04:30 - 05:00 | TX: 9.5 | TN: 9.3 | Pluja: None
2026-01-19 18:25:03 -    ✅ Període UTC: 05:00 - 05:30 | TX: 9.3 | TN: 9.1 | Pluja: None
2026-01-19 18:25:03 -    ✅ Període UTC: 05:30 - 06:00 | TX: 9.3 | TN: 8.9 | Pluja: None
2026-01-19 18:25:03 -    ✅ Període UTC: 06:00 - 06:30 | TX: 9.4 | TN: 9.1 | Pluja: None
2026-01-19 18:25:03 -    ✅ Període UTC: 06:30 - 07:00 | TX: 9.1 | TN: 8.9 | Pluja: None
2026-01-19 18:25:03 -    ✅ Període UTC: 07:00 - 07:30 | TX: 8.9 | TN: 8.7 | Pluja: None
2026-01-19 18:25:03 -    ✅ Període UTC: 07:30 - 08:00 | TX: 8.7 | TN: 8.6 | Pluja: None
2026-01-19 18:25:03 -    ✅ Període UTC: 08:00 - 08:30 | TX: 8.6 | TN: 8.5 | Pluja: None
2026-01-19 18:25:03 -    ✅ Període UTC: 08:30 - 09:00 | TX: 8.5 | TN: 8.4 | Pluja: None
2026-01-19 18:25:03 -    ✅ Període UTC: 09:00 - 09:30 | TX: 8.5 | TN: 8.4 | Pluja: None
2026-01-19 18:25:03 -    ✅ Període UTC: 09:30 - 10:00 | TX: 8.6 | TN: 8.5 | Pluja: None
2026-01-19 18:25:03 -    ✅ Període UTC: 10:00 - 10:30 | TX: 8.6 | TN: 8.6 | Pluja: None
2026-01-19 18:25:03 -    ✅ Període UTC: 10:30 - 11:00 | TX: 8.8 | TN: 8.6 | Pluja: None
2026-01-19 18:25:03 -    ✅ Període UTC: 11:00 - 11:30 | TX: 8.8 | TN: 8.8 | Pluja: None
2026-01-19 18:25:03 -    ✅ Període UTC: 11:30 - 12:00 | TX: 8.9 | TN: 8.8 | Pluja: None
2026-01-19 18:25:03 -    ✅ Període UTC: 12:00 - 12:30 | TX: 8.8 | TN: 8.8 | Pluja: None
2026-01-19 18:25:03 -    ✅ Període UTC: 12:30 - 13:00 | TX: 8.8 | TN: 8.7 | Pluja: None
2026-01-19 18:25:03 -    ✅ Període UTC: 13:00 - 13:30 | TX: 8.8 | TN: 8.7 | Pluja: 1.0
2026-01-19 18:25:03 -    ✅ Període UTC: 13:30 - 14:00 | TX: 8.8 | TN: 8.7 | Pluja: 1.0
2026-01-19 18:25:03 -    ✅ Període UTC: 14:00 - 14:30 | TX: 8.8 | TN: 8.8 | Pluja: 0.8
2026-01-19 18:25:03 -    ✅ Període UTC: 14:30 - 15:00 | TX: 8.8 | TN: 8.8 | Pluja: 1.3
2026-01-19 18:25:03 -    ✅ Període UTC: 15:00 - 15:30 | TX: 8.9 | TN: 8.8 | Pluja: 0.8
2026-01-19 18:25:03 -    ✅ Període UTC: 15:30 - 16:00 | TX: 8.9 | TN: 8.9 | Pluja: 0.2
2026-01-19 18:25:03 -    ✅ Període UTC: 16:00 - 16:30 | TX: 8.9 | TN: 8.9 | Pluja: 1.2
2026-01-19 18:25:03 -    ✅ Període UTC: 16:30 - 17:00 | TX: 8.9 | TN: 8.7 | Pluja: 1.7
2026-01-19 18:25:03 -    ✅ Període UTC: 17:00 - 17:30 | TX: 8.7 | TN: 8.7 | Pluja: 1.0
2026-01-19 18:25:03 -    ✅ Període UTC: 17:30 - 18:00 | TX: 8.7 | TN: 8.7 | Pluja: 1.5
2026-01-19 18:25:03 - 📈 Total períodes vàlids trobats: 36
2026-01-19 18:25:03 - 📊 RESUM CALCULAT:
2026-01-19 18:25:03 -    • Màxima del dia: 9.8°C
2026-01-19 18:25:03 -    • Mínima del dia: 8.4°C
2026-01-19 18:25:03 -    • Pluja acumulada: 10.5mm
2026-01-19 18:25:03 -    • Últim període: 17:30 - 18:00 UTC
2026-01-19 18:25:03 -    • Hora actualització: 18:25
2026-01-19 18:25:03 - 💾 Dades guardades a data/UO_20260119.csv (36 registres)
2026-01-19 18:25:03 - ✅ Fornells de la Selva: 36 períodes processats
2026-01-19 18:25:03 - 
==================================================
2026-01-19 18:25:03 - 📡 Processant: Girona [XJ]
2026-01-19 18:25:03 - 
🌐 Connectant a Girona...
2026-01-19 18:25:03 - 📊 Total files trobades a la taula: 37
2026-01-19 18:25:03 -    ✅ Període UTC: 00:00 - 00:30 | TX: 9.9 | TN: 9.8 | Pluja: 0.0
2026-01-19 18:25:03 -    ✅ Període UTC: 00:30 - 01:00 | TX: 9.9 | TN: 9.9 | Pluja: 0.1
2026-01-19 18:25:03 -    ✅ Període UTC: 01:00 - 01:30 | TX: 9.9 | TN: 9.8 | Pluja: 0.1
2026-01-19 18:25:03 -    ✅ Període UTC: 01:30 - 02:00 | TX: 9.8 | TN: 9.6 | Pluja: 0.0
2026-01-19 18:25:03 -    ✅ Període UTC: 02:00 - 02:30 | TX: 9.7 | TN: 9.6 | Pluja: 0.0
2026-01-19 18:25:03 -    ✅ Període UTC: 02:30 - 03:00 | TX: 9.7 | TN: 8.9 | Pluja: 0.0
2026-01-19 18:25:03 -    ✅ Període UTC: 03:00 - 03:30 | TX: 9.0 | TN: 8.6 | Pluja: 0.1
2026-01-19 18:25:03 -    ✅ Període UTC: 03:30 - 04:00 | TX: 9.2 | TN: 8.6 | Pluja: 0.0
2026-01-19 18:25:03 -    ✅ Període UTC: 04:00 - 04:30 | TX: 9.3 | TN: 9.2 | Pluja: 0.0
2026-01-19 18:25:03 -    ✅ Període UTC: 04:30 - 05:00 | TX: 9.3 | TN: 9.2 | Pluja: 0.0
2026-01-19 18:25:03 -    ✅ Període UTC: 05:00 - 05:30 | TX: 9.2 | TN: 9.1 | Pluja: 0.0
2026-01-19 18:25:03 -    ✅ Període UTC: 05:30 - 06:00 | TX: 9.1 | TN: 9.0 | Pluja: 0.2
2026-01-19 18:25:03 -    ✅ Període UTC: 06:00 - 06:30 | TX: 9.2 | TN: 9.0 | Pluja: 0.9
2026-01-19 18:25:03 -    ✅ Període UTC: 06:30 - 07:00 | TX: 9.0 | TN: 8.8 | Pluja: 0.6
2026-01-19 18:25:03 -    ✅ Període UTC: 07:00 - 07:30 | TX: 8.7 | TN: 8.6 | Pluja: 0.9
2026-01-19 18:25:03 -    ✅ Període UTC: 07:30 - 08:00 | TX: 8.6 | TN: 8.5 | Pluja: 1.4
2026-01-19 18:25:03 -    ✅ Període UTC: 08:00 - 08:30 | TX: 8.5 | TN: 8.5 | Pluja: 3.7
2026-01-19 18:25:03 -    ✅ Període UTC: 08:30 - 09:00 | TX: 8.5 | TN: 8.5 | Pluja: 3.0
2026-01-19 18:25:03 -    ✅ Període UTC: 09:00 - 09:30 | TX: 8.6 | TN: 8.5 | Pluja: 0.7
2026-01-19 18:25:03 -    ✅ Període UTC: 09:30 - 10:00 | TX: 8.7 | TN: 8.6 | Pluja: 3.9
2026-01-19 18:25:03 -    ✅ Període UTC: 10:00 - 10:30 | TX: 8.9 | TN: 8.7 | Pluja: 2.5
2026-01-19 18:25:03 -    ✅ Període UTC: 10:30 - 11:00 | TX: 8.9 | TN: 8.9 | Pluja: 1.8
2026-01-19 18:25:03 -    ✅ Període UTC: 11:00 - 11:30 | TX: 9.0 | TN: 8.9 | Pluja: 2.9
2026-01-19 18:25:03 -    ✅ Període UTC: 11:30 - 12:00 | TX: 8.9 | TN: 8.9 | Pluja: 0.7
2026-01-19 18:25:03 -    ✅ Període UTC: 12:00 - 12:30 | TX: 9.0 | TN: 8.9 | Pluja: 0.7
2026-01-19 18:25:03 -    ✅ Període UTC: 12:30 - 13:00 | TX: 9.0 | TN: 8.9 | Pluja: 2.4
2026-01-19 18:25:03 -    ✅ Període UTC: 13:00 - 13:30 | TX: 8.9 | TN: 8.9 | Pluja: 2.2
2026-01-19 18:25:03 -    ✅ Període UTC: 13:30 - 14:00 | TX: 8.9 | TN: 8.8 | Pluja: 1.2
2026-01-19 18:25:03 -    ✅ Període UTC: 14:00 - 14:30 | TX: 8.9 | TN: 8.8 | Pluja: 0.7
2026-01-19 18:25:03 -    ✅ Període UTC: 14:30 - 15:00 | TX: 9.0 | TN: 8.9 | Pluja: 1.8
2026-01-19 18:25:03 -    ✅ Període UTC: 15:00 - 15:30 | TX: 9.0 | TN: 9.0 | Pluja: 1.8
2026-01-19 18:25:03 -    ✅ Període UTC: 15:30 - 16:00 | TX: 9.1 | TN: 9.0 | Pluja: 2.4
2026-01-19 18:25:03 -    ✅ Període UTC: 16:00 - 16:30 | TX: 9.0 | TN: 9.0 | Pluja: 0.6
2026-01-19 18:25:03 -    ✅ Període UTC: 16:30 - 17:00 | TX: 9.0 | TN: 8.8 | Pluja: 0.8
2026-01-19 18:25:03 -    ✅ Període UTC: 17:00 - 17:30 | TX: 8.8 | TN: 8.7 | Pluja: 2.6
2026-01-19 18:25:03 -    ✅ Període UTC: 17:30 - 18:00 | TX: 8.7 | TN: 8.7 | Pluja: 1.5
2026-01-19 18:25:03 - 📈 Total períodes vàlids trobats: 36
2026-01-19 18:25:03 - 📊 RESUM CALCULAT:
2026-01-19 18:25:03 -    • Màxima del dia: 9.9°C
2026-01-19 18:25:03 -    • Mínima del dia: 8.5°C
2026-01-19 18:25:03 -    • Pluja acumulada: 42.19999999999999mm
2026-01-19 18:25:03 -    • Últim període: 17:30 - 18:00 UTC
2026-01-19 18:25:03 -    • Hora actualització: 18:25
2026-01-19 18:25:03 - 💾 Dades guardades a data/XJ_20260119.csv (36 registres)
2026-01-19 18:25:03 - ✅ Girona: 36 períodes processats
2026-01-19 18:25:03 - 💾 Dades guardades a data/weather_daily_20260119.json
2026-01-19 18:25:03 - 💾 Dades guardades a data/weather_summary.json
2026-01-19 18:25:03 - 
============================================================
2026-01-19 18:25:03 - 📋 RESUM FINAL DEL DIA (UTC)
2026-01-19 18:25:03 - ============================================================
2026-01-19 18:25:03 - 
📍 Fornells de la Selva:
2026-01-19 18:25:03 -    • Períodes: 36
2026-01-19 18:25:03 -    • Màxima: 9.8°C
2026-01-19 18:25:03 -    • Mínima: 8.4°C
2026-01-19 18:25:03 -    • Pluja: 10.5mm
2026-01-19 18:25:03 -    • Últim període: 17:30 - 18:00 UTC
2026-01-19 18:25:03 -    • Actualització: 18:25
2026-01-19 18:25:03 - 
📍 Girona:
2026-01-19 18:25:03 -    • Períodes: 36
2026-01-19 18:25:03 -    • Màxima: 9.9°C
2026-01-19 18:25:03 -    • Mínima: 8.5°C
2026-01-19 18:25:03 -    • Pluja: 42.19999999999999mm
2026-01-19 18:25:03 -    • Últim període: 17:30 - 18:00 UTC
2026-01-19 18:25:03 -    • Actualització: 18:25
2026-01-19 18:25:03 - 
💾 Fitxers generats:
2026-01-19 18:25:03 -    • data/weather_summary.json (per HTML)
2026-01-19 18:25:03 -    • data/weather_daily_YYYYMMDD.json (complet)
2026-01-19 18:25:03 -    • data/XX_YYYYMMDD.csv (per estació)
2026-01-19 18:25:03 - 
✅ PROCÉS COMPLETAT
2026-01-19 18:25:03 - ============================================================
