=== INICI DAILY SCRAPER (UTC): 2025-12-31 19:35:16 ===
2025-12-31 19:35:16 - ============================================================
2025-12-31 19:35:16 - 🌤️  DAILY WEATHER SCRAPER - VERSIÓ UTC
2025-12-31 19:35:16 - ============================================================
2025-12-31 19:35:16 - 
==================================================
2025-12-31 19:35:16 - 📡 Processant: Fornells de la Selva [UO]
2025-12-31 19:35:16 - 
🌐 Connectant a Fornells de la Selva...
2025-12-31 19:35:18 - 📊 Total files trobades a la taula: 40
2025-12-31 19:35:18 -    ✅ Període UTC: 00:00 - 00:30 | TX: 2.8 | TN: 2.4 | Pluja: 0.0
2025-12-31 19:35:18 -    ✅ Període UTC: 00:30 - 01:00 | TX: 2.5 | TN: 1.9 | Pluja: 0.0
2025-12-31 19:35:18 -    ✅ Període UTC: 01:00 - 01:30 | TX: 2.1 | TN: 1.4 | Pluja: 0.0
2025-12-31 19:35:18 -    ✅ Període UTC: 01:30 - 02:00 | TX: 1.8 | TN: 1.2 | Pluja: 0.0
2025-12-31 19:35:18 -    ✅ Període UTC: 02:00 - 02:30 | TX: 3.1 | TN: 1.8 | Pluja: 0.0
2025-12-31 19:35:18 -    ✅ Període UTC: 02:30 - 03:00 | TX: 3.8 | TN: 3.1 | Pluja: 0.0
2025-12-31 19:35:18 -    ✅ Període UTC: 03:00 - 03:30 | TX: 3.8 | TN: 3.0 | Pluja: 0.0
2025-12-31 19:35:18 -    ✅ Període UTC: 03:30 - 04:00 | TX: 3.5 | TN: 3.0 | Pluja: 0.0
2025-12-31 19:35:18 -    ✅ Període UTC: 04:00 - 04:30 | TX: 3.7 | TN: 2.7 | Pluja: 0.0
2025-12-31 19:35:18 -    ✅ Període UTC: 04:30 - 05:00 | TX: 3.4 | TN: 2.1 | Pluja: 0.0
2025-12-31 19:35:18 -    ✅ Període UTC: 05:00 - 05:30 | TX: 2.9 | TN: 2.2 | Pluja: 0.0
2025-12-31 19:35:18 -    ✅ Període UTC: 05:30 - 06:00 | TX: 3.2 | TN: 2.4 | Pluja: 0.0
2025-12-31 19:35:18 -    ✅ Període UTC: 06:00 - 06:30 | TX: 3.2 | TN: 1.6 | Pluja: 0.0
2025-12-31 19:35:18 -    ✅ Període UTC: 06:30 - 07:00 | TX: 1.8 | TN: 1.1 | Pluja: 0.0
2025-12-31 19:35:18 -    ✅ Període UTC: 07:00 - 07:30 | TX: 1.3 | TN: 0.6 | Pluja: 0.0
2025-12-31 19:35:18 -    ✅ Període UTC: 07:30 - 08:00 | TX: 1.3 | TN: 0.5 | Pluja: 0.0
2025-12-31 19:35:18 -    ✅ Període UTC: 08:00 - 08:30 | TX: 2.6 | TN: 1.3 | Pluja: 0.0
2025-12-31 19:35:18 -    ✅ Període UTC: 08:30 - 09:00 | TX: 4.6 | TN: 2.7 | Pluja: 0.0
2025-12-31 19:35:18 -    ✅ Període UTC: 09:00 - 09:30 | TX: 6.5 | TN: 4.6 | Pluja: 0.0
2025-12-31 19:35:18 -    ✅ Període UTC: 09:30 - 10:00 | TX: 7.8 | TN: 6.6 | Pluja: 0.0
2025-12-31 19:35:18 -    ✅ Període UTC: 10:00 - 10:30 | TX: 8.6 | TN: 7.9 | Pluja: 0.0
2025-12-31 19:35:18 -    ✅ Període UTC: 10:30 - 11:00 | TX: 9.4 | TN: 8.6 | Pluja: 0.0
2025-12-31 19:35:18 -    ✅ Període UTC: 11:00 - 11:30 | TX: 9.7 | TN: 9.4 | Pluja: 0.0
2025-12-31 19:35:18 -    ✅ Període UTC: 11:30 - 12:00 | TX: 10.1 | TN: 9.7 | Pluja: 0.0
2025-12-31 19:35:18 -    ✅ Període UTC: 12:00 - 12:30 | TX: 10.5 | TN: 10.0 | Pluja: 0.0
2025-12-31 19:35:18 -    ✅ Període UTC: 12:30 - 13:00 | TX: 11.1 | TN: 10.4 | Pluja: 0.0
2025-12-31 19:35:18 -    ✅ Període UTC: 13:00 - 13:30 | TX: 11.4 | TN: 10.8 | Pluja: 0.0
2025-12-31 19:35:18 -    ✅ Període UTC: 13:30 - 14:00 | TX: 11.3 | TN: 10.3 | Pluja: 0.0
2025-12-31 19:35:18 -    ✅ Període UTC: 14:00 - 14:30 | TX: 10.4 | TN: 10.0 | Pluja: 0.0
2025-12-31 19:35:18 -    ✅ Període UTC: 14:30 - 15:00 | TX: 10.1 | TN: 9.7 | Pluja: 0.0
2025-12-31 19:35:18 -    ✅ Període UTC: 15:00 - 15:30 | TX: 9.6 | TN: 8.9 | Pluja: 0.0
2025-12-31 19:35:18 -    ✅ Període UTC: 15:30 - 16:00 | TX: 8.9 | TN: 8.0 | Pluja: 0.0
2025-12-31 19:35:18 -    ✅ Període UTC: 16:00 - 16:30 | TX: 8.0 | TN: 6.4 | Pluja: 0.0
2025-12-31 19:35:18 -    ✅ Període UTC: 16:30 - 17:00 | TX: 6.9 | TN: 6.3 | Pluja: 0.0
2025-12-31 19:35:18 -    ✅ Període UTC: 17:00 - 17:30 | TX: 6.3 | TN: 5.1 | Pluja: 0.0
2025-12-31 19:35:18 -    ✅ Període UTC: 17:30 - 18:00 | TX: 5.0 | TN: 3.6 | Pluja: 0.0
2025-12-31 19:35:18 -    ✅ Període UTC: 18:00 - 18:30 | TX: 4.0 | TN: 3.1 | Pluja: 0.0
2025-12-31 19:35:18 -    ✅ Període UTC: 18:30 - 19:00 | TX: 3.2 | TN: 2.7 | Pluja: 0.0
2025-12-31 19:35:18 - 📈 Total períodes vàlids trobats: 38
2025-12-31 19:35:18 - 📊 RESUM CALCULAT:
2025-12-31 19:35:18 -    • Màxima del dia: 11.4°C
2025-12-31 19:35:18 -    • Mínima del dia: 0.5°C
2025-12-31 19:35:18 -    • Pluja acumulada: 0.0mm
2025-12-31 19:35:18 -    • Últim període: 18:30 - 19:00 UTC
2025-12-31 19:35:18 -    • Hora actualització: 19:35
2025-12-31 19:35:18 - 💾 Dades guardades a data/UO_20251231.csv (38 registres)
2025-12-31 19:35:18 - ✅ Fornells de la Selva: 38 períodes processats
2025-12-31 19:35:18 - 
==================================================
2025-12-31 19:35:18 - 📡 Processant: Girona [XJ]
2025-12-31 19:35:18 - 
🌐 Connectant a Girona...
2025-12-31 19:35:20 - 📊 Total files trobades a la taula: 40
2025-12-31 19:35:20 -    ✅ Període UTC: 00:00 - 00:30 | TX: 2.7 | TN: 2.2 | Pluja: 0.0
2025-12-31 19:35:20 -    ✅ Període UTC: 00:30 - 01:00 | TX: 3.6 | TN: 2.7 | Pluja: 0.0
2025-12-31 19:35:20 -    ✅ Període UTC: 01:00 - 01:30 | TX: 3.5 | TN: 2.8 | Pluja: 0.0
2025-12-31 19:35:20 -    ✅ Període UTC: 01:30 - 02:00 | TX: 3.1 | TN: 2.8 | Pluja: 0.0
2025-12-31 19:35:20 -    ✅ Període UTC: 02:00 - 02:30 | TX: 3.4 | TN: 2.9 | Pluja: 0.0
2025-12-31 19:35:20 -    ✅ Període UTC: 02:30 - 03:00 | TX: 3.6 | TN: 3.2 | Pluja: 0.0
2025-12-31 19:35:20 -    ✅ Període UTC: 03:00 - 03:30 | TX: 3.2 | TN: 2.7 | Pluja: 0.0
2025-12-31 19:35:20 -    ✅ Període UTC: 03:30 - 04:00 | TX: 2.7 | TN: 1.7 | Pluja: 0.0
2025-12-31 19:35:20 -    ✅ Període UTC: 04:00 - 04:30 | TX: 1.7 | TN: 1.2 | Pluja: 0.0
2025-12-31 19:35:20 -    ✅ Període UTC: 04:30 - 05:00 | TX: 1.5 | TN: 0.5 | Pluja: 0.0
2025-12-31 19:35:20 -    ✅ Període UTC: 05:00 - 05:30 | TX: 1.3 | TN: 0.8 | Pluja: 0.0
2025-12-31 19:35:20 -    ✅ Període UTC: 05:30 - 06:00 | TX: 1.3 | TN: 0.9 | Pluja: 0.0
2025-12-31 19:35:20 -    ✅ Període UTC: 06:00 - 06:30 | TX: 1.2 | TN: 0.7 | Pluja: 0.0
2025-12-31 19:35:20 -    ✅ Període UTC: 06:30 - 07:00 | TX: 0.7 | TN: 0.1 | Pluja: 0.0
2025-12-31 19:35:20 -    ✅ Període UTC: 07:00 - 07:30 | TX: 0.3 | TN: -0.3 | Pluja: 0.0
2025-12-31 19:35:20 -    ✅ Període UTC: 07:30 - 08:00 | TX: 1.5 | TN: 0.0 | Pluja: 0.0
2025-12-31 19:35:20 -    ✅ Període UTC: 08:00 - 08:30 | TX: 2.1 | TN: 1.3 | Pluja: 0.0
2025-12-31 19:35:20 -    ✅ Període UTC: 08:30 - 09:00 | TX: 4.9 | TN: 2.1 | Pluja: 0.0
2025-12-31 19:35:20 -    ✅ Període UTC: 09:00 - 09:30 | TX: 6.0 | TN: 4.8 | Pluja: 0.0
2025-12-31 19:35:20 -    ✅ Període UTC: 09:30 - 10:00 | TX: 8.6 | TN: 6.0 | Pluja: 0.0
2025-12-31 19:35:20 -    ✅ Període UTC: 10:00 - 10:30 | TX: 9.3 | TN: 8.3 | Pluja: 0.0
2025-12-31 19:35:20 -    ✅ Període UTC: 10:30 - 11:00 | TX: 10.1 | TN: 9.2 | Pluja: 0.4
2025-12-31 19:35:20 -    ✅ Període UTC: 11:00 - 11:30 | TX: 11.2 | TN: 9.9 | Pluja: 0.0
2025-12-31 19:35:20 -    ✅ Període UTC: 11:30 - 12:00 | TX: 10.7 | TN: 10.2 | Pluja: 0.0
2025-12-31 19:35:20 -    ✅ Període UTC: 12:00 - 12:30 | TX: 11.0 | TN: 10.5 | Pluja: 0.0
2025-12-31 19:35:20 -    ✅ Període UTC: 12:30 - 13:00 | TX: 11.4 | TN: 10.9 | Pluja: 0.0
2025-12-31 19:35:20 -    ✅ Període UTC: 13:00 - 13:30 | TX: 12.0 | TN: 11.1 | Pluja: 0.0
2025-12-31 19:35:20 -    ✅ Període UTC: 13:30 - 14:00 | TX: 11.8 | TN: 10.8 | Pluja: 0.0
2025-12-31 19:35:20 -    ✅ Període UTC: 14:00 - 14:30 | TX: 11.2 | TN: 10.7 | Pluja: 0.0
2025-12-31 19:35:20 -    ✅ Període UTC: 14:30 - 15:00 | TX: 11.2 | TN: 10.4 | Pluja: 0.0
2025-12-31 19:35:20 -    ✅ Període UTC: 15:00 - 15:30 | TX: 10.4 | TN: 9.9 | Pluja: 0.0
2025-12-31 19:35:20 -    ✅ Període UTC: 15:30 - 16:00 | TX: 9.8 | TN: 8.9 | Pluja: 0.0
2025-12-31 19:35:20 -    ✅ Període UTC: 16:00 - 16:30 | TX: 8.9 | TN: 7.5 | Pluja: 0.0
2025-12-31 19:35:20 -    ✅ Període UTC: 16:30 - 17:00 | TX: 7.4 | TN: 6.8 | Pluja: 0.0
2025-12-31 19:35:20 -    ✅ Període UTC: 17:00 - 17:30 | TX: 7.2 | TN: 5.2 | Pluja: 0.0
2025-12-31 19:35:20 -    ✅ Període UTC: 17:30 - 18:00 | TX: 5.1 | TN: 3.7 | Pluja: 0.0
2025-12-31 19:35:20 -    ✅ Període UTC: 18:00 - 18:30 | TX: 3.7 | TN: 2.8 | Pluja: 0.0
2025-12-31 19:35:20 -    ✅ Període UTC: 18:30 - 19:00 | TX: 2.8 | TN: 2.2 | Pluja: 0.0
2025-12-31 19:35:20 - 📈 Total períodes vàlids trobats: 38
2025-12-31 19:35:20 - 📊 RESUM CALCULAT:
2025-12-31 19:35:20 -    • Màxima del dia: 12.0°C
2025-12-31 19:35:20 -    • Mínima del dia: -0.3°C
2025-12-31 19:35:20 -    • Pluja acumulada: 0.4mm
2025-12-31 19:35:20 -    • Últim període: 18:30 - 19:00 UTC
2025-12-31 19:35:20 -    • Hora actualització: 19:35
2025-12-31 19:35:20 - 💾 Dades guardades a data/XJ_20251231.csv (38 registres)
2025-12-31 19:35:20 - ✅ Girona: 38 períodes processats
2025-12-31 19:35:20 - 💾 Dades guardades a data/weather_daily_20251231.json
2025-12-31 19:35:20 - 💾 Dades guardades a data/weather_summary.json
2025-12-31 19:35:20 - 
============================================================
2025-12-31 19:35:20 - 📋 RESUM FINAL DEL DIA (UTC)
2025-12-31 19:35:20 - ============================================================
2025-12-31 19:35:20 - 
📍 Fornells de la Selva:
2025-12-31 19:35:20 -    • Períodes: 38
2025-12-31 19:35:20 -    • Màxima: 11.4°C
2025-12-31 19:35:20 -    • Mínima: 0.5°C
2025-12-31 19:35:20 -    • Pluja: 0.0mm
2025-12-31 19:35:20 -    • Últim període: 18:30 - 19:00 UTC
2025-12-31 19:35:20 -    • Actualització: 19:35
2025-12-31 19:35:20 - 
📍 Girona:
2025-12-31 19:35:20 -    • Períodes: 38
2025-12-31 19:35:20 -    • Màxima: 12.0°C
2025-12-31 19:35:20 -    • Mínima: -0.3°C
2025-12-31 19:35:20 -    • Pluja: 0.4mm
2025-12-31 19:35:20 -    • Últim període: 18:30 - 19:00 UTC
2025-12-31 19:35:20 -    • Actualització: 19:35
2025-12-31 19:35:20 - 
💾 Fitxers generats:
2025-12-31 19:35:20 -    • data/weather_summary.json (per HTML)
2025-12-31 19:35:20 -    • data/weather_daily_YYYYMMDD.json (complet)
2025-12-31 19:35:20 -    • data/XX_YYYYMMDD.csv (per estació)
2025-12-31 19:35:20 - 
✅ PROCÉS COMPLETAT
2025-12-31 19:35:20 - ============================================================
