=== INICI DAILY SCRAPER (UTC): 2025-12-26 22:59:59 ===
2025-12-26 22:59:59 - ============================================================
2025-12-26 22:59:59 - 🌤️  DAILY WEATHER SCRAPER - VERSIÓ UTC
2025-12-26 22:59:59 - ============================================================
2025-12-26 22:59:59 - 
==================================================
2025-12-26 22:59:59 - 📡 Processant: Fornells de la Selva [UO]
2025-12-26 22:59:59 - 
🌐 Connectant a Fornells de la Selva...
2025-12-26 23:00:00 - 📊 Total files trobades a la taula: 47
2025-12-26 23:00:00 -    ✅ Període UTC: 00:00 - 00:30 | TX: 10.8 | TN: 9.1 | Pluja: 0.7
2025-12-26 23:00:00 -    ✅ Període UTC: 00:30 - 01:00 | TX: 11.1 | TN: 10.8 | Pluja: 0.9
2025-12-26 23:00:00 -    ✅ Període UTC: 01:00 - 01:30 | TX: 11.3 | TN: 11.1 | Pluja: 0.4
2025-12-26 23:00:00 -    ✅ Període UTC: 01:30 - 02:00 | TX: 11.5 | TN: 11.3 | Pluja: 0.3
2025-12-26 23:00:00 -    ✅ Període UTC: 02:00 - 02:30 | TX: 11.5 | TN: 11.4 | Pluja: 0.1
2025-12-26 23:00:00 -    ✅ Període UTC: 02:30 - 03:00 | TX: 11.4 | TN: 10.8 | Pluja: 3.9
2025-12-26 23:00:00 -    ✅ Període UTC: 03:00 - 03:30 | TX: 10.9 | TN: 10.4 | Pluja: 6.0
2025-12-26 23:00:00 -    ✅ Període UTC: 03:30 - 04:00 | TX: 11.6 | TN: 10.8 | Pluja: 1.4
2025-12-26 23:00:00 -    ✅ Període UTC: 04:00 - 04:30 | TX: 11.7 | TN: 11.6 | Pluja: 0.5
2025-12-26 23:00:00 -    ✅ Període UTC: 04:30 - 05:00 | TX: 11.7 | TN: 11.5 | Pluja: 0.8
2025-12-26 23:00:00 -    ✅ Període UTC: 05:00 - 05:30 | TX: 11.7 | TN: 11.5 | Pluja: 0.7
2025-12-26 23:00:00 -    ✅ Període UTC: 05:30 - 06:00 | TX: 11.7 | TN: 11.5 | Pluja: 0.2
2025-12-26 23:00:00 -    ✅ Període UTC: 06:00 - 06:30 | TX: 11.7 | TN: 11.5 | Pluja: 0.3
2025-12-26 23:00:00 -    ✅ Període UTC: 06:30 - 07:00 | TX: 11.8 | TN: 11.6 | Pluja: 0.3
2025-12-26 23:00:00 -    ✅ Període UTC: 07:00 - 07:30 | TX: 11.9 | TN: 11.7 | Pluja: 1.5
2025-12-26 23:00:00 -    ✅ Període UTC: 07:30 - 08:00 | TX: 11.8 | TN: 11.6 | Pluja: 1.1
2025-12-26 23:00:00 -    ✅ Període UTC: 08:00 - 08:30 | TX: 11.7 | TN: 11.6 | Pluja: 0.1
2025-12-26 23:00:00 -    ✅ Període UTC: 08:30 - 09:00 | TX: 11.8 | TN: 11.5 | Pluja: 0.8
2025-12-26 23:00:00 -    ✅ Període UTC: 09:00 - 09:30 | TX: 11.9 | TN: 11.5 | Pluja: 0.7
2025-12-26 23:00:00 -    ✅ Període UTC: 09:30 - 10:00 | TX: 11.9 | TN: 11.7 | Pluja: 0.6
2025-12-26 23:00:00 -    ✅ Període UTC: 10:00 - 10:30 | TX: 11.9 | TN: 11.7 | Pluja: 0.2
2025-12-26 23:00:00 -    ✅ Període UTC: 10:30 - 11:00 | TX: 11.7 | TN: 11.4 | Pluja: 0.6
2025-12-26 23:00:00 -    ✅ Període UTC: 11:00 - 11:30 | TX: 11.9 | TN: 11.5 | Pluja: 0.5
2025-12-26 23:00:00 -    ✅ Període UTC: 11:30 - 12:00 | TX: 11.9 | TN: 11.2 | Pluja: 0.2
2025-12-26 23:00:00 -    ✅ Període UTC: 12:00 - 12:30 | TX: 11.2 | TN: 11.1 | Pluja: 0.4
2025-12-26 23:00:00 -    ✅ Període UTC: 12:30 - 13:00 | TX: 11.3 | TN: 11.2 | Pluja: 1.1
2025-12-26 23:00:00 -    ✅ Període UTC: 13:00 - 13:30 | TX: 11.3 | TN: 11.3 | Pluja: 1.4
2025-12-26 23:00:00 -    ✅ Període UTC: 13:30 - 14:00 | TX: 11.3 | TN: 11.3 | Pluja: 3.3
2025-12-26 23:00:00 -    ✅ Període UTC: 14:00 - 14:30 | TX: 11.3 | TN: 11.2 | Pluja: 4.6
2025-12-26 23:00:00 -    ✅ Període UTC: 14:30 - 15:00 | TX: 11.4 | TN: 11.2 | Pluja: 2.9
2025-12-26 23:00:00 -    ✅ Període UTC: 15:00 - 15:30 | TX: 11.5 | TN: 11.4 | Pluja: 0.8
2025-12-26 23:00:00 -    ✅ Període UTC: 15:30 - 16:00 | TX: 11.5 | TN: 11.3 | Pluja: 0.4
2025-12-26 23:00:00 -    ✅ Període UTC: 16:00 - 16:30 | TX: 11.4 | TN: 11.3 | Pluja: 0.3
2025-12-26 23:00:00 -    ✅ Període UTC: 16:30 - 17:00 | TX: 11.5 | TN: 11.3 | Pluja: 0.4
2025-12-26 23:00:00 -    ✅ Període UTC: 17:00 - 17:30 | TX: 11.8 | TN: 11.5 | Pluja: 0.1
2025-12-26 23:00:00 -    ✅ Període UTC: 17:30 - 18:00 | TX: 11.9 | TN: 11.7 | Pluja: 0.0
2025-12-26 23:00:00 -    ✅ Període UTC: 18:00 - 18:30 | TX: 11.9 | TN: 11.8 | Pluja: 0.0
2025-12-26 23:00:00 -    ✅ Període UTC: 18:30 - 19:00 | TX: 11.8 | TN: 11.7 | Pluja: 0.0
2025-12-26 23:00:00 -    ✅ Període UTC: 19:00 - 19:30 | TX: 11.7 | TN: 11.5 | Pluja: 0.0
2025-12-26 23:00:00 -    ✅ Període UTC: 19:30 - 20:00 | TX: 11.8 | TN: 11.5 | Pluja: 0.0
2025-12-26 23:00:00 -    ✅ Període UTC: 20:00 - 20:30 | TX: 11.9 | TN: 11.7 | Pluja: 0.0
2025-12-26 23:00:00 -    ✅ Període UTC: 20:30 - 21:00 | TX: 11.8 | TN: 11.7 | Pluja: 0.0
2025-12-26 23:00:00 -    ✅ Període UTC: 21:00 - 21:30 | TX: 11.6 | TN: 11.4 | Pluja: 0.0
2025-12-26 23:00:00 -    ✅ Període UTC: 21:30 - 22:00 | TX: 11.4 | TN: 11.2 | Pluja: 0.0
2025-12-26 23:00:00 -    ✅ Període UTC: 22:00 - 22:30 | TX: 11.2 | TN: 11.0 | Pluja: 0.2
2025-12-26 23:00:00 - 📈 Total períodes vàlids trobats: 45
2025-12-26 23:00:00 - 📊 RESUM CALCULAT:
2025-12-26 23:00:00 -    • Màxima del dia: 11.9°C
2025-12-26 23:00:00 -    • Mínima del dia: 9.1°C
2025-12-26 23:00:00 -    • Pluja acumulada: 38.699999999999996mm
2025-12-26 23:00:00 -    • Últim període: 22:00 - 22:30 UTC
2025-12-26 23:00:00 -    • Hora actualització: 23:00
2025-12-26 23:00:00 - 💾 Dades guardades a data/UO_20251226.csv (45 registres)
2025-12-26 23:00:00 - ✅ Fornells de la Selva: 45 períodes processats
2025-12-26 23:00:00 - 
==================================================
2025-12-26 23:00:00 - 📡 Processant: Girona [XJ]
2025-12-26 23:00:00 - 
🌐 Connectant a Girona...
2025-12-26 23:00:02 - 📊 Total files trobades a la taula: 47
2025-12-26 23:00:02 -    ✅ Període UTC: 00:00 - 00:30 | TX: 9.2 | TN: 9.1 | Pluja: 1.4
2025-12-26 23:00:02 -    ✅ Període UTC: 00:30 - 01:00 | TX: 10.3 | TN: 9.2 | Pluja: 1.7
2025-12-26 23:00:02 -    ✅ Període UTC: 01:00 - 01:30 | TX: 10.8 | TN: 10.3 | Pluja: 0.5
2025-12-26 23:00:02 -    ✅ Període UTC: 01:30 - 02:00 | TX: 11.2 | TN: 10.8 | Pluja: 0.0
2025-12-26 23:00:02 -    ✅ Període UTC: 02:00 - 02:30 | TX: 11.2 | TN: 11.1 | Pluja: 0.2
2025-12-26 23:00:02 -    ✅ Període UTC: 02:30 - 03:00 | TX: 11.3 | TN: 10.9 | Pluja: 2.5
2025-12-26 23:00:02 -    ✅ Període UTC: 03:00 - 03:30 | TX: 10.9 | TN: 10.8 | Pluja: 4.7
2025-12-26 23:00:02 -    ✅ Període UTC: 03:30 - 04:00 | TX: 11.1 | TN: 10.8 | Pluja: 3.8
2025-12-26 23:00:02 -    ✅ Període UTC: 04:00 - 04:30 | TX: 11.3 | TN: 11.1 | Pluja: 2.1
2025-12-26 23:00:02 -    ✅ Període UTC: 04:30 - 05:00 | TX: 11.3 | TN: 11.2 | Pluja: 0.9
2025-12-26 23:00:02 -    ✅ Període UTC: 05:00 - 05:30 | TX: 11.5 | TN: 11.2 | Pluja: 0.0
2025-12-26 23:00:02 -    ✅ Període UTC: 05:30 - 06:00 | TX: 11.7 | TN: 11.4 | Pluja: 0.1
2025-12-26 23:00:02 -    ✅ Període UTC: 06:00 - 06:30 | TX: 11.8 | TN: 11.6 | Pluja: 0.3
2025-12-26 23:00:02 -    ✅ Període UTC: 06:30 - 07:00 | TX: 12.1 | TN: 11.8 | Pluja: 0.0
2025-12-26 23:00:02 -    ✅ Període UTC: 07:00 - 07:30 | TX: 12.1 | TN: 11.7 | Pluja: 2.6
2025-12-26 23:00:02 -    ✅ Període UTC: 07:30 - 08:00 | TX: 11.7 | TN: 11.4 | Pluja: 1.7
2025-12-26 23:00:02 -    ✅ Període UTC: 08:00 - 08:30 | TX: 11.8 | TN: 11.5 | Pluja: 0.6
2025-12-26 23:00:02 -    ✅ Període UTC: 08:30 - 09:00 | TX: 11.9 | TN: 11.7 | Pluja: 0.4
2025-12-26 23:00:02 -    ✅ Període UTC: 09:00 - 09:30 | TX: 11.8 | TN: 11.5 | Pluja: 2.0
2025-12-26 23:00:02 -    ✅ Període UTC: 09:30 - 10:00 | TX: 12.0 | TN: 11.7 | Pluja: 0.5
2025-12-26 23:00:02 -    ✅ Període UTC: 10:00 - 10:30 | TX: 11.9 | TN: 11.7 | Pluja: 0.4
2025-12-26 23:00:02 -    ✅ Període UTC: 10:30 - 11:00 | TX: 11.7 | TN: 11.4 | Pluja: 1.3
2025-12-26 23:00:02 -    ✅ Període UTC: 11:00 - 11:30 | TX: 11.5 | TN: 11.4 | Pluja: 0.6
2025-12-26 23:00:02 -    ✅ Període UTC: 11:30 - 12:00 | TX: 11.6 | TN: 11.4 | Pluja: 0.1
2025-12-26 23:00:02 -    ✅ Període UTC: 12:00 - 12:30 | TX: 11.4 | TN: 11.1 | Pluja: 0.6
2025-12-26 23:00:02 -    ✅ Període UTC: 12:30 - 13:00 | TX: 11.4 | TN: 11.1 | Pluja: 0.1
2025-12-26 23:00:02 -    ✅ Període UTC: 13:00 - 13:30 | TX: 11.4 | TN: 11.3 | Pluja: 0.8
2025-12-26 23:00:02 -    ✅ Període UTC: 13:30 - 14:00 | TX: 11.3 | TN: 11.2 | Pluja: 1.8
2025-12-26 23:00:02 -    ✅ Període UTC: 14:00 - 14:30 | TX: 11.4 | TN: 11.2 | Pluja: 2.2
2025-12-26 23:00:02 -    ✅ Període UTC: 14:30 - 15:00 | TX: 11.4 | TN: 11.2 | Pluja: 1.5
2025-12-26 23:00:02 -    ✅ Període UTC: 15:00 - 15:30 | TX: 11.4 | TN: 11.3 | Pluja: 0.8
2025-12-26 23:00:02 -    ✅ Període UTC: 15:30 - 16:00 | TX: 11.5 | TN: 11.4 | Pluja: 0.6
2025-12-26 23:00:02 -    ✅ Període UTC: 16:00 - 16:30 | TX: 11.5 | TN: 11.3 | Pluja: 0.4
2025-12-26 23:00:02 -    ✅ Període UTC: 16:30 - 17:00 | TX: 11.5 | TN: 11.4 | Pluja: 0.2
2025-12-26 23:00:02 -    ✅ Període UTC: 17:00 - 17:30 | TX: 11.6 | TN: 11.3 | Pluja: 0.0
2025-12-26 23:00:02 -    ✅ Període UTC: 17:30 - 18:00 | TX: 12.0 | TN: 11.6 | Pluja: 0.0
2025-12-26 23:00:02 -    ✅ Període UTC: 18:00 - 18:30 | TX: 11.9 | TN: 11.7 | Pluja: 0.0
2025-12-26 23:00:02 -    ✅ Període UTC: 18:30 - 19:00 | TX: 11.7 | TN: 11.5 | Pluja: 0.0
2025-12-26 23:00:02 -    ✅ Període UTC: 19:00 - 19:30 | TX: 11.6 | TN: 11.4 | Pluja: 0.4
2025-12-26 23:00:02 -    ✅ Període UTC: 19:30 - 20:00 | TX: 11.5 | TN: 11.3 | Pluja: 0.1
2025-12-26 23:00:02 -    ✅ Període UTC: 20:00 - 20:30 | TX: 11.8 | TN: 11.4 | Pluja: 0.1
2025-12-26 23:00:02 -    ✅ Període UTC: 20:30 - 21:00 | TX: 11.8 | TN: 11.5 | Pluja: 0.0
2025-12-26 23:00:02 -    ✅ Període UTC: 21:00 - 21:30 | TX: 11.4 | TN: 11.0 | Pluja: 0.0
2025-12-26 23:00:02 -    ✅ Període UTC: 21:30 - 22:00 | TX: 11.0 | TN: 10.8 | Pluja: 0.0
2025-12-26 23:00:02 -    ✅ Període UTC: 22:00 - 22:30 | TX: 11.1 | TN: 10.9 | Pluja: 1.3
2025-12-26 23:00:02 - 📈 Total períodes vàlids trobats: 45
2025-12-26 23:00:02 - 📊 RESUM CALCULAT:
2025-12-26 23:00:02 -    • Màxima del dia: 12.1°C
2025-12-26 23:00:02 -    • Mínima del dia: 9.1°C
2025-12-26 23:00:02 -    • Pluja acumulada: 39.30000000000001mm
2025-12-26 23:00:02 -    • Últim període: 22:00 - 22:30 UTC
2025-12-26 23:00:02 -    • Hora actualització: 23:00
2025-12-26 23:00:02 - 💾 Dades guardades a data/XJ_20251226.csv (45 registres)
2025-12-26 23:00:02 - ✅ Girona: 45 períodes processats
2025-12-26 23:00:02 - 💾 Dades guardades a data/weather_daily_20251226.json
2025-12-26 23:00:02 - 💾 Dades guardades a data/weather_summary.json
2025-12-26 23:00:02 - 
============================================================
2025-12-26 23:00:02 - 📋 RESUM FINAL DEL DIA (UTC)
2025-12-26 23:00:02 - ============================================================
2025-12-26 23:00:02 - 
📍 Fornells de la Selva:
2025-12-26 23:00:02 -    • Períodes: 45
2025-12-26 23:00:02 -    • Màxima: 11.9°C
2025-12-26 23:00:02 -    • Mínima: 9.1°C
2025-12-26 23:00:02 -    • Pluja: 38.699999999999996mm
2025-12-26 23:00:02 -    • Últim període: 22:00 - 22:30 UTC
2025-12-26 23:00:02 -    • Actualització: 23:00
2025-12-26 23:00:02 - 
📍 Girona:
2025-12-26 23:00:02 -    • Períodes: 45
2025-12-26 23:00:02 -    • Màxima: 12.1°C
2025-12-26 23:00:02 -    • Mínima: 9.1°C
2025-12-26 23:00:02 -    • Pluja: 39.30000000000001mm
2025-12-26 23:00:02 -    • Últim període: 22:00 - 22:30 UTC
2025-12-26 23:00:02 -    • Actualització: 23:00
2025-12-26 23:00:02 - 
💾 Fitxers generats:
2025-12-26 23:00:02 -    • data/weather_summary.json (per HTML)
2025-12-26 23:00:02 -    • data/weather_daily_YYYYMMDD.json (complet)
2025-12-26 23:00:02 -    • data/XX_YYYYMMDD.csv (per estació)
2025-12-26 23:00:02 - 
✅ PROCÉS COMPLETAT
2025-12-26 23:00:02 - ============================================================
