=== INICI DAILY SCRAPER (UTC): 2026-02-13 14:50:23 ===
2026-02-13 14:50:23 - ============================================================
2026-02-13 14:50:23 - 🌤️  DAILY WEATHER SCRAPER - VERSIÓ UTC
2026-02-13 14:50:23 - ============================================================
2026-02-13 14:50:23 - 
==================================================
2026-02-13 14:50:23 - 📡 Processant: Fornells de la Selva [UO]
2026-02-13 14:50:23 - 
🌐 Connectant a Fornells de la Selva...
2026-02-13 14:50:25 - 📊 Total files trobades a la taula: 30
2026-02-13 14:50:25 -    ✅ Període UTC: 00:00 - 00:30 | TX: 8.8 | TN: 7.5 | Pluja: 0.0
2026-02-13 14:50:25 -    ✅ Període UTC: 00:30 - 01:00 | TX: 7.8 | TN: 7.2 | Pluja: 0.0
2026-02-13 14:50:25 -    ✅ Període UTC: 01:00 - 01:30 | TX: 7.6 | TN: 6.1 | Pluja: 0.0
2026-02-13 14:50:25 -    ✅ Període UTC: 01:30 - 02:00 | TX: 8.8 | TN: 7.3 | Pluja: 0.0
2026-02-13 14:50:25 -    ✅ Període UTC: 02:00 - 02:30 | TX: 8.1 | TN: 6.9 | Pluja: 0.0
2026-02-13 14:50:25 -    ✅ Període UTC: 02:30 - 03:00 | TX: 7.9 | TN: 7.0 | Pluja: 0.0
2026-02-13 14:50:25 -    ✅ Període UTC: 03:00 - 03:30 | TX: 7.7 | TN: 6.7 | Pluja: 0.0
2026-02-13 14:50:25 -    ✅ Període UTC: 03:30 - 04:00 | TX: 6.9 | TN: 6.3 | Pluja: 0.0
2026-02-13 14:50:25 -    ✅ Període UTC: 04:00 - 04:30 | TX: 7.6 | TN: 6.2 | Pluja: 0.0
2026-02-13 14:50:25 -    ✅ Període UTC: 04:30 - 05:00 | TX: 7.1 | TN: 6.2 | Pluja: 0.0
2026-02-13 14:50:25 -    ✅ Període UTC: 05:00 - 05:30 | TX: 6.9 | TN: 6.2 | Pluja: 0.0
2026-02-13 14:50:25 -    ✅ Període UTC: 05:30 - 06:00 | TX: 7.2 | TN: 6.2 | Pluja: 0.0
2026-02-13 14:50:25 -    ✅ Període UTC: 06:00 - 06:30 | TX: 7.4 | TN: 6.7 | Pluja: 0.0
2026-02-13 14:50:25 -    ✅ Període UTC: 06:30 - 07:00 | TX: 7.3 | TN: 6.8 | Pluja: 0.0
2026-02-13 14:50:25 -    ✅ Període UTC: 07:00 - 07:30 | TX: 7.4 | TN: 7.1 | Pluja: 0.1
2026-02-13 14:50:25 -    ✅ Període UTC: 07:30 - 08:00 | TX: 7.8 | TN: 7.4 | Pluja: 0.0
2026-02-13 14:50:25 -    ✅ Període UTC: 08:00 - 08:30 | TX: 8.0 | TN: 7.8 | Pluja: 0.0
2026-02-13 14:50:25 -    ✅ Període UTC: 08:30 - 09:00 | TX: 8.8 | TN: 8.0 | Pluja: 0.0
2026-02-13 14:50:25 -    ✅ Període UTC: 09:00 - 09:30 | TX: 9.3 | TN: 8.9 | Pluja: 0.0
2026-02-13 14:50:25 -    ✅ Període UTC: 09:30 - 10:00 | TX: 9.6 | TN: 9.4 | Pluja: 0.1
2026-02-13 14:50:25 -    ✅ Període UTC: 10:00 - 10:30 | TX: 10.1 | TN: 9.6 | Pluja: 0.1
2026-02-13 14:50:25 -    ✅ Període UTC: 10:30 - 11:00 | TX: 10.9 | TN: 10.1 | Pluja: 0.0
2026-02-13 14:50:25 -    ✅ Període UTC: 11:00 - 11:30 | TX: 11.1 | TN: 10.8 | Pluja: 0.0
2026-02-13 14:50:25 -    ✅ Període UTC: 11:30 - 12:00 | TX: 10.8 | TN: 10.5 | Pluja: 0.4
2026-02-13 14:50:25 -    ✅ Període UTC: 12:00 - 12:30 | TX: 10.5 | TN: 10.0 | Pluja: 1.1
2026-02-13 14:50:25 -    ✅ Període UTC: 12:30 - 13:00 | TX: 10.2 | TN: 10.0 | Pluja: 0.4
2026-02-13 14:50:25 - 📈 Total períodes vàlids trobats: 26
2026-02-13 14:50:25 - 📊 RESUM CALCULAT:
2026-02-13 14:50:25 -    • Màxima del dia: 11.1°C
2026-02-13 14:50:25 -    • Mínima del dia: 6.1°C
2026-02-13 14:50:25 -    • Pluja acumulada: 2.2mm
2026-02-13 14:50:25 -    • Últim període: 12:30 - 13:00 UTC
2026-02-13 14:50:25 -    • Hora actualització: 14:50
2026-02-13 14:50:25 - 💾 Dades guardades a data/UO_20260213.csv (26 registres)
2026-02-13 14:50:25 - ✅ Fornells de la Selva: 26 períodes processats
2026-02-13 14:50:25 - 
==================================================
2026-02-13 14:50:25 - 📡 Processant: Girona [XJ]
2026-02-13 14:50:25 - 
🌐 Connectant a Girona...
2026-02-13 14:50:27 - 📊 Total files trobades a la taula: 30
2026-02-13 14:50:27 -    ✅ Període UTC: 00:00 - 00:30 | TX: 11.3 | TN: 8.0 | Pluja: 0.0
2026-02-13 14:50:27 -    ✅ Període UTC: 00:30 - 01:00 | TX: 8.7 | TN: 7.6 | Pluja: 0.0
2026-02-13 14:50:27 -    ✅ Període UTC: 01:00 - 01:30 | TX: 8.8 | TN: 7.9 | Pluja: 0.0
2026-02-13 14:50:27 -    ✅ Període UTC: 01:30 - 02:00 | TX: 7.9 | TN: 6.4 | Pluja: 0.0
2026-02-13 14:50:27 -    ✅ Període UTC: 02:00 - 02:30 | TX: 7.5 | TN: 6.6 | Pluja: 0.0
2026-02-13 14:50:27 -    ✅ Període UTC: 02:30 - 03:00 | TX: 7.6 | TN: 6.6 | Pluja: 0.0
2026-02-13 14:50:27 -    ✅ Període UTC: 03:00 - 03:30 | TX: 7.6 | TN: 6.9 | Pluja: 0.0
2026-02-13 14:50:27 -    ✅ Període UTC: 03:30 - 04:00 | TX: 7.4 | TN: 7.0 | Pluja: 0.0
2026-02-13 14:50:27 -    ✅ Període UTC: 04:00 - 04:30 | TX: 7.2 | TN: 6.9 | Pluja: 0.0
2026-02-13 14:50:27 -    ✅ Període UTC: 04:30 - 05:00 | TX: 7.6 | TN: 6.9 | Pluja: 0.0
2026-02-13 14:50:27 -    ✅ Període UTC: 05:00 - 05:30 | TX: 7.2 | TN: 6.9 | Pluja: 0.0
2026-02-13 14:50:27 -    ✅ Període UTC: 05:30 - 06:00 | TX: 6.9 | TN: 6.6 | Pluja: 0.0
2026-02-13 14:50:27 -    ✅ Període UTC: 06:00 - 06:30 | TX: 7.0 | TN: 6.8 | Pluja: 0.0
2026-02-13 14:50:27 -    ✅ Període UTC: 06:30 - 07:00 | TX: 7.1 | TN: 6.8 | Pluja: 0.0
2026-02-13 14:50:27 -    ✅ Període UTC: 07:00 - 07:30 | TX: 7.5 | TN: 7.2 | Pluja: 0.2
2026-02-13 14:50:27 -    ✅ Període UTC: 07:30 - 08:00 | TX: 7.7 | TN: 7.5 | Pluja: 0.0
2026-02-13 14:50:27 -    ✅ Període UTC: 08:00 - 08:30 | TX: 8.2 | TN: 7.7 | Pluja: 0.1
2026-02-13 14:50:27 -    ✅ Període UTC: 08:30 - 09:00 | TX: 10.6 | TN: 8.2 | Pluja: 0.0
2026-02-13 14:50:27 -    ✅ Període UTC: 09:00 - 09:30 | TX: 11.0 | TN: 10.5 | Pluja: 0.0
2026-02-13 14:50:27 -    ✅ Període UTC: 09:30 - 10:00 | TX: 10.5 | TN: 10.3 | Pluja: 0.0
2026-02-13 14:50:27 -    ✅ Període UTC: 10:00 - 10:30 | TX: 10.6 | TN: 10.3 | Pluja: 0.2
2026-02-13 14:50:27 -    ✅ Període UTC: 10:30 - 11:00 | TX: 11.4 | TN: 10.6 | Pluja: 0.1
2026-02-13 14:50:27 -    ✅ Període UTC: 11:00 - 11:30 | TX: 11.9 | TN: 11.4 | Pluja: 0.0
2026-02-13 14:50:27 -    ✅ Període UTC: 11:30 - 12:00 | TX: 11.8 | TN: 10.9 | Pluja: 0.3
2026-02-13 14:50:27 -    ✅ Període UTC: 12:00 - 12:30 | TX: 11.0 | TN: 10.4 | Pluja: 0.6
2026-02-13 14:50:27 -    ✅ Període UTC: 12:30 - 13:00 | TX: 10.4 | TN: 10.3 | Pluja: 0.6
2026-02-13 14:50:27 -    ✅ Període UTC: 13:00 - 13:30 | TX: 10.5 | TN: 10.2 | Pluja: 0.8
2026-02-13 14:50:27 -    ✅ Període UTC: 13:30 - 14:00 | TX: 10.4 | TN: 10.2 | Pluja: 0.7
2026-02-13 14:50:27 -    ✅ Període UTC: 14:00 - 14:30 | TX: 10.6 | TN: 10.3 | Pluja: 0.3
2026-02-13 14:50:27 - 📈 Total períodes vàlids trobats: 29
2026-02-13 14:50:27 - 📊 RESUM CALCULAT:
2026-02-13 14:50:27 -    • Màxima del dia: 11.9°C
2026-02-13 14:50:27 -    • Mínima del dia: 6.4°C
2026-02-13 14:50:27 -    • Pluja acumulada: 3.9000000000000004mm
2026-02-13 14:50:27 -    • Últim període: 14:00 - 14:30 UTC
2026-02-13 14:50:27 -    • Hora actualització: 14:50
2026-02-13 14:50:27 - 💾 Dades guardades a data/XJ_20260213.csv (29 registres)
2026-02-13 14:50:27 - ✅ Girona: 29 períodes processats
2026-02-13 14:50:27 - 💾 Dades guardades a data/weather_daily_20260213.json
2026-02-13 14:50:27 - 💾 Dades guardades a data/weather_summary.json
2026-02-13 14:50:27 - 
============================================================
2026-02-13 14:50:27 - 📋 RESUM FINAL DEL DIA (UTC)
2026-02-13 14:50:27 - ============================================================
2026-02-13 14:50:27 - 
📍 Fornells de la Selva:
2026-02-13 14:50:27 -    • Períodes: 26
2026-02-13 14:50:27 -    • Màxima: 11.1°C
2026-02-13 14:50:27 -    • Mínima: 6.1°C
2026-02-13 14:50:27 -    • Pluja: 2.2mm
2026-02-13 14:50:27 -    • Últim període: 12:30 - 13:00 UTC
2026-02-13 14:50:27 -    • Actualització: 14:50
2026-02-13 14:50:27 - 
📍 Girona:
2026-02-13 14:50:27 -    • Períodes: 29
2026-02-13 14:50:27 -    • Màxima: 11.9°C
2026-02-13 14:50:27 -    • Mínima: 6.4°C
2026-02-13 14:50:27 -    • Pluja: 3.9000000000000004mm
2026-02-13 14:50:27 -    • Últim període: 14:00 - 14:30 UTC
2026-02-13 14:50:27 -    • Actualització: 14:50
2026-02-13 14:50:27 - 
💾 Fitxers generats:
2026-02-13 14:50:27 -    • data/weather_summary.json (per HTML)
2026-02-13 14:50:27 -    • data/weather_daily_YYYYMMDD.json (complet)
2026-02-13 14:50:27 -    • data/XX_YYYYMMDD.csv (per estació)
2026-02-13 14:50:27 - 
✅ PROCÉS COMPLETAT
2026-02-13 14:50:27 - ============================================================
