=== INICI DAILY SCRAPER (UTC): 2026-01-22 22:25:18 ===
2026-01-22 22:25:18 - ============================================================
2026-01-22 22:25:18 - 🌤️  DAILY WEATHER SCRAPER - VERSIÓ UTC
2026-01-22 22:25:18 - ============================================================
2026-01-22 22:25:18 - 
==================================================
2026-01-22 22:25:18 - 📡 Processant: Fornells de la Selva [UO]
2026-01-22 22:25:18 - 
🌐 Connectant a Fornells de la Selva...
2026-01-22 22:25:20 - 📊 Total files trobades a la taula: 45
2026-01-22 22:25:20 -    ✅ Període UTC: 00:00 - 00:30 | TX: 10.7 | TN: 10.5 | Pluja: 0.0
2026-01-22 22:25:20 -    ✅ Període UTC: 00:30 - 01:00 | TX: 10.9 | TN: 10.6 | Pluja: 0.0
2026-01-22 22:25:20 -    ✅ Període UTC: 01:00 - 01:30 | TX: 10.9 | TN: 10.7 | Pluja: 0.0
2026-01-22 22:25:20 -    ✅ Període UTC: 01:30 - 02:00 | TX: 10.8 | TN: 10.5 | Pluja: 0.0
2026-01-22 22:25:20 -    ✅ Període UTC: 02:00 - 02:30 | TX: 10.5 | TN: 9.9 | Pluja: 0.0
2026-01-22 22:25:20 -    ✅ Període UTC: 02:30 - 03:00 | TX: 9.9 | TN: 8.7 | Pluja: 0.0
2026-01-22 22:25:20 -    ✅ Període UTC: 03:00 - 03:30 | TX: 9.4 | TN: 8.3 | Pluja: 0.0
2026-01-22 22:25:20 -    ✅ Període UTC: 03:30 - 04:00 | TX: 8.8 | TN: 8.2 | Pluja: 0.0
2026-01-22 22:25:20 -    ✅ Període UTC: 04:00 - 04:30 | TX: 8.4 | TN: 7.7 | Pluja: 0.0
2026-01-22 22:25:20 -    ✅ Període UTC: 04:30 - 05:00 | TX: 8.1 | TN: 7.5 | Pluja: 0.0
2026-01-22 22:25:20 -    ✅ Període UTC: 05:00 - 05:30 | TX: 8.6 | TN: 8.1 | Pluja: 0.0
2026-01-22 22:25:20 -    ✅ Període UTC: 05:30 - 06:00 | TX: 9.0 | TN: 8.6 | Pluja: 0.0
2026-01-22 22:25:20 -    ✅ Període UTC: 06:00 - 06:30 | TX: 9.0 | TN: 8.5 | Pluja: 0.2
2026-01-22 22:25:20 -    ✅ Període UTC: 06:30 - 07:00 | TX: 8.6 | TN: 8.3 | Pluja: 0.4
2026-01-22 22:25:20 -    ✅ Període UTC: 07:00 - 07:30 | TX: 8.8 | TN: 8.3 | Pluja: 0.2
2026-01-22 22:25:20 -    ✅ Període UTC: 07:30 - 08:00 | TX: 8.8 | TN: 8.4 | Pluja: 0.0
2026-01-22 22:25:20 -    ✅ Període UTC: 08:00 - 08:30 | TX: 8.8 | TN: 8.4 | Pluja: 0.0
2026-01-22 22:25:20 -    ✅ Període UTC: 08:30 - 09:00 | TX: 8.9 | TN: 8.6 | Pluja: 0.0
2026-01-22 22:25:20 -    ✅ Període UTC: 09:00 - 09:30 | TX: 8.8 | TN: 8.8 | Pluja: 0.0
2026-01-22 22:25:20 -    ✅ Període UTC: 09:30 - 10:00 | TX: 8.8 | TN: 8.7 | Pluja: 0.0
2026-01-22 22:25:20 -    ✅ Període UTC: 10:00 - 10:30 | TX: 9.0 | TN: 8.8 | Pluja: 0.0
2026-01-22 22:25:20 -    ✅ Període UTC: 10:30 - 11:00 | TX: 9.4 | TN: 9.0 | Pluja: 0.0
2026-01-22 22:25:20 -    ✅ Període UTC: 11:00 - 11:30 | TX: 9.9 | TN: 9.4 | Pluja: 0.0
2026-01-22 22:25:20 -    ✅ Període UTC: 11:30 - 12:00 | TX: 10.4 | TN: 9.9 | Pluja: 0.0
2026-01-22 22:25:20 -    ✅ Període UTC: 12:00 - 12:30 | TX: 11.1 | TN: 10.4 | Pluja: 0.0
2026-01-22 22:25:20 -    ✅ Període UTC: 12:30 - 13:00 | TX: 11.8 | TN: 11.1 | Pluja: 0.0
2026-01-22 22:25:20 -    ✅ Període UTC: 13:00 - 13:30 | TX: 11.8 | TN: 11.5 | Pluja: 0.0
2026-01-22 22:25:20 -    ✅ Període UTC: 13:30 - 14:00 | TX: 11.8 | TN: 11.6 | Pluja: 0.0
2026-01-22 22:25:20 -    ✅ Període UTC: 14:00 - 14:30 | TX: 13.6 | TN: 11.8 | Pluja: 0.0
2026-01-22 22:25:20 -    ✅ Període UTC: 14:30 - 15:00 | TX: 13.5 | TN: 12.7 | Pluja: 0.0
2026-01-22 22:25:20 -    ✅ Període UTC: 15:00 - 15:30 | TX: 13.2 | TN: 12.4 | Pluja: 0.0
2026-01-22 22:25:20 -    ✅ Període UTC: 15:30 - 16:00 | TX: 12.7 | TN: 12.1 | Pluja: 0.0
2026-01-22 22:25:20 -    ✅ Període UTC: 16:00 - 16:30 | TX: 12.1 | TN: 10.5 | Pluja: 0.0
2026-01-22 22:25:20 -    ✅ Període UTC: 16:30 - 17:00 | TX: 10.5 | TN: 10.0 | Pluja: 0.0
2026-01-22 22:25:20 -    ✅ Període UTC: 17:00 - 17:30 | TX: 10.0 | TN: 8.9 | Pluja: 0.0
2026-01-22 22:25:20 -    ✅ Període UTC: 17:30 - 18:00 | TX: 10.1 | TN: 9.0 | Pluja: 0.0
2026-01-22 22:25:20 -    ✅ Període UTC: 18:00 - 18:30 | TX: 9.4 | TN: 9.1 | Pluja: 0.0
2026-01-22 22:25:20 -    ✅ Període UTC: 18:30 - 19:00 | TX: 9.1 | TN: 8.8 | Pluja: 0.0
2026-01-22 22:25:20 -    ✅ Període UTC: 19:00 - 19:30 | TX: 8.8 | TN: 8.5 | Pluja: 0.0
2026-01-22 22:25:20 -    ✅ Període UTC: 19:30 - 20:00 | TX: 8.6 | TN: 8.5 | Pluja: 0.0
2026-01-22 22:25:20 -    ✅ Període UTC: 20:00 - 20:30 | TX: 8.6 | TN: 8.5 | Pluja: 0.0
2026-01-22 22:25:20 -    ✅ Període UTC: 20:30 - 21:00 | TX: 8.7 | TN: 8.3 | Pluja: 0.0
2026-01-22 22:25:20 -    ✅ Període UTC: 21:00 - 21:30 | TX: 8.3 | TN: 8.2 | Pluja: 0.0
2026-01-22 22:25:20 -    ✅ Període UTC: 21:30 - 22:00 | TX: 8.4 | TN: 7.6 | Pluja: 0.0
2026-01-22 22:25:20 - 📈 Total períodes vàlids trobats: 44
2026-01-22 22:25:20 - 📊 RESUM CALCULAT:
2026-01-22 22:25:20 -    • Màxima del dia: 13.6°C
2026-01-22 22:25:20 -    • Mínima del dia: 7.5°C
2026-01-22 22:25:20 -    • Pluja acumulada: 0.8mm
2026-01-22 22:25:20 -    • Últim període: 21:30 - 22:00 UTC
2026-01-22 22:25:20 -    • Hora actualització: 22:25
2026-01-22 22:25:20 - 💾 Dades guardades a data/UO_20260122.csv (44 registres)
2026-01-22 22:25:20 - ✅ Fornells de la Selva: 44 períodes processats
2026-01-22 22:25:20 - 
==================================================
2026-01-22 22:25:20 - 📡 Processant: Girona [XJ]
2026-01-22 22:25:20 - 
🌐 Connectant a Girona...
2026-01-22 22:25:21 - 📊 Total files trobades a la taula: 45
2026-01-22 22:25:21 -    ✅ Període UTC: 00:00 - 00:30 | TX: 11.0 | TN: 10.7 | Pluja: 0.0
2026-01-22 22:25:21 -    ✅ Període UTC: 00:30 - 01:00 | TX: 11.1 | TN: 10.8 | Pluja: 0.0
2026-01-22 22:25:21 -    ✅ Període UTC: 01:00 - 01:30 | TX: 11.1 | TN: 10.9 | Pluja: 0.0
2026-01-22 22:25:21 -    ✅ Període UTC: 01:30 - 02:00 | TX: 10.9 | TN: 10.3 | Pluja: 0.0
2026-01-22 22:25:21 -    ✅ Període UTC: 02:00 - 02:30 | TX: 10.3 | TN: 9.5 | Pluja: 0.0
2026-01-22 22:25:21 -    ✅ Període UTC: 02:30 - 03:00 | TX: 9.4 | TN: 8.4 | Pluja: 0.0
2026-01-22 22:25:21 -    ✅ Període UTC: 03:00 - 03:30 | TX: 8.8 | TN: 8.4 | Pluja: 0.0
2026-01-22 22:25:21 -    ✅ Període UTC: 03:30 - 04:00 | TX: 8.9 | TN: 7.9 | Pluja: 0.0
2026-01-22 22:25:21 -    ✅ Període UTC: 04:00 - 04:30 | TX: 8.0 | TN: 7.6 | Pluja: 0.0
2026-01-22 22:25:21 -    ✅ Període UTC: 04:30 - 05:00 | TX: 8.1 | TN: 7.6 | Pluja: 0.0
2026-01-22 22:25:21 -    ✅ Període UTC: 05:00 - 05:30 | TX: 7.7 | TN: 7.5 | Pluja: 0.0
2026-01-22 22:25:21 -    ✅ Període UTC: 05:30 - 06:00 | TX: 7.8 | TN: 7.6 | Pluja: 0.0
2026-01-22 22:25:21 -    ✅ Període UTC: 06:00 - 06:30 | TX: 8.0 | TN: 7.7 | Pluja: 0.3
2026-01-22 22:25:21 -    ✅ Període UTC: 06:30 - 07:00 | TX: 7.9 | TN: 7.8 | Pluja: 0.0
2026-01-22 22:25:21 -    ✅ Període UTC: 07:00 - 07:30 | TX: 8.1 | TN: 7.9 | Pluja: 0.2
2026-01-22 22:25:21 -    ✅ Període UTC: 07:30 - 08:00 | TX: 8.1 | TN: 8.0 | Pluja: 0.1
2026-01-22 22:25:21 -    ✅ Període UTC: 08:00 - 08:30 | TX: 8.2 | TN: 8.1 | Pluja: 0.0
2026-01-22 22:25:21 -    ✅ Període UTC: 08:30 - 09:00 | TX: 8.4 | TN: 8.2 | Pluja: 0.0
2026-01-22 22:25:21 -    ✅ Període UTC: 09:00 - 09:30 | TX: 8.8 | TN: 8.4 | Pluja: 0.0
2026-01-22 22:25:21 -    ✅ Període UTC: 09:30 - 10:00 | TX: 9.5 | TN: 8.8 | Pluja: 0.0
2026-01-22 22:25:21 -    ✅ Període UTC: 10:00 - 10:30 | TX: 9.7 | TN: 9.5 | Pluja: 0.0
2026-01-22 22:25:21 -    ✅ Període UTC: 10:30 - 11:00 | TX: 10.0 | TN: 9.7 | Pluja: 0.0
2026-01-22 22:25:21 -    ✅ Període UTC: 11:00 - 11:30 | TX: 10.3 | TN: 10.0 | Pluja: 0.0
2026-01-22 22:25:21 -    ✅ Període UTC: 11:30 - 12:00 | TX: 10.6 | TN: 10.1 | Pluja: 0.0
2026-01-22 22:25:21 -    ✅ Període UTC: 12:00 - 12:30 | TX: 11.2 | TN: 10.6 | Pluja: 0.0
2026-01-22 22:25:21 -    ✅ Període UTC: 12:30 - 13:00 | TX: 11.8 | TN: 11.2 | Pluja: 0.0
2026-01-22 22:25:21 -    ✅ Període UTC: 13:00 - 13:30 | TX: 12.0 | TN: 11.7 | Pluja: 0.0
2026-01-22 22:25:21 -    ✅ Període UTC: 13:30 - 14:00 | TX: 12.0 | TN: 11.8 | Pluja: 0.0
2026-01-22 22:25:21 -    ✅ Període UTC: 14:00 - 14:30 | TX: 13.0 | TN: 11.9 | Pluja: 0.0
2026-01-22 22:25:21 -    ✅ Període UTC: 14:30 - 15:00 | TX: 13.6 | TN: 13.0 | Pluja: 0.0
2026-01-22 22:25:21 -    ✅ Període UTC: 15:00 - 15:30 | TX: 13.8 | TN: 12.7 | Pluja: 0.0
2026-01-22 22:25:21 -    ✅ Període UTC: 15:30 - 16:00 | TX: 13.5 | TN: 12.9 | Pluja: 0.0
2026-01-22 22:25:21 -    ✅ Període UTC: 16:00 - 16:30 | TX: 12.9 | TN: 11.8 | Pluja: 0.0
2026-01-22 22:25:21 -    ✅ Període UTC: 16:30 - 17:00 | TX: 11.7 | TN: 11.0 | Pluja: 0.0
2026-01-22 22:25:21 -    ✅ Període UTC: 17:00 - 17:30 | TX: 11.0 | TN: 10.8 | Pluja: 0.0
2026-01-22 22:25:21 -    ✅ Període UTC: 17:30 - 18:00 | TX: 10.8 | TN: 10.5 | Pluja: 0.0
2026-01-22 22:25:21 -    ✅ Període UTC: 18:00 - 18:30 | TX: 10.5 | TN: 9.9 | Pluja: 0.0
2026-01-22 22:25:21 -    ✅ Període UTC: 18:30 - 19:00 | TX: 9.9 | TN: 9.4 | Pluja: 0.0
2026-01-22 22:25:21 -    ✅ Període UTC: 19:00 - 19:30 | TX: 9.8 | TN: 9.4 | Pluja: 0.0
2026-01-22 22:25:21 -    ✅ Període UTC: 19:30 - 20:00 | TX: 9.6 | TN: 9.1 | Pluja: 0.0
2026-01-22 22:25:21 -    ✅ Període UTC: 20:00 - 20:30 | TX: 9.2 | TN: 9.0 | Pluja: 0.0
2026-01-22 22:25:21 -    ✅ Període UTC: 20:30 - 21:00 | TX: 9.2 | TN: 8.9 | Pluja: 0.0
2026-01-22 22:25:21 -    ✅ Període UTC: 21:00 - 21:30 | TX: 9.0 | TN: 8.8 | Pluja: 0.0
2026-01-22 22:25:21 -    ✅ Període UTC: 21:30 - 22:00 | TX: 8.8 | TN: 8.3 | Pluja: 0.0
2026-01-22 22:25:21 - 📈 Total períodes vàlids trobats: 44
2026-01-22 22:25:21 - 📊 RESUM CALCULAT:
2026-01-22 22:25:21 -    • Màxima del dia: 13.8°C
2026-01-22 22:25:21 -    • Mínima del dia: 7.5°C
2026-01-22 22:25:21 -    • Pluja acumulada: 0.6mm
2026-01-22 22:25:21 -    • Últim període: 21:30 - 22:00 UTC
2026-01-22 22:25:21 -    • Hora actualització: 22:25
2026-01-22 22:25:21 - 💾 Dades guardades a data/XJ_20260122.csv (44 registres)
2026-01-22 22:25:21 - ✅ Girona: 44 períodes processats
2026-01-22 22:25:21 - 💾 Dades guardades a data/weather_daily_20260122.json
2026-01-22 22:25:21 - 💾 Dades guardades a data/weather_summary.json
2026-01-22 22:25:21 - 
============================================================
2026-01-22 22:25:21 - 📋 RESUM FINAL DEL DIA (UTC)
2026-01-22 22:25:21 - ============================================================
2026-01-22 22:25:21 - 
📍 Fornells de la Selva:
2026-01-22 22:25:21 -    • Períodes: 44
2026-01-22 22:25:21 -    • Màxima: 13.6°C
2026-01-22 22:25:21 -    • Mínima: 7.5°C
2026-01-22 22:25:21 -    • Pluja: 0.8mm
2026-01-22 22:25:21 -    • Últim període: 21:30 - 22:00 UTC
2026-01-22 22:25:21 -    • Actualització: 22:25
2026-01-22 22:25:21 - 
📍 Girona:
2026-01-22 22:25:21 -    • Períodes: 44
2026-01-22 22:25:21 -    • Màxima: 13.8°C
2026-01-22 22:25:21 -    • Mínima: 7.5°C
2026-01-22 22:25:21 -    • Pluja: 0.6mm
2026-01-22 22:25:21 -    • Últim període: 21:30 - 22:00 UTC
2026-01-22 22:25:21 -    • Actualització: 22:25
2026-01-22 22:25:21 - 
💾 Fitxers generats:
2026-01-22 22:25:21 -    • data/weather_summary.json (per HTML)
2026-01-22 22:25:21 -    • data/weather_daily_YYYYMMDD.json (complet)
2026-01-22 22:25:21 -    • data/XX_YYYYMMDD.csv (per estació)
2026-01-22 22:25:21 - 
✅ PROCÉS COMPLETAT
2026-01-22 22:25:21 - ============================================================
