=== INICI DAILY SCRAPER (UTC): 2025-12-26 13:42:43 ===
2025-12-26 13:42:43 - ============================================================
2025-12-26 13:42:43 - 🌤️  DAILY WEATHER SCRAPER - VERSIÓ UTC
2025-12-26 13:42:43 - ============================================================
2025-12-26 13:42:43 - 
==================================================
2025-12-26 13:42:43 - 📡 Processant: Fornells de la Selva [UO]
2025-12-26 13:42:43 - 
🌐 Connectant a Fornells de la Selva...
2025-12-26 13:42:44 - 📊 Total files trobades a la taula: 28
2025-12-26 13:42:44 -    ✅ Període UTC: 00:00 - 00:30 | TX: 10.8 | TN: 9.1 | Pluja: 0.7
2025-12-26 13:42:44 -    ✅ Període UTC: 00:30 - 01:00 | TX: 11.1 | TN: 10.8 | Pluja: 0.9
2025-12-26 13:42:44 -    ✅ Període UTC: 01:00 - 01:30 | TX: 11.3 | TN: 11.1 | Pluja: 0.4
2025-12-26 13:42:44 -    ✅ Període UTC: 01:30 - 02:00 | TX: 11.5 | TN: 11.3 | Pluja: 0.3
2025-12-26 13:42:44 -    ✅ Període UTC: 02:00 - 02:30 | TX: 11.5 | TN: 11.4 | Pluja: 0.1
2025-12-26 13:42:44 -    ✅ Període UTC: 02:30 - 03:00 | TX: 11.4 | TN: 10.8 | Pluja: 3.9
2025-12-26 13:42:44 -    ✅ Període UTC: 03:00 - 03:30 | TX: 10.9 | TN: 10.4 | Pluja: 6.0
2025-12-26 13:42:44 -    ✅ Període UTC: 03:30 - 04:00 | TX: 11.6 | TN: 10.8 | Pluja: 1.4
2025-12-26 13:42:44 -    ✅ Període UTC: 04:00 - 04:30 | TX: 11.7 | TN: 11.6 | Pluja: 0.5
2025-12-26 13:42:44 -    ✅ Període UTC: 04:30 - 05:00 | TX: 11.7 | TN: 11.5 | Pluja: 0.8
2025-12-26 13:42:44 -    ✅ Període UTC: 05:00 - 05:30 | TX: 11.7 | TN: 11.5 | Pluja: 0.7
2025-12-26 13:42:44 -    ✅ Període UTC: 05:30 - 06:00 | TX: 11.7 | TN: 11.5 | Pluja: 0.2
2025-12-26 13:42:44 -    ✅ Període UTC: 06:00 - 06:30 | TX: 11.7 | TN: 11.5 | Pluja: 0.3
2025-12-26 13:42:44 -    ✅ Període UTC: 06:30 - 07:00 | TX: 11.8 | TN: 11.6 | Pluja: 0.3
2025-12-26 13:42:44 -    ✅ Període UTC: 07:00 - 07:30 | TX: 11.9 | TN: 11.7 | Pluja: 1.5
2025-12-26 13:42:44 -    ✅ Període UTC: 07:30 - 08:00 | TX: 11.8 | TN: 11.6 | Pluja: 1.1
2025-12-26 13:42:44 -    ✅ Període UTC: 08:00 - 08:30 | TX: 11.7 | TN: 11.6 | Pluja: 0.1
2025-12-26 13:42:44 -    ✅ Període UTC: 08:30 - 09:00 | TX: 11.8 | TN: 11.5 | Pluja: 0.8
2025-12-26 13:42:44 -    ✅ Període UTC: 09:00 - 09:30 | TX: 11.9 | TN: 11.5 | Pluja: 0.7
2025-12-26 13:42:44 -    ✅ Període UTC: 09:30 - 10:00 | TX: 11.9 | TN: 11.7 | Pluja: 0.6
2025-12-26 13:42:44 -    ✅ Període UTC: 10:00 - 10:30 | TX: 11.9 | TN: 11.7 | Pluja: 0.2
2025-12-26 13:42:44 -    ✅ Període UTC: 10:30 - 11:00 | TX: 11.7 | TN: 11.4 | Pluja: 0.6
2025-12-26 13:42:44 -    ✅ Període UTC: 11:00 - 11:30 | TX: 11.9 | TN: 11.5 | Pluja: 0.5
2025-12-26 13:42:44 -    ✅ Període UTC: 11:30 - 12:00 | TX: 11.9 | TN: 11.2 | Pluja: 0.2
2025-12-26 13:42:44 -    ✅ Període UTC: 12:00 - 12:30 | TX: 11.2 | TN: 11.1 | Pluja: 0.4
2025-12-26 13:42:44 -    ✅ Període UTC: 12:30 - 13:00 | TX: 11.3 | TN: 11.2 | Pluja: 1.1
2025-12-26 13:42:44 -    ✅ Període UTC: 13:00 - 13:30 | TX: 11.3 | TN: 11.3 | Pluja: 1.4
2025-12-26 13:42:44 - 📈 Total períodes vàlids trobats: 27
2025-12-26 13:42:44 - 📊 RESUM CALCULAT:
2025-12-26 13:42:44 -    • Màxima del dia: 11.9°C
2025-12-26 13:42:44 -    • Mínima del dia: 9.1°C
2025-12-26 13:42:44 -    • Pluja acumulada: 25.700000000000003mm
2025-12-26 13:42:44 -    • Últim període: 13:00 - 13:30 UTC
2025-12-26 13:42:44 -    • Hora actualització: 13:42
2025-12-26 13:42:44 - 💾 Dades guardades a data/UO_20251226.csv (27 registres)
2025-12-26 13:42:44 - ✅ Fornells de la Selva: 27 períodes processats
2025-12-26 13:42:44 - 
==================================================
2025-12-26 13:42:44 - 📡 Processant: Girona [XJ]
2025-12-26 13:42:44 - 
🌐 Connectant a Girona...
2025-12-26 13:42:46 - 📊 Total files trobades a la taula: 28
2025-12-26 13:42:46 -    ✅ Període UTC: 00:00 - 00:30 | TX: 9.2 | TN: 9.1 | Pluja: 1.4
2025-12-26 13:42:46 -    ✅ Període UTC: 00:30 - 01:00 | TX: 10.3 | TN: 9.2 | Pluja: 1.7
2025-12-26 13:42:46 -    ✅ Període UTC: 01:00 - 01:30 | TX: 10.8 | TN: 10.3 | Pluja: 0.5
2025-12-26 13:42:46 -    ✅ Període UTC: 01:30 - 02:00 | TX: 11.2 | TN: 10.8 | Pluja: 0.0
2025-12-26 13:42:46 -    ✅ Període UTC: 02:00 - 02:30 | TX: 11.2 | TN: 11.1 | Pluja: 0.2
2025-12-26 13:42:46 -    ✅ Període UTC: 02:30 - 03:00 | TX: 11.3 | TN: 10.9 | Pluja: 2.5
2025-12-26 13:42:46 -    ✅ Període UTC: 03:00 - 03:30 | TX: 10.9 | TN: 10.8 | Pluja: 4.7
2025-12-26 13:42:46 -    ✅ Període UTC: 03:30 - 04:00 | TX: 11.1 | TN: 10.8 | Pluja: 3.8
2025-12-26 13:42:46 -    ✅ Període UTC: 04:00 - 04:30 | TX: 11.3 | TN: 11.1 | Pluja: 2.1
2025-12-26 13:42:46 -    ✅ Període UTC: 04:30 - 05:00 | TX: 11.3 | TN: 11.2 | Pluja: 0.9
2025-12-26 13:42:46 -    ✅ Període UTC: 05:00 - 05:30 | TX: 11.5 | TN: 11.2 | Pluja: 0.0
2025-12-26 13:42:46 -    ✅ Període UTC: 05:30 - 06:00 | TX: 11.7 | TN: 11.4 | Pluja: 0.1
2025-12-26 13:42:46 -    ✅ Període UTC: 06:00 - 06:30 | TX: 11.8 | TN: 11.6 | Pluja: 0.3
2025-12-26 13:42:46 -    ✅ Període UTC: 06:30 - 07:00 | TX: 12.1 | TN: 11.8 | Pluja: 0.0
2025-12-26 13:42:46 -    ✅ Període UTC: 07:00 - 07:30 | TX: 12.1 | TN: 11.7 | Pluja: 2.6
2025-12-26 13:42:46 -    ✅ Període UTC: 07:30 - 08:00 | TX: 11.7 | TN: 11.4 | Pluja: 1.7
2025-12-26 13:42:46 -    ✅ Període UTC: 08:00 - 08:30 | TX: 11.8 | TN: 11.5 | Pluja: 0.6
2025-12-26 13:42:46 -    ✅ Període UTC: 08:30 - 09:00 | TX: 11.9 | TN: 11.7 | Pluja: 0.4
2025-12-26 13:42:46 -    ✅ Període UTC: 09:00 - 09:30 | TX: 11.8 | TN: 11.5 | Pluja: 2.0
2025-12-26 13:42:46 -    ✅ Període UTC: 09:30 - 10:00 | TX: 12.0 | TN: 11.7 | Pluja: 0.5
2025-12-26 13:42:46 -    ✅ Període UTC: 10:00 - 10:30 | TX: 11.9 | TN: 11.7 | Pluja: 0.4
2025-12-26 13:42:46 -    ✅ Període UTC: 10:30 - 11:00 | TX: 11.7 | TN: 11.4 | Pluja: 1.3
2025-12-26 13:42:46 -    ✅ Període UTC: 11:00 - 11:30 | TX: 11.5 | TN: 11.4 | Pluja: 0.6
2025-12-26 13:42:46 -    ✅ Període UTC: 11:30 - 12:00 | TX: 11.6 | TN: 11.4 | Pluja: 0.1
2025-12-26 13:42:46 -    ✅ Període UTC: 12:00 - 12:30 | TX: 11.4 | TN: 11.1 | Pluja: 0.6
2025-12-26 13:42:46 -    ✅ Període UTC: 12:30 - 13:00 | TX: 11.4 | TN: 11.1 | Pluja: 0.1
2025-12-26 13:42:46 -    ✅ Període UTC: 13:00 - 13:30 | TX: 11.4 | TN: 11.3 | Pluja: 0.8
2025-12-26 13:42:46 - 📈 Total períodes vàlids trobats: 27
2025-12-26 13:42:46 - 📊 RESUM CALCULAT:
2025-12-26 13:42:46 -    • Màxima del dia: 12.1°C
2025-12-26 13:42:46 -    • Mínima del dia: 9.1°C
2025-12-26 13:42:46 -    • Pluja acumulada: 29.90000000000001mm
2025-12-26 13:42:46 -    • Últim període: 13:00 - 13:30 UTC
2025-12-26 13:42:46 -    • Hora actualització: 13:42
2025-12-26 13:42:46 - 💾 Dades guardades a data/XJ_20251226.csv (27 registres)
2025-12-26 13:42:46 - ✅ Girona: 27 períodes processats
2025-12-26 13:42:46 - 💾 Dades guardades a data/weather_daily_20251226.json
2025-12-26 13:42:46 - 💾 Dades guardades a data/weather_summary.json
2025-12-26 13:42:46 - 
============================================================
2025-12-26 13:42:46 - 📋 RESUM FINAL DEL DIA (UTC)
2025-12-26 13:42:46 - ============================================================
2025-12-26 13:42:46 - 
📍 Fornells de la Selva:
2025-12-26 13:42:46 -    • Períodes: 27
2025-12-26 13:42:46 -    • Màxima: 11.9°C
2025-12-26 13:42:46 -    • Mínima: 9.1°C
2025-12-26 13:42:46 -    • Pluja: 25.700000000000003mm
2025-12-26 13:42:46 -    • Últim període: 13:00 - 13:30 UTC
2025-12-26 13:42:46 -    • Actualització: 13:42
2025-12-26 13:42:46 - 
📍 Girona:
2025-12-26 13:42:46 -    • Períodes: 27
2025-12-26 13:42:46 -    • Màxima: 12.1°C
2025-12-26 13:42:46 -    • Mínima: 9.1°C
2025-12-26 13:42:46 -    • Pluja: 29.90000000000001mm
2025-12-26 13:42:46 -    • Últim període: 13:00 - 13:30 UTC
2025-12-26 13:42:46 -    • Actualització: 13:42
2025-12-26 13:42:46 - 
💾 Fitxers generats:
2025-12-26 13:42:46 -    • data/weather_summary.json (per HTML)
2025-12-26 13:42:46 -    • data/weather_daily_YYYYMMDD.json (complet)
2025-12-26 13:42:46 -    • data/XX_YYYYMMDD.csv (per estació)
2025-12-26 13:42:46 - 
✅ PROCÉS COMPLETAT
2025-12-26 13:42:46 - ============================================================
