=== INICI DAILY SCRAPER (UTC): 2026-01-17 14:50:18 ===
2026-01-17 14:50:18 - ============================================================
2026-01-17 14:50:18 - 🌤️  DAILY WEATHER SCRAPER - VERSIÓ UTC
2026-01-17 14:50:18 - ============================================================
2026-01-17 14:50:18 - 
==================================================
2026-01-17 14:50:18 - 📡 Processant: Fornells de la Selva [UO]
2026-01-17 14:50:18 - 
🌐 Connectant a Fornells de la Selva...
2026-01-17 14:50:18 - 📊 Total files trobades a la taula: 30
2026-01-17 14:50:18 -    ✅ Període UTC: 00:00 - 00:30 | TX: 9.2 | TN: 8.7 | Pluja: 0.0
2026-01-17 14:50:18 -    ✅ Període UTC: 00:30 - 01:00 | TX: 9.1 | TN: 8.8 | Pluja: 0.0
2026-01-17 14:50:18 -    ✅ Període UTC: 01:00 - 01:30 | TX: 9.1 | TN: 8.9 | Pluja: 0.1
2026-01-17 14:50:18 -    ✅ Període UTC: 01:30 - 02:00 | TX: 9.0 | TN: 8.3 | Pluja: 0.0
2026-01-17 14:50:18 -    ✅ Període UTC: 02:00 - 02:30 | TX: 8.5 | TN: 8.1 | Pluja: 0.0
2026-01-17 14:50:18 -    ✅ Període UTC: 02:30 - 03:00 | TX: 9.2 | TN: 8.5 | Pluja: 0.1
2026-01-17 14:50:18 -    ✅ Període UTC: 03:00 - 03:30 | TX: 9.1 | TN: 8.8 | Pluja: 0.0
2026-01-17 14:50:18 -    ✅ Període UTC: 03:30 - 04:00 | TX: 8.8 | TN: 8.7 | Pluja: 0.0
2026-01-17 14:50:18 -    ✅ Període UTC: 04:00 - 04:30 | TX: 8.8 | TN: 8.4 | Pluja: 0.0
2026-01-17 14:50:18 -    ✅ Període UTC: 04:30 - 05:00 | TX: 8.4 | TN: 8.1 | Pluja: 0.0
2026-01-17 14:50:18 -    ✅ Període UTC: 05:00 - 05:30 | TX: 8.6 | TN: 8.4 | Pluja: 0.0
2026-01-17 14:50:18 -    ✅ Període UTC: 05:30 - 06:00 | TX: 8.5 | TN: 7.9 | Pluja: 0.0
2026-01-17 14:50:18 -    ✅ Període UTC: 06:00 - 06:30 | TX: 8.0 | TN: 7.6 | Pluja: 0.0
2026-01-17 14:50:18 -    ✅ Període UTC: 06:30 - 07:00 | TX: 8.4 | TN: 7.5 | Pluja: 0.0
2026-01-17 14:50:18 -    ✅ Període UTC: 07:00 - 07:30 | TX: 7.9 | TN: 7.0 | Pluja: 0.0
2026-01-17 14:50:18 -    ✅ Període UTC: 07:30 - 08:00 | TX: 7.0 | TN: 6.2 | Pluja: 0.0
2026-01-17 14:50:18 -    ✅ Període UTC: 08:00 - 08:30 | TX: 7.5 | TN: 6.4 | Pluja: 0.0
2026-01-17 14:50:18 -    ✅ Període UTC: 08:30 - 09:00 | TX: 8.9 | TN: 7.6 | Pluja: 0.0
2026-01-17 14:50:18 -    ✅ Període UTC: 09:00 - 09:30 | TX: 9.4 | TN: 8.9 | Pluja: 0.0
2026-01-17 14:50:18 -    ✅ Període UTC: 09:30 - 10:00 | TX: 10.2 | TN: 9.5 | Pluja: 0.0
2026-01-17 14:50:18 -    ✅ Període UTC: 10:00 - 10:30 | TX: 10.7 | TN: 10.2 | Pluja: 0.0
2026-01-17 14:50:18 -    ✅ Període UTC: 10:30 - 11:00 | TX: 11.2 | TN: 10.7 | Pluja: 0.0
2026-01-17 14:50:18 -    ✅ Període UTC: 11:00 - 11:30 | TX: 12.3 | TN: 11.2 | Pluja: 0.0
2026-01-17 14:50:18 -    ✅ Període UTC: 11:30 - 12:00 | TX: 13.8 | TN: 12.4 | Pluja: 0.0
2026-01-17 14:50:18 -    ✅ Període UTC: 12:00 - 12:30 | TX: 14.0 | TN: 13.8 | Pluja: 0.0
2026-01-17 14:50:18 -    ✅ Període UTC: 12:30 - 13:00 | TX: 14.2 | TN: 13.8 | Pluja: 0.0
2026-01-17 14:50:18 -    ✅ Període UTC: 13:00 - 13:30 | TX: 14.9 | TN: 14.0 | Pluja: 0.0
2026-01-17 14:50:18 -    ✅ Període UTC: 13:30 - 14:00 | TX: 14.5 | TN: 14.1 | Pluja: 0.0
2026-01-17 14:50:18 -    ✅ Període UTC: 14:00 - 14:30 | TX: 14.2 | TN: 14.0 | Pluja: 0.0
2026-01-17 14:50:18 - 📈 Total períodes vàlids trobats: 29
2026-01-17 14:50:18 - 📊 RESUM CALCULAT:
2026-01-17 14:50:18 -    • Màxima del dia: 14.9°C
2026-01-17 14:50:18 -    • Mínima del dia: 6.2°C
2026-01-17 14:50:18 -    • Pluja acumulada: 0.2mm
2026-01-17 14:50:18 -    • Últim període: 14:00 - 14:30 UTC
2026-01-17 14:50:18 -    • Hora actualització: 14:50
2026-01-17 14:50:18 - 💾 Dades guardades a data/UO_20260117.csv (29 registres)
2026-01-17 14:50:18 - ✅ Fornells de la Selva: 29 períodes processats
2026-01-17 14:50:18 - 
==================================================
2026-01-17 14:50:18 - 📡 Processant: Girona [XJ]
2026-01-17 14:50:18 - 
🌐 Connectant a Girona...
2026-01-17 14:50:18 - 📊 Total files trobades a la taula: 30
2026-01-17 14:50:18 -    ✅ Període UTC: 00:00 - 00:30 | TX: 8.4 | TN: 8.2 | Pluja: 0.0
2026-01-17 14:50:18 -    ✅ Període UTC: 00:30 - 01:00 | TX: 8.6 | TN: 8.3 | Pluja: 0.0
2026-01-17 14:50:18 -    ✅ Període UTC: 01:00 - 01:30 | TX: 8.6 | TN: 8.5 | Pluja: 0.0
2026-01-17 14:50:18 -    ✅ Període UTC: 01:30 - 02:00 | TX: 8.7 | TN: 8.3 | Pluja: 0.1
2026-01-17 14:50:18 -    ✅ Període UTC: 02:00 - 02:30 | TX: 8.3 | TN: 7.8 | Pluja: 0.0
2026-01-17 14:50:18 -    ✅ Període UTC: 02:30 - 03:00 | TX: 8.0 | TN: 7.7 | Pluja: 0.0
2026-01-17 14:50:18 -    ✅ Període UTC: 03:00 - 03:30 | TX: 8.0 | TN: 7.9 | Pluja: 0.0
2026-01-17 14:50:18 -    ✅ Període UTC: 03:30 - 04:00 | TX: 8.2 | TN: 8.0 | Pluja: 0.0
2026-01-17 14:50:18 -    ✅ Període UTC: 04:00 - 04:30 | TX: 8.3 | TN: 8.0 | Pluja: 0.0
2026-01-17 14:50:18 -    ✅ Període UTC: 04:30 - 05:00 | TX: 8.3 | TN: 7.8 | Pluja: 0.0
2026-01-17 14:50:18 -    ✅ Període UTC: 05:00 - 05:30 | TX: 7.9 | TN: 7.6 | Pluja: 0.0
2026-01-17 14:50:18 -    ✅ Període UTC: 05:30 - 06:00 | TX: 7.9 | TN: 7.4 | Pluja: 0.0
2026-01-17 14:50:18 -    ✅ Període UTC: 06:00 - 06:30 | TX: 7.7 | TN: 7.1 | Pluja: 0.0
2026-01-17 14:50:18 -    ✅ Període UTC: 06:30 - 07:00 | TX: 7.6 | TN: 6.5 | Pluja: 0.0
2026-01-17 14:50:18 -    ✅ Període UTC: 07:00 - 07:30 | TX: 6.4 | TN: 6.0 | Pluja: 0.0
2026-01-17 14:50:18 -    ✅ Període UTC: 07:30 - 08:00 | TX: 6.1 | TN: 5.8 | Pluja: 0.0
2026-01-17 14:50:18 -    ✅ Període UTC: 08:00 - 08:30 | TX: 7.3 | TN: 6.1 | Pluja: 0.0
2026-01-17 14:50:18 -    ✅ Període UTC: 08:30 - 09:00 | TX: 8.9 | TN: 7.3 | Pluja: 0.0
2026-01-17 14:50:18 -    ✅ Període UTC: 09:00 - 09:30 | TX: 9.7 | TN: 8.8 | Pluja: 0.0
2026-01-17 14:50:18 -    ✅ Període UTC: 09:30 - 10:00 | TX: 11.0 | TN: 9.7 | Pluja: 0.0
2026-01-17 14:50:18 -    ✅ Període UTC: 10:00 - 10:30 | TX: 12.1 | TN: 11.1 | Pluja: 0.0
2026-01-17 14:50:18 -    ✅ Període UTC: 10:30 - 11:00 | TX: 12.2 | TN: 11.8 | Pluja: 0.9
2026-01-17 14:50:18 -    ✅ Període UTC: 11:00 - 11:30 | TX: 12.2 | TN: 11.5 | Pluja: 0.8
2026-01-17 14:50:18 -    ✅ Període UTC: 11:30 - 12:00 | TX: 12.6 | TN: 12.3 | Pluja: 0.0
2026-01-17 14:50:18 -    ✅ Període UTC: 12:00 - 12:30 | TX: 13.1 | TN: 12.6 | Pluja: 0.0
2026-01-17 14:50:18 -    ✅ Període UTC: 12:30 - 13:00 | TX: 13.6 | TN: 13.0 | Pluja: 0.0
2026-01-17 14:50:18 -    ✅ Període UTC: 13:00 - 13:30 | TX: 14.4 | TN: 13.6 | Pluja: 0.0
2026-01-17 14:50:18 -    ✅ Període UTC: 13:30 - 14:00 | TX: 14.8 | TN: 14.2 | Pluja: 0.0
2026-01-17 14:50:18 -    ✅ Període UTC: 14:00 - 14:30 | TX: 15.6 | TN: 14.9 | Pluja: 0.2
2026-01-17 14:50:18 - 📈 Total períodes vàlids trobats: 29
2026-01-17 14:50:18 - 📊 RESUM CALCULAT:
2026-01-17 14:50:18 -    • Màxima del dia: 15.6°C
2026-01-17 14:50:18 -    • Mínima del dia: 5.8°C
2026-01-17 14:50:18 -    • Pluja acumulada: 2.0mm
2026-01-17 14:50:18 -    • Últim període: 14:00 - 14:30 UTC
2026-01-17 14:50:18 -    • Hora actualització: 14:50
2026-01-17 14:50:18 - 💾 Dades guardades a data/XJ_20260117.csv (29 registres)
2026-01-17 14:50:18 - ✅ Girona: 29 períodes processats
2026-01-17 14:50:18 - 💾 Dades guardades a data/weather_daily_20260117.json
2026-01-17 14:50:18 - 💾 Dades guardades a data/weather_summary.json
2026-01-17 14:50:18 - 
============================================================
2026-01-17 14:50:18 - 📋 RESUM FINAL DEL DIA (UTC)
2026-01-17 14:50:18 - ============================================================
2026-01-17 14:50:18 - 
📍 Fornells de la Selva:
2026-01-17 14:50:18 -    • Períodes: 29
2026-01-17 14:50:18 -    • Màxima: 14.9°C
2026-01-17 14:50:18 -    • Mínima: 6.2°C
2026-01-17 14:50:18 -    • Pluja: 0.2mm
2026-01-17 14:50:18 -    • Últim període: 14:00 - 14:30 UTC
2026-01-17 14:50:18 -    • Actualització: 14:50
2026-01-17 14:50:18 - 
📍 Girona:
2026-01-17 14:50:18 -    • Períodes: 29
2026-01-17 14:50:18 -    • Màxima: 15.6°C
2026-01-17 14:50:18 -    • Mínima: 5.8°C
2026-01-17 14:50:18 -    • Pluja: 2.0mm
2026-01-17 14:50:18 -    • Últim període: 14:00 - 14:30 UTC
2026-01-17 14:50:18 -    • Actualització: 14:50
2026-01-17 14:50:18 - 
💾 Fitxers generats:
2026-01-17 14:50:18 -    • data/weather_summary.json (per HTML)
2026-01-17 14:50:18 -    • data/weather_daily_YYYYMMDD.json (complet)
2026-01-17 14:50:18 -    • data/XX_YYYYMMDD.csv (per estació)
2026-01-17 14:50:18 - 
✅ PROCÉS COMPLETAT
2026-01-17 14:50:18 - ============================================================
