=== INICI DAILY SCRAPER (UTC): 2026-01-25 23:30:48 ===
2026-01-25 23:30:48 - ============================================================
2026-01-25 23:30:48 - 🌤️  DAILY WEATHER SCRAPER - VERSIÓ UTC
2026-01-25 23:30:48 - ============================================================
2026-01-25 23:30:48 - 
==================================================
2026-01-25 23:30:48 - 📡 Processant: Fornells de la Selva [UO]
2026-01-25 23:30:48 - 
🌐 Connectant a Fornells de la Selva...
2026-01-25 23:30:48 - 📊 Total files trobades a la taula: 48
2026-01-25 23:30:48 -    ✅ Període UTC: 00:00 - 00:30 | TX: 3.8 | TN: 3.1 | Pluja: 0.1
2026-01-25 23:30:48 -    ✅ Període UTC: 00:30 - 01:00 | TX: 3.2 | TN: 2.5 | Pluja: 0.0
2026-01-25 23:30:48 -    ✅ Període UTC: 01:00 - 01:30 | TX: 3.6 | TN: 3.0 | Pluja: 0.0
2026-01-25 23:30:48 -    ✅ Període UTC: 01:30 - 02:00 | TX: 3.6 | TN: 3.4 | Pluja: 0.0
2026-01-25 23:30:48 -    ✅ Període UTC: 02:00 - 02:30 | TX: 3.6 | TN: 3.4 | Pluja: 0.0
2026-01-25 23:30:48 -    ✅ Període UTC: 02:30 - 03:00 | TX: 3.7 | TN: 3.5 | Pluja: 0.0
2026-01-25 23:30:48 -    ✅ Període UTC: 03:00 - 03:30 | TX: 3.5 | TN: 2.9 | Pluja: 0.0
2026-01-25 23:30:48 -    ✅ Període UTC: 03:30 - 04:00 | TX: 3.1 | TN: 2.0 | Pluja: 0.0
2026-01-25 23:30:48 -    ✅ Període UTC: 04:00 - 04:30 | TX: 2.5 | TN: 1.6 | Pluja: 0.0
2026-01-25 23:30:48 -    ✅ Període UTC: 04:30 - 05:00 | TX: 1.7 | TN: 1.2 | Pluja: 0.0
2026-01-25 23:30:48 -    ✅ Període UTC: 05:00 - 05:30 | TX: 2.1 | TN: 1.7 | Pluja: 0.0
2026-01-25 23:30:48 -    ✅ Període UTC: 05:30 - 06:00 | TX: 1.9 | TN: 1.1 | Pluja: 0.0
2026-01-25 23:30:48 -    ✅ Període UTC: 06:00 - 06:30 | TX: 1.5 | TN: 0.9 | Pluja: 0.0
2026-01-25 23:30:48 -    ✅ Període UTC: 06:30 - 07:00 | TX: 1.1 | TN: 0.3 | Pluja: 0.0
2026-01-25 23:30:48 -    ✅ Període UTC: 07:00 - 07:30 | TX: 0.9 | TN: 0.2 | Pluja: 0.0
2026-01-25 23:30:48 -    ✅ Període UTC: 07:30 - 08:00 | TX: 2.0 | TN: 1.0 | Pluja: 0.0
2026-01-25 23:30:48 -    ✅ Període UTC: 08:00 - 08:30 | TX: 2.8 | TN: 1.9 | Pluja: 0.0
2026-01-25 23:30:48 -    ✅ Període UTC: 08:30 - 09:00 | TX: 3.5 | TN: 2.8 | Pluja: 0.0
2026-01-25 23:30:48 -    ✅ Període UTC: 09:00 - 09:30 | TX: 5.5 | TN: 3.5 | Pluja: 0.0
2026-01-25 23:30:48 -    ✅ Període UTC: 09:30 - 10:00 | TX: 8.2 | TN: 5.6 | Pluja: 0.0
2026-01-25 23:30:48 -    ✅ Període UTC: 10:00 - 10:30 | TX: 7.8 | TN: 7.1 | Pluja: 0.0
2026-01-25 23:30:48 -    ✅ Període UTC: 10:30 - 11:00 | TX: 9.2 | TN: 7.8 | Pluja: 0.0
2026-01-25 23:30:48 -    ✅ Període UTC: 11:00 - 11:30 | TX: 10.3 | TN: 9.2 | Pluja: 0.0
2026-01-25 23:30:48 -    ✅ Període UTC: 11:30 - 12:00 | TX: 11.8 | TN: 9.9 | Pluja: 0.0
2026-01-25 23:30:48 -    ✅ Període UTC: 12:00 - 12:30 | TX: 11.6 | TN: 10.9 | Pluja: 0.0
2026-01-25 23:30:48 -    ✅ Període UTC: 12:30 - 13:00 | TX: 12.3 | TN: 11.6 | Pluja: 0.0
2026-01-25 23:30:48 -    ✅ Període UTC: 13:00 - 13:30 | TX: 13.1 | TN: 11.8 | Pluja: 0.0
2026-01-25 23:30:48 -    ✅ Període UTC: 13:30 - 14:00 | TX: 12.9 | TN: 12.3 | Pluja: 0.0
2026-01-25 23:30:48 -    ✅ Període UTC: 14:00 - 14:30 | TX: 12.8 | TN: 12.3 | Pluja: 0.0
2026-01-25 23:30:48 -    ✅ Període UTC: 14:30 - 15:00 | TX: 13.5 | TN: 12.9 | Pluja: 0.0
2026-01-25 23:30:48 -    ✅ Període UTC: 15:00 - 15:30 | TX: 13.0 | TN: 12.7 | Pluja: 0.0
2026-01-25 23:30:48 -    ✅ Període UTC: 15:30 - 16:00 | TX: 12.7 | TN: 12.1 | Pluja: 0.0
2026-01-25 23:30:48 -    ✅ Període UTC: 16:00 - 16:30 | TX: 12.0 | TN: 11.4 | Pluja: 0.0
2026-01-25 23:30:48 -    ✅ Període UTC: 16:30 - 17:00 | TX: 11.4 | TN: 9.9 | Pluja: 0.0
2026-01-25 23:30:48 -    ✅ Període UTC: 17:00 - 17:30 | TX: 9.8 | TN: 8.9 | Pluja: 0.0
2026-01-25 23:30:48 -    ✅ Període UTC: 17:30 - 18:00 | TX: 8.9 | TN: 7.8 | Pluja: 0.0
2026-01-25 23:30:48 -    ✅ Període UTC: 18:00 - 18:30 | TX: 7.8 | TN: 6.7 | Pluja: 0.0
2026-01-25 23:30:48 -    ✅ Període UTC: 18:30 - 19:00 | TX: 6.8 | TN: 5.3 | Pluja: 0.0
2026-01-25 23:30:48 -    ✅ Període UTC: 19:00 - 19:30 | TX: 5.1 | TN: 4.0 | Pluja: 0.0
2026-01-25 23:30:48 -    ✅ Període UTC: 19:30 - 20:00 | TX: 4.5 | TN: 4.0 | Pluja: 0.0
2026-01-25 23:30:48 -    ✅ Període UTC: 20:00 - 20:30 | TX: 4.8 | TN: 4.3 | Pluja: 0.0
2026-01-25 23:30:48 -    ✅ Període UTC: 20:30 - 21:00 | TX: 4.6 | TN: 4.2 | Pluja: 0.0
2026-01-25 23:30:48 -    ✅ Període UTC: 21:00 - 21:30 | TX: 4.2 | TN: 3.4 | Pluja: 0.0
2026-01-25 23:30:48 -    ✅ Període UTC: 21:30 - 22:00 | TX: 3.5 | TN: 3.0 | Pluja: 0.0
2026-01-25 23:30:48 -    ✅ Període UTC: 22:00 - 22:30 | TX: 3.3 | TN: 2.8 | Pluja: 0.0
2026-01-25 23:30:48 -    ✅ Període UTC: 22:30 - 23:00 | TX: 3.1 | TN: 2.1 | Pluja: 0.0
2026-01-25 23:30:48 - 📈 Total períodes vàlids trobats: 46
2026-01-25 23:30:48 - 📊 RESUM CALCULAT:
2026-01-25 23:30:48 -    • Màxima del dia: 13.5°C
2026-01-25 23:30:48 -    • Mínima del dia: 0.2°C
2026-01-25 23:30:48 -    • Pluja acumulada: 0.1mm
2026-01-25 23:30:48 -    • Últim període: 22:30 - 23:00 UTC
2026-01-25 23:30:48 -    • Hora actualització: 23:30
2026-01-25 23:30:48 - 💾 Dades guardades a data/UO_20260125.csv (46 registres)
2026-01-25 23:30:48 - ✅ Fornells de la Selva: 46 períodes processats
2026-01-25 23:30:48 - 
==================================================
2026-01-25 23:30:48 - 📡 Processant: Girona [XJ]
2026-01-25 23:30:48 - 
🌐 Connectant a Girona...
2026-01-25 23:30:48 - 📊 Total files trobades a la taula: 47
2026-01-25 23:30:48 -    ✅ Període UTC: 00:00 - 00:30 | TX: 4.1 | TN: 3.4 | Pluja: 0.0
2026-01-25 23:30:48 -    ✅ Període UTC: 00:30 - 01:00 | TX: 3.6 | TN: 3.3 | Pluja: 0.0
2026-01-25 23:30:48 -    ✅ Període UTC: 01:00 - 01:30 | TX: 3.6 | TN: 3.3 | Pluja: 0.0
2026-01-25 23:30:48 -    ✅ Període UTC: 01:30 - 02:00 | TX: 3.6 | TN: 3.5 | Pluja: 0.0
2026-01-25 23:30:48 -    ✅ Període UTC: 02:00 - 02:30 | TX: 3.5 | TN: 3.4 | Pluja: 0.0
2026-01-25 23:30:48 -    ✅ Període UTC: 02:30 - 03:00 | TX: 3.5 | TN: 3.5 | Pluja: 0.0
2026-01-25 23:30:48 -    ✅ Període UTC: 03:00 - 03:30 | TX: 3.5 | TN: 2.9 | Pluja: 0.0
2026-01-25 23:30:48 -    ✅ Període UTC: 03:30 - 04:00 | TX: 2.9 | TN: 2.5 | Pluja: 0.0
2026-01-25 23:30:48 -    ✅ Període UTC: 04:00 - 04:30 | TX: 2.8 | TN: 2.2 | Pluja: 0.0
2026-01-25 23:30:48 -    ✅ Període UTC: 04:30 - 05:00 | TX: 2.9 | TN: 2.0 | Pluja: 0.0
2026-01-25 23:30:48 -    ✅ Període UTC: 05:00 - 05:30 | TX: 3.2 | TN: 2.7 | Pluja: 0.0
2026-01-25 23:30:48 -    ✅ Període UTC: 05:30 - 06:00 | TX: 3.4 | TN: 3.1 | Pluja: 0.0
2026-01-25 23:30:48 -    ✅ Període UTC: 06:00 - 06:30 | TX: 3.6 | TN: 3.1 | Pluja: 0.0
2026-01-25 23:30:48 -    ✅ Període UTC: 06:30 - 07:00 | TX: 3.8 | TN: 2.8 | Pluja: 0.0
2026-01-25 23:30:48 -    ✅ Període UTC: 07:00 - 07:30 | TX: 4.2 | TN: 3.6 | Pluja: 0.0
2026-01-25 23:30:48 -    ✅ Període UTC: 07:30 - 08:00 | TX: 4.9 | TN: 4.2 | Pluja: 0.0
2026-01-25 23:30:48 -    ✅ Període UTC: 08:00 - 08:30 | TX: 5.5 | TN: 4.7 | Pluja: 0.0
2026-01-25 23:30:48 -    ✅ Període UTC: 08:30 - 09:00 | TX: 6.2 | TN: 5.5 | Pluja: 0.0
2026-01-25 23:30:48 -    ✅ Període UTC: 09:00 - 09:30 | TX: 8.3 | TN: 6.2 | Pluja: 0.0
2026-01-25 23:30:48 -    ✅ Període UTC: 09:30 - 10:00 | TX: 10.0 | TN: 8.3 | Pluja: 0.0
2026-01-25 23:30:48 -    ✅ Període UTC: 10:00 - 10:30 | TX: 10.0 | TN: 8.7 | Pluja: 0.0
2026-01-25 23:30:48 -    ✅ Període UTC: 10:30 - 11:00 | TX: 9.8 | TN: 8.8 | Pluja: 0.0
2026-01-25 23:30:48 -    ✅ Període UTC: 11:00 - 11:30 | TX: 10.5 | TN: 9.8 | Pluja: 0.0
2026-01-25 23:30:48 -    ✅ Període UTC: 11:30 - 12:00 | TX: 10.7 | TN: 9.8 | Pluja: 0.0
2026-01-25 23:30:48 -    ✅ Període UTC: 12:00 - 12:30 | TX: 11.2 | TN: 10.5 | Pluja: 0.0
2026-01-25 23:30:48 -    ✅ Període UTC: 12:30 - 13:00 | TX: 12.0 | TN: 11.2 | Pluja: 0.1
2026-01-25 23:30:48 -    ✅ Període UTC: 13:00 - 13:30 | TX: 12.2 | TN: 11.6 | Pluja: 0.0
2026-01-25 23:30:48 -    ✅ Període UTC: 13:30 - 14:00 | TX: 12.8 | TN: 11.8 | Pluja: 0.0
2026-01-25 23:30:48 -    ✅ Període UTC: 14:00 - 14:30 | TX: 13.2 | TN: 12.1 | Pluja: 0.0
2026-01-25 23:30:48 -    ✅ Període UTC: 14:30 - 15:00 | TX: 13.3 | TN: 12.7 | Pluja: 0.0
2026-01-25 23:30:48 -    ✅ Període UTC: 15:00 - 15:30 | TX: 13.1 | TN: 12.6 | Pluja: 0.0
2026-01-25 23:30:48 -    ✅ Període UTC: 15:30 - 16:00 | TX: 12.9 | TN: 12.4 | Pluja: 0.0
2026-01-25 23:30:48 -    ✅ Període UTC: 16:00 - 16:30 | TX: 12.3 | TN: 11.7 | Pluja: 0.0
2026-01-25 23:30:48 -    ✅ Període UTC: 16:30 - 17:00 | TX: 11.7 | TN: 10.1 | Pluja: 0.0
2026-01-25 23:30:48 -    ✅ Període UTC: 17:00 - 17:30 | TX: 10.0 | TN: 9.0 | Pluja: 0.0
2026-01-25 23:30:48 -    ✅ Període UTC: 17:30 - 18:00 | TX: 8.9 | TN: 7.9 | Pluja: 0.0
2026-01-25 23:30:48 -    ✅ Període UTC: 18:00 - 18:30 | TX: 7.8 | TN: 7.0 | Pluja: 0.0
2026-01-25 23:30:48 -    ✅ Període UTC: 18:30 - 19:00 | TX: 7.2 | TN: 6.1 | Pluja: 0.0
2026-01-25 23:30:48 -    ✅ Període UTC: 19:00 - 19:30 | TX: 6.0 | TN: 4.7 | Pluja: 0.0
2026-01-25 23:30:48 -    ✅ Període UTC: 19:30 - 20:00 | TX: 4.7 | TN: 4.1 | Pluja: 0.0
2026-01-25 23:30:48 -    ✅ Període UTC: 20:00 - 20:30 | TX: 4.3 | TN: 3.7 | Pluja: 0.0
2026-01-25 23:30:48 -    ✅ Període UTC: 20:30 - 21:00 | TX: 3.8 | TN: 3.0 | Pluja: 0.0
2026-01-25 23:30:48 -    ✅ Període UTC: 21:00 - 21:30 | TX: 3.6 | TN: 3.0 | Pluja: 0.0
2026-01-25 23:30:48 -    ✅ Període UTC: 21:30 - 22:00 | TX: 2.9 | TN: 2.7 | Pluja: 0.0
2026-01-25 23:30:48 -    ✅ Període UTC: 22:00 - 22:30 | TX: 2.9 | TN: 2.5 | Pluja: 0.0
2026-01-25 23:30:48 -    ✅ Període UTC: 22:30 - 23:00 | TX: 2.7 | TN: 1.9 | Pluja: 0.0
2026-01-25 23:30:48 - 📈 Total períodes vàlids trobats: 46
2026-01-25 23:30:48 - 📊 RESUM CALCULAT:
2026-01-25 23:30:48 -    • Màxima del dia: 13.3°C
2026-01-25 23:30:48 -    • Mínima del dia: 1.9°C
2026-01-25 23:30:48 -    • Pluja acumulada: 0.1mm
2026-01-25 23:30:48 -    • Últim període: 22:30 - 23:00 UTC
2026-01-25 23:30:48 -    • Hora actualització: 23:30
2026-01-25 23:30:48 - 💾 Dades guardades a data/XJ_20260125.csv (46 registres)
2026-01-25 23:30:48 - ✅ Girona: 46 períodes processats
2026-01-25 23:30:48 - 💾 Dades guardades a data/weather_daily_20260125.json
2026-01-25 23:30:48 - 💾 Dades guardades a data/weather_summary.json
2026-01-25 23:30:48 - 
============================================================
2026-01-25 23:30:48 - 📋 RESUM FINAL DEL DIA (UTC)
2026-01-25 23:30:48 - ============================================================
2026-01-25 23:30:48 - 
📍 Fornells de la Selva:
2026-01-25 23:30:48 -    • Períodes: 46
2026-01-25 23:30:48 -    • Màxima: 13.5°C
2026-01-25 23:30:48 -    • Mínima: 0.2°C
2026-01-25 23:30:48 -    • Pluja: 0.1mm
2026-01-25 23:30:48 -    • Últim període: 22:30 - 23:00 UTC
2026-01-25 23:30:48 -    • Actualització: 23:30
2026-01-25 23:30:48 - 
📍 Girona:
2026-01-25 23:30:48 -    • Períodes: 46
2026-01-25 23:30:48 -    • Màxima: 13.3°C
2026-01-25 23:30:48 -    • Mínima: 1.9°C
2026-01-25 23:30:48 -    • Pluja: 0.1mm
2026-01-25 23:30:48 -    • Últim període: 22:30 - 23:00 UTC
2026-01-25 23:30:48 -    • Actualització: 23:30
2026-01-25 23:30:48 - 
💾 Fitxers generats:
2026-01-25 23:30:48 -    • data/weather_summary.json (per HTML)
2026-01-25 23:30:48 -    • data/weather_daily_YYYYMMDD.json (complet)
2026-01-25 23:30:48 -    • data/XX_YYYYMMDD.csv (per estació)
2026-01-25 23:30:48 - 
✅ PROCÉS COMPLETAT
2026-01-25 23:30:48 - ============================================================
