=== INICI DAILY SCRAPER (UTC): 2026-01-06 20:40:18 ===
2026-01-06 20:40:18 - ============================================================
2026-01-06 20:40:18 - 🌤️  DAILY WEATHER SCRAPER - VERSIÓ UTC
2026-01-06 20:40:18 - ============================================================
2026-01-06 20:40:18 - 
==================================================
2026-01-06 20:40:18 - 📡 Processant: Fornells de la Selva [UO]
2026-01-06 20:40:18 - 
🌐 Connectant a Fornells de la Selva...
2026-01-06 20:40:19 - 📊 Total files trobades a la taula: 42
2026-01-06 20:40:19 -    ✅ Període UTC: 00:00 - 00:30 | TX: 0.0 | TN: -0.7 | Pluja: 0.0
2026-01-06 20:40:19 -    ✅ Període UTC: 00:30 - 01:00 | TX: -0.7 | TN: -1.1 | Pluja: 0.0
2026-01-06 20:40:19 -    ✅ Període UTC: 01:00 - 01:30 | TX: -1.1 | TN: -1.4 | Pluja: 0.0
2026-01-06 20:40:19 -    ✅ Període UTC: 01:30 - 02:00 | TX: -1.1 | TN: -1.5 | Pluja: 0.0
2026-01-06 20:40:19 -    ✅ Període UTC: 02:00 - 02:30 | TX: -1.4 | TN: -1.9 | Pluja: 0.0
2026-01-06 20:40:19 -    ✅ Període UTC: 02:30 - 03:00 | TX: -2.0 | TN: -2.4 | Pluja: 0.0
2026-01-06 20:40:19 -    ✅ Període UTC: 03:00 - 03:30 | TX: -2.4 | TN: -2.8 | Pluja: 0.0
2026-01-06 20:40:19 -    ✅ Període UTC: 03:30 - 04:00 | TX: -2.9 | TN: -3.2 | Pluja: 0.0
2026-01-06 20:40:19 -    ✅ Període UTC: 04:00 - 04:30 | TX: -3.2 | TN: -3.3 | Pluja: 0.0
2026-01-06 20:40:19 -    ✅ Període UTC: 04:30 - 05:00 | TX: -3.3 | TN: -3.5 | Pluja: 0.0
2026-01-06 20:40:19 -    ✅ Període UTC: 05:00 - 05:30 | TX: -3.4 | TN: -3.8 | Pluja: 0.0
2026-01-06 20:40:19 -    ✅ Període UTC: 05:30 - 06:00 | TX: -3.6 | TN: -3.9 | Pluja: 0.0
2026-01-06 20:40:19 -    ✅ Període UTC: 06:00 - 06:30 | TX: -3.8 | TN: -4.2 | Pluja: 0.0
2026-01-06 20:40:19 -    ✅ Període UTC: 06:30 - 07:00 | TX: -4.0 | TN: -4.3 | Pluja: 0.0
2026-01-06 20:40:19 -    ✅ Període UTC: 07:00 - 07:30 | TX: -4.0 | TN: -4.3 | Pluja: 0.0
2026-01-06 20:40:19 -    ✅ Període UTC: 07:30 - 08:00 | TX: -3.6 | TN: -4.2 | Pluja: 0.0
2026-01-06 20:40:19 -    ✅ Període UTC: 08:00 - 08:30 | TX: -2.4 | TN: -3.5 | Pluja: 0.0
2026-01-06 20:40:19 -    ✅ Període UTC: 08:30 - 09:00 | TX: -0.3 | TN: -2.3 | Pluja: 0.0
2026-01-06 20:40:19 -    ✅ Període UTC: 09:00 - 09:30 | TX: 1.4 | TN: -0.6 | Pluja: 0.0
2026-01-06 20:40:19 -    ✅ Període UTC: 09:30 - 10:00 | TX: 3.6 | TN: 1.4 | Pluja: 0.0
2026-01-06 20:40:19 -    ✅ Període UTC: 10:00 - 10:30 | TX: 6.1 | TN: 3.6 | Pluja: 0.0
2026-01-06 20:40:19 -    ✅ Període UTC: 10:30 - 11:00 | TX: 7.6 | TN: 6.1 | Pluja: 0.0
2026-01-06 20:40:19 -    ✅ Període UTC: 11:00 - 11:30 | TX: 9.1 | TN: 7.7 | Pluja: 0.0
2026-01-06 20:40:19 -    ✅ Període UTC: 11:30 - 12:00 | TX: 10.4 | TN: 9.2 | Pluja: 0.0
2026-01-06 20:40:19 -    ✅ Període UTC: 12:00 - 12:30 | TX: 10.7 | TN: 10.3 | Pluja: 0.0
2026-01-06 20:40:19 -    ✅ Període UTC: 12:30 - 13:00 | TX: 10.6 | TN: 10.4 | Pluja: 0.0
2026-01-06 20:40:19 -    ✅ Període UTC: 13:00 - 13:30 | TX: 10.5 | TN: 10.2 | Pluja: 0.0
2026-01-06 20:40:19 -    ✅ Període UTC: 13:30 - 14:00 | TX: 10.5 | TN: 10.2 | Pluja: 0.0
2026-01-06 20:40:19 -    ✅ Període UTC: 14:00 - 14:30 | TX: 10.2 | TN: 9.8 | Pluja: 0.0
2026-01-06 20:40:19 -    ✅ Període UTC: 14:30 - 15:00 | TX: 9.8 | TN: 9.2 | Pluja: 0.0
2026-01-06 20:40:19 -    ✅ Període UTC: 15:00 - 15:30 | TX: 9.3 | TN: 8.3 | Pluja: 0.0
2026-01-06 20:40:19 -    ✅ Període UTC: 15:30 - 16:00 | TX: 8.2 | TN: 7.4 | Pluja: 0.0
2026-01-06 20:40:19 -    ✅ Període UTC: 16:00 - 16:30 | TX: 7.3 | TN: 6.5 | Pluja: 0.0
2026-01-06 20:40:19 -    ✅ Període UTC: 16:30 - 17:00 | TX: 6.5 | TN: 5.2 | Pluja: 0.0
2026-01-06 20:40:19 -    ✅ Període UTC: 17:00 - 17:30 | TX: 5.5 | TN: 4.6 | Pluja: 0.0
2026-01-06 20:40:19 -    ✅ Període UTC: 17:30 - 18:00 | TX: 4.9 | TN: 3.1 | Pluja: 0.0
2026-01-06 20:40:19 -    ✅ Període UTC: 18:00 - 18:30 | TX: 3.7 | TN: 2.7 | Pluja: 0.0
2026-01-06 20:40:19 -    ✅ Període UTC: 18:30 - 19:00 | TX: 3.4 | TN: 1.9 | Pluja: 0.0
2026-01-06 20:40:19 -    ✅ Període UTC: 19:00 - 19:30 | TX: 3.1 | TN: 1.5 | Pluja: 0.0
2026-01-06 20:40:19 -    ✅ Període UTC: 19:30 - 20:00 | TX: 1.5 | TN: -1.0 | Pluja: 0.0
2026-01-06 20:40:19 -    ✅ Període UTC: 20:00 - 20:30 | TX: -1.1 | TN: -1.8 | Pluja: 0.0
2026-01-06 20:40:19 - 📈 Total períodes vàlids trobats: 41
2026-01-06 20:40:19 - 📊 RESUM CALCULAT:
2026-01-06 20:40:19 -    • Màxima del dia: 10.7°C
2026-01-06 20:40:19 -    • Mínima del dia: -4.3°C
2026-01-06 20:40:19 -    • Pluja acumulada: 0.0mm
2026-01-06 20:40:19 -    • Últim període: 20:00 - 20:30 UTC
2026-01-06 20:40:19 -    • Hora actualització: 20:40
2026-01-06 20:40:19 - 💾 Dades guardades a data/UO_20260106.csv (41 registres)
2026-01-06 20:40:19 - ✅ Fornells de la Selva: 41 períodes processats
2026-01-06 20:40:19 - 
==================================================
2026-01-06 20:40:19 - 📡 Processant: Girona [XJ]
2026-01-06 20:40:19 - 
🌐 Connectant a Girona...
2026-01-06 20:40:21 - 📊 Total files trobades a la taula: 42
2026-01-06 20:40:21 -    ✅ Període UTC: 00:00 - 00:30 | TX: -0.5 | TN: -1.3 | Pluja: 0.0
2026-01-06 20:40:21 -    ✅ Període UTC: 00:30 - 01:00 | TX: -1.3 | TN: -1.7 | Pluja: 0.0
2026-01-06 20:40:21 -    ✅ Període UTC: 01:00 - 01:30 | TX: -1.6 | TN: -2.0 | Pluja: 0.0
2026-01-06 20:40:21 -    ✅ Període UTC: 01:30 - 02:00 | TX: -1.8 | TN: -2.1 | Pluja: 0.0
2026-01-06 20:40:21 -    ✅ Període UTC: 02:00 - 02:30 | TX: -1.3 | TN: -2.2 | Pluja: 0.0
2026-01-06 20:40:21 -    ✅ Període UTC: 02:30 - 03:00 | TX: -2.3 | TN: -3.0 | Pluja: 0.0
2026-01-06 20:40:21 -    ✅ Període UTC: 03:00 - 03:30 | TX: -2.7 | TN: -3.3 | Pluja: 0.0
2026-01-06 20:40:21 -    ✅ Període UTC: 03:30 - 04:00 | TX: -3.1 | TN: -3.5 | Pluja: 0.0
2026-01-06 20:40:21 -    ✅ Període UTC: 04:00 - 04:30 | TX: -3.4 | TN: -3.8 | Pluja: 0.0
2026-01-06 20:40:21 -    ✅ Període UTC: 04:30 - 05:00 | TX: -3.6 | TN: -4.0 | Pluja: 0.0
2026-01-06 20:40:21 -    ✅ Període UTC: 05:00 - 05:30 | TX: -4.0 | TN: -4.3 | Pluja: 0.0
2026-01-06 20:40:21 -    ✅ Període UTC: 05:30 - 06:00 | TX: -4.2 | TN: -4.7 | Pluja: 0.0
2026-01-06 20:40:21 -    ✅ Període UTC: 06:00 - 06:30 | TX: -4.3 | TN: -4.7 | Pluja: 0.0
2026-01-06 20:40:21 -    ✅ Període UTC: 06:30 - 07:00 | TX: -4.5 | TN: -4.9 | Pluja: 0.0
2026-01-06 20:40:21 -    ✅ Període UTC: 07:00 - 07:30 | TX: -4.7 | TN: -5.0 | Pluja: 0.0
2026-01-06 20:40:21 -    ✅ Període UTC: 07:30 - 08:00 | TX: -4.1 | TN: -4.8 | Pluja: 0.0
2026-01-06 20:40:21 -    ✅ Període UTC: 08:00 - 08:30 | TX: -1.5 | TN: -4.0 | Pluja: 0.0
2026-01-06 20:40:21 -    ✅ Període UTC: 08:30 - 09:00 | TX: 0.8 | TN: -1.5 | Pluja: 0.0
2026-01-06 20:40:21 -    ✅ Període UTC: 09:00 - 09:30 | TX: 2.7 | TN: 0.9 | Pluja: 0.0
2026-01-06 20:40:21 -    ✅ Període UTC: 09:30 - 10:00 | TX: 5.2 | TN: 2.7 | Pluja: 0.0
2026-01-06 20:40:21 -    ✅ Període UTC: 10:00 - 10:30 | TX: 7.3 | TN: 5.4 | Pluja: 0.0
2026-01-06 20:40:21 -    ✅ Període UTC: 10:30 - 11:00 | TX: 8.1 | TN: 7.0 | Pluja: 0.0
2026-01-06 20:40:21 -    ✅ Període UTC: 11:00 - 11:30 | TX: 9.3 | TN: 7.9 | Pluja: 0.0
2026-01-06 20:40:21 -    ✅ Període UTC: 11:30 - 12:00 | TX: 11.2 | TN: 9.4 | Pluja: 0.0
2026-01-06 20:40:21 -    ✅ Període UTC: 12:00 - 12:30 | TX: 11.7 | TN: 11.3 | Pluja: 0.0
2026-01-06 20:40:21 -    ✅ Període UTC: 12:30 - 13:00 | TX: 11.9 | TN: 11.4 | Pluja: 0.0
2026-01-06 20:40:21 -    ✅ Període UTC: 13:00 - 13:30 | TX: 11.7 | TN: 11.3 | Pluja: 0.0
2026-01-06 20:40:21 -    ✅ Període UTC: 13:30 - 14:00 | TX: 11.5 | TN: 11.1 | Pluja: 0.0
2026-01-06 20:40:21 -    ✅ Període UTC: 14:00 - 14:30 | TX: 11.3 | TN: 10.7 | Pluja: 0.0
2026-01-06 20:40:21 -    ✅ Període UTC: 14:30 - 15:00 | TX: 11.0 | TN: 10.1 | Pluja: 0.0
2026-01-06 20:40:21 -    ✅ Període UTC: 15:00 - 15:30 | TX: 10.1 | TN: 9.0 | Pluja: 0.0
2026-01-06 20:40:21 -    ✅ Període UTC: 15:30 - 16:00 | TX: 9.0 | TN: 8.4 | Pluja: 0.0
2026-01-06 20:40:21 -    ✅ Període UTC: 16:00 - 16:30 | TX: 8.4 | TN: 7.5 | Pluja: 0.0
2026-01-06 20:40:21 -    ✅ Període UTC: 16:30 - 17:00 | TX: 7.4 | TN: 6.4 | Pluja: 0.0
2026-01-06 20:40:21 -    ✅ Període UTC: 17:00 - 17:30 | TX: 6.4 | TN: 4.9 | Pluja: 0.0
2026-01-06 20:40:21 -    ✅ Període UTC: 17:30 - 18:00 | TX: 4.7 | TN: 1.5 | Pluja: 0.0
2026-01-06 20:40:21 -    ✅ Període UTC: 18:00 - 18:30 | TX: 1.4 | TN: 0.3 | Pluja: 0.0
2026-01-06 20:40:21 -    ✅ Període UTC: 18:30 - 19:00 | TX: 0.4 | TN: -0.2 | Pluja: 0.0
2026-01-06 20:40:21 -    ✅ Període UTC: 19:00 - 19:30 | TX: -0.2 | TN: -1.6 | Pluja: 0.0
2026-01-06 20:40:21 -    ✅ Període UTC: 19:30 - 20:00 | TX: -0.5 | TN: -2.4 | Pluja: 0.0
2026-01-06 20:40:21 -    ✅ Període UTC: 20:00 - 20:30 | TX: -2.1 | TN: -3.0 | Pluja: 0.0
2026-01-06 20:40:21 - 📈 Total períodes vàlids trobats: 41
2026-01-06 20:40:21 - 📊 RESUM CALCULAT:
2026-01-06 20:40:21 -    • Màxima del dia: 11.9°C
2026-01-06 20:40:21 -    • Mínima del dia: -5.0°C
2026-01-06 20:40:21 -    • Pluja acumulada: 0.0mm
2026-01-06 20:40:21 -    • Últim període: 20:00 - 20:30 UTC
2026-01-06 20:40:21 -    • Hora actualització: 20:40
2026-01-06 20:40:21 - 💾 Dades guardades a data/XJ_20260106.csv (41 registres)
2026-01-06 20:40:21 - ✅ Girona: 41 períodes processats
2026-01-06 20:40:21 - 💾 Dades guardades a data/weather_daily_20260106.json
2026-01-06 20:40:21 - 💾 Dades guardades a data/weather_summary.json
2026-01-06 20:40:21 - 
============================================================
2026-01-06 20:40:21 - 📋 RESUM FINAL DEL DIA (UTC)
2026-01-06 20:40:21 - ============================================================
2026-01-06 20:40:21 - 
📍 Fornells de la Selva:
2026-01-06 20:40:21 -    • Períodes: 41
2026-01-06 20:40:21 -    • Màxima: 10.7°C
2026-01-06 20:40:21 -    • Mínima: -4.3°C
2026-01-06 20:40:21 -    • Pluja: 0.0mm
2026-01-06 20:40:21 -    • Últim període: 20:00 - 20:30 UTC
2026-01-06 20:40:21 -    • Actualització: 20:40
2026-01-06 20:40:21 - 
📍 Girona:
2026-01-06 20:40:21 -    • Períodes: 41
2026-01-06 20:40:21 -    • Màxima: 11.9°C
2026-01-06 20:40:21 -    • Mínima: -5.0°C
2026-01-06 20:40:21 -    • Pluja: 0.0mm
2026-01-06 20:40:21 -    • Últim període: 20:00 - 20:30 UTC
2026-01-06 20:40:21 -    • Actualització: 20:40
2026-01-06 20:40:21 - 
💾 Fitxers generats:
2026-01-06 20:40:21 -    • data/weather_summary.json (per HTML)
2026-01-06 20:40:21 -    • data/weather_daily_YYYYMMDD.json (complet)
2026-01-06 20:40:21 -    • data/XX_YYYYMMDD.csv (per estació)
2026-01-06 20:40:21 - 
✅ PROCÉS COMPLETAT
2026-01-06 20:40:21 - ============================================================
