=== INICI DAILY SCRAPER (UTC): 2026-01-04 15:56:08 ===
2026-01-04 15:56:08 - ============================================================
2026-01-04 15:56:08 - 🌤️  DAILY WEATHER SCRAPER - VERSIÓ UTC
2026-01-04 15:56:08 - ============================================================
2026-01-04 15:56:08 - 
==================================================
2026-01-04 15:56:08 - 📡 Processant: Fornells de la Selva [UO]
2026-01-04 15:56:08 - 
🌐 Connectant a Fornells de la Selva...
2026-01-04 15:56:10 - 📊 Total files trobades a la taula: 32
2026-01-04 15:56:10 -    ✅ Període UTC: 00:00 - 00:30 | TX: 6.4 | TN: 6.3 | Pluja: 0.0
2026-01-04 15:56:10 -    ✅ Període UTC: 00:30 - 01:00 | TX: 6.3 | TN: 6.1 | Pluja: 0.0
2026-01-04 15:56:10 -    ✅ Període UTC: 01:00 - 01:30 | TX: 6.1 | TN: 6.0 | Pluja: 0.0
2026-01-04 15:56:10 -    ✅ Període UTC: 01:30 - 02:00 | TX: 6.1 | TN: 5.9 | Pluja: 0.0
2026-01-04 15:56:10 -    ✅ Període UTC: 02:00 - 02:30 | TX: 6.1 | TN: 5.8 | Pluja: 0.0
2026-01-04 15:56:10 -    ✅ Període UTC: 02:30 - 03:00 | TX: 5.8 | TN: 5.5 | Pluja: 0.0
2026-01-04 15:56:10 -    ✅ Període UTC: 03:00 - 03:30 | TX: 5.5 | TN: 5.2 | Pluja: 0.0
2026-01-04 15:56:10 -    ✅ Període UTC: 03:30 - 04:00 | TX: 5.1 | TN: 4.9 | Pluja: 0.0
2026-01-04 15:56:10 -    ✅ Període UTC: 04:00 - 04:30 | TX: 5.2 | TN: 4.9 | Pluja: 0.0
2026-01-04 15:56:10 -    ✅ Període UTC: 04:30 - 05:00 | TX: 5.4 | TN: 5.1 | Pluja: 0.0
2026-01-04 15:56:10 -    ✅ Període UTC: 05:00 - 05:30 | TX: 5.5 | TN: 5.3 | Pluja: 0.0
2026-01-04 15:56:10 -    ✅ Període UTC: 05:30 - 06:00 | TX: 5.3 | TN: 5.0 | Pluja: 0.0
2026-01-04 15:56:10 -    ✅ Període UTC: 06:00 - 06:30 | TX: 5.1 | TN: 4.6 | Pluja: 0.0
2026-01-04 15:56:10 -    ✅ Període UTC: 06:30 - 07:00 | TX: 4.7 | TN: 4.6 | Pluja: 0.0
2026-01-04 15:56:10 -    ✅ Període UTC: 07:00 - 07:30 | TX: 4.7 | TN: 4.5 | Pluja: 0.0
2026-01-04 15:56:10 -    ✅ Període UTC: 07:30 - 08:00 | TX: 4.6 | TN: 4.4 | Pluja: 0.0
2026-01-04 15:56:10 -    ✅ Període UTC: 08:00 - 08:30 | TX: 4.5 | TN: 4.4 | Pluja: 0.0
2026-01-04 15:56:10 -    ✅ Període UTC: 08:30 - 09:00 | TX: 4.4 | TN: 4.3 | Pluja: 0.0
2026-01-04 15:56:10 -    ✅ Període UTC: 09:00 - 09:30 | TX: 4.6 | TN: 4.4 | Pluja: 0.0
2026-01-04 15:56:10 -    ✅ Període UTC: 09:30 - 10:00 | TX: 4.9 | TN: 4.6 | Pluja: 0.0
2026-01-04 15:56:10 -    ✅ Període UTC: 10:00 - 10:30 | TX: 5.5 | TN: 5.0 | Pluja: 0.0
2026-01-04 15:56:10 -    ✅ Període UTC: 10:30 - 11:00 | TX: 6.6 | TN: 5.5 | Pluja: 0.0
2026-01-04 15:56:10 -    ✅ Període UTC: 11:00 - 11:30 | TX: 6.8 | TN: 6.3 | Pluja: 0.0
2026-01-04 15:56:10 -    ✅ Període UTC: 11:30 - 12:00 | TX: 6.4 | TN: 6.3 | Pluja: 0.0
2026-01-04 15:56:10 -    ✅ Període UTC: 12:00 - 12:30 | TX: 6.6 | TN: 6.3 | Pluja: 0.0
2026-01-04 15:56:10 -    ✅ Període UTC: 12:30 - 13:00 | TX: 6.9 | TN: 6.6 | Pluja: 0.0
2026-01-04 15:56:10 -    ✅ Període UTC: 13:00 - 13:30 | TX: 7.0 | TN: 6.9 | Pluja: 0.0
2026-01-04 15:56:10 -    ✅ Període UTC: 13:30 - 14:00 | TX: 7.1 | TN: 6.9 | Pluja: 0.0
2026-01-04 15:56:10 -    ✅ Període UTC: 14:00 - 14:30 | TX: 7.1 | TN: 6.8 | Pluja: 0.0
2026-01-04 15:56:10 -    ✅ Període UTC: 14:30 - 15:00 | TX: 6.8 | TN: 6.6 | Pluja: 0.0
2026-01-04 15:56:10 -    ✅ Període UTC: 15:00 - 15:30 | TX: 6.7 | TN: 6.5 | Pluja: 0.0
2026-01-04 15:56:10 - 📈 Total períodes vàlids trobats: 31
2026-01-04 15:56:10 - 📊 RESUM CALCULAT:
2026-01-04 15:56:10 -    • Màxima del dia: 7.1°C
2026-01-04 15:56:10 -    • Mínima del dia: 4.3°C
2026-01-04 15:56:10 -    • Pluja acumulada: 0.0mm
2026-01-04 15:56:10 -    • Últim període: 15:00 - 15:30 UTC
2026-01-04 15:56:10 -    • Hora actualització: 15:56
2026-01-04 15:56:10 - 💾 Dades guardades a data/UO_20260104.csv (31 registres)
2026-01-04 15:56:10 - ✅ Fornells de la Selva: 31 períodes processats
2026-01-04 15:56:10 - 
==================================================
2026-01-04 15:56:10 - 📡 Processant: Girona [XJ]
2026-01-04 15:56:10 - 
🌐 Connectant a Girona...
2026-01-04 15:56:12 - 📊 Total files trobades a la taula: 32
2026-01-04 15:56:12 -    ✅ Període UTC: 00:00 - 00:30 | TX: 6.5 | TN: 6.3 | Pluja: 0.0
2026-01-04 15:56:12 -    ✅ Període UTC: 00:30 - 01:00 | TX: 6.3 | TN: 6.2 | Pluja: 0.0
2026-01-04 15:56:12 -    ✅ Període UTC: 01:00 - 01:30 | TX: 6.2 | TN: 6.1 | Pluja: 0.0
2026-01-04 15:56:12 -    ✅ Període UTC: 01:30 - 02:00 | TX: 6.2 | TN: 6.2 | Pluja: 0.0
2026-01-04 15:56:12 -    ✅ Període UTC: 02:00 - 02:30 | TX: 6.2 | TN: 5.8 | Pluja: 0.0
2026-01-04 15:56:12 -    ✅ Període UTC: 02:30 - 03:00 | TX: 5.8 | TN: 5.2 | Pluja: 0.0
2026-01-04 15:56:12 -    ✅ Període UTC: 03:00 - 03:30 | TX: 5.2 | TN: 5.0 | Pluja: 0.0
2026-01-04 15:56:12 -    ✅ Període UTC: 03:30 - 04:00 | TX: 5.0 | TN: 4.9 | Pluja: 0.1
2026-01-04 15:56:12 -    ✅ Període UTC: 04:00 - 04:30 | TX: 5.2 | TN: 4.8 | Pluja: 0.0
2026-01-04 15:56:12 -    ✅ Període UTC: 04:30 - 05:00 | TX: 5.3 | TN: 5.1 | Pluja: 0.0
2026-01-04 15:56:12 -    ✅ Període UTC: 05:00 - 05:30 | TX: 5.4 | TN: 5.3 | Pluja: 0.0
2026-01-04 15:56:12 -    ✅ Període UTC: 05:30 - 06:00 | TX: 5.4 | TN: 5.2 | Pluja: 0.0
2026-01-04 15:56:12 -    ✅ Període UTC: 06:00 - 06:30 | TX: 5.2 | TN: 4.8 | Pluja: 0.0
2026-01-04 15:56:12 -    ✅ Període UTC: 06:30 - 07:00 | TX: 4.9 | TN: 4.7 | Pluja: 0.0
2026-01-04 15:56:12 -    ✅ Període UTC: 07:00 - 07:30 | TX: 4.9 | TN: 4.7 | Pluja: 0.0
2026-01-04 15:56:12 -    ✅ Període UTC: 07:30 - 08:00 | TX: 4.9 | TN: 4.8 | Pluja: 0.0
2026-01-04 15:56:12 -    ✅ Període UTC: 08:00 - 08:30 | TX: 4.8 | TN: 4.5 | Pluja: 0.0
2026-01-04 15:56:12 -    ✅ Període UTC: 08:30 - 09:00 | TX: 5.5 | TN: 4.4 | Pluja: 0.0
2026-01-04 15:56:12 -    ✅ Període UTC: 09:00 - 09:30 | TX: 5.5 | TN: 4.8 | Pluja: 0.0
2026-01-04 15:56:12 -    ✅ Període UTC: 09:30 - 10:00 | TX: 5.5 | TN: 5.0 | Pluja: 0.0
2026-01-04 15:56:12 -    ✅ Període UTC: 10:00 - 10:30 | TX: 6.4 | TN: 5.5 | Pluja: 0.0
2026-01-04 15:56:12 -    ✅ Període UTC: 10:30 - 11:00 | TX: 6.8 | TN: 6.4 | Pluja: 0.0
2026-01-04 15:56:12 -    ✅ Període UTC: 11:00 - 11:30 | TX: 6.8 | TN: 6.3 | Pluja: 0.0
2026-01-04 15:56:12 -    ✅ Període UTC: 11:30 - 12:00 | TX: 6.8 | TN: 6.3 | Pluja: 0.0
2026-01-04 15:56:12 -    ✅ Període UTC: 12:00 - 12:30 | TX: 7.8 | TN: 6.8 | Pluja: 0.0
2026-01-04 15:56:12 -    ✅ Període UTC: 12:30 - 13:00 | TX: 7.8 | TN: 7.4 | Pluja: 0.0
2026-01-04 15:56:12 -    ✅ Període UTC: 13:00 - 13:30 | TX: 7.6 | TN: 7.4 | Pluja: 0.0
2026-01-04 15:56:12 -    ✅ Període UTC: 13:30 - 14:00 | TX: 7.5 | TN: 7.4 | Pluja: 0.0
2026-01-04 15:56:12 -    ✅ Període UTC: 14:00 - 14:30 | TX: 7.4 | TN: 7.4 | Pluja: 0.0
2026-01-04 15:56:12 -    ✅ Període UTC: 14:30 - 15:00 | TX: 7.4 | TN: 7.2 | Pluja: 0.0
2026-01-04 15:56:12 -    ✅ Període UTC: 15:00 - 15:30 | TX: 7.2 | TN: 7.2 | Pluja: 0.0
2026-01-04 15:56:12 - 📈 Total períodes vàlids trobats: 31
2026-01-04 15:56:12 - 📊 RESUM CALCULAT:
2026-01-04 15:56:12 -    • Màxima del dia: 7.8°C
2026-01-04 15:56:12 -    • Mínima del dia: 4.4°C
2026-01-04 15:56:12 -    • Pluja acumulada: 0.1mm
2026-01-04 15:56:12 -    • Últim període: 15:00 - 15:30 UTC
2026-01-04 15:56:12 -    • Hora actualització: 15:56
2026-01-04 15:56:12 - 💾 Dades guardades a data/XJ_20260104.csv (31 registres)
2026-01-04 15:56:12 - ✅ Girona: 31 períodes processats
2026-01-04 15:56:12 - 💾 Dades guardades a data/weather_daily_20260104.json
2026-01-04 15:56:12 - 💾 Dades guardades a data/weather_summary.json
2026-01-04 15:56:12 - 
============================================================
2026-01-04 15:56:12 - 📋 RESUM FINAL DEL DIA (UTC)
2026-01-04 15:56:12 - ============================================================
2026-01-04 15:56:12 - 
📍 Fornells de la Selva:
2026-01-04 15:56:12 -    • Períodes: 31
2026-01-04 15:56:12 -    • Màxima: 7.1°C
2026-01-04 15:56:12 -    • Mínima: 4.3°C
2026-01-04 15:56:12 -    • Pluja: 0.0mm
2026-01-04 15:56:12 -    • Últim període: 15:00 - 15:30 UTC
2026-01-04 15:56:12 -    • Actualització: 15:56
2026-01-04 15:56:12 - 
📍 Girona:
2026-01-04 15:56:12 -    • Períodes: 31
2026-01-04 15:56:12 -    • Màxima: 7.8°C
2026-01-04 15:56:12 -    • Mínima: 4.4°C
2026-01-04 15:56:12 -    • Pluja: 0.1mm
2026-01-04 15:56:12 -    • Últim període: 15:00 - 15:30 UTC
2026-01-04 15:56:12 -    • Actualització: 15:56
2026-01-04 15:56:12 - 
💾 Fitxers generats:
2026-01-04 15:56:12 -    • data/weather_summary.json (per HTML)
2026-01-04 15:56:12 -    • data/weather_daily_YYYYMMDD.json (complet)
2026-01-04 15:56:12 -    • data/XX_YYYYMMDD.csv (per estació)
2026-01-04 15:56:12 - 
✅ PROCÉS COMPLETAT
2026-01-04 15:56:12 - ============================================================
