=== INICI DAILY SCRAPER (UTC): 2026-01-12 18:15:19 ===
2026-01-12 18:15:19 - ============================================================
2026-01-12 18:15:19 - 🌤️  DAILY WEATHER SCRAPER - VERSIÓ UTC
2026-01-12 18:15:19 - ============================================================
2026-01-12 18:15:19 - 
==================================================
2026-01-12 18:15:19 - 📡 Processant: Fornells de la Selva [UO]
2026-01-12 18:15:19 - 
🌐 Connectant a Fornells de la Selva...
2026-01-12 18:15:21 - 📊 Total files trobades a la taula: 37
2026-01-12 18:15:21 -    ✅ Període UTC: 00:00 - 00:30 | TX: -0.3 | TN: -0.9 | Pluja: 0.0
2026-01-12 18:15:21 -    ✅ Període UTC: 00:30 - 01:00 | TX: -0.5 | TN: -1.1 | Pluja: 0.0
2026-01-12 18:15:21 -    ✅ Període UTC: 01:00 - 01:30 | TX: -0.8 | TN: -1.1 | Pluja: 0.0
2026-01-12 18:15:21 -    ✅ Període UTC: 01:30 - 02:00 | TX: -0.8 | TN: -1.2 | Pluja: 0.0
2026-01-12 18:15:21 -    ✅ Període UTC: 02:00 - 02:30 | TX: -1.0 | TN: -1.4 | Pluja: 0.0
2026-01-12 18:15:21 -    ✅ Període UTC: 02:30 - 03:00 | TX: -0.8 | TN: -1.2 | Pluja: 0.0
2026-01-12 18:15:21 -    ✅ Període UTC: 03:00 - 03:30 | TX: -1.0 | TN: -1.3 | Pluja: 0.0
2026-01-12 18:15:21 -    ✅ Període UTC: 03:30 - 04:00 | TX: -1.0 | TN: -1.8 | Pluja: 0.0
2026-01-12 18:15:21 -    ✅ Període UTC: 04:00 - 04:30 | TX: -1.3 | TN: -1.6 | Pluja: 0.0
2026-01-12 18:15:21 -    ✅ Període UTC: 04:30 - 05:00 | TX: -1.5 | TN: -2.1 | Pluja: 0.0
2026-01-12 18:15:21 -    ✅ Període UTC: 05:00 - 05:30 | TX: -1.3 | TN: -1.7 | Pluja: 0.0
2026-01-12 18:15:21 -    ✅ Període UTC: 05:30 - 06:00 | TX: -1.4 | TN: -1.9 | Pluja: 0.0
2026-01-12 18:15:21 -    ✅ Període UTC: 06:00 - 06:30 | TX: -1.3 | TN: -1.7 | Pluja: 0.0
2026-01-12 18:15:21 -    ✅ Període UTC: 06:30 - 07:00 | TX: -1.7 | TN: -2.0 | Pluja: 0.0
2026-01-12 18:15:21 -    ✅ Període UTC: 07:00 - 07:30 | TX: -1.7 | TN: -2.1 | Pluja: 0.0
2026-01-12 18:15:21 -    ✅ Període UTC: 07:30 - 08:00 | TX: -1.4 | TN: -2.1 | Pluja: 0.0
2026-01-12 18:15:21 -    ✅ Període UTC: 08:00 - 08:30 | TX: -0.7 | TN: -1.6 | Pluja: 0.0
2026-01-12 18:15:21 -    ✅ Període UTC: 08:30 - 09:00 | TX: 1.3 | TN: -0.6 | Pluja: 0.0
2026-01-12 18:15:21 -    ✅ Període UTC: 09:00 - 09:30 | TX: 3.9 | TN: 1.1 | Pluja: 0.0
2026-01-12 18:15:21 -    ✅ Període UTC: 09:30 - 10:00 | TX: 5.5 | TN: 3.9 | Pluja: 0.0
2026-01-12 18:15:21 -    ✅ Període UTC: 10:00 - 10:30 | TX: 7.6 | TN: 5.6 | Pluja: 0.0
2026-01-12 18:15:21 -    ✅ Període UTC: 10:30 - 11:00 | TX: 9.6 | TN: 7.6 | Pluja: 0.0
2026-01-12 18:15:21 -    ✅ Període UTC: 11:00 - 11:30 | TX: 10.8 | TN: 9.1 | Pluja: 0.0
2026-01-12 18:15:21 -    ✅ Període UTC: 11:30 - 12:00 | TX: 11.2 | TN: 10.8 | Pluja: 0.0
2026-01-12 18:15:21 -    ✅ Període UTC: 12:00 - 12:30 | TX: 12.4 | TN: 11.1 | Pluja: 0.0
2026-01-12 18:15:21 -    ✅ Període UTC: 12:30 - 13:00 | TX: 13.7 | TN: 12.4 | Pluja: 0.0
2026-01-12 18:15:21 -    ✅ Període UTC: 13:00 - 13:30 | TX: 15.9 | TN: 13.8 | Pluja: 0.0
2026-01-12 18:15:21 -    ✅ Període UTC: 13:30 - 14:00 | TX: 16.1 | TN: 15.2 | Pluja: 0.0
2026-01-12 18:15:21 -    ✅ Període UTC: 14:00 - 14:30 | TX: 15.2 | TN: 14.4 | Pluja: 0.0
2026-01-12 18:15:21 -    ✅ Període UTC: 14:30 - 15:00 | TX: 14.6 | TN: 13.6 | Pluja: 0.0
2026-01-12 18:15:21 -    ✅ Període UTC: 15:00 - 15:30 | TX: 13.5 | TN: 12.9 | Pluja: 0.0
2026-01-12 18:15:21 -    ✅ Període UTC: 15:30 - 16:00 | TX: 13.0 | TN: 12.0 | Pluja: 0.0
2026-01-12 18:15:21 -    ✅ Període UTC: 16:00 - 16:30 | TX: 12.1 | TN: 11.5 | Pluja: 0.0
2026-01-12 18:15:21 -    ✅ Període UTC: 16:30 - 17:00 | TX: 11.9 | TN: 10.6 | Pluja: 0.0
2026-01-12 18:15:21 -    ✅ Període UTC: 17:00 - 17:30 | TX: 11.8 | TN: 10.4 | Pluja: 0.0
2026-01-12 18:15:21 -    ✅ Període UTC: 17:30 - 18:00 | TX: 10.9 | TN: 7.1 | Pluja: 0.0
2026-01-12 18:15:21 - 📈 Total períodes vàlids trobats: 36
2026-01-12 18:15:21 - 📊 RESUM CALCULAT:
2026-01-12 18:15:21 -    • Màxima del dia: 16.1°C
2026-01-12 18:15:21 -    • Mínima del dia: -2.1°C
2026-01-12 18:15:21 -    • Pluja acumulada: 0.0mm
2026-01-12 18:15:21 -    • Últim període: 17:30 - 18:00 UTC
2026-01-12 18:15:21 -    • Hora actualització: 18:15
2026-01-12 18:15:21 - 💾 Dades guardades a data/UO_20260112.csv (36 registres)
2026-01-12 18:15:21 - ✅ Fornells de la Selva: 36 períodes processats
2026-01-12 18:15:21 - 
==================================================
2026-01-12 18:15:21 - 📡 Processant: Girona [XJ]
2026-01-12 18:15:21 - 
🌐 Connectant a Girona...
2026-01-12 18:15:22 - 📊 Total files trobades a la taula: 37
2026-01-12 18:15:22 -    ✅ Període UTC: 00:00 - 00:30 | TX: -0.6 | TN: -0.9 | Pluja: 0.0
2026-01-12 18:15:22 -    ✅ Període UTC: 00:30 - 01:00 | TX: -0.6 | TN: -1.0 | Pluja: 0.0
2026-01-12 18:15:22 -    ✅ Període UTC: 01:00 - 01:30 | TX: -0.7 | TN: -1.1 | Pluja: 0.0
2026-01-12 18:15:22 -    ✅ Període UTC: 01:30 - 02:00 | TX: -0.9 | TN: -1.2 | Pluja: 0.0
2026-01-12 18:15:22 -    ✅ Període UTC: 02:00 - 02:30 | TX: -1.1 | TN: -1.4 | Pluja: 0.0
2026-01-12 18:15:22 -    ✅ Període UTC: 02:30 - 03:00 | TX: -0.8 | TN: -1.3 | Pluja: 0.0
2026-01-12 18:15:22 -    ✅ Període UTC: 03:00 - 03:30 | TX: -1.2 | TN: -1.5 | Pluja: 0.0
2026-01-12 18:15:22 -    ✅ Període UTC: 03:30 - 04:00 | TX: -1.4 | TN: -1.8 | Pluja: 0.0
2026-01-12 18:15:22 -    ✅ Període UTC: 04:00 - 04:30 | TX: -1.6 | TN: -2.0 | Pluja: 0.0
2026-01-12 18:15:22 -    ✅ Període UTC: 04:30 - 05:00 | TX: -1.5 | TN: -1.9 | Pluja: 0.0
2026-01-12 18:15:22 -    ✅ Període UTC: 05:00 - 05:30 | TX: -1.5 | TN: -2.2 | Pluja: 0.0
2026-01-12 18:15:22 -    ✅ Període UTC: 05:30 - 06:00 | TX: -1.6 | TN: -2.2 | Pluja: 0.0
2026-01-12 18:15:22 -    ✅ Període UTC: 06:00 - 06:30 | TX: -1.9 | TN: -2.3 | Pluja: 0.0
2026-01-12 18:15:22 -    ✅ Període UTC: 06:30 - 07:00 | TX: -1.3 | TN: -2.4 | Pluja: 0.0
2026-01-12 18:15:22 -    ✅ Període UTC: 07:00 - 07:30 | TX: -1.9 | TN: -2.0 | Pluja: 0.0
2026-01-12 18:15:22 -    ✅ Període UTC: 07:30 - 08:00 | TX: -1.2 | TN: -2.0 | Pluja: 0.0
2026-01-12 18:15:22 -    ✅ Període UTC: 08:00 - 08:30 | TX: 0.0 | TN: -1.2 | Pluja: 0.0
2026-01-12 18:15:22 -    ✅ Període UTC: 08:30 - 09:00 | TX: 2.1 | TN: 0.1 | Pluja: 0.0
2026-01-12 18:15:22 -    ✅ Període UTC: 09:00 - 09:30 | TX: 4.2 | TN: 2.2 | Pluja: 0.0
2026-01-12 18:15:22 -    ✅ Període UTC: 09:30 - 10:00 | TX: 6.3 | TN: 4.2 | Pluja: 0.0
2026-01-12 18:15:22 -    ✅ Període UTC: 10:00 - 10:30 | TX: 8.0 | TN: 6.4 | Pluja: 0.0
2026-01-12 18:15:22 -    ✅ Període UTC: 10:30 - 11:00 | TX: 10.3 | TN: 8.1 | Pluja: 0.0
2026-01-12 18:15:22 -    ✅ Període UTC: 11:00 - 11:30 | TX: 10.9 | TN: 10.3 | Pluja: 0.0
2026-01-12 18:15:22 -    ✅ Període UTC: 11:30 - 12:00 | TX: 11.7 | TN: 10.8 | Pluja: 0.0
2026-01-12 18:15:22 -    ✅ Període UTC: 12:00 - 12:30 | TX: 13.3 | TN: 11.8 | Pluja: 0.0
2026-01-12 18:15:22 -    ✅ Període UTC: 12:30 - 13:00 | TX: 14.8 | TN: 13.5 | Pluja: 0.0
2026-01-12 18:15:22 -    ✅ Període UTC: 13:00 - 13:30 | TX: 15.5 | TN: 14.7 | Pluja: 0.0
2026-01-12 18:15:22 -    ✅ Període UTC: 13:30 - 14:00 | TX: 15.6 | TN: 14.9 | Pluja: 0.0
2026-01-12 18:15:22 -    ✅ Període UTC: 14:00 - 14:30 | TX: 15.4 | TN: 14.9 | Pluja: 0.0
2026-01-12 18:15:22 -    ✅ Període UTC: 14:30 - 15:00 | TX: 15.4 | TN: 14.8 | Pluja: 0.0
2026-01-12 18:15:22 -    ✅ Període UTC: 15:00 - 15:30 | TX: 14.8 | TN: 14.3 | Pluja: 0.0
2026-01-12 18:15:22 -    ✅ Període UTC: 15:30 - 16:00 | TX: 14.3 | TN: 13.8 | Pluja: 0.0
2026-01-12 18:15:22 -    ✅ Període UTC: 16:00 - 16:30 | TX: 13.8 | TN: 11.1 | Pluja: 0.0
2026-01-12 18:15:22 -    ✅ Període UTC: 16:30 - 17:00 | TX: 11.1 | TN: 9.7 | Pluja: 0.0
2026-01-12 18:15:22 -    ✅ Període UTC: 17:00 - 17:30 | TX: 9.7 | TN: 9.2 | Pluja: 0.0
2026-01-12 18:15:22 -    ✅ Període UTC: 17:30 - 18:00 | TX: 9.3 | TN: 8.9 | Pluja: 0.0
2026-01-12 18:15:22 - 📈 Total períodes vàlids trobats: 36
2026-01-12 18:15:22 - 📊 RESUM CALCULAT:
2026-01-12 18:15:22 -    • Màxima del dia: 15.6°C
2026-01-12 18:15:22 -    • Mínima del dia: -2.4°C
2026-01-12 18:15:22 -    • Pluja acumulada: 0.0mm
2026-01-12 18:15:22 -    • Últim període: 17:30 - 18:00 UTC
2026-01-12 18:15:22 -    • Hora actualització: 18:15
2026-01-12 18:15:22 - 💾 Dades guardades a data/XJ_20260112.csv (36 registres)
2026-01-12 18:15:22 - ✅ Girona: 36 períodes processats
2026-01-12 18:15:22 - 💾 Dades guardades a data/weather_daily_20260112.json
2026-01-12 18:15:22 - 💾 Dades guardades a data/weather_summary.json
2026-01-12 18:15:22 - 
============================================================
2026-01-12 18:15:22 - 📋 RESUM FINAL DEL DIA (UTC)
2026-01-12 18:15:22 - ============================================================
2026-01-12 18:15:22 - 
📍 Fornells de la Selva:
2026-01-12 18:15:22 -    • Períodes: 36
2026-01-12 18:15:22 -    • Màxima: 16.1°C
2026-01-12 18:15:22 -    • Mínima: -2.1°C
2026-01-12 18:15:22 -    • Pluja: 0.0mm
2026-01-12 18:15:22 -    • Últim període: 17:30 - 18:00 UTC
2026-01-12 18:15:22 -    • Actualització: 18:15
2026-01-12 18:15:22 - 
📍 Girona:
2026-01-12 18:15:22 -    • Períodes: 36
2026-01-12 18:15:22 -    • Màxima: 15.6°C
2026-01-12 18:15:22 -    • Mínima: -2.4°C
2026-01-12 18:15:22 -    • Pluja: 0.0mm
2026-01-12 18:15:22 -    • Últim període: 17:30 - 18:00 UTC
2026-01-12 18:15:22 -    • Actualització: 18:15
2026-01-12 18:15:22 - 
💾 Fitxers generats:
2026-01-12 18:15:22 -    • data/weather_summary.json (per HTML)
2026-01-12 18:15:22 -    • data/weather_daily_YYYYMMDD.json (complet)
2026-01-12 18:15:22 -    • data/XX_YYYYMMDD.csv (per estació)
2026-01-12 18:15:22 - 
✅ PROCÉS COMPLETAT
2026-01-12 18:15:22 - ============================================================
