=== INICI DAILY SCRAPER (UTC): 2026-02-07 15:50:19 ===
2026-02-07 15:50:19 - ============================================================
2026-02-07 15:50:19 - 🌤️  DAILY WEATHER SCRAPER - VERSIÓ UTC
2026-02-07 15:50:19 - ============================================================
2026-02-07 15:50:19 - 
==================================================
2026-02-07 15:50:19 - 📡 Processant: Fornells de la Selva [UO]
2026-02-07 15:50:19 - 
🌐 Connectant a Fornells de la Selva...
2026-02-07 15:50:20 - 📊 Total files trobades a la taula: 32
2026-02-07 15:50:20 -    ✅ Període UTC: 00:00 - 00:30 | TX: 5.1 | TN: 4.6 | Pluja: 0.0
2026-02-07 15:50:20 -    ✅ Període UTC: 00:30 - 01:00 | TX: 5.2 | TN: 4.9 | Pluja: 0.0
2026-02-07 15:50:20 -    ✅ Període UTC: 01:00 - 01:30 | TX: 5.1 | TN: 4.7 | Pluja: 0.0
2026-02-07 15:50:20 -    ✅ Període UTC: 01:30 - 02:00 | TX: 4.8 | TN: 3.7 | Pluja: 0.0
2026-02-07 15:50:20 -    ✅ Període UTC: 02:00 - 02:30 | TX: 4.2 | TN: 3.8 | Pluja: 0.0
2026-02-07 15:50:20 -    ✅ Període UTC: 02:30 - 03:00 | TX: 4.8 | TN: 3.9 | Pluja: 0.0
2026-02-07 15:50:20 -    ✅ Període UTC: 03:00 - 03:30 | TX: 4.3 | TN: 3.3 | Pluja: 0.0
2026-02-07 15:50:20 -    ✅ Període UTC: 03:30 - 04:00 | TX: 4.1 | TN: 2.8 | Pluja: 0.0
2026-02-07 15:50:20 -    ✅ Període UTC: 04:00 - 04:30 | TX: 3.6 | TN: 2.6 | Pluja: 0.0
2026-02-07 15:50:20 -    ✅ Període UTC: 04:30 - 05:00 | TX: 3.1 | TN: 2.5 | Pluja: 0.0
2026-02-07 15:50:20 -    ✅ Període UTC: 05:00 - 05:30 | TX: 3.1 | TN: 2.4 | Pluja: 0.0
2026-02-07 15:50:20 -    ✅ Període UTC: 05:30 - 06:00 | TX: 2.5 | TN: 1.9 | Pluja: 0.0
2026-02-07 15:50:20 -    ✅ Període UTC: 06:00 - 06:30 | TX: 2.1 | TN: 1.7 | Pluja: 0.0
2026-02-07 15:50:20 -    ✅ Període UTC: 06:30 - 07:00 | TX: 2.7 | TN: 1.7 | Pluja: 0.0
2026-02-07 15:50:20 -    ✅ Període UTC: 07:00 - 07:30 | TX: 3.1 | TN: 2.2 | Pluja: 0.0
2026-02-07 15:50:20 -    ✅ Període UTC: 07:30 - 08:00 | TX: 6.0 | TN: 3.0 | Pluja: 0.0
2026-02-07 15:50:20 -    ✅ Període UTC: 08:00 - 08:30 | TX: 8.6 | TN: 6.1 | Pluja: 0.0
2026-02-07 15:50:20 -    ✅ Període UTC: 08:30 - 09:00 | TX: 11.0 | TN: 8.3 | Pluja: 0.0
2026-02-07 15:50:20 -    ✅ Període UTC: 09:00 - 09:30 | TX: 12.8 | TN: 10.9 | Pluja: 0.0
2026-02-07 15:50:20 -    ✅ Període UTC: 09:30 - 10:00 | TX: 13.3 | TN: 11.8 | Pluja: 0.0
2026-02-07 15:50:20 -    ✅ Període UTC: 10:00 - 10:30 | TX: 13.9 | TN: 13.3 | Pluja: 0.0
2026-02-07 15:50:20 -    ✅ Període UTC: 10:30 - 11:00 | TX: 14.4 | TN: 13.5 | Pluja: 0.0
2026-02-07 15:50:20 -    ✅ Període UTC: 11:00 - 11:30 | TX: 15.4 | TN: 14.1 | Pluja: 0.0
2026-02-07 15:50:20 -    ✅ Període UTC: 11:30 - 12:00 | TX: 15.1 | TN: 13.6 | Pluja: 0.0
2026-02-07 15:50:20 -    ✅ Període UTC: 12:00 - 12:30 | TX: 15.8 | TN: 15.2 | Pluja: 0.0
2026-02-07 15:50:20 -    ✅ Període UTC: 12:30 - 13:00 | TX: 16.1 | TN: 15.3 | Pluja: 0.0
2026-02-07 15:50:20 -    ✅ Període UTC: 13:00 - 13:30 | TX: 16.5 | TN: 15.1 | Pluja: 0.0
2026-02-07 15:50:20 -    ✅ Període UTC: 13:30 - 14:00 | TX: 15.9 | TN: 14.7 | Pluja: 0.0
2026-02-07 15:50:20 -    ✅ Període UTC: 14:00 - 14:30 | TX: 15.8 | TN: 15.5 | Pluja: 0.0
2026-02-07 15:50:20 -    ✅ Període UTC: 14:30 - 15:00 | TX: 15.8 | TN: 15.1 | Pluja: 0.0
2026-02-07 15:50:20 -    ✅ Període UTC: 15:00 - 15:30 | TX: 16.3 | TN: 15.5 | Pluja: 0.0
2026-02-07 15:50:20 - 📈 Total períodes vàlids trobats: 31
2026-02-07 15:50:20 - 📊 RESUM CALCULAT:
2026-02-07 15:50:20 -    • Màxima del dia: 16.5°C
2026-02-07 15:50:20 -    • Mínima del dia: 1.7°C
2026-02-07 15:50:20 -    • Pluja acumulada: 0.0mm
2026-02-07 15:50:20 -    • Últim període: 15:00 - 15:30 UTC
2026-02-07 15:50:20 -    • Hora actualització: 15:50
2026-02-07 15:50:20 - 💾 Dades guardades a data/UO_20260207.csv (31 registres)
2026-02-07 15:50:20 - ✅ Fornells de la Selva: 31 períodes processats
2026-02-07 15:50:20 - 
==================================================
2026-02-07 15:50:20 - 📡 Processant: Girona [XJ]
2026-02-07 15:50:20 - 
🌐 Connectant a Girona...
2026-02-07 15:50:22 - 📊 Total files trobades a la taula: 32
2026-02-07 15:50:22 -    ✅ Període UTC: 00:00 - 00:30 | TX: 8.4 | TN: 6.6 | Pluja: 0.0
2026-02-07 15:50:22 -    ✅ Període UTC: 00:30 - 01:00 | TX: 10.2 | TN: 8.8 | Pluja: 0.0
2026-02-07 15:50:22 -    ✅ Període UTC: 01:00 - 01:30 | TX: 8.6 | TN: 7.7 | Pluja: 0.0
2026-02-07 15:50:22 -    ✅ Període UTC: 01:30 - 02:00 | TX: 8.8 | TN: 7.4 | Pluja: 0.0
2026-02-07 15:50:22 -    ✅ Període UTC: 02:00 - 02:30 | TX: 8.5 | TN: 6.4 | Pluja: 0.0
2026-02-07 15:50:22 -    ✅ Període UTC: 02:30 - 03:00 | TX: 7.6 | TN: 5.8 | Pluja: 0.0
2026-02-07 15:50:22 -    ✅ Període UTC: 03:00 - 03:30 | TX: 5.9 | TN: 4.9 | Pluja: 0.0
2026-02-07 15:50:22 -    ✅ Període UTC: 03:30 - 04:00 | TX: 4.9 | TN: 4.3 | Pluja: 0.0
2026-02-07 15:50:22 -    ✅ Període UTC: 04:00 - 04:30 | TX: 4.7 | TN: 4.3 | Pluja: 0.0
2026-02-07 15:50:22 -    ✅ Període UTC: 04:30 - 05:00 | TX: 4.3 | TN: 3.8 | Pluja: 0.0
2026-02-07 15:50:22 -    ✅ Període UTC: 05:00 - 05:30 | TX: 4.5 | TN: 3.4 | Pluja: 0.0
2026-02-07 15:50:22 -    ✅ Període UTC: 05:30 - 06:00 | TX: 3.4 | TN: 2.9 | Pluja: 0.0
2026-02-07 15:50:22 -    ✅ Període UTC: 06:00 - 06:30 | TX: 3.4 | TN: 2.6 | Pluja: 0.0
2026-02-07 15:50:22 -    ✅ Període UTC: 06:30 - 07:00 | TX: 4.1 | TN: 2.9 | Pluja: 0.0
2026-02-07 15:50:22 -    ✅ Període UTC: 07:00 - 07:30 | TX: 4.8 | TN: 3.9 | Pluja: 0.0
2026-02-07 15:50:22 -    ✅ Període UTC: 07:30 - 08:00 | TX: 5.7 | TN: 4.4 | Pluja: 0.0
2026-02-07 15:50:22 -    ✅ Període UTC: 08:00 - 08:30 | TX: 6.6 | TN: 5.8 | Pluja: 0.0
2026-02-07 15:50:22 -    ✅ Període UTC: 08:30 - 09:00 | TX: 9.9 | TN: 6.4 | Pluja: 0.0
2026-02-07 15:50:22 -    ✅ Període UTC: 09:00 - 09:30 | TX: 12.5 | TN: 10.2 | Pluja: 0.1
2026-02-07 15:50:22 -    ✅ Període UTC: 09:30 - 10:00 | TX: 13.4 | TN: 12.3 | Pluja: 0.2
2026-02-07 15:50:22 -    ✅ Període UTC: 10:00 - 10:30 | TX: 13.9 | TN: 13.1 | Pluja: 0.0
2026-02-07 15:50:22 -    ✅ Període UTC: 10:30 - 11:00 | TX: 14.4 | TN: 13.8 | Pluja: 0.0
2026-02-07 15:50:22 -    ✅ Període UTC: 11:00 - 11:30 | TX: 15.5 | TN: 14.3 | Pluja: 0.0
2026-02-07 15:50:22 -    ✅ Període UTC: 11:30 - 12:00 | TX: 15.7 | TN: 14.6 | Pluja: 0.0
2026-02-07 15:50:22 -    ✅ Període UTC: 12:00 - 12:30 | TX: 16.6 | TN: 14.6 | Pluja: 0.0
2026-02-07 15:50:22 -    ✅ Període UTC: 12:30 - 13:00 | TX: 15.8 | TN: 14.2 | Pluja: 0.0
2026-02-07 15:50:22 -    ✅ Període UTC: 13:00 - 13:30 | TX: 15.7 | TN: 15.0 | Pluja: 0.0
2026-02-07 15:50:22 -    ✅ Període UTC: 13:30 - 14:00 | TX: 16.2 | TN: 15.3 | Pluja: 0.0
2026-02-07 15:50:22 -    ✅ Període UTC: 14:00 - 14:30 | TX: 16.1 | TN: 15.5 | Pluja: 0.0
2026-02-07 15:50:22 -    ✅ Període UTC: 14:30 - 15:00 | TX: 16.5 | TN: 15.7 | Pluja: 0.0
2026-02-07 15:50:22 -    ✅ Període UTC: 15:00 - 15:30 | TX: 16.4 | TN: 15.7 | Pluja: 0.0
2026-02-07 15:50:22 - 📈 Total períodes vàlids trobats: 31
2026-02-07 15:50:22 - 📊 RESUM CALCULAT:
2026-02-07 15:50:22 -    • Màxima del dia: 16.6°C
2026-02-07 15:50:22 -    • Mínima del dia: 2.6°C
2026-02-07 15:50:22 -    • Pluja acumulada: 0.30000000000000004mm
2026-02-07 15:50:22 -    • Últim període: 15:00 - 15:30 UTC
2026-02-07 15:50:22 -    • Hora actualització: 15:50
2026-02-07 15:50:22 - 💾 Dades guardades a data/XJ_20260207.csv (31 registres)
2026-02-07 15:50:22 - ✅ Girona: 31 períodes processats
2026-02-07 15:50:22 - 💾 Dades guardades a data/weather_daily_20260207.json
2026-02-07 15:50:22 - 💾 Dades guardades a data/weather_summary.json
2026-02-07 15:50:22 - 
============================================================
2026-02-07 15:50:22 - 📋 RESUM FINAL DEL DIA (UTC)
2026-02-07 15:50:22 - ============================================================
2026-02-07 15:50:22 - 
📍 Fornells de la Selva:
2026-02-07 15:50:22 -    • Períodes: 31
2026-02-07 15:50:22 -    • Màxima: 16.5°C
2026-02-07 15:50:22 -    • Mínima: 1.7°C
2026-02-07 15:50:22 -    • Pluja: 0.0mm
2026-02-07 15:50:22 -    • Últim període: 15:00 - 15:30 UTC
2026-02-07 15:50:22 -    • Actualització: 15:50
2026-02-07 15:50:22 - 
📍 Girona:
2026-02-07 15:50:22 -    • Períodes: 31
2026-02-07 15:50:22 -    • Màxima: 16.6°C
2026-02-07 15:50:22 -    • Mínima: 2.6°C
2026-02-07 15:50:22 -    • Pluja: 0.30000000000000004mm
2026-02-07 15:50:22 -    • Últim període: 15:00 - 15:30 UTC
2026-02-07 15:50:22 -    • Actualització: 15:50
2026-02-07 15:50:22 - 
💾 Fitxers generats:
2026-02-07 15:50:22 -    • data/weather_summary.json (per HTML)
2026-02-07 15:50:22 -    • data/weather_daily_YYYYMMDD.json (complet)
2026-02-07 15:50:22 -    • data/XX_YYYYMMDD.csv (per estació)
2026-02-07 15:50:22 - 
✅ PROCÉS COMPLETAT
2026-02-07 15:50:22 - ============================================================
