=== INICI DAILY SCRAPER (UTC): 2026-01-10 14:49:36 ===
2026-01-10 14:49:36 - ============================================================
2026-01-10 14:49:36 - 🌤️  DAILY WEATHER SCRAPER - VERSIÓ UTC
2026-01-10 14:49:36 - ============================================================
2026-01-10 14:49:36 - 
==================================================
2026-01-10 14:49:36 - 📡 Processant: Fornells de la Selva [UO]
2026-01-10 14:49:36 - 
🌐 Connectant a Fornells de la Selva...
2026-01-10 14:49:38 - 📊 Total files trobades a la taula: 30
2026-01-10 14:49:38 -    ✅ Període UTC: 00:00 - 00:30 | TX: 1.1 | TN: -0.2 | Pluja: 0.0
2026-01-10 14:49:38 -    ✅ Període UTC: 00:30 - 01:00 | TX: 0.5 | TN: -0.5 | Pluja: 0.0
2026-01-10 14:49:38 -    ✅ Període UTC: 01:00 - 01:30 | TX: -0.3 | TN: -0.6 | Pluja: 0.0
2026-01-10 14:49:38 -    ✅ Període UTC: 01:30 - 02:00 | TX: -0.1 | TN: -1.1 | Pluja: 0.0
2026-01-10 14:49:38 -    ✅ Període UTC: 02:00 - 02:30 | TX: -0.2 | TN: -1.1 | Pluja: 0.0
2026-01-10 14:49:38 -    ✅ Període UTC: 02:30 - 03:00 | TX: -0.2 | TN: -1.2 | Pluja: 0.0
2026-01-10 14:49:38 -    ✅ Període UTC: 03:00 - 03:30 | TX: -0.3 | TN: -1.0 | Pluja: 0.0
2026-01-10 14:49:38 -    ✅ Període UTC: 03:30 - 04:00 | TX: 0.4 | TN: -1.0 | Pluja: 0.0
2026-01-10 14:49:38 -    ✅ Període UTC: 04:00 - 04:30 | TX: 0.9 | TN: -0.5 | Pluja: 0.0
2026-01-10 14:49:38 -    ✅ Període UTC: 04:30 - 05:00 | TX: 0.6 | TN: -0.4 | Pluja: 0.0
2026-01-10 14:49:38 -    ✅ Període UTC: 05:00 - 05:30 | TX: -0.7 | TN: -1.4 | Pluja: 0.0
2026-01-10 14:49:38 -    ✅ Període UTC: 05:30 - 06:00 | TX: -0.7 | TN: -1.4 | Pluja: 0.0
2026-01-10 14:49:38 -    ✅ Període UTC: 06:00 - 06:30 | TX: -0.4 | TN: -1.4 | Pluja: 0.0
2026-01-10 14:49:38 -    ✅ Període UTC: 06:30 - 07:00 | TX: -0.7 | TN: -1.8 | Pluja: 0.0
2026-01-10 14:49:38 -    ✅ Període UTC: 07:00 - 07:30 | TX: -0.3 | TN: -1.8 | Pluja: 0.0
2026-01-10 14:49:38 -    ✅ Període UTC: 07:30 - 08:00 | TX: -0.5 | TN: -1.2 | Pluja: 0.0
2026-01-10 14:49:38 -    ✅ Període UTC: 08:00 - 08:30 | TX: 0.8 | TN: -0.6 | Pluja: 0.0
2026-01-10 14:49:38 -    ✅ Període UTC: 08:30 - 09:00 | TX: 2.5 | TN: 0.8 | Pluja: 0.0
2026-01-10 14:49:38 -    ✅ Període UTC: 09:00 - 09:30 | TX: 5.3 | TN: 2.6 | Pluja: 0.0
2026-01-10 14:49:38 -    ✅ Període UTC: 09:30 - 10:00 | TX: 6.7 | TN: 5.4 | Pluja: 0.0
2026-01-10 14:49:38 -    ✅ Període UTC: 10:00 - 10:30 | TX: 8.7 | TN: 6.6 | Pluja: 0.0
2026-01-10 14:49:38 -    ✅ Període UTC: 10:30 - 11:00 | TX: 9.4 | TN: 8.2 | Pluja: 0.0
2026-01-10 14:49:38 -    ✅ Període UTC: 11:00 - 11:30 | TX: 11.0 | TN: 9.6 | Pluja: 0.0
2026-01-10 14:49:38 -    ✅ Període UTC: 11:30 - 12:00 | TX: 12.2 | TN: 10.7 | Pluja: 0.0
2026-01-10 14:49:38 -    ✅ Període UTC: 12:00 - 12:30 | TX: 12.7 | TN: 11.4 | Pluja: 0.0
2026-01-10 14:49:38 -    ✅ Període UTC: 12:30 - 13:00 | TX: 12.7 | TN: 11.7 | Pluja: 0.0
2026-01-10 14:49:38 -    ✅ Període UTC: 13:00 - 13:30 | TX: 12.9 | TN: 11.9 | Pluja: 0.0
2026-01-10 14:49:38 -    ✅ Període UTC: 13:30 - 14:00 | TX: 12.8 | TN: 11.5 | Pluja: 0.0
2026-01-10 14:49:38 -    ✅ Període UTC: 14:00 - 14:30 | TX: 11.8 | TN: 11.5 | Pluja: 0.0
2026-01-10 14:49:38 - 📈 Total períodes vàlids trobats: 29
2026-01-10 14:49:38 - 📊 RESUM CALCULAT:
2026-01-10 14:49:38 -    • Màxima del dia: 12.9°C
2026-01-10 14:49:38 -    • Mínima del dia: -1.8°C
2026-01-10 14:49:38 -    • Pluja acumulada: 0.0mm
2026-01-10 14:49:38 -    • Últim període: 14:00 - 14:30 UTC
2026-01-10 14:49:38 -    • Hora actualització: 14:49
2026-01-10 14:49:38 - 💾 Dades guardades a data/UO_20260110.csv (29 registres)
2026-01-10 14:49:38 - ✅ Fornells de la Selva: 29 períodes processats
2026-01-10 14:49:38 - 
==================================================
2026-01-10 14:49:38 - 📡 Processant: Girona [XJ]
2026-01-10 14:49:38 - 
🌐 Connectant a Girona...
2026-01-10 14:49:40 - 📊 Total files trobades a la taula: 30
2026-01-10 14:49:40 -    ✅ Període UTC: 00:00 - 00:30 | TX: 0.1 | TN: -0.5 | Pluja: 0.0
2026-01-10 14:49:40 -    ✅ Període UTC: 00:30 - 01:00 | TX: -0.4 | TN: -0.9 | Pluja: 0.0
2026-01-10 14:49:40 -    ✅ Període UTC: 01:00 - 01:30 | TX: -0.9 | TN: -1.4 | Pluja: 0.0
2026-01-10 14:49:40 -    ✅ Període UTC: 01:30 - 02:00 | TX: -0.4 | TN: -1.2 | Pluja: 0.0
2026-01-10 14:49:40 -    ✅ Període UTC: 02:00 - 02:30 | TX: -0.1 | TN: -1.0 | Pluja: 0.0
2026-01-10 14:49:40 -    ✅ Període UTC: 02:30 - 03:00 | TX: -0.3 | TN: -1.0 | Pluja: 0.0
2026-01-10 14:49:40 -    ✅ Període UTC: 03:00 - 03:30 | TX: -0.6 | TN: -1.3 | Pluja: 0.0
2026-01-10 14:49:40 -    ✅ Període UTC: 03:30 - 04:00 | TX: -0.4 | TN: -1.5 | Pluja: 0.0
2026-01-10 14:49:40 -    ✅ Període UTC: 04:00 - 04:30 | TX: -0.1 | TN: -1.3 | Pluja: 0.0
2026-01-10 14:49:40 -    ✅ Període UTC: 04:30 - 05:00 | TX: -0.6 | TN: -1.4 | Pluja: 0.0
2026-01-10 14:49:40 -    ✅ Període UTC: 05:00 - 05:30 | TX: -0.6 | TN: -1.6 | Pluja: 0.0
2026-01-10 14:49:40 -    ✅ Període UTC: 05:30 - 06:00 | TX: -0.7 | TN: -1.3 | Pluja: 0.0
2026-01-10 14:49:40 -    ✅ Període UTC: 06:00 - 06:30 | TX: -0.6 | TN: -1.7 | Pluja: 0.0
2026-01-10 14:49:40 -    ✅ Període UTC: 06:30 - 07:00 | TX: -1.1 | TN: -1.8 | Pluja: 0.0
2026-01-10 14:49:40 -    ✅ Període UTC: 07:00 - 07:30 | TX: -1.4 | TN: -2.0 | Pluja: 0.0
2026-01-10 14:49:40 -    ✅ Període UTC: 07:30 - 08:00 | TX: -0.7 | TN: -1.8 | Pluja: 0.0
2026-01-10 14:49:40 -    ✅ Període UTC: 08:00 - 08:30 | TX: 1.1 | TN: -0.5 | Pluja: 0.0
2026-01-10 14:49:40 -    ✅ Període UTC: 08:30 - 09:00 | TX: 4.3 | TN: 1.4 | Pluja: 0.1
2026-01-10 14:49:40 -    ✅ Període UTC: 09:00 - 09:30 | TX: 7.3 | TN: 4.5 | Pluja: 0.0
2026-01-10 14:49:40 -    ✅ Període UTC: 09:30 - 10:00 | TX: 8.5 | TN: 7.0 | Pluja: 0.0
2026-01-10 14:49:40 -    ✅ Període UTC: 10:00 - 10:30 | TX: 9.4 | TN: 8.5 | Pluja: 0.1
2026-01-10 14:49:40 -    ✅ Període UTC: 10:30 - 11:00 | TX: 10.3 | TN: 9.4 | Pluja: 0.1
2026-01-10 14:49:40 -    ✅ Període UTC: 11:00 - 11:30 | TX: 11.1 | TN: 10.3 | Pluja: 0.0
2026-01-10 14:49:40 -    ✅ Període UTC: 11:30 - 12:00 | TX: 11.9 | TN: 10.9 | Pluja: 0.0
2026-01-10 14:49:40 -    ✅ Període UTC: 12:00 - 12:30 | TX: 12.4 | TN: 11.4 | Pluja: 0.0
2026-01-10 14:49:40 -    ✅ Període UTC: 12:30 - 13:00 | TX: 13.1 | TN: 12.4 | Pluja: 0.0
2026-01-10 14:49:40 -    ✅ Període UTC: 13:00 - 13:30 | TX: 13.8 | TN: 12.4 | Pluja: 0.0
2026-01-10 14:49:40 -    ✅ Període UTC: 13:30 - 14:00 | TX: 14.0 | TN: 13.0 | Pluja: 0.0
2026-01-10 14:49:40 -    ✅ Període UTC: 14:00 - 14:30 | TX: 13.5 | TN: 12.0 | Pluja: 0.0
2026-01-10 14:49:40 - 📈 Total períodes vàlids trobats: 29
2026-01-10 14:49:40 - 📊 RESUM CALCULAT:
2026-01-10 14:49:40 -    • Màxima del dia: 14.0°C
2026-01-10 14:49:40 -    • Mínima del dia: -2.0°C
2026-01-10 14:49:40 -    • Pluja acumulada: 0.30000000000000004mm
2026-01-10 14:49:40 -    • Últim període: 14:00 - 14:30 UTC
2026-01-10 14:49:40 -    • Hora actualització: 14:49
2026-01-10 14:49:40 - 💾 Dades guardades a data/XJ_20260110.csv (29 registres)
2026-01-10 14:49:40 - ✅ Girona: 29 períodes processats
2026-01-10 14:49:40 - 💾 Dades guardades a data/weather_daily_20260110.json
2026-01-10 14:49:40 - 💾 Dades guardades a data/weather_summary.json
2026-01-10 14:49:40 - 
============================================================
2026-01-10 14:49:40 - 📋 RESUM FINAL DEL DIA (UTC)
2026-01-10 14:49:40 - ============================================================
2026-01-10 14:49:40 - 
📍 Fornells de la Selva:
2026-01-10 14:49:40 -    • Períodes: 29
2026-01-10 14:49:40 -    • Màxima: 12.9°C
2026-01-10 14:49:40 -    • Mínima: -1.8°C
2026-01-10 14:49:40 -    • Pluja: 0.0mm
2026-01-10 14:49:40 -    • Últim període: 14:00 - 14:30 UTC
2026-01-10 14:49:40 -    • Actualització: 14:49
2026-01-10 14:49:40 - 
📍 Girona:
2026-01-10 14:49:40 -    • Períodes: 29
2026-01-10 14:49:40 -    • Màxima: 14.0°C
2026-01-10 14:49:40 -    • Mínima: -2.0°C
2026-01-10 14:49:40 -    • Pluja: 0.30000000000000004mm
2026-01-10 14:49:40 -    • Últim període: 14:00 - 14:30 UTC
2026-01-10 14:49:40 -    • Actualització: 14:49
2026-01-10 14:49:40 - 
💾 Fitxers generats:
2026-01-10 14:49:40 -    • data/weather_summary.json (per HTML)
2026-01-10 14:49:40 -    • data/weather_daily_YYYYMMDD.json (complet)
2026-01-10 14:49:40 -    • data/XX_YYYYMMDD.csv (per estació)
2026-01-10 14:49:40 - 
✅ PROCÉS COMPLETAT
2026-01-10 14:49:40 - ============================================================
