=== INICI DAILY SCRAPER (UTC): 2025-12-20 22:34:41 ===
2025-12-20 22:34:41 - ============================================================
2025-12-20 22:34:41 - 🌤️  DAILY WEATHER SCRAPER - VERSIÓ UTC
2025-12-20 22:34:41 - ============================================================
2025-12-20 22:34:41 - 
==================================================
2025-12-20 22:34:41 - 📡 Processant: Fornells de la Selva [UO]
2025-12-20 22:34:41 - 
🌐 Connectant a Fornells de la Selva...
2025-12-20 22:34:43 - 📊 Total files trobades a la taula: 46
2025-12-20 22:34:43 -    ✅ Període UTC: 00:00 - 00:30 | TX: 11.6 | TN: 11.5 | Pluja: 1.8
2025-12-20 22:34:43 -    ✅ Període UTC: 00:30 - 01:00 | TX: 11.6 | TN: 11.5 | Pluja: 1.7
2025-12-20 22:34:43 -    ✅ Període UTC: 01:00 - 01:30 | TX: 11.5 | TN: 11.4 | Pluja: 1.9
2025-12-20 22:34:43 -    ✅ Període UTC: 01:30 - 02:00 | TX: 11.5 | TN: 11.3 | Pluja: 0.6
2025-12-20 22:34:43 -    ✅ Període UTC: 02:00 - 02:30 | TX: 11.3 | TN: 11.0 | Pluja: 0.1
2025-12-20 22:34:43 -    ✅ Període UTC: 02:30 - 03:00 | TX: 11.1 | TN: 11.0 | Pluja: 0.0
2025-12-20 22:34:43 -    ✅ Període UTC: 03:00 - 03:30 | TX: 11.1 | TN: 10.9 | Pluja: 0.0
2025-12-20 22:34:43 -    ✅ Període UTC: 03:30 - 04:00 | TX: 10.9 | TN: 10.8 | Pluja: 0.0
2025-12-20 22:34:43 -    ✅ Període UTC: 04:00 - 04:30 | TX: 10.9 | TN: 10.7 | Pluja: 0.0
2025-12-20 22:34:43 -    ✅ Període UTC: 04:30 - 05:00 | TX: 10.8 | TN: 10.5 | Pluja: 0.0
2025-12-20 22:34:43 -    ✅ Període UTC: 05:00 - 05:30 | TX: 10.5 | TN: 10.3 | Pluja: 0.0
2025-12-20 22:34:43 -    ✅ Període UTC: 05:30 - 06:00 | TX: 10.5 | TN: 10.1 | Pluja: 0.0
2025-12-20 22:34:43 -    ✅ Període UTC: 06:00 - 06:30 | TX: 10.7 | TN: 10.3 | Pluja: 0.0
2025-12-20 22:34:43 -    ✅ Període UTC: 06:30 - 07:00 | TX: 10.9 | TN: 10.7 | Pluja: 0.0
2025-12-20 22:34:43 -    ✅ Període UTC: 07:00 - 07:30 | TX: 11.0 | TN: 10.9 | Pluja: 0.0
2025-12-20 22:34:43 -    ✅ Període UTC: 07:30 - 08:00 | TX: 11.3 | TN: 11.0 | Pluja: 0.0
2025-12-20 22:34:43 -    ✅ Període UTC: 08:00 - 08:30 | TX: 11.5 | TN: 11.3 | Pluja: 0.0
2025-12-20 22:34:43 -    ✅ Període UTC: 08:30 - 09:00 | TX: 12.0 | TN: 11.5 | Pluja: 0.0
2025-12-20 22:34:43 -    ✅ Període UTC: 09:00 - 09:30 | TX: 12.4 | TN: 11.9 | Pluja: 0.0
2025-12-20 22:34:43 -    ✅ Període UTC: 09:30 - 10:00 | TX: 13.1 | TN: 12.3 | Pluja: 0.0
2025-12-20 22:34:43 -    ✅ Període UTC: 10:00 - 10:30 | TX: 13.6 | TN: 13.2 | Pluja: 0.0
2025-12-20 22:34:43 -    ✅ Període UTC: 10:30 - 11:00 | TX: 14.1 | TN: 13.5 | Pluja: 0.0
2025-12-20 22:34:43 -    ✅ Període UTC: 11:00 - 11:30 | TX: 14.5 | TN: 14.1 | Pluja: 0.0
2025-12-20 22:34:43 -    ✅ Període UTC: 11:30 - 12:00 | TX: 14.6 | TN: 14.1 | Pluja: 0.0
2025-12-20 22:34:43 -    ✅ Període UTC: 12:00 - 12:30 | TX: 15.5 | TN: 14.6 | Pluja: 0.0
2025-12-20 22:34:43 -    ✅ Període UTC: 12:30 - 13:00 | TX: 15.5 | TN: 15.0 | Pluja: 0.0
2025-12-20 22:34:43 -    ✅ Període UTC: 13:00 - 13:30 | TX: 15.6 | TN: 15.1 | Pluja: 0.0
2025-12-20 22:34:43 -    ✅ Període UTC: 13:30 - 14:00 | TX: 15.6 | TN: 15.4 | Pluja: 0.0
2025-12-20 22:34:43 -    ✅ Període UTC: 14:00 - 14:30 | TX: 15.5 | TN: 15.1 | Pluja: 0.0
2025-12-20 22:34:43 -    ✅ Període UTC: 14:30 - 15:00 | TX: 15.1 | TN: 14.7 | Pluja: 0.0
2025-12-20 22:34:43 -    ✅ Període UTC: 15:00 - 15:30 | TX: 14.7 | TN: 14.4 | Pluja: 0.0
2025-12-20 22:34:43 -    ✅ Període UTC: 15:30 - 16:00 | TX: 14.4 | TN: 14.1 | Pluja: 0.0
2025-12-20 22:34:43 -    ✅ Període UTC: 16:00 - 16:30 | TX: 14.1 | TN: 13.7 | Pluja: 0.0
2025-12-20 22:34:43 -    ✅ Període UTC: 16:30 - 17:00 | TX: 13.8 | TN: 13.1 | Pluja: 0.0
2025-12-20 22:34:43 -    ✅ Període UTC: 17:00 - 17:30 | TX: 13.2 | TN: 13.0 | Pluja: 0.0
2025-12-20 22:34:43 -    ✅ Període UTC: 17:30 - 18:00 | TX: 13.0 | TN: 12.8 | Pluja: 0.0
2025-12-20 22:34:43 -    ✅ Període UTC: 18:00 - 18:30 | TX: 13.1 | TN: 12.9 | Pluja: 3.2
2025-12-20 22:34:43 -    ✅ Període UTC: 18:30 - 19:00 | TX: 13.0 | TN: 12.8 | Pluja: 2.8
2025-12-20 22:34:43 -    ✅ Període UTC: 19:00 - 19:30 | TX: 12.8 | TN: 12.7 | Pluja: 1.0
2025-12-20 22:34:43 -    ✅ Període UTC: 19:30 - 20:00 | TX: 12.7 | TN: 12.5 | Pluja: 0.8
2025-12-20 22:34:43 -    ✅ Període UTC: 20:00 - 20:30 | TX: 12.7 | TN: 12.5 | Pluja: 1.0
2025-12-20 22:34:43 -    ✅ Període UTC: 20:30 - 21:00 | TX: 12.6 | TN: 12.5 | Pluja: 0.9
2025-12-20 22:34:43 -    ✅ Període UTC: 21:00 - 21:30 | TX: 12.6 | TN: 12.5 | Pluja: 3.5
2025-12-20 22:34:43 -    ✅ Període UTC: 21:30 - 22:00 | TX: 12.5 | TN: 12.5 | Pluja: 5.2
2025-12-20 22:34:43 - 📈 Total períodes vàlids trobats: 44
2025-12-20 22:34:43 - 📊 RESUM CALCULAT:
2025-12-20 22:34:43 -    • Màxima del dia: 15.6°C
2025-12-20 22:34:43 -    • Mínima del dia: 10.1°C
2025-12-20 22:34:43 -    • Pluja acumulada: 24.500000000000004mm
2025-12-20 22:34:43 -    • Últim període: 21:30 - 22:00 UTC
2025-12-20 22:34:43 -    • Hora actualització: 22:34
2025-12-20 22:34:43 - 💾 Dades guardades a data/UO_20251220.csv (44 registres)
2025-12-20 22:34:43 - ✅ Fornells de la Selva: 44 períodes processats
2025-12-20 22:34:43 - 
==================================================
2025-12-20 22:34:43 - 📡 Processant: Girona [XJ]
2025-12-20 22:34:43 - 
🌐 Connectant a Girona...
2025-12-20 22:34:45 - 📊 Total files trobades a la taula: 46
2025-12-20 22:34:45 -    ✅ Període UTC: 00:00 - 00:30 | TX: 11.2 | TN: 10.9 | Pluja: 0.9
2025-12-20 22:34:45 -    ✅ Període UTC: 00:30 - 01:00 | TX: 11.0 | TN: 10.9 | Pluja: 2.5
2025-12-20 22:34:45 -    ✅ Període UTC: 01:00 - 01:30 | TX: 11.0 | TN: 10.9 | Pluja: 5.5
2025-12-20 22:34:45 -    ✅ Període UTC: 01:30 - 02:00 | TX: 11.2 | TN: 11.0 | Pluja: 4.1
2025-12-20 22:34:45 -    ✅ Període UTC: 02:00 - 02:30 | TX: 11.2 | TN: 11.0 | Pluja: 0.3
2025-12-20 22:34:45 -    ✅ Període UTC: 02:30 - 03:00 | TX: 11.0 | TN: 10.8 | Pluja: 0.0
2025-12-20 22:34:45 -    ✅ Període UTC: 03:00 - 03:30 | TX: 11.1 | TN: 10.9 | Pluja: 0.0
2025-12-20 22:34:45 -    ✅ Període UTC: 03:30 - 04:00 | TX: 11.0 | TN: 10.7 | Pluja: 0.0
2025-12-20 22:34:45 -    ✅ Període UTC: 04:00 - 04:30 | TX: 10.7 | TN: 10.5 | Pluja: 0.0
2025-12-20 22:34:45 -    ✅ Període UTC: 04:30 - 05:00 | TX: 10.5 | TN: 10.3 | Pluja: 0.1
2025-12-20 22:34:45 -    ✅ Període UTC: 05:00 - 05:30 | TX: 10.3 | TN: 10.2 | Pluja: 0.0
2025-12-20 22:34:45 -    ✅ Període UTC: 05:30 - 06:00 | TX: 10.2 | TN: 10.1 | Pluja: 0.0
2025-12-20 22:34:45 -    ✅ Període UTC: 06:00 - 06:30 | TX: 10.3 | TN: 10.0 | Pluja: 0.0
2025-12-20 22:34:45 -    ✅ Període UTC: 06:30 - 07:00 | TX: 10.5 | TN: 10.3 | Pluja: 0.0
2025-12-20 22:34:45 -    ✅ Període UTC: 07:00 - 07:30 | TX: 10.7 | TN: 10.5 | Pluja: 0.0
2025-12-20 22:34:45 -    ✅ Període UTC: 07:30 - 08:00 | TX: 11.0 | TN: 10.7 | Pluja: 0.0
2025-12-20 22:34:45 -    ✅ Període UTC: 08:00 - 08:30 | TX: 11.4 | TN: 11.0 | Pluja: 0.0
2025-12-20 22:34:45 -    ✅ Període UTC: 08:30 - 09:00 | TX: 11.9 | TN: 11.4 | Pluja: 0.0
2025-12-20 22:34:45 -    ✅ Període UTC: 09:00 - 09:30 | TX: 12.2 | TN: 11.8 | Pluja: 0.0
2025-12-20 22:34:45 -    ✅ Període UTC: 09:30 - 10:00 | TX: 12.8 | TN: 12.2 | Pluja: 0.0
2025-12-20 22:34:45 -    ✅ Període UTC: 10:00 - 10:30 | TX: 13.3 | TN: 12.8 | Pluja: 0.0
2025-12-20 22:34:45 -    ✅ Període UTC: 10:30 - 11:00 | TX: 13.6 | TN: 13.2 | Pluja: 0.0
2025-12-20 22:34:45 -    ✅ Període UTC: 11:00 - 11:30 | TX: 14.3 | TN: 13.6 | Pluja: 0.0
2025-12-20 22:34:45 -    ✅ Període UTC: 11:30 - 12:00 | TX: 14.5 | TN: 14.2 | Pluja: 0.0
2025-12-20 22:34:45 -    ✅ Període UTC: 12:00 - 12:30 | TX: 14.8 | TN: 14.5 | Pluja: 0.0
2025-12-20 22:34:45 -    ✅ Període UTC: 12:30 - 13:00 | TX: 15.0 | TN: 14.8 | Pluja: 0.0
2025-12-20 22:34:45 -    ✅ Període UTC: 13:00 - 13:30 | TX: 15.2 | TN: 15.0 | Pluja: 0.0
2025-12-20 22:34:45 -    ✅ Període UTC: 13:30 - 14:00 | TX: 15.4 | TN: 15.2 | Pluja: 0.0
2025-12-20 22:34:45 -    ✅ Període UTC: 14:00 - 14:30 | TX: 15.4 | TN: 15.2 | Pluja: 0.0
2025-12-20 22:34:45 -    ✅ Període UTC: 14:30 - 15:00 | TX: 15.4 | TN: 15.3 | Pluja: 0.0
2025-12-20 22:34:45 -    ✅ Període UTC: 15:00 - 15:30 | TX: 15.3 | TN: 14.9 | Pluja: 0.0
2025-12-20 22:34:45 -    ✅ Període UTC: 15:30 - 16:00 | TX: 14.9 | TN: 14.5 | Pluja: 0.0
2025-12-20 22:34:45 -    ✅ Període UTC: 16:00 - 16:30 | TX: 14.5 | TN: 14.1 | Pluja: 0.0
2025-12-20 22:34:45 -    ✅ Període UTC: 16:30 - 17:00 | TX: 14.1 | TN: 13.4 | Pluja: 0.0
2025-12-20 22:34:45 -    ✅ Període UTC: 17:00 - 17:30 | TX: 13.4 | TN: 13.2 | Pluja: 0.0
2025-12-20 22:34:45 -    ✅ Període UTC: 17:30 - 18:00 | TX: 13.3 | TN: 12.9 | Pluja: 0.0
2025-12-20 22:34:45 -    ✅ Període UTC: 18:00 - 18:30 | TX: 13.0 | TN: 12.8 | Pluja: 0.9
2025-12-20 22:34:45 -    ✅ Període UTC: 18:30 - 19:00 | TX: 13.0 | TN: 12.8 | Pluja: 4.5
2025-12-20 22:34:45 -    ✅ Període UTC: 19:00 - 19:30 | TX: 12.8 | TN: 12.7 | Pluja: 3.4
2025-12-20 22:34:45 -    ✅ Període UTC: 19:30 - 20:00 | TX: 12.7 | TN: 12.7 | Pluja: 1.3
2025-12-20 22:34:45 -    ✅ Període UTC: 20:00 - 20:30 | TX: 12.7 | TN: 12.6 | Pluja: 1.8
2025-12-20 22:34:45 -    ✅ Període UTC: 20:30 - 21:00 | TX: 12.6 | TN: 12.5 | Pluja: 0.6
2025-12-20 22:34:45 -    ✅ Període UTC: 21:00 - 21:30 | TX: 12.5 | TN: 12.5 | Pluja: 2.5
2025-12-20 22:34:45 -    ✅ Període UTC: 21:30 - 22:00 | TX: 12.5 | TN: 12.3 | Pluja: 4.2
2025-12-20 22:34:45 - 📈 Total períodes vàlids trobats: 44
2025-12-20 22:34:45 - 📊 RESUM CALCULAT:
2025-12-20 22:34:45 -    • Màxima del dia: 15.4°C
2025-12-20 22:34:45 -    • Mínima del dia: 10.0°C
2025-12-20 22:34:45 -    • Pluja acumulada: 32.6mm
2025-12-20 22:34:45 -    • Últim període: 21:30 - 22:00 UTC
2025-12-20 22:34:45 -    • Hora actualització: 22:34
2025-12-20 22:34:45 - 💾 Dades guardades a data/XJ_20251220.csv (44 registres)
2025-12-20 22:34:45 - ✅ Girona: 44 períodes processats
2025-12-20 22:34:45 - 💾 Dades guardades a data/weather_daily_20251220.json
2025-12-20 22:34:45 - 💾 Dades guardades a data/weather_summary.json
2025-12-20 22:34:45 - 
============================================================
2025-12-20 22:34:45 - 📋 RESUM FINAL DEL DIA (UTC)
2025-12-20 22:34:45 - ============================================================
2025-12-20 22:34:45 - 
📍 Fornells de la Selva:
2025-12-20 22:34:45 -    • Períodes: 44
2025-12-20 22:34:45 -    • Màxima: 15.6°C
2025-12-20 22:34:45 -    • Mínima: 10.1°C
2025-12-20 22:34:45 -    • Pluja: 24.500000000000004mm
2025-12-20 22:34:45 -    • Últim període: 21:30 - 22:00 UTC
2025-12-20 22:34:45 -    • Actualització: 22:34
2025-12-20 22:34:45 - 
📍 Girona:
2025-12-20 22:34:45 -    • Períodes: 44
2025-12-20 22:34:45 -    • Màxima: 15.4°C
2025-12-20 22:34:45 -    • Mínima: 10.0°C
2025-12-20 22:34:45 -    • Pluja: 32.6mm
2025-12-20 22:34:45 -    • Últim període: 21:30 - 22:00 UTC
2025-12-20 22:34:45 -    • Actualització: 22:34
2025-12-20 22:34:45 - 
💾 Fitxers generats:
2025-12-20 22:34:45 -    • data/weather_summary.json (per HTML)
2025-12-20 22:34:45 -    • data/weather_daily_YYYYMMDD.json (complet)
2025-12-20 22:34:45 -    • data/XX_YYYYMMDD.csv (per estació)
2025-12-20 22:34:45 - 
✅ PROCÉS COMPLETAT
2025-12-20 22:34:45 - ============================================================
