=== INICI DAILY SCRAPER (UTC): 2026-01-07 15:30:24 ===
2026-01-07 15:30:24 - ============================================================
2026-01-07 15:30:24 - 🌤️  DAILY WEATHER SCRAPER - VERSIÓ UTC
2026-01-07 15:30:24 - ============================================================
2026-01-07 15:30:24 - 
==================================================
2026-01-07 15:30:24 - 📡 Processant: Fornells de la Selva [UO]
2026-01-07 15:30:24 - 
🌐 Connectant a Fornells de la Selva...
2026-01-07 15:30:26 - 📊 Total files trobades a la taula: 32
2026-01-07 15:30:26 -    ✅ Període UTC: 00:00 - 00:30 | TX: -3.4 | TN: -4.5 | Pluja: 0.0
2026-01-07 15:30:26 -    ✅ Període UTC: 00:30 - 01:00 | TX: -3.8 | TN: -4.4 | Pluja: 0.0
2026-01-07 15:30:26 -    ✅ Període UTC: 01:00 - 01:30 | TX: -4.0 | TN: -4.6 | Pluja: 0.0
2026-01-07 15:30:26 -    ✅ Període UTC: 01:30 - 02:00 | TX: -3.8 | TN: -4.5 | Pluja: 0.0
2026-01-07 15:30:26 -    ✅ Període UTC: 02:00 - 02:30 | TX: -4.3 | TN: -5.2 | Pluja: 0.0
2026-01-07 15:30:26 -    ✅ Període UTC: 02:30 - 03:00 | TX: -4.9 | TN: -5.4 | Pluja: 0.0
2026-01-07 15:30:26 -    ✅ Període UTC: 03:00 - 03:30 | TX: -4.8 | TN: -5.6 | Pluja: 0.0
2026-01-07 15:30:26 -    ✅ Període UTC: 03:30 - 04:00 | TX: -5.3 | TN: -5.9 | Pluja: 0.0
2026-01-07 15:30:26 -    ✅ Període UTC: 04:00 - 04:30 | TX: -5.6 | TN: -6.0 | Pluja: 0.0
2026-01-07 15:30:26 -    ✅ Període UTC: 04:30 - 05:00 | TX: -5.7 | TN: -6.3 | Pluja: 0.0
2026-01-07 15:30:26 -    ✅ Període UTC: 05:00 - 05:30 | TX: -6.0 | TN: -6.6 | Pluja: 0.0
2026-01-07 15:30:26 -    ✅ Període UTC: 05:30 - 06:00 | TX: -6.5 | TN: -6.7 | Pluja: 0.0
2026-01-07 15:30:26 -    ✅ Període UTC: 06:00 - 06:30 | TX: -6.5 | TN: -6.7 | Pluja: 0.0
2026-01-07 15:30:26 -    ✅ Període UTC: 06:30 - 07:00 | TX: -6.1 | TN: -6.7 | Pluja: 0.0
2026-01-07 15:30:26 -    ✅ Període UTC: 07:00 - 07:30 | TX: -6.6 | TN: -6.8 | Pluja: 0.0
2026-01-07 15:30:26 -    ✅ Període UTC: 07:30 - 08:00 | TX: -4.7 | TN: -6.6 | Pluja: 0.0
2026-01-07 15:30:26 -    ✅ Període UTC: 08:00 - 08:30 | TX: -3.0 | TN: -4.9 | Pluja: 0.0
2026-01-07 15:30:26 -    ✅ Període UTC: 08:30 - 09:00 | TX: -1.3 | TN: -3.9 | Pluja: 0.0
2026-01-07 15:30:26 -    ✅ Període UTC: 09:00 - 09:30 | TX: -0.3 | TN: -1.2 | Pluja: 0.0
2026-01-07 15:30:26 -    ✅ Període UTC: 09:30 - 10:00 | TX: 1.7 | TN: -0.4 | Pluja: 0.0
2026-01-07 15:30:26 -    ✅ Període UTC: 10:00 - 10:30 | TX: 3.8 | TN: 1.8 | Pluja: 0.0
2026-01-07 15:30:26 -    ✅ Període UTC: 10:30 - 11:00 | TX: 4.4 | TN: 3.8 | Pluja: 0.0
2026-01-07 15:30:26 -    ✅ Període UTC: 11:00 - 11:30 | TX: 6.7 | TN: 4.2 | Pluja: 0.0
2026-01-07 15:30:26 -    ✅ Període UTC: 11:30 - 12:00 | TX: 7.5 | TN: 6.4 | Pluja: 0.0
2026-01-07 15:30:26 -    ✅ Període UTC: 12:00 - 12:30 | TX: 8.5 | TN: 7.2 | Pluja: 0.0
2026-01-07 15:30:26 -    ✅ Període UTC: 12:30 - 13:00 | TX: 8.9 | TN: 8.3 | Pluja: 0.0
2026-01-07 15:30:26 -    ✅ Període UTC: 13:00 - 13:30 | TX: 9.2 | TN: 8.3 | Pluja: 0.0
2026-01-07 15:30:26 -    ✅ Període UTC: 13:30 - 14:00 | TX: 9.9 | TN: 8.9 | Pluja: 0.0
2026-01-07 15:30:26 -    ✅ Període UTC: 14:00 - 14:30 | TX: 10.0 | TN: 9.5 | Pluja: 0.0
2026-01-07 15:30:26 -    ✅ Període UTC: 14:30 - 15:00 | TX: 9.6 | TN: 9.1 | Pluja: 0.0
2026-01-07 15:30:26 - 📈 Total períodes vàlids trobats: 30
2026-01-07 15:30:26 - 📊 RESUM CALCULAT:
2026-01-07 15:30:26 -    • Màxima del dia: 10.0°C
2026-01-07 15:30:26 -    • Mínima del dia: -6.8°C
2026-01-07 15:30:26 -    • Pluja acumulada: 0.0mm
2026-01-07 15:30:26 -    • Últim període: 14:30 - 15:00 UTC
2026-01-07 15:30:26 -    • Hora actualització: 15:30
2026-01-07 15:30:26 - 💾 Dades guardades a data/UO_20260107.csv (30 registres)
2026-01-07 15:30:26 - ✅ Fornells de la Selva: 30 períodes processats
2026-01-07 15:30:26 - 
==================================================
2026-01-07 15:30:26 - 📡 Processant: Girona [XJ]
2026-01-07 15:30:26 - 
🌐 Connectant a Girona...
2026-01-07 15:30:27 - 📊 Total files trobades a la taula: 32
2026-01-07 15:30:27 -    ✅ Període UTC: 00:00 - 00:30 | TX: -2.2 | TN: -4.5 | Pluja: 0.0
2026-01-07 15:30:27 -    ✅ Període UTC: 00:30 - 01:00 | TX: -4.1 | TN: -5.1 | Pluja: 0.0
2026-01-07 15:30:27 -    ✅ Període UTC: 01:00 - 01:30 | TX: -4.9 | TN: -5.6 | Pluja: 0.0
2026-01-07 15:30:27 -    ✅ Període UTC: 01:30 - 02:00 | TX: -5.4 | TN: -6.1 | Pluja: 0.0
2026-01-07 15:30:27 -    ✅ Període UTC: 02:00 - 02:30 | TX: -5.7 | TN: -6.2 | Pluja: 0.0
2026-01-07 15:30:27 -    ✅ Període UTC: 02:30 - 03:00 | TX: -5.9 | TN: -6.5 | Pluja: 0.0
2026-01-07 15:30:27 -    ✅ Període UTC: 03:00 - 03:30 | TX: -5.6 | TN: -6.2 | Pluja: 0.0
2026-01-07 15:30:27 -    ✅ Període UTC: 03:30 - 04:00 | TX: -6.0 | TN: -6.6 | Pluja: 0.0
2026-01-07 15:30:27 -    ✅ Període UTC: 04:00 - 04:30 | TX: -6.6 | TN: -6.9 | Pluja: 0.0
2026-01-07 15:30:27 -    ✅ Període UTC: 04:30 - 05:00 | TX: -6.5 | TN: -6.9 | Pluja: 0.0
2026-01-07 15:30:27 -    ✅ Període UTC: 05:00 - 05:30 | TX: -6.8 | TN: -7.2 | Pluja: 0.0
2026-01-07 15:30:27 -    ✅ Període UTC: 05:30 - 06:00 | TX: -6.8 | TN: -7.4 | Pluja: 0.0
2026-01-07 15:30:27 -    ✅ Període UTC: 06:00 - 06:30 | TX: -6.8 | TN: -7.2 | Pluja: 0.0
2026-01-07 15:30:27 -    ✅ Període UTC: 06:30 - 07:00 | TX: -7.2 | TN: -7.5 | Pluja: 0.0
2026-01-07 15:30:27 -    ✅ Període UTC: 07:00 - 07:30 | TX: -7.0 | TN: -7.6 | Pluja: 0.0
2026-01-07 15:30:27 -    ✅ Període UTC: 07:30 - 08:00 | TX: -5.8 | TN: -7.4 | Pluja: 0.0
2026-01-07 15:30:27 -    ✅ Període UTC: 08:00 - 08:30 | TX: -3.5 | TN: -5.7 | Pluja: 0.0
2026-01-07 15:30:27 -    ✅ Període UTC: 08:30 - 09:00 | TX: -1.1 | TN: -3.4 | Pluja: 0.0
2026-01-07 15:30:27 -    ✅ Període UTC: 09:00 - 09:30 | TX: 0.8 | TN: -1.1 | Pluja: 0.0
2026-01-07 15:30:27 -    ✅ Període UTC: 09:30 - 10:00 | TX: 2.8 | TN: 0.6 | Pluja: 0.0
2026-01-07 15:30:27 -    ✅ Període UTC: 10:00 - 10:30 | TX: 4.0 | TN: 2.3 | Pluja: 0.0
2026-01-07 15:30:27 -    ✅ Període UTC: 10:30 - 11:00 | TX: 5.2 | TN: 4.0 | Pluja: 0.0
2026-01-07 15:30:27 -    ✅ Període UTC: 11:00 - 11:30 | TX: 6.7 | TN: 5.2 | Pluja: 0.0
2026-01-07 15:30:27 -    ✅ Període UTC: 11:30 - 12:00 | TX: 8.4 | TN: 6.6 | Pluja: 0.0
2026-01-07 15:30:27 -    ✅ Període UTC: 12:00 - 12:30 | TX: 8.7 | TN: 8.0 | Pluja: 0.0
2026-01-07 15:30:27 -    ✅ Període UTC: 12:30 - 13:00 | TX: 8.9 | TN: 8.0 | Pluja: 0.0
2026-01-07 15:30:27 -    ✅ Període UTC: 13:00 - 13:30 | TX: 9.5 | TN: 8.5 | Pluja: 0.0
2026-01-07 15:30:27 -    ✅ Període UTC: 13:30 - 14:00 | TX: 9.8 | TN: 9.3 | Pluja: 0.0
2026-01-07 15:30:27 -    ✅ Període UTC: 14:00 - 14:30 | TX: 10.0 | TN: 9.6 | Pluja: 0.0
2026-01-07 15:30:27 -    ✅ Període UTC: 14:30 - 15:00 | TX: 10.0 | TN: 9.5 | Pluja: 0.0
2026-01-07 15:30:27 - 📈 Total períodes vàlids trobats: 30
2026-01-07 15:30:27 - 📊 RESUM CALCULAT:
2026-01-07 15:30:27 -    • Màxima del dia: 10.0°C
2026-01-07 15:30:27 -    • Mínima del dia: -7.6°C
2026-01-07 15:30:27 -    • Pluja acumulada: 0.0mm
2026-01-07 15:30:27 -    • Últim període: 14:30 - 15:00 UTC
2026-01-07 15:30:27 -    • Hora actualització: 15:30
2026-01-07 15:30:27 - 💾 Dades guardades a data/XJ_20260107.csv (30 registres)
2026-01-07 15:30:27 - ✅ Girona: 30 períodes processats
2026-01-07 15:30:27 - 💾 Dades guardades a data/weather_daily_20260107.json
2026-01-07 15:30:27 - 💾 Dades guardades a data/weather_summary.json
2026-01-07 15:30:27 - 
============================================================
2026-01-07 15:30:27 - 📋 RESUM FINAL DEL DIA (UTC)
2026-01-07 15:30:27 - ============================================================
2026-01-07 15:30:27 - 
📍 Fornells de la Selva:
2026-01-07 15:30:27 -    • Períodes: 30
2026-01-07 15:30:27 -    • Màxima: 10.0°C
2026-01-07 15:30:27 -    • Mínima: -6.8°C
2026-01-07 15:30:27 -    • Pluja: 0.0mm
2026-01-07 15:30:27 -    • Últim període: 14:30 - 15:00 UTC
2026-01-07 15:30:27 -    • Actualització: 15:30
2026-01-07 15:30:27 - 
📍 Girona:
2026-01-07 15:30:27 -    • Períodes: 30
2026-01-07 15:30:27 -    • Màxima: 10.0°C
2026-01-07 15:30:27 -    • Mínima: -7.6°C
2026-01-07 15:30:27 -    • Pluja: 0.0mm
2026-01-07 15:30:27 -    • Últim període: 14:30 - 15:00 UTC
2026-01-07 15:30:27 -    • Actualització: 15:30
2026-01-07 15:30:27 - 
💾 Fitxers generats:
2026-01-07 15:30:27 -    • data/weather_summary.json (per HTML)
2026-01-07 15:30:27 -    • data/weather_daily_YYYYMMDD.json (complet)
2026-01-07 15:30:27 -    • data/XX_YYYYMMDD.csv (per estació)
2026-01-07 15:30:27 - 
✅ PROCÉS COMPLETAT
2026-01-07 15:30:27 - ============================================================
