=== INICI DAILY SCRAPER (UTC): 2026-02-11 16:20:19 ===
2026-02-11 16:20:19 - ============================================================
2026-02-11 16:20:19 - 🌤️  DAILY WEATHER SCRAPER - VERSIÓ UTC
2026-02-11 16:20:19 - ============================================================
2026-02-11 16:20:19 - 
==================================================
2026-02-11 16:20:19 - 📡 Processant: Fornells de la Selva [UO]
2026-02-11 16:20:19 - 
🌐 Connectant a Fornells de la Selva...
2026-02-11 16:20:21 - 📊 Total files trobades a la taula: 33
2026-02-11 16:20:21 -    ✅ Període UTC: 00:00 - 00:30 | TX: 10.7 | TN: 10.5 | Pluja: 0.0
2026-02-11 16:20:21 -    ✅ Període UTC: 00:30 - 01:00 | TX: 10.6 | TN: 9.6 | Pluja: 0.0
2026-02-11 16:20:21 -    ✅ Període UTC: 01:00 - 01:30 | TX: 9.4 | TN: 8.5 | Pluja: 0.0
2026-02-11 16:20:21 -    ✅ Període UTC: 01:30 - 02:00 | TX: 9.5 | TN: 7.9 | Pluja: 0.0
2026-02-11 16:20:21 -    ✅ Període UTC: 02:00 - 02:30 | TX: 8.8 | TN: 7.6 | Pluja: 0.0
2026-02-11 16:20:21 -    ✅ Període UTC: 02:30 - 03:00 | TX: 8.8 | TN: 6.9 | Pluja: 0.0
2026-02-11 16:20:21 -    ✅ Període UTC: 03:00 - 03:30 | TX: 7.8 | TN: 6.9 | Pluja: 0.1
2026-02-11 16:20:21 -    ✅ Període UTC: 03:30 - 04:00 | TX: 7.7 | TN: 6.6 | Pluja: 0.0
2026-02-11 16:20:21 -    ✅ Període UTC: 04:00 - 04:30 | TX: 7.7 | TN: 6.7 | Pluja: 0.0
2026-02-11 16:20:21 -    ✅ Període UTC: 04:30 - 05:00 | TX: 7.5 | TN: 6.1 | Pluja: 0.0
2026-02-11 16:20:21 -    ✅ Període UTC: 05:00 - 05:30 | TX: 8.2 | TN: 6.9 | Pluja: 0.0
2026-02-11 16:20:21 -    ✅ Període UTC: 05:30 - 06:00 | TX: 8.7 | TN: 7.2 | Pluja: 0.0
2026-02-11 16:20:21 -    ✅ Període UTC: 06:00 - 06:30 | TX: 12.5 | TN: 7.6 | Pluja: 0.0
2026-02-11 16:20:21 -    ✅ Període UTC: 06:30 - 07:00 | TX: 14.2 | TN: 11.4 | Pluja: 0.0
2026-02-11 16:20:21 -    ✅ Període UTC: 07:00 - 07:30 | TX: 14.7 | TN: 13.8 | Pluja: 0.0
2026-02-11 16:20:21 -    ✅ Període UTC: 07:30 - 08:00 | TX: 15.6 | TN: 14.7 | Pluja: 0.0
2026-02-11 16:20:21 -    ✅ Període UTC: 08:00 - 08:30 | TX: 14.7 | TN: 12.5 | Pluja: 0.0
2026-02-11 16:20:21 -    ✅ Període UTC: 08:30 - 09:00 | TX: 14.1 | TN: 13.0 | Pluja: 0.0
2026-02-11 16:20:21 -    ✅ Període UTC: 09:00 - 09:30 | TX: 14.9 | TN: 13.8 | Pluja: 0.0
2026-02-11 16:20:21 -    ✅ Període UTC: 09:30 - 10:00 | TX: 16.5 | TN: 15.0 | Pluja: 0.0
2026-02-11 16:20:21 -    ✅ Període UTC: 10:00 - 10:30 | TX: 16.9 | TN: 15.9 | Pluja: 0.0
2026-02-11 16:20:21 -    ✅ Període UTC: 10:30 - 11:00 | TX: 17.6 | TN: 16.9 | Pluja: 0.0
2026-02-11 16:20:21 -    ✅ Període UTC: 11:00 - 11:30 | TX: 18.7 | TN: 17.6 | Pluja: 0.0
2026-02-11 16:20:21 -    ✅ Període UTC: 11:30 - 12:00 | TX: None | TN: None | Pluja: 0.0
2026-02-11 16:20:21 -    ✅ Període UTC: 12:00 - 12:30 | TX: None | TN: None | Pluja: 0.0
2026-02-11 16:20:21 -    ✅ Període UTC: 12:30 - 13:00 | TX: None | TN: None | Pluja: 0.0
2026-02-11 16:20:21 -    ✅ Període UTC: 13:00 - 13:30 | TX: None | TN: None | Pluja: 0.0
2026-02-11 16:20:21 -    ✅ Període UTC: 13:30 - 14:00 | TX: 21.1 | TN: 19.9 | Pluja: 0.0
2026-02-11 16:20:21 -    ✅ Període UTC: 14:00 - 14:30 | TX: 21.1 | TN: 20.3 | Pluja: 0.0
2026-02-11 16:20:21 -    ✅ Període UTC: 14:30 - 15:00 | TX: 21.2 | TN: 19.9 | Pluja: 0.0
2026-02-11 16:20:21 -    ✅ Període UTC: 15:00 - 15:30 | TX: 19.8 | TN: 18.4 | Pluja: 0.0
2026-02-11 16:20:21 -    ✅ Període UTC: 15:30 - 16:00 | TX: 18.3 | TN: 17.4 | Pluja: 0.0
2026-02-11 16:20:21 - 📈 Total períodes vàlids trobats: 32
2026-02-11 16:20:21 - 📊 RESUM CALCULAT:
2026-02-11 16:20:21 -    • Màxima del dia: 21.2°C
2026-02-11 16:20:21 -    • Mínima del dia: 6.1°C
2026-02-11 16:20:21 -    • Pluja acumulada: 0.1mm
2026-02-11 16:20:21 -    • Últim període: 15:30 - 16:00 UTC
2026-02-11 16:20:21 -    • Hora actualització: 16:20
2026-02-11 16:20:21 - 💾 Dades guardades a data/UO_20260211.csv (32 registres)
2026-02-11 16:20:21 - ✅ Fornells de la Selva: 32 períodes processats
2026-02-11 16:20:21 - 
==================================================
2026-02-11 16:20:21 - 📡 Processant: Girona [XJ]
2026-02-11 16:20:21 - 
🌐 Connectant a Girona...
2026-02-11 16:20:23 - 📊 Total files trobades a la taula: 33
2026-02-11 16:20:23 -    ✅ Període UTC: 00:00 - 00:30 | TX: 10.4 | TN: 9.9 | Pluja: 0.0
2026-02-11 16:20:23 -    ✅ Període UTC: 00:30 - 01:00 | TX: 10.3 | TN: 9.7 | Pluja: 0.0
2026-02-11 16:20:23 -    ✅ Període UTC: 01:00 - 01:30 | TX: 9.7 | TN: 8.8 | Pluja: 0.0
2026-02-11 16:20:23 -    ✅ Període UTC: 01:30 - 02:00 | TX: 10.0 | TN: 8.7 | Pluja: 0.0
2026-02-11 16:20:23 -    ✅ Període UTC: 02:00 - 02:30 | TX: 9.0 | TN: 8.3 | Pluja: 0.0
2026-02-11 16:20:23 -    ✅ Període UTC: 02:30 - 03:00 | TX: 9.2 | TN: 8.2 | Pluja: 0.0
2026-02-11 16:20:23 -    ✅ Període UTC: 03:00 - 03:30 | TX: 8.5 | TN: 7.8 | Pluja: 0.0
2026-02-11 16:20:23 -    ✅ Període UTC: 03:30 - 04:00 | TX: 8.7 | TN: 7.7 | Pluja: 0.0
2026-02-11 16:20:23 -    ✅ Període UTC: 04:00 - 04:30 | TX: 9.5 | TN: 8.1 | Pluja: 0.0
2026-02-11 16:20:23 -    ✅ Període UTC: 04:30 - 05:00 | TX: 8.4 | TN: 7.3 | Pluja: 0.0
2026-02-11 16:20:23 -    ✅ Període UTC: 05:00 - 05:30 | TX: 8.4 | TN: 6.9 | Pluja: 0.0
2026-02-11 16:20:23 -    ✅ Període UTC: 05:30 - 06:00 | TX: 11.1 | TN: 7.9 | Pluja: 0.0
2026-02-11 16:20:23 -    ✅ Període UTC: 06:00 - 06:30 | TX: 11.9 | TN: 10.4 | Pluja: 0.0
2026-02-11 16:20:23 -    ✅ Període UTC: 06:30 - 07:00 | TX: 12.0 | TN: 10.3 | Pluja: 0.0
2026-02-11 16:20:23 -    ✅ Període UTC: 07:00 - 07:30 | TX: 12.3 | TN: 11.3 | Pluja: 0.0
2026-02-11 16:20:23 -    ✅ Període UTC: 07:30 - 08:00 | TX: 12.8 | TN: 12.1 | Pluja: 0.0
2026-02-11 16:20:23 -    ✅ Període UTC: 08:00 - 08:30 | TX: 12.8 | TN: 11.9 | Pluja: 0.0
2026-02-11 16:20:23 -    ✅ Període UTC: 08:30 - 09:00 | TX: 14.0 | TN: 12.6 | Pluja: 0.0
2026-02-11 16:20:23 -    ✅ Període UTC: 09:00 - 09:30 | TX: 15.0 | TN: 14.0 | Pluja: 0.0
2026-02-11 16:20:23 -    ✅ Període UTC: 09:30 - 10:00 | TX: 16.9 | TN: 15.1 | Pluja: 0.1
2026-02-11 16:20:23 -    ✅ Període UTC: 10:00 - 10:30 | TX: 16.9 | TN: 16.4 | Pluja: 0.0
2026-02-11 16:20:23 -    ✅ Període UTC: 10:30 - 11:00 | TX: 18.3 | TN: 16.9 | Pluja: 0.0
2026-02-11 16:20:23 -    ✅ Període UTC: 11:00 - 11:30 | TX: 19.0 | TN: 18.0 | Pluja: 0.0
2026-02-11 16:20:23 -    ✅ Període UTC: 11:30 - 12:00 | TX: 19.8 | TN: 18.8 | Pluja: 0.0
2026-02-11 16:20:23 -    ✅ Període UTC: 12:00 - 12:30 | TX: 20.2 | TN: 19.6 | Pluja: 0.0
2026-02-11 16:20:23 -    ✅ Període UTC: 12:30 - 13:00 | TX: 20.7 | TN: 19.9 | Pluja: 0.0
2026-02-11 16:20:23 -    ✅ Període UTC: 13:00 - 13:30 | TX: 20.8 | TN: 20.4 | Pluja: 0.0
2026-02-11 16:20:23 -    ✅ Període UTC: 13:30 - 14:00 | TX: 21.1 | TN: 20.5 | Pluja: 0.0
2026-02-11 16:20:23 -    ✅ Període UTC: 14:00 - 14:30 | TX: 21.4 | TN: 19.9 | Pluja: 0.0
2026-02-11 16:20:23 -    ✅ Període UTC: 14:30 - 15:00 | TX: 19.9 | TN: 18.4 | Pluja: 0.0
2026-02-11 16:20:23 -    ✅ Període UTC: 15:00 - 15:30 | TX: 18.4 | TN: 17.8 | Pluja: 0.0
2026-02-11 16:20:23 -    ✅ Període UTC: 15:30 - 16:00 | TX: 17.7 | TN: 17.0 | Pluja: 0.0
2026-02-11 16:20:23 - 📈 Total períodes vàlids trobats: 32
2026-02-11 16:20:23 - 📊 RESUM CALCULAT:
2026-02-11 16:20:23 -    • Màxima del dia: 21.4°C
2026-02-11 16:20:23 -    • Mínima del dia: 6.9°C
2026-02-11 16:20:23 -    • Pluja acumulada: 0.1mm
2026-02-11 16:20:23 -    • Últim període: 15:30 - 16:00 UTC
2026-02-11 16:20:23 -    • Hora actualització: 16:20
2026-02-11 16:20:23 - 💾 Dades guardades a data/XJ_20260211.csv (32 registres)
2026-02-11 16:20:23 - ✅ Girona: 32 períodes processats
2026-02-11 16:20:23 - 💾 Dades guardades a data/weather_daily_20260211.json
2026-02-11 16:20:23 - 💾 Dades guardades a data/weather_summary.json
2026-02-11 16:20:23 - 
============================================================
2026-02-11 16:20:23 - 📋 RESUM FINAL DEL DIA (UTC)
2026-02-11 16:20:23 - ============================================================
2026-02-11 16:20:23 - 
📍 Fornells de la Selva:
2026-02-11 16:20:23 -    • Períodes: 32
2026-02-11 16:20:23 -    • Màxima: 21.2°C
2026-02-11 16:20:23 -    • Mínima: 6.1°C
2026-02-11 16:20:23 -    • Pluja: 0.1mm
2026-02-11 16:20:23 -    • Últim període: 15:30 - 16:00 UTC
2026-02-11 16:20:23 -    • Actualització: 16:20
2026-02-11 16:20:23 - 
📍 Girona:
2026-02-11 16:20:23 -    • Períodes: 32
2026-02-11 16:20:23 -    • Màxima: 21.4°C
2026-02-11 16:20:23 -    • Mínima: 6.9°C
2026-02-11 16:20:23 -    • Pluja: 0.1mm
2026-02-11 16:20:23 -    • Últim període: 15:30 - 16:00 UTC
2026-02-11 16:20:23 -    • Actualització: 16:20
2026-02-11 16:20:23 - 
💾 Fitxers generats:
2026-02-11 16:20:23 -    • data/weather_summary.json (per HTML)
2026-02-11 16:20:23 -    • data/weather_daily_YYYYMMDD.json (complet)
2026-02-11 16:20:23 -    • data/XX_YYYYMMDD.csv (per estació)
2026-02-11 16:20:23 - 
✅ PROCÉS COMPLETAT
2026-02-11 16:20:23 - ============================================================
