=== INICI DAILY SCRAPER (UTC): 2025-12-29 15:15:21 ===
2025-12-29 15:15:21 - ============================================================
2025-12-29 15:15:21 - 🌤️  DAILY WEATHER SCRAPER - VERSIÓ UTC
2025-12-29 15:15:21 - ============================================================
2025-12-29 15:15:21 - 
==================================================
2025-12-29 15:15:21 - 📡 Processant: Fornells de la Selva [UO]
2025-12-29 15:15:21 - 
🌐 Connectant a Fornells de la Selva...
2025-12-29 15:15:23 - 📊 Total files trobades a la taula: 31
2025-12-29 15:15:23 -    ✅ Període UTC: 00:00 - 00:30 | TX: 9.0 | TN: 8.9 | Pluja: 0.0
2025-12-29 15:15:23 -    ✅ Període UTC: 00:30 - 01:00 | TX: 9.2 | TN: 9.0 | Pluja: 0.0
2025-12-29 15:15:23 -    ✅ Període UTC: 01:00 - 01:30 | TX: 9.2 | TN: 9.0 | Pluja: 0.0
2025-12-29 15:15:23 -    ✅ Període UTC: 01:30 - 02:00 | TX: 9.4 | TN: 9.1 | Pluja: 0.0
2025-12-29 15:15:23 -    ✅ Període UTC: 02:00 - 02:30 | TX: 9.6 | TN: 9.4 | Pluja: 0.0
2025-12-29 15:15:23 -    ✅ Període UTC: 02:30 - 03:00 | TX: 9.6 | TN: 9.5 | Pluja: 0.0
2025-12-29 15:15:23 -    ✅ Període UTC: 03:00 - 03:30 | TX: 9.7 | TN: 9.6 | Pluja: 2.7
2025-12-29 15:15:23 -    ✅ Període UTC: 03:30 - 04:00 | TX: 9.7 | TN: 9.5 | Pluja: 0.5
2025-12-29 15:15:23 -    ✅ Període UTC: 04:00 - 04:30 | TX: 9.5 | TN: 9.4 | Pluja: 0.7
2025-12-29 15:15:23 -    ✅ Període UTC: 04:30 - 05:00 | TX: 9.4 | TN: 9.4 | Pluja: 0.3
2025-12-29 15:15:23 -    ✅ Període UTC: 05:00 - 05:30 | TX: 9.4 | TN: 9.3 | Pluja: 0.2
2025-12-29 15:15:23 -    ✅ Període UTC: 05:30 - 06:00 | TX: 9.4 | TN: 9.3 | Pluja: 0.6
2025-12-29 15:15:23 -    ✅ Període UTC: 06:00 - 06:30 | TX: 9.4 | TN: 9.3 | Pluja: 0.0
2025-12-29 15:15:23 -    ✅ Període UTC: 06:30 - 07:00 | TX: 9.4 | TN: 9.4 | Pluja: 0.3
2025-12-29 15:15:23 -    ✅ Període UTC: 07:00 - 07:30 | TX: 9.4 | TN: 9.4 | Pluja: 0.1
2025-12-29 15:15:23 -    ✅ Període UTC: 07:30 - 08:00 | TX: 9.5 | TN: 9.4 | Pluja: 0.0
2025-12-29 15:15:23 -    ✅ Període UTC: 08:00 - 08:30 | TX: 9.6 | TN: 9.5 | Pluja: 0.0
2025-12-29 15:15:23 -    ✅ Període UTC: 08:30 - 09:00 | TX: 9.7 | TN: 9.6 | Pluja: 0.0
2025-12-29 15:15:23 -    ✅ Període UTC: 09:00 - 09:30 | TX: 10.0 | TN: 9.7 | Pluja: 0.0
2025-12-29 15:15:23 -    ✅ Període UTC: 09:30 - 10:00 | TX: 10.2 | TN: 10.0 | Pluja: 0.0
2025-12-29 15:15:23 -    ✅ Període UTC: 10:00 - 10:30 | TX: 10.5 | TN: 10.1 | Pluja: 0.0
2025-12-29 15:15:23 -    ✅ Període UTC: 10:30 - 11:00 | TX: 10.8 | TN: 10.5 | Pluja: 0.0
2025-12-29 15:15:23 -    ✅ Període UTC: 11:00 - 11:30 | TX: 11.0 | TN: 10.8 | Pluja: 0.0
2025-12-29 15:15:23 -    ✅ Període UTC: 11:30 - 12:00 | TX: 11.4 | TN: 11.0 | Pluja: 0.0
2025-12-29 15:15:23 -    ✅ Període UTC: 12:00 - 12:30 | TX: 11.6 | TN: 11.4 | Pluja: 0.0
2025-12-29 15:15:23 -    ✅ Període UTC: 12:30 - 13:00 | TX: 12.3 | TN: 11.6 | Pluja: 0.0
2025-12-29 15:15:23 -    ✅ Període UTC: 13:00 - 13:30 | TX: 12.3 | TN: 12.0 | Pluja: 0.0
2025-12-29 15:15:23 -    ✅ Període UTC: 13:30 - 14:00 | TX: 12.6 | TN: 12.3 | Pluja: 0.0
2025-12-29 15:15:23 -    ✅ Període UTC: 14:00 - 14:30 | TX: 12.6 | TN: 12.4 | Pluja: 0.0
2025-12-29 15:15:23 -    ✅ Període UTC: 14:30 - 15:00 | TX: 12.7 | TN: 12.2 | Pluja: 0.0
2025-12-29 15:15:23 - 📈 Total períodes vàlids trobats: 30
2025-12-29 15:15:23 - 📊 RESUM CALCULAT:
2025-12-29 15:15:23 -    • Màxima del dia: 12.7°C
2025-12-29 15:15:23 -    • Mínima del dia: 8.9°C
2025-12-29 15:15:23 -    • Pluja acumulada: 5.3999999999999995mm
2025-12-29 15:15:23 -    • Últim període: 14:30 - 15:00 UTC
2025-12-29 15:15:23 -    • Hora actualització: 15:15
2025-12-29 15:15:23 - 💾 Dades guardades a data/UO_20251229.csv (30 registres)
2025-12-29 15:15:23 - ✅ Fornells de la Selva: 30 períodes processats
2025-12-29 15:15:23 - 
==================================================
2025-12-29 15:15:23 - 📡 Processant: Girona [XJ]
2025-12-29 15:15:23 - 
🌐 Connectant a Girona...
2025-12-29 15:15:24 - 📊 Total files trobades a la taula: 31
2025-12-29 15:15:24 -    ✅ Període UTC: 00:00 - 00:30 | TX: 8.7 | TN: 8.6 | Pluja: 0.0
2025-12-29 15:15:24 -    ✅ Període UTC: 00:30 - 01:00 | TX: 8.8 | TN: 8.6 | Pluja: 0.0
2025-12-29 15:15:24 -    ✅ Període UTC: 01:00 - 01:30 | TX: 9.0 | TN: 8.8 | Pluja: 0.0
2025-12-29 15:15:24 -    ✅ Període UTC: 01:30 - 02:00 | TX: 9.1 | TN: 9.0 | Pluja: 0.0
2025-12-29 15:15:24 -    ✅ Període UTC: 02:00 - 02:30 | TX: 9.2 | TN: 9.0 | Pluja: 0.0
2025-12-29 15:15:24 -    ✅ Període UTC: 02:30 - 03:00 | TX: 9.3 | TN: 9.2 | Pluja: 0.0
2025-12-29 15:15:24 -    ✅ Període UTC: 03:00 - 03:30 | TX: 9.8 | TN: 9.3 | Pluja: 0.0
2025-12-29 15:15:24 -    ✅ Període UTC: 03:30 - 04:00 | TX: 9.8 | TN: 9.5 | Pluja: 1.9
2025-12-29 15:15:24 -    ✅ Període UTC: 04:00 - 04:30 | TX: 9.5 | TN: 9.2 | Pluja: 0.6
2025-12-29 15:15:24 -    ✅ Període UTC: 04:30 - 05:00 | TX: 9.2 | TN: 9.2 | Pluja: 0.1
2025-12-29 15:15:24 -    ✅ Període UTC: 05:00 - 05:30 | TX: 9.2 | TN: 9.1 | Pluja: 0.2
2025-12-29 15:15:24 -    ✅ Període UTC: 05:30 - 06:00 | TX: 9.2 | TN: 9.1 | Pluja: 0.0
2025-12-29 15:15:24 -    ✅ Període UTC: 06:00 - 06:30 | TX: 9.2 | TN: 9.1 | Pluja: 0.0
2025-12-29 15:15:24 -    ✅ Període UTC: 06:30 - 07:00 | TX: 9.3 | TN: 9.1 | Pluja: 0.0
2025-12-29 15:15:24 -    ✅ Període UTC: 07:00 - 07:30 | TX: 9.2 | TN: 9.2 | Pluja: 0.0
2025-12-29 15:15:24 -    ✅ Període UTC: 07:30 - 08:00 | TX: 9.3 | TN: 9.3 | Pluja: 0.0
2025-12-29 15:15:24 -    ✅ Període UTC: 08:00 - 08:30 | TX: 9.4 | TN: 9.3 | Pluja: 0.1
2025-12-29 15:15:24 -    ✅ Període UTC: 08:30 - 09:00 | TX: 9.7 | TN: 9.4 | Pluja: 0.0
2025-12-29 15:15:24 -    ✅ Període UTC: 09:00 - 09:30 | TX: 9.9 | TN: 9.7 | Pluja: 0.0
2025-12-29 15:15:24 -    ✅ Període UTC: 09:30 - 10:00 | TX: 10.4 | TN: 9.9 | Pluja: 0.0
2025-12-29 15:15:24 -    ✅ Període UTC: 10:00 - 10:30 | TX: 10.6 | TN: 10.4 | Pluja: 0.0
2025-12-29 15:15:24 -    ✅ Període UTC: 10:30 - 11:00 | TX: 10.8 | TN: 10.6 | Pluja: 0.0
2025-12-29 15:15:24 -    ✅ Període UTC: 11:00 - 11:30 | TX: 11.2 | TN: 10.8 | Pluja: 0.0
2025-12-29 15:15:24 -    ✅ Període UTC: 11:30 - 12:00 | TX: 11.8 | TN: 11.2 | Pluja: 0.0
2025-12-29 15:15:24 -    ✅ Període UTC: 12:00 - 12:30 | TX: 12.0 | TN: 11.8 | Pluja: 0.0
2025-12-29 15:15:24 -    ✅ Període UTC: 12:30 - 13:00 | TX: 12.7 | TN: 11.8 | Pluja: 0.0
2025-12-29 15:15:24 -    ✅ Període UTC: 13:00 - 13:30 | TX: 13.1 | TN: 12.5 | Pluja: 0.0
2025-12-29 15:15:24 -    ✅ Període UTC: 13:30 - 14:00 | TX: 13.1 | TN: 12.9 | Pluja: 0.0
2025-12-29 15:15:24 -    ✅ Període UTC: 14:00 - 14:30 | TX: 13.3 | TN: 13.1 | Pluja: 0.0
2025-12-29 15:15:24 -    ✅ Període UTC: 14:30 - 15:00 | TX: 13.5 | TN: 13.1 | Pluja: 0.0
2025-12-29 15:15:24 - 📈 Total períodes vàlids trobats: 30
2025-12-29 15:15:24 - 📊 RESUM CALCULAT:
2025-12-29 15:15:24 -    • Màxima del dia: 13.5°C
2025-12-29 15:15:24 -    • Mínima del dia: 8.6°C
2025-12-29 15:15:24 -    • Pluja acumulada: 2.9000000000000004mm
2025-12-29 15:15:24 -    • Últim període: 14:30 - 15:00 UTC
2025-12-29 15:15:24 -    • Hora actualització: 15:15
2025-12-29 15:15:24 - 💾 Dades guardades a data/XJ_20251229.csv (30 registres)
2025-12-29 15:15:24 - ✅ Girona: 30 períodes processats
2025-12-29 15:15:24 - 💾 Dades guardades a data/weather_daily_20251229.json
2025-12-29 15:15:24 - 💾 Dades guardades a data/weather_summary.json
2025-12-29 15:15:24 - 
============================================================
2025-12-29 15:15:24 - 📋 RESUM FINAL DEL DIA (UTC)
2025-12-29 15:15:24 - ============================================================
2025-12-29 15:15:24 - 
📍 Fornells de la Selva:
2025-12-29 15:15:24 -    • Períodes: 30
2025-12-29 15:15:24 -    • Màxima: 12.7°C
2025-12-29 15:15:24 -    • Mínima: 8.9°C
2025-12-29 15:15:24 -    • Pluja: 5.3999999999999995mm
2025-12-29 15:15:24 -    • Últim període: 14:30 - 15:00 UTC
2025-12-29 15:15:24 -    • Actualització: 15:15
2025-12-29 15:15:24 - 
📍 Girona:
2025-12-29 15:15:24 -    • Períodes: 30
2025-12-29 15:15:24 -    • Màxima: 13.5°C
2025-12-29 15:15:24 -    • Mínima: 8.6°C
2025-12-29 15:15:24 -    • Pluja: 2.9000000000000004mm
2025-12-29 15:15:24 -    • Últim període: 14:30 - 15:00 UTC
2025-12-29 15:15:24 -    • Actualització: 15:15
2025-12-29 15:15:24 - 
💾 Fitxers generats:
2025-12-29 15:15:24 -    • data/weather_summary.json (per HTML)
2025-12-29 15:15:24 -    • data/weather_daily_YYYYMMDD.json (complet)
2025-12-29 15:15:24 -    • data/XX_YYYYMMDD.csv (per estació)
2025-12-29 15:15:24 - 
✅ PROCÉS COMPLETAT
2025-12-29 15:15:24 - ============================================================
