=== INICI DAILY SCRAPER (UTC): 2025-12-23 23:10:20 ===
2025-12-23 23:10:20 - ============================================================
2025-12-23 23:10:20 - 🌤️  DAILY WEATHER SCRAPER - VERSIÓ UTC
2025-12-23 23:10:20 - ============================================================
2025-12-23 23:10:20 - 
==================================================
2025-12-23 23:10:20 - 📡 Processant: Fornells de la Selva [UO]
2025-12-23 23:10:20 - 
🌐 Connectant a Fornells de la Selva...
2025-12-23 23:10:22 - 📊 Total files trobades a la taula: 47
2025-12-23 23:10:22 -    ✅ Període UTC: 00:00 - 00:30 | TX: 5.9 | TN: 5.9 | Pluja: 0.0
2025-12-23 23:10:22 -    ✅ Període UTC: 00:30 - 01:00 | TX: 6.0 | TN: 5.9 | Pluja: 0.0
2025-12-23 23:10:22 -    ✅ Període UTC: 01:00 - 01:30 | TX: 6.1 | TN: 6.0 | Pluja: 0.1
2025-12-23 23:10:22 -    ✅ Període UTC: 01:30 - 02:00 | TX: 6.1 | TN: 6.1 | Pluja: 0.2
2025-12-23 23:10:22 -    ✅ Període UTC: 02:00 - 02:30 | TX: 6.2 | TN: 6.1 | Pluja: 0.2
2025-12-23 23:10:22 -    ✅ Període UTC: 02:30 - 03:00 | TX: 6.2 | TN: 6.2 | Pluja: 0.5
2025-12-23 23:10:22 -    ✅ Període UTC: 03:00 - 03:30 | TX: 6.3 | TN: 6.2 | Pluja: 0.1
2025-12-23 23:10:22 -    ✅ Període UTC: 03:30 - 04:00 | TX: 6.3 | TN: 6.2 | Pluja: 0.1
2025-12-23 23:10:22 -    ✅ Període UTC: 04:00 - 04:30 | TX: 6.3 | TN: 6.3 | Pluja: 0.5
2025-12-23 23:10:22 -    ✅ Període UTC: 04:30 - 05:00 | TX: 6.3 | TN: 6.3 | Pluja: 0.6
2025-12-23 23:10:22 -    ✅ Període UTC: 05:00 - 05:30 | TX: 6.4 | TN: 6.3 | Pluja: 0.6
2025-12-23 23:10:22 -    ✅ Període UTC: 05:30 - 06:00 | TX: 6.4 | TN: 6.3 | Pluja: 0.2
2025-12-23 23:10:22 -    ✅ Període UTC: 06:00 - 06:30 | TX: 6.3 | TN: 6.2 | Pluja: 0.0
2025-12-23 23:10:22 -    ✅ Període UTC: 06:30 - 07:00 | TX: 6.2 | TN: 6.1 | Pluja: 0.0
2025-12-23 23:10:22 -    ✅ Període UTC: 07:00 - 07:30 | TX: 6.1 | TN: 6.0 | Pluja: 0.0
2025-12-23 23:10:22 -    ✅ Període UTC: 07:30 - 08:00 | TX: 6.3 | TN: 6.1 | Pluja: 0.3
2025-12-23 23:10:22 -    ✅ Període UTC: 08:00 - 08:30 | TX: 6.5 | TN: 6.3 | Pluja: 0.0
2025-12-23 23:10:22 -    ✅ Període UTC: 08:30 - 09:00 | TX: 6.5 | TN: 6.5 | Pluja: 0.0
2025-12-23 23:10:22 -    ✅ Període UTC: 09:00 - 09:30 | TX: 7.0 | TN: 6.5 | Pluja: 0.0
2025-12-23 23:10:22 -    ✅ Període UTC: 09:30 - 10:00 | TX: 7.5 | TN: 7.0 | Pluja: 0.2
2025-12-23 23:10:22 -    ✅ Període UTC: 10:00 - 10:30 | TX: 7.7 | TN: 7.5 | Pluja: 0.3
2025-12-23 23:10:22 -    ✅ Període UTC: 10:30 - 11:00 | TX: 7.8 | TN: 7.4 | Pluja: 0.6
2025-12-23 23:10:22 -    ✅ Període UTC: 11:00 - 11:30 | TX: 8.7 | TN: 7.8 | Pluja: 0.0
2025-12-23 23:10:22 -    ✅ Període UTC: 11:30 - 12:00 | TX: 9.7 | TN: 8.8 | Pluja: 0.0
2025-12-23 23:10:22 -    ✅ Període UTC: 12:00 - 12:30 | TX: 9.8 | TN: 9.7 | Pluja: 0.0
2025-12-23 23:10:22 -    ✅ Període UTC: 12:30 - 13:00 | TX: 10.9 | TN: 9.9 | Pluja: 0.0
2025-12-23 23:10:22 -    ✅ Període UTC: 13:00 - 13:30 | TX: 11.2 | TN: 10.7 | Pluja: 0.0
2025-12-23 23:10:22 -    ✅ Període UTC: 13:30 - 14:00 | TX: 11.0 | TN: 10.9 | Pluja: 0.0
2025-12-23 23:10:22 -    ✅ Període UTC: 14:00 - 14:30 | TX: 11.6 | TN: 11.0 | Pluja: 0.0
2025-12-23 23:10:22 -    ✅ Període UTC: 14:30 - 15:00 | TX: 11.6 | TN: 11.1 | Pluja: 0.0
2025-12-23 23:10:22 -    ✅ Període UTC: 15:00 - 15:30 | TX: 11.1 | TN: 10.9 | Pluja: 0.0
2025-12-23 23:10:22 -    ✅ Període UTC: 15:30 - 16:00 | TX: 10.9 | TN: 10.6 | Pluja: 0.0
2025-12-23 23:10:22 -    ✅ Període UTC: 16:00 - 16:30 | TX: 10.9 | TN: 10.6 | Pluja: 0.0
2025-12-23 23:10:22 -    ✅ Període UTC: 16:30 - 17:00 | TX: 10.9 | TN: 10.7 | Pluja: 0.0
2025-12-23 23:10:22 -    ✅ Període UTC: 17:00 - 17:30 | TX: 10.9 | TN: 10.7 | Pluja: 0.0
2025-12-23 23:10:22 -    ✅ Període UTC: 17:30 - 18:00 | TX: 10.8 | TN: 10.1 | Pluja: 0.0
2025-12-23 23:10:22 -    ✅ Període UTC: 18:00 - 18:30 | TX: 10.2 | TN: 9.8 | Pluja: 0.0
2025-12-23 23:10:22 -    ✅ Període UTC: 18:30 - 19:00 | TX: 10.0 | TN: 9.3 | Pluja: 0.0
2025-12-23 23:10:22 -    ✅ Període UTC: 19:00 - 19:30 | TX: 9.3 | TN: 8.6 | Pluja: 0.0
2025-12-23 23:10:22 -    ✅ Període UTC: 19:30 - 20:00 | TX: 8.9 | TN: 8.3 | Pluja: 0.0
2025-12-23 23:10:22 -    ✅ Període UTC: 20:00 - 20:30 | TX: 8.6 | TN: 8.3 | Pluja: 0.0
2025-12-23 23:10:22 -    ✅ Període UTC: 20:30 - 21:00 | TX: 8.4 | TN: 8.2 | Pluja: 0.0
2025-12-23 23:10:22 -    ✅ Període UTC: 21:00 - 21:30 | TX: 8.9 | TN: 8.3 | Pluja: 0.0
2025-12-23 23:10:22 -    ✅ Període UTC: 21:30 - 22:00 | TX: 8.7 | TN: 8.4 | Pluja: 0.0
2025-12-23 23:10:22 -    ✅ Període UTC: 22:00 - 22:30 | TX: 8.9 | TN: 8.4 | Pluja: 0.0
2025-12-23 23:10:22 -    ✅ Període UTC: 22:30 - 23:00 | TX: 8.4 | TN: 8.1 | Pluja: 0.0
2025-12-23 23:10:22 - 📈 Total períodes vàlids trobats: 46
2025-12-23 23:10:22 - 📊 RESUM CALCULAT:
2025-12-23 23:10:22 -    • Màxima del dia: 11.6°C
2025-12-23 23:10:22 -    • Mínima del dia: 5.9°C
2025-12-23 23:10:22 -    • Pluja acumulada: 4.5mm
2025-12-23 23:10:22 -    • Últim període: 22:30 - 23:00 UTC
2025-12-23 23:10:22 -    • Hora actualització: 23:10
2025-12-23 23:10:22 - 💾 Dades guardades a data/UO_20251223.csv (46 registres)
2025-12-23 23:10:22 - ✅ Fornells de la Selva: 46 períodes processats
2025-12-23 23:10:22 - 
==================================================
2025-12-23 23:10:22 - 📡 Processant: Girona [XJ]
2025-12-23 23:10:22 - 
🌐 Connectant a Girona...
2025-12-23 23:10:23 - 📊 Total files trobades a la taula: 47
2025-12-23 23:10:23 -    ✅ Període UTC: 00:00 - 00:30 | TX: 5.9 | TN: 5.8 | Pluja: 0.0
2025-12-23 23:10:23 -    ✅ Període UTC: 00:30 - 01:00 | TX: 6.0 | TN: 5.9 | Pluja: 0.0
2025-12-23 23:10:23 -    ✅ Període UTC: 01:00 - 01:30 | TX: 6.0 | TN: 6.0 | Pluja: 0.1
2025-12-23 23:10:23 -    ✅ Període UTC: 01:30 - 02:00 | TX: 6.0 | TN: 6.0 | Pluja: 0.1
2025-12-23 23:10:23 -    ✅ Període UTC: 02:00 - 02:30 | TX: 6.1 | TN: 6.0 | Pluja: 0.5
2025-12-23 23:10:23 -    ✅ Període UTC: 02:30 - 03:00 | TX: 6.1 | TN: 6.1 | Pluja: 0.4
2025-12-23 23:10:23 -    ✅ Període UTC: 03:00 - 03:30 | TX: 6.1 | TN: 6.1 | Pluja: 0.1
2025-12-23 23:10:23 -    ✅ Període UTC: 03:30 - 04:00 | TX: 6.2 | TN: 6.1 | Pluja: 0.2
2025-12-23 23:10:23 -    ✅ Període UTC: 04:00 - 04:30 | TX: 6.2 | TN: 6.2 | Pluja: 0.6
2025-12-23 23:10:23 -    ✅ Període UTC: 04:30 - 05:00 | TX: 6.2 | TN: 6.2 | Pluja: 0.8
2025-12-23 23:10:23 -    ✅ Període UTC: 05:00 - 05:30 | TX: 6.2 | TN: 6.2 | Pluja: 0.8
2025-12-23 23:10:23 -    ✅ Període UTC: 05:30 - 06:00 | TX: 6.2 | TN: 6.1 | Pluja: 0.5
2025-12-23 23:10:23 -    ✅ Període UTC: 06:00 - 06:30 | TX: 6.1 | TN: 5.9 | Pluja: 0.0
2025-12-23 23:10:23 -    ✅ Període UTC: 06:30 - 07:00 | TX: 6.0 | TN: 5.8 | Pluja: 0.0
2025-12-23 23:10:23 -    ✅ Període UTC: 07:00 - 07:30 | TX: 6.2 | TN: 6.0 | Pluja: 0.2
2025-12-23 23:10:23 -    ✅ Període UTC: 07:30 - 08:00 | TX: 6.2 | TN: 6.2 | Pluja: 0.0
2025-12-23 23:10:23 -    ✅ Període UTC: 08:00 - 08:30 | TX: 6.6 | TN: 6.2 | Pluja: 0.0
2025-12-23 23:10:23 -    ✅ Període UTC: 08:30 - 09:00 | TX: 6.8 | TN: 6.6 | Pluja: 0.1
2025-12-23 23:10:23 -    ✅ Període UTC: 09:00 - 09:30 | TX: 7.1 | TN: 6.8 | Pluja: 0.1
2025-12-23 23:10:23 -    ✅ Període UTC: 09:30 - 10:00 | TX: 7.3 | TN: 7.0 | Pluja: 0.2
2025-12-23 23:10:23 -    ✅ Període UTC: 10:00 - 10:30 | TX: 7.3 | TN: 7.1 | Pluja: 0.4
2025-12-23 23:10:23 -    ✅ Període UTC: 10:30 - 11:00 | TX: 7.6 | TN: 7.3 | Pluja: 0.5
2025-12-23 23:10:23 -    ✅ Període UTC: 11:00 - 11:30 | TX: 9.1 | TN: 7.7 | Pluja: 0.0
2025-12-23 23:10:23 -    ✅ Període UTC: 11:30 - 12:00 | TX: 9.7 | TN: 9.1 | Pluja: 0.0
2025-12-23 23:10:23 -    ✅ Període UTC: 12:00 - 12:30 | TX: 10.1 | TN: 9.7 | Pluja: 0.0
2025-12-23 23:10:23 -    ✅ Període UTC: 12:30 - 13:00 | TX: 10.6 | TN: 10.0 | Pluja: 0.0
2025-12-23 23:10:23 -    ✅ Període UTC: 13:00 - 13:30 | TX: 11.6 | TN: 10.7 | Pluja: 0.0
2025-12-23 23:10:23 -    ✅ Període UTC: 13:30 - 14:00 | TX: 11.9 | TN: 11.4 | Pluja: 0.0
2025-12-23 23:10:23 -    ✅ Període UTC: 14:00 - 14:30 | TX: 12.2 | TN: 11.9 | Pluja: 0.0
2025-12-23 23:10:23 -    ✅ Període UTC: 14:30 - 15:00 | TX: 11.9 | TN: 11.4 | Pluja: 0.0
2025-12-23 23:10:23 -    ✅ Període UTC: 15:00 - 15:30 | TX: 11.4 | TN: 11.3 | Pluja: 0.0
2025-12-23 23:10:23 -    ✅ Període UTC: 15:30 - 16:00 | TX: 11.3 | TN: 11.2 | Pluja: 0.0
2025-12-23 23:10:23 -    ✅ Període UTC: 16:00 - 16:30 | TX: 11.2 | TN: 11.0 | Pluja: 0.0
2025-12-23 23:10:23 -    ✅ Període UTC: 16:30 - 17:00 | TX: 11.1 | TN: 10.9 | Pluja: 0.0
2025-12-23 23:10:23 -    ✅ Període UTC: 17:00 - 17:30 | TX: 11.1 | TN: 10.8 | Pluja: 0.0
2025-12-23 23:10:23 -    ✅ Període UTC: 17:30 - 18:00 | TX: 10.9 | TN: 10.8 | Pluja: 0.0
2025-12-23 23:10:23 -    ✅ Període UTC: 18:00 - 18:30 | TX: 10.8 | TN: 10.5 | Pluja: 0.0
2025-12-23 23:10:23 -    ✅ Període UTC: 18:30 - 19:00 | TX: 10.5 | TN: 10.1 | Pluja: 0.0
2025-12-23 23:10:23 -    ✅ Període UTC: 19:00 - 19:30 | TX: 10.1 | TN: 9.9 | Pluja: 0.0
2025-12-23 23:10:23 -    ✅ Període UTC: 19:30 - 20:00 | TX: 10.0 | TN: 9.5 | Pluja: 0.0
2025-12-23 23:10:23 -    ✅ Període UTC: 20:00 - 20:30 | TX: 9.7 | TN: 9.4 | Pluja: 0.0
2025-12-23 23:10:23 -    ✅ Període UTC: 20:30 - 21:00 | TX: 9.6 | TN: 9.4 | Pluja: 0.0
2025-12-23 23:10:23 -    ✅ Període UTC: 21:00 - 21:30 | TX: 9.7 | TN: 9.5 | Pluja: 0.0
2025-12-23 23:10:23 -    ✅ Període UTC: 21:30 - 22:00 | TX: 9.7 | TN: 9.3 | Pluja: 0.0
2025-12-23 23:10:23 -    ✅ Període UTC: 22:00 - 22:30 | TX: 9.5 | TN: 8.8 | Pluja: 0.0
2025-12-23 23:10:23 -    ✅ Període UTC: 22:30 - 23:00 | TX: 8.9 | TN: 8.2 | Pluja: 0.0
2025-12-23 23:10:23 - 📈 Total períodes vàlids trobats: 46
2025-12-23 23:10:23 - 📊 RESUM CALCULAT:
2025-12-23 23:10:23 -    • Màxima del dia: 12.2°C
2025-12-23 23:10:23 -    • Mínima del dia: 5.8°C
2025-12-23 23:10:23 -    • Pluja acumulada: 5.6mm
2025-12-23 23:10:23 -    • Últim període: 22:30 - 23:00 UTC
2025-12-23 23:10:23 -    • Hora actualització: 23:10
2025-12-23 23:10:23 - 💾 Dades guardades a data/XJ_20251223.csv (46 registres)
2025-12-23 23:10:23 - ✅ Girona: 46 períodes processats
2025-12-23 23:10:23 - 💾 Dades guardades a data/weather_daily_20251223.json
2025-12-23 23:10:23 - 💾 Dades guardades a data/weather_summary.json
2025-12-23 23:10:23 - 
============================================================
2025-12-23 23:10:23 - 📋 RESUM FINAL DEL DIA (UTC)
2025-12-23 23:10:23 - ============================================================
2025-12-23 23:10:23 - 
📍 Fornells de la Selva:
2025-12-23 23:10:23 -    • Períodes: 46
2025-12-23 23:10:23 -    • Màxima: 11.6°C
2025-12-23 23:10:23 -    • Mínima: 5.9°C
2025-12-23 23:10:23 -    • Pluja: 4.5mm
2025-12-23 23:10:23 -    • Últim període: 22:30 - 23:00 UTC
2025-12-23 23:10:23 -    • Actualització: 23:10
2025-12-23 23:10:23 - 
📍 Girona:
2025-12-23 23:10:23 -    • Períodes: 46
2025-12-23 23:10:23 -    • Màxima: 12.2°C
2025-12-23 23:10:23 -    • Mínima: 5.8°C
2025-12-23 23:10:23 -    • Pluja: 5.6mm
2025-12-23 23:10:23 -    • Últim període: 22:30 - 23:00 UTC
2025-12-23 23:10:23 -    • Actualització: 23:10
2025-12-23 23:10:23 - 
💾 Fitxers generats:
2025-12-23 23:10:23 -    • data/weather_summary.json (per HTML)
2025-12-23 23:10:23 -    • data/weather_daily_YYYYMMDD.json (complet)
2025-12-23 23:10:23 -    • data/XX_YYYYMMDD.csv (per estació)
2025-12-23 23:10:23 - 
✅ PROCÉS COMPLETAT
2025-12-23 23:10:23 - ============================================================
