=== INICI DAILY SCRAPER (UTC): 2026-01-05 15:18:53 ===
2026-01-05 15:18:53 - ============================================================
2026-01-05 15:18:53 - 🌤️  DAILY WEATHER SCRAPER - VERSIÓ UTC
2026-01-05 15:18:53 - ============================================================
2026-01-05 15:18:53 - 
==================================================
2026-01-05 15:18:53 - 📡 Processant: Fornells de la Selva [UO]
2026-01-05 15:18:53 - 
🌐 Connectant a Fornells de la Selva...
2026-01-05 15:18:55 - 📊 Total files trobades a la taula: 31
2026-01-05 15:18:55 -    ✅ Període UTC: 00:00 - 00:30 | TX: 3.6 | TN: 3.2 | Pluja: 0.0
2026-01-05 15:18:55 -    ✅ Període UTC: 00:30 - 01:00 | TX: 3.7 | TN: 3.2 | Pluja: 0.0
2026-01-05 15:18:55 -    ✅ Període UTC: 01:00 - 01:30 | TX: 3.2 | TN: 3.1 | Pluja: 0.0
2026-01-05 15:18:55 -    ✅ Període UTC: 01:30 - 02:00 | TX: 3.3 | TN: 3.2 | Pluja: 0.0
2026-01-05 15:18:55 -    ✅ Període UTC: 02:00 - 02:30 | TX: 3.4 | TN: 3.2 | Pluja: 0.0
2026-01-05 15:18:55 -    ✅ Període UTC: 02:30 - 03:00 | TX: 3.4 | TN: 3.2 | Pluja: 0.0
2026-01-05 15:18:55 -    ✅ Període UTC: 03:00 - 03:30 | TX: 3.3 | TN: 3.1 | Pluja: 0.0
2026-01-05 15:18:55 -    ✅ Període UTC: 03:30 - 04:00 | TX: 3.0 | TN: 2.9 | Pluja: 0.0
2026-01-05 15:18:55 -    ✅ Període UTC: 04:00 - 04:30 | TX: 2.9 | TN: 2.8 | Pluja: 0.0
2026-01-05 15:18:55 -    ✅ Període UTC: 04:30 - 05:00 | TX: 2.8 | TN: 2.8 | Pluja: 0.0
2026-01-05 15:18:55 -    ✅ Període UTC: 05:00 - 05:30 | TX: 2.8 | TN: 2.7 | Pluja: 0.0
2026-01-05 15:18:55 -    ✅ Període UTC: 05:30 - 06:00 | TX: 2.8 | TN: 2.7 | Pluja: 0.0
2026-01-05 15:18:55 -    ✅ Període UTC: 06:00 - 06:30 | TX: 2.8 | TN: 2.7 | Pluja: 0.0
2026-01-05 15:18:55 -    ✅ Període UTC: 06:30 - 07:00 | TX: 2.9 | TN: 2.8 | Pluja: 0.0
2026-01-05 15:18:55 -    ✅ Període UTC: 07:00 - 07:30 | TX: 3.0 | TN: 2.8 | Pluja: 0.0
2026-01-05 15:18:55 -    ✅ Període UTC: 07:30 - 08:00 | TX: 3.1 | TN: 2.9 | Pluja: 0.0
2026-01-05 15:18:55 -    ✅ Període UTC: 08:00 - 08:30 | TX: 3.4 | TN: 3.0 | Pluja: 0.0
2026-01-05 15:18:55 -    ✅ Període UTC: 08:30 - 09:00 | TX: 4.0 | TN: 3.4 | Pluja: 0.0
2026-01-05 15:18:55 -    ✅ Període UTC: 09:00 - 09:30 | TX: 4.1 | TN: 4.0 | Pluja: 0.0
2026-01-05 15:18:55 -    ✅ Període UTC: 09:30 - 10:00 | TX: 4.6 | TN: 4.1 | Pluja: 0.0
2026-01-05 15:18:55 -    ✅ Període UTC: 10:00 - 10:30 | TX: 4.9 | TN: 4.6 | Pluja: 0.0
2026-01-05 15:18:55 -    ✅ Període UTC: 10:30 - 11:00 | TX: 5.2 | TN: 4.8 | Pluja: 0.0
2026-01-05 15:18:55 -    ✅ Període UTC: 11:00 - 11:30 | TX: 6.0 | TN: 5.3 | Pluja: 0.0
2026-01-05 15:18:55 -    ✅ Període UTC: 11:30 - 12:00 | TX: 5.8 | TN: 5.6 | Pluja: 0.0
2026-01-05 15:18:55 -    ✅ Període UTC: 12:00 - 12:30 | TX: 6.5 | TN: 5.8 | Pluja: 0.0
2026-01-05 15:18:55 -    ✅ Període UTC: 12:30 - 13:00 | TX: 7.4 | TN: 6.5 | Pluja: 0.0
2026-01-05 15:18:55 -    ✅ Període UTC: 13:00 - 13:30 | TX: 7.8 | TN: 7.4 | Pluja: 0.0
2026-01-05 15:18:55 -    ✅ Període UTC: 13:30 - 14:00 | TX: 7.5 | TN: 7.3 | Pluja: 0.0
2026-01-05 15:18:55 -    ✅ Període UTC: 14:00 - 14:30 | TX: 7.6 | TN: 7.1 | Pluja: 0.0
2026-01-05 15:18:55 -    ✅ Període UTC: 14:30 - 15:00 | TX: 7.3 | TN: 7.0 | Pluja: 0.0
2026-01-05 15:18:55 - 📈 Total períodes vàlids trobats: 30
2026-01-05 15:18:55 - 📊 RESUM CALCULAT:
2026-01-05 15:18:55 -    • Màxima del dia: 7.8°C
2026-01-05 15:18:55 -    • Mínima del dia: 2.7°C
2026-01-05 15:18:55 -    • Pluja acumulada: 0.0mm
2026-01-05 15:18:55 -    • Últim període: 14:30 - 15:00 UTC
2026-01-05 15:18:55 -    • Hora actualització: 15:18
2026-01-05 15:18:55 - 💾 Dades guardades a data/UO_20260105.csv (30 registres)
2026-01-05 15:18:55 - ✅ Fornells de la Selva: 30 períodes processats
2026-01-05 15:18:55 - 
==================================================
2026-01-05 15:18:55 - 📡 Processant: Girona [XJ]
2026-01-05 15:18:55 - 
🌐 Connectant a Girona...
2026-01-05 15:18:56 - 📊 Total files trobades a la taula: 31
2026-01-05 15:18:56 -    ✅ Període UTC: 00:00 - 00:30 | TX: 3.3 | TN: 3.3 | Pluja: 0.0
2026-01-05 15:18:56 -    ✅ Període UTC: 00:30 - 01:00 | TX: 3.3 | TN: 3.2 | Pluja: 0.0
2026-01-05 15:18:56 -    ✅ Període UTC: 01:00 - 01:30 | TX: 3.2 | TN: 3.1 | Pluja: 0.0
2026-01-05 15:18:56 -    ✅ Període UTC: 01:30 - 02:00 | TX: 3.3 | TN: 3.2 | Pluja: 0.0
2026-01-05 15:18:56 -    ✅ Període UTC: 02:00 - 02:30 | TX: 3.4 | TN: 3.3 | Pluja: 0.0
2026-01-05 15:18:56 -    ✅ Període UTC: 02:30 - 03:00 | TX: 3.4 | TN: 3.1 | Pluja: 0.0
2026-01-05 15:18:56 -    ✅ Període UTC: 03:00 - 03:30 | TX: 3.2 | TN: 2.9 | Pluja: 0.0
2026-01-05 15:18:56 -    ✅ Període UTC: 03:30 - 04:00 | TX: 2.8 | TN: 2.6 | Pluja: 0.0
2026-01-05 15:18:56 -    ✅ Període UTC: 04:00 - 04:30 | TX: 2.8 | TN: 2.6 | Pluja: 0.0
2026-01-05 15:18:56 -    ✅ Període UTC: 04:30 - 05:00 | TX: 2.9 | TN: 2.6 | Pluja: 0.0
2026-01-05 15:18:56 -    ✅ Període UTC: 05:00 - 05:30 | TX: 2.9 | TN: 2.8 | Pluja: 0.0
2026-01-05 15:18:56 -    ✅ Període UTC: 05:30 - 06:00 | TX: 3.0 | TN: 2.8 | Pluja: 0.0
2026-01-05 15:18:56 -    ✅ Període UTC: 06:00 - 06:30 | TX: 2.9 | TN: 2.7 | Pluja: 0.0
2026-01-05 15:18:56 -    ✅ Període UTC: 06:30 - 07:00 | TX: 2.9 | TN: 2.7 | Pluja: 0.0
2026-01-05 15:18:56 -    ✅ Període UTC: 07:00 - 07:30 | TX: 2.9 | TN: 2.8 | Pluja: 0.0
2026-01-05 15:18:56 -    ✅ Període UTC: 07:30 - 08:00 | TX: 3.0 | TN: 2.8 | Pluja: 0.0
2026-01-05 15:18:56 -    ✅ Període UTC: 08:00 - 08:30 | TX: 3.5 | TN: 3.0 | Pluja: 0.0
2026-01-05 15:18:56 -    ✅ Període UTC: 08:30 - 09:00 | TX: 3.9 | TN: 3.5 | Pluja: 0.0
2026-01-05 15:18:56 -    ✅ Període UTC: 09:00 - 09:30 | TX: 4.0 | TN: 3.9 | Pluja: 0.0
2026-01-05 15:18:56 -    ✅ Període UTC: 09:30 - 10:00 | TX: 4.6 | TN: 4.0 | Pluja: 0.0
2026-01-05 15:18:56 -    ✅ Període UTC: 10:00 - 10:30 | TX: 4.9 | TN: 4.6 | Pluja: 0.0
2026-01-05 15:18:56 -    ✅ Període UTC: 10:30 - 11:00 | TX: 5.7 | TN: 4.7 | Pluja: 0.0
2026-01-05 15:18:56 -    ✅ Període UTC: 11:00 - 11:30 | TX: 6.4 | TN: 5.6 | Pluja: 0.0
2026-01-05 15:18:56 -    ✅ Període UTC: 11:30 - 12:00 | TX: 6.6 | TN: 5.9 | Pluja: 0.0
2026-01-05 15:18:56 -    ✅ Període UTC: 12:00 - 12:30 | TX: 6.7 | TN: 6.4 | Pluja: 0.0
2026-01-05 15:18:56 -    ✅ Període UTC: 12:30 - 13:00 | TX: 8.6 | TN: 6.7 | Pluja: 0.0
2026-01-05 15:18:56 -    ✅ Període UTC: 13:00 - 13:30 | TX: 8.3 | TN: 7.6 | Pluja: 0.0
2026-01-05 15:18:56 -    ✅ Període UTC: 13:30 - 14:00 | TX: 7.6 | TN: 7.4 | Pluja: 0.0
2026-01-05 15:18:56 -    ✅ Període UTC: 14:00 - 14:30 | TX: 7.6 | TN: 7.4 | Pluja: 0.0
2026-01-05 15:18:56 -    ✅ Període UTC: 14:30 - 15:00 | TX: 7.5 | TN: 7.4 | Pluja: 0.0
2026-01-05 15:18:56 - 📈 Total períodes vàlids trobats: 30
2026-01-05 15:18:56 - 📊 RESUM CALCULAT:
2026-01-05 15:18:56 -    • Màxima del dia: 8.6°C
2026-01-05 15:18:56 -    • Mínima del dia: 2.6°C
2026-01-05 15:18:56 -    • Pluja acumulada: 0.0mm
2026-01-05 15:18:56 -    • Últim període: 14:30 - 15:00 UTC
2026-01-05 15:18:56 -    • Hora actualització: 15:18
2026-01-05 15:18:56 - 💾 Dades guardades a data/XJ_20260105.csv (30 registres)
2026-01-05 15:18:56 - ✅ Girona: 30 períodes processats
2026-01-05 15:18:56 - 💾 Dades guardades a data/weather_daily_20260105.json
2026-01-05 15:18:56 - 💾 Dades guardades a data/weather_summary.json
2026-01-05 15:18:56 - 
============================================================
2026-01-05 15:18:56 - 📋 RESUM FINAL DEL DIA (UTC)
2026-01-05 15:18:56 - ============================================================
2026-01-05 15:18:56 - 
📍 Fornells de la Selva:
2026-01-05 15:18:56 -    • Períodes: 30
2026-01-05 15:18:56 -    • Màxima: 7.8°C
2026-01-05 15:18:56 -    • Mínima: 2.7°C
2026-01-05 15:18:56 -    • Pluja: 0.0mm
2026-01-05 15:18:56 -    • Últim període: 14:30 - 15:00 UTC
2026-01-05 15:18:56 -    • Actualització: 15:18
2026-01-05 15:18:56 - 
📍 Girona:
2026-01-05 15:18:56 -    • Períodes: 30
2026-01-05 15:18:56 -    • Màxima: 8.6°C
2026-01-05 15:18:56 -    • Mínima: 2.6°C
2026-01-05 15:18:56 -    • Pluja: 0.0mm
2026-01-05 15:18:56 -    • Últim període: 14:30 - 15:00 UTC
2026-01-05 15:18:56 -    • Actualització: 15:18
2026-01-05 15:18:56 - 
💾 Fitxers generats:
2026-01-05 15:18:56 -    • data/weather_summary.json (per HTML)
2026-01-05 15:18:56 -    • data/weather_daily_YYYYMMDD.json (complet)
2026-01-05 15:18:56 -    • data/XX_YYYYMMDD.csv (per estació)
2026-01-05 15:18:56 - 
✅ PROCÉS COMPLETAT
2026-01-05 15:18:56 - ============================================================
