=== INICI DAILY SCRAPER (UTC): 2026-02-08 15:20:19 ===
2026-02-08 15:20:19 - ============================================================
2026-02-08 15:20:19 - 🌤️  DAILY WEATHER SCRAPER - VERSIÓ UTC
2026-02-08 15:20:19 - ============================================================
2026-02-08 15:20:19 - 
==================================================
2026-02-08 15:20:19 - 📡 Processant: Fornells de la Selva [UO]
2026-02-08 15:20:19 - 
🌐 Connectant a Fornells de la Selva...
2026-02-08 15:20:20 - 📊 Total files trobades a la taula: 31
2026-02-08 15:20:20 -    ✅ Període UTC: 00:00 - 00:30 | TX: 9.5 | TN: 8.8 | Pluja: 0.0
2026-02-08 15:20:20 -    ✅ Període UTC: 00:30 - 01:00 | TX: 9.4 | TN: 9.2 | Pluja: 0.0
2026-02-08 15:20:20 -    ✅ Període UTC: 01:00 - 01:30 | TX: 9.2 | TN: 8.0 | Pluja: 0.0
2026-02-08 15:20:20 -    ✅ Període UTC: 01:30 - 02:00 | TX: 8.2 | TN: 7.6 | Pluja: 0.0
2026-02-08 15:20:20 -    ✅ Període UTC: 02:00 - 02:30 | TX: 7.6 | TN: 7.3 | Pluja: 0.0
2026-02-08 15:20:20 -    ✅ Període UTC: 02:30 - 03:00 | TX: 7.3 | TN: 6.9 | Pluja: 0.2
2026-02-08 15:20:20 -    ✅ Període UTC: 03:00 - 03:30 | TX: 6.9 | TN: 6.7 | Pluja: 0.3
2026-02-08 15:20:20 -    ✅ Període UTC: 03:30 - 04:00 | TX: 7.0 | TN: 6.8 | Pluja: 0.2
2026-02-08 15:20:20 -    ✅ Període UTC: 04:00 - 04:30 | TX: 6.9 | TN: 6.0 | Pluja: 0.0
2026-02-08 15:20:20 -    ✅ Període UTC: 04:30 - 05:00 | TX: 6.0 | TN: 5.2 | Pluja: 0.0
2026-02-08 15:20:20 -    ✅ Període UTC: 05:00 - 05:30 | TX: 5.6 | TN: 4.7 | Pluja: 0.0
2026-02-08 15:20:20 -    ✅ Període UTC: 05:30 - 06:00 | TX: 4.9 | TN: 3.7 | Pluja: 0.0
2026-02-08 15:20:20 -    ✅ Període UTC: 06:00 - 06:30 | TX: 4.8 | TN: 3.7 | Pluja: 0.0
2026-02-08 15:20:20 -    ✅ Període UTC: 06:30 - 07:00 | TX: 4.0 | TN: 3.0 | Pluja: 0.0
2026-02-08 15:20:20 -    ✅ Període UTC: 07:00 - 07:30 | TX: 3.6 | TN: 2.7 | Pluja: 0.0
2026-02-08 15:20:20 -    ✅ Període UTC: 07:30 - 08:00 | TX: 5.1 | TN: 2.7 | Pluja: 0.0
2026-02-08 15:20:20 -    ✅ Període UTC: 08:00 - 08:30 | TX: 7.1 | TN: 5.1 | Pluja: 0.0
2026-02-08 15:20:20 -    ✅ Període UTC: 08:30 - 09:00 | TX: 9.7 | TN: 7.2 | Pluja: 0.0
2026-02-08 15:20:20 -    ✅ Període UTC: 09:00 - 09:30 | TX: 10.3 | TN: 9.8 | Pluja: 0.0
2026-02-08 15:20:20 -    ✅ Període UTC: 09:30 - 10:00 | TX: 10.8 | TN: 10.0 | Pluja: 0.0
2026-02-08 15:20:20 -    ✅ Període UTC: 10:00 - 10:30 | TX: 12.3 | TN: 10.8 | Pluja: 0.0
2026-02-08 15:20:20 -    ✅ Període UTC: 10:30 - 11:00 | TX: 12.9 | TN: 12.3 | Pluja: 0.0
2026-02-08 15:20:20 -    ✅ Període UTC: 11:00 - 11:30 | TX: 13.9 | TN: 12.8 | Pluja: 0.0
2026-02-08 15:20:20 -    ✅ Període UTC: 11:30 - 12:00 | TX: 14.6 | TN: 13.9 | Pluja: 0.0
2026-02-08 15:20:20 -    ✅ Període UTC: 12:00 - 12:30 | TX: 14.8 | TN: 14.3 | Pluja: 0.0
2026-02-08 15:20:20 -    ✅ Període UTC: 12:30 - 13:00 | TX: 15.0 | TN: 14.5 | Pluja: 0.0
2026-02-08 15:20:20 -    ✅ Període UTC: 13:00 - 13:30 | TX: 14.8 | TN: 13.9 | Pluja: 0.0
2026-02-08 15:20:20 -    ✅ Període UTC: 13:30 - 14:00 | TX: 14.3 | TN: 13.9 | Pluja: 0.0
2026-02-08 15:20:20 -    ✅ Període UTC: 14:00 - 14:30 | TX: 14.2 | TN: 12.8 | Pluja: 0.0
2026-02-08 15:20:20 -    ✅ Període UTC: 14:30 - 15:00 | TX: 12.8 | TN: 12.3 | Pluja: 0.0
2026-02-08 15:20:20 - 📈 Total períodes vàlids trobats: 30
2026-02-08 15:20:20 - 📊 RESUM CALCULAT:
2026-02-08 15:20:20 -    • Màxima del dia: 15.0°C
2026-02-08 15:20:20 -    • Mínima del dia: 2.7°C
2026-02-08 15:20:20 -    • Pluja acumulada: 0.7mm
2026-02-08 15:20:20 -    • Últim període: 14:30 - 15:00 UTC
2026-02-08 15:20:20 -    • Hora actualització: 15:20
2026-02-08 15:20:20 - 💾 Dades guardades a data/UO_20260208.csv (30 registres)
2026-02-08 15:20:20 - ✅ Fornells de la Selva: 30 períodes processats
2026-02-08 15:20:20 - 
==================================================
2026-02-08 15:20:20 - 📡 Processant: Girona [XJ]
2026-02-08 15:20:20 - 
🌐 Connectant a Girona...
2026-02-08 15:20:22 - 📊 Total files trobades a la taula: 31
2026-02-08 15:20:22 -    ✅ Període UTC: 00:00 - 00:30 | TX: 10.5 | TN: 8.8 | Pluja: 0.0
2026-02-08 15:20:22 -    ✅ Període UTC: 00:30 - 01:00 | TX: 10.5 | TN: 9.2 | Pluja: 0.0
2026-02-08 15:20:22 -    ✅ Període UTC: 01:00 - 01:30 | TX: 9.1 | TN: 7.5 | Pluja: 0.0
2026-02-08 15:20:22 -    ✅ Període UTC: 01:30 - 02:00 | TX: 7.4 | TN: 6.7 | Pluja: 0.0
2026-02-08 15:20:22 -    ✅ Període UTC: 02:00 - 02:30 | TX: 7.0 | TN: 6.8 | Pluja: 0.0
2026-02-08 15:20:22 -    ✅ Període UTC: 02:30 - 03:00 | TX: 7.9 | TN: 6.7 | Pluja: 0.0
2026-02-08 15:20:22 -    ✅ Període UTC: 03:00 - 03:30 | TX: 8.8 | TN: 8.1 | Pluja: 0.1
2026-02-08 15:20:22 -    ✅ Període UTC: 03:30 - 04:00 | TX: 8.6 | TN: 7.7 | Pluja: 0.1
2026-02-08 15:20:22 -    ✅ Període UTC: 04:00 - 04:30 | TX: 7.7 | TN: 7.2 | Pluja: 0.0
2026-02-08 15:20:22 -    ✅ Període UTC: 04:30 - 05:00 | TX: 7.6 | TN: 7.2 | Pluja: 0.0
2026-02-08 15:20:22 -    ✅ Període UTC: 05:00 - 05:30 | TX: 7.1 | TN: 6.4 | Pluja: 0.0
2026-02-08 15:20:22 -    ✅ Període UTC: 05:30 - 06:00 | TX: 7.2 | TN: 6.2 | Pluja: 0.0
2026-02-08 15:20:22 -    ✅ Període UTC: 06:00 - 06:30 | TX: 7.4 | TN: 5.5 | Pluja: 0.0
2026-02-08 15:20:22 -    ✅ Període UTC: 06:30 - 07:00 | TX: 5.5 | TN: 4.6 | Pluja: 0.0
2026-02-08 15:20:22 -    ✅ Període UTC: 07:00 - 07:30 | TX: 5.0 | TN: 4.2 | Pluja: 0.0
2026-02-08 15:20:22 -    ✅ Període UTC: 07:30 - 08:00 | TX: 7.4 | TN: 4.5 | Pluja: 0.0
2026-02-08 15:20:22 -    ✅ Període UTC: 08:00 - 08:30 | TX: 9.2 | TN: 7.6 | Pluja: 0.0
2026-02-08 15:20:22 -    ✅ Període UTC: 08:30 - 09:00 | TX: 10.4 | TN: 8.8 | Pluja: 0.2
2026-02-08 15:20:22 -    ✅ Període UTC: 09:00 - 09:30 | TX: 11.0 | TN: 10.0 | Pluja: 0.0
2026-02-08 15:20:22 -    ✅ Període UTC: 09:30 - 10:00 | TX: 12.9 | TN: 11.1 | Pluja: 0.0
2026-02-08 15:20:22 -    ✅ Període UTC: 10:00 - 10:30 | TX: 13.1 | TN: 12.6 | Pluja: 0.0
2026-02-08 15:20:22 -    ✅ Període UTC: 10:30 - 11:00 | TX: 14.3 | TN: 13.0 | Pluja: 0.0
2026-02-08 15:20:22 -    ✅ Període UTC: 11:00 - 11:30 | TX: 14.9 | TN: 14.1 | Pluja: 0.0
2026-02-08 15:20:22 -    ✅ Període UTC: 11:30 - 12:00 | TX: 15.1 | TN: 14.6 | Pluja: 0.0
2026-02-08 15:20:22 -    ✅ Període UTC: 12:00 - 12:30 | TX: 15.7 | TN: 15.1 | Pluja: 0.0
2026-02-08 15:20:22 -    ✅ Període UTC: 12:30 - 13:00 | TX: 16.0 | TN: 15.3 | Pluja: 0.0
2026-02-08 15:20:22 -    ✅ Període UTC: 13:00 - 13:30 | TX: 15.2 | TN: 14.7 | Pluja: 0.0
2026-02-08 15:20:22 -    ✅ Període UTC: 13:30 - 14:00 | TX: 15.2 | TN: 14.7 | Pluja: 0.0
2026-02-08 15:20:22 -    ✅ Període UTC: 14:00 - 14:30 | TX: 14.8 | TN: 13.4 | Pluja: 0.0
2026-02-08 15:20:22 -    ✅ Període UTC: 14:30 - 15:00 | TX: 13.5 | TN: 12.8 | Pluja: 0.0
2026-02-08 15:20:22 - 📈 Total períodes vàlids trobats: 30
2026-02-08 15:20:22 - 📊 RESUM CALCULAT:
2026-02-08 15:20:22 -    • Màxima del dia: 16.0°C
2026-02-08 15:20:22 -    • Mínima del dia: 4.2°C
2026-02-08 15:20:22 -    • Pluja acumulada: 0.4mm
2026-02-08 15:20:22 -    • Últim període: 14:30 - 15:00 UTC
2026-02-08 15:20:22 -    • Hora actualització: 15:20
2026-02-08 15:20:22 - 💾 Dades guardades a data/XJ_20260208.csv (30 registres)
2026-02-08 15:20:22 - ✅ Girona: 30 períodes processats
2026-02-08 15:20:22 - 💾 Dades guardades a data/weather_daily_20260208.json
2026-02-08 15:20:22 - 💾 Dades guardades a data/weather_summary.json
2026-02-08 15:20:22 - 
============================================================
2026-02-08 15:20:22 - 📋 RESUM FINAL DEL DIA (UTC)
2026-02-08 15:20:22 - ============================================================
2026-02-08 15:20:22 - 
📍 Fornells de la Selva:
2026-02-08 15:20:22 -    • Períodes: 30
2026-02-08 15:20:22 -    • Màxima: 15.0°C
2026-02-08 15:20:22 -    • Mínima: 2.7°C
2026-02-08 15:20:22 -    • Pluja: 0.7mm
2026-02-08 15:20:22 -    • Últim període: 14:30 - 15:00 UTC
2026-02-08 15:20:22 -    • Actualització: 15:20
2026-02-08 15:20:22 - 
📍 Girona:
2026-02-08 15:20:22 -    • Períodes: 30
2026-02-08 15:20:22 -    • Màxima: 16.0°C
2026-02-08 15:20:22 -    • Mínima: 4.2°C
2026-02-08 15:20:22 -    • Pluja: 0.4mm
2026-02-08 15:20:22 -    • Últim període: 14:30 - 15:00 UTC
2026-02-08 15:20:22 -    • Actualització: 15:20
2026-02-08 15:20:22 - 
💾 Fitxers generats:
2026-02-08 15:20:22 -    • data/weather_summary.json (per HTML)
2026-02-08 15:20:22 -    • data/weather_daily_YYYYMMDD.json (complet)
2026-02-08 15:20:22 -    • data/XX_YYYYMMDD.csv (per estació)
2026-02-08 15:20:22 - 
✅ PROCÉS COMPLETAT
2026-02-08 15:20:22 - ============================================================
