=== INICI DAILY SCRAPER (UTC): 2026-01-20 13:12:00 ===
2026-01-20 13:12:00 - ============================================================
2026-01-20 13:12:00 - 🌤️  DAILY WEATHER SCRAPER - VERSIÓ UTC
2026-01-20 13:12:00 - ============================================================
2026-01-20 13:12:00 - 
==================================================
2026-01-20 13:12:00 - 📡 Processant: Fornells de la Selva [UO]
2026-01-20 13:12:00 - 
🌐 Connectant a Fornells de la Selva...
2026-01-20 13:12:02 - 📊 Total files trobades a la taula: 27
2026-01-20 13:12:02 -    ✅ Període UTC: 00:00 - 00:30 | TX: 8.8 | TN: 8.7 | Pluja: 3.1
2026-01-20 13:12:02 -    ✅ Període UTC: 00:30 - 01:00 | TX: 8.7 | TN: 8.7 | Pluja: 5.0
2026-01-20 13:12:02 -    ✅ Període UTC: 01:00 - 01:30 | TX: 8.7 | TN: 8.5 | Pluja: 5.1
2026-01-20 13:12:02 -    ✅ Període UTC: 01:30 - 02:00 | TX: 8.5 | TN: 8.4 | Pluja: 3.9
2026-01-20 13:12:02 -    ✅ Període UTC: 02:00 - 02:30 | TX: 8.4 | TN: 8.2 | Pluja: 5.2
2026-01-20 13:12:02 -    ✅ Període UTC: 02:30 - 03:00 | TX: 8.2 | TN: 8.1 | Pluja: 4.3
2026-01-20 13:12:02 -    ✅ Període UTC: 03:00 - 03:30 | TX: 8.1 | TN: 8.0 | Pluja: 5.3
2026-01-20 13:12:02 -    ✅ Període UTC: 03:30 - 04:00 | TX: 8.0 | TN: 7.8 | Pluja: 3.5
2026-01-20 13:12:02 -    ✅ Període UTC: 04:00 - 04:30 | TX: 7.8 | TN: 7.5 | Pluja: 3.4
2026-01-20 13:12:02 -    ✅ Període UTC: 04:30 - 05:00 | TX: 7.5 | TN: 7.1 | Pluja: 3.3
2026-01-20 13:12:02 -    ✅ Període UTC: 05:00 - 05:30 | TX: 7.1 | TN: 6.7 | Pluja: 3.1
2026-01-20 13:12:02 -    ✅ Període UTC: 05:30 - 06:00 | TX: 6.7 | TN: 6.3 | Pluja: 3.6
2026-01-20 13:12:02 -    ✅ Període UTC: 06:00 - 06:30 | TX: 6.3 | TN: 6.2 | Pluja: 3.1
2026-01-20 13:12:02 -    ✅ Període UTC: 06:30 - 07:00 | TX: 6.2 | TN: 6.2 | Pluja: 2.2
2026-01-20 13:12:02 -    ✅ Període UTC: 07:00 - 07:30 | TX: 6.3 | TN: 6.2 | Pluja: 2.5
2026-01-20 13:12:02 -    ✅ Període UTC: 07:30 - 08:00 | TX: 6.5 | TN: 6.3 | Pluja: 2.6
2026-01-20 13:12:02 -    ✅ Període UTC: 08:00 - 08:30 | TX: 6.5 | TN: 6.5 | Pluja: 2.4
2026-01-20 13:12:02 -    ✅ Període UTC: 08:30 - 09:00 | TX: 6.7 | TN: 6.5 | Pluja: 2.5
2026-01-20 13:12:02 -    ✅ Període UTC: 09:00 - 09:30 | TX: 6.7 | TN: 6.7 | Pluja: 2.6
2026-01-20 13:12:02 -    ✅ Període UTC: 09:30 - 10:00 | TX: 6.8 | TN: 6.7 | Pluja: 3.1
2026-01-20 13:12:02 -    ✅ Període UTC: 10:00 - 10:30 | TX: 6.9 | TN: 6.8 | Pluja: 3.2
2026-01-20 13:12:02 -    ✅ Període UTC: 10:30 - 11:00 | TX: 7.1 | TN: 6.9 | Pluja: 2.2
2026-01-20 13:12:02 -    ✅ Període UTC: 11:00 - 11:30 | TX: 7.1 | TN: 7.1 | Pluja: 2.1
2026-01-20 13:12:02 -    ✅ Període UTC: 11:30 - 12:00 | TX: 7.4 | TN: 7.1 | Pluja: 1.2
2026-01-20 13:12:02 -    ✅ Període UTC: 12:00 - 12:30 | TX: 7.6 | TN: 7.4 | Pluja: 0.9
2026-01-20 13:12:02 -    ✅ Període UTC: 12:30 - 13:00 | TX: 7.7 | TN: 7.6 | Pluja: 0.7
2026-01-20 13:12:02 - 📈 Total períodes vàlids trobats: 26
2026-01-20 13:12:02 - 📊 RESUM CALCULAT:
2026-01-20 13:12:02 -    • Màxima del dia: 8.8°C
2026-01-20 13:12:02 -    • Mínima del dia: 6.2°C
2026-01-20 13:12:02 -    • Pluja acumulada: 80.1mm
2026-01-20 13:12:02 -    • Últim període: 12:30 - 13:00 UTC
2026-01-20 13:12:02 -    • Hora actualització: 13:12
2026-01-20 13:12:02 - 💾 Dades guardades a data/UO_20260120.csv (26 registres)
2026-01-20 13:12:02 - ✅ Fornells de la Selva: 26 períodes processats
2026-01-20 13:12:02 - 
==================================================
2026-01-20 13:12:02 - 📡 Processant: Girona [XJ]
2026-01-20 13:12:02 - 
🌐 Connectant a Girona...
2026-01-20 13:12:04 - 📊 Total files trobades a la taula: 27
2026-01-20 13:12:04 -    ✅ Període UTC: 00:00 - 00:30 | TX: 8.7 | TN: 8.5 | Pluja: 2.9
2026-01-20 13:12:04 -    ✅ Període UTC: 00:30 - 01:00 | TX: 8.5 | TN: 8.5 | Pluja: 3.4
2026-01-20 13:12:04 -    ✅ Període UTC: 01:00 - 01:30 | TX: 8.5 | TN: 8.4 | Pluja: 4.6
2026-01-20 13:12:04 -    ✅ Període UTC: 01:30 - 02:00 | TX: 8.4 | TN: 8.4 | Pluja: 3.4
2026-01-20 13:12:04 -    ✅ Període UTC: 02:00 - 02:30 | TX: 8.4 | TN: 8.2 | Pluja: 3.9
2026-01-20 13:12:04 -    ✅ Període UTC: 02:30 - 03:00 | TX: 8.2 | TN: 8.1 | Pluja: 3.7
2026-01-20 13:12:04 -    ✅ Període UTC: 03:00 - 03:30 | TX: 8.1 | TN: 7.8 | Pluja: 4.2
2026-01-20 13:12:04 -    ✅ Període UTC: 03:30 - 04:00 | TX: 7.8 | TN: 7.6 | Pluja: 3.9
2026-01-20 13:12:04 -    ✅ Període UTC: 04:00 - 04:30 | TX: 7.6 | TN: 7.1 | Pluja: 3.6
2026-01-20 13:12:04 -    ✅ Període UTC: 04:30 - 05:00 | TX: 7.1 | TN: 6.7 | Pluja: 3.2
2026-01-20 13:12:04 -    ✅ Període UTC: 05:00 - 05:30 | TX: 6.7 | TN: 6.3 | Pluja: 3.3
2026-01-20 13:12:04 -    ✅ Període UTC: 05:30 - 06:00 | TX: 6.3 | TN: 6.1 | Pluja: 3.7
2026-01-20 13:12:04 -    ✅ Període UTC: 06:00 - 06:30 | TX: 6.1 | TN: 6.0 | Pluja: 3.4
2026-01-20 13:12:04 -    ✅ Període UTC: 06:30 - 07:00 | TX: 6.2 | TN: 6.0 | Pluja: 2.6
2026-01-20 13:12:04 -    ✅ Període UTC: 07:00 - 07:30 | TX: 6.3 | TN: 6.2 | Pluja: 2.9
2026-01-20 13:12:04 -    ✅ Període UTC: 07:30 - 08:00 | TX: 6.5 | TN: 6.3 | Pluja: 3.3
2026-01-20 13:12:04 -    ✅ Període UTC: 08:00 - 08:30 | TX: 6.5 | TN: 6.4 | Pluja: 2.6
2026-01-20 13:12:04 -    ✅ Període UTC: 08:30 - 09:00 | TX: 6.7 | TN: 6.5 | Pluja: 2.9
2026-01-20 13:12:04 -    ✅ Període UTC: 09:00 - 09:30 | TX: 6.8 | TN: 6.7 | Pluja: 2.9
2026-01-20 13:12:04 -    ✅ Període UTC: 09:30 - 10:00 | TX: 6.9 | TN: 6.8 | Pluja: 3.1
2026-01-20 13:12:04 -    ✅ Període UTC: 10:00 - 10:30 | TX: 7.0 | TN: 6.9 | Pluja: 3.4
2026-01-20 13:12:04 -    ✅ Període UTC: 10:30 - 11:00 | TX: 7.2 | TN: 7.0 | Pluja: 3.0
2026-01-20 13:12:04 -    ✅ Període UTC: 11:00 - 11:30 | TX: 7.3 | TN: 7.2 | Pluja: 3.1
2026-01-20 13:12:04 -    ✅ Període UTC: 11:30 - 12:00 | TX: 7.6 | TN: 7.3 | Pluja: 1.8
2026-01-20 13:12:04 -    ✅ Període UTC: 12:00 - 12:30 | TX: 7.7 | TN: 7.5 | Pluja: 1.2
2026-01-20 13:12:04 -    ✅ Període UTC: 12:30 - 13:00 | TX: 7.8 | TN: 7.6 | Pluja: 1.2
2026-01-20 13:12:04 - 📈 Total períodes vàlids trobats: 26
2026-01-20 13:12:04 - 📊 RESUM CALCULAT:
2026-01-20 13:12:04 -    • Màxima del dia: 8.7°C
2026-01-20 13:12:04 -    • Mínima del dia: 6.0°C
2026-01-20 13:12:04 -    • Pluja acumulada: 81.19999999999999mm
2026-01-20 13:12:04 -    • Últim període: 12:30 - 13:00 UTC
2026-01-20 13:12:04 -    • Hora actualització: 13:12
2026-01-20 13:12:04 - 💾 Dades guardades a data/XJ_20260120.csv (26 registres)
2026-01-20 13:12:04 - ✅ Girona: 26 períodes processats
2026-01-20 13:12:04 - 💾 Dades guardades a data/weather_daily_20260120.json
2026-01-20 13:12:04 - 💾 Dades guardades a data/weather_summary.json
2026-01-20 13:12:04 - 
============================================================
2026-01-20 13:12:04 - 📋 RESUM FINAL DEL DIA (UTC)
2026-01-20 13:12:04 - ============================================================
2026-01-20 13:12:04 - 
📍 Fornells de la Selva:
2026-01-20 13:12:04 -    • Períodes: 26
2026-01-20 13:12:04 -    • Màxima: 8.8°C
2026-01-20 13:12:04 -    • Mínima: 6.2°C
2026-01-20 13:12:04 -    • Pluja: 80.1mm
2026-01-20 13:12:04 -    • Últim període: 12:30 - 13:00 UTC
2026-01-20 13:12:04 -    • Actualització: 13:12
2026-01-20 13:12:04 - 
📍 Girona:
2026-01-20 13:12:04 -    • Períodes: 26
2026-01-20 13:12:04 -    • Màxima: 8.7°C
2026-01-20 13:12:04 -    • Mínima: 6.0°C
2026-01-20 13:12:04 -    • Pluja: 81.19999999999999mm
2026-01-20 13:12:04 -    • Últim període: 12:30 - 13:00 UTC
2026-01-20 13:12:04 -    • Actualització: 13:12
2026-01-20 13:12:04 - 
💾 Fitxers generats:
2026-01-20 13:12:04 -    • data/weather_summary.json (per HTML)
2026-01-20 13:12:04 -    • data/weather_daily_YYYYMMDD.json (complet)
2026-01-20 13:12:04 -    • data/XX_YYYYMMDD.csv (per estació)
2026-01-20 13:12:04 - 
✅ PROCÉS COMPLETAT
2026-01-20 13:12:04 - ============================================================
