=== INICI DAILY SCRAPER (UTC): 2025-12-21 23:40:39 ===
2025-12-21 23:40:39 - ============================================================
2025-12-21 23:40:39 - 🌤️  DAILY WEATHER SCRAPER - VERSIÓ UTC
2025-12-21 23:40:39 - ============================================================
2025-12-21 23:40:39 - 
==================================================
2025-12-21 23:40:39 - 📡 Processant: Fornells de la Selva [UO]
2025-12-21 23:40:39 - 
🌐 Connectant a Fornells de la Selva...
2025-12-21 23:40:39 - 📊 Total files trobades a la taula: 48
2025-12-21 23:40:39 -    ✅ Període UTC: 00:00 - 00:30 | TX: 12.2 | TN: 12.1 | Pluja: 3.9
2025-12-21 23:40:39 -    ✅ Període UTC: 00:30 - 01:00 | TX: 12.1 | TN: 12.1 | Pluja: 3.0
2025-12-21 23:40:39 -    ✅ Període UTC: 01:00 - 01:30 | TX: 12.1 | TN: 12.1 | Pluja: 2.7
2025-12-21 23:40:39 -    ✅ Període UTC: 01:30 - 02:00 | TX: 12.1 | TN: 12.0 | Pluja: 3.8
2025-12-21 23:40:39 -    ✅ Període UTC: 02:00 - 02:30 | TX: 12.0 | TN: 11.9 | Pluja: 3.5
2025-12-21 23:40:39 -    ✅ Període UTC: 02:30 - 03:00 | TX: 11.9 | TN: 11.8 | Pluja: 0.8
2025-12-21 23:40:39 -    ✅ Període UTC: 03:00 - 03:30 | TX: 11.8 | TN: 11.8 | Pluja: 4.4
2025-12-21 23:40:39 -    ✅ Període UTC: 03:30 - 04:00 | TX: 11.8 | TN: 11.7 | Pluja: 2.4
2025-12-21 23:40:39 -    ✅ Període UTC: 04:00 - 04:30 | TX: 11.7 | TN: 11.6 | Pluja: 0.6
2025-12-21 23:40:39 -    ✅ Període UTC: 04:30 - 05:00 | TX: 11.6 | TN: 11.6 | Pluja: 0.6
2025-12-21 23:40:39 -    ✅ Període UTC: 05:00 - 05:30 | TX: 11.6 | TN: 11.5 | Pluja: 0.3
2025-12-21 23:40:39 -    ✅ Període UTC: 05:30 - 06:00 | TX: 11.5 | TN: 11.4 | Pluja: 0.1
2025-12-21 23:40:39 -    ✅ Període UTC: 06:00 - 06:30 | TX: 11.4 | TN: 11.2 | Pluja: 0.0
2025-12-21 23:40:39 -    ✅ Període UTC: 06:30 - 07:00 | TX: 11.2 | TN: 10.9 | Pluja: 0.0
2025-12-21 23:40:39 -    ✅ Període UTC: 07:00 - 07:30 | TX: 11.1 | TN: 10.8 | Pluja: 0.0
2025-12-21 23:40:39 -    ✅ Període UTC: 07:30 - 08:00 | TX: 10.9 | TN: 10.7 | Pluja: 0.0
2025-12-21 23:40:39 -    ✅ Període UTC: 08:00 - 08:30 | TX: 11.2 | TN: 10.9 | Pluja: 0.0
2025-12-21 23:40:39 -    ✅ Període UTC: 08:30 - 09:00 | TX: 11.3 | TN: 11.1 | Pluja: 0.0
2025-12-21 23:40:39 -    ✅ Període UTC: 09:00 - 09:30 | TX: 11.6 | TN: 11.2 | Pluja: 0.0
2025-12-21 23:40:39 -    ✅ Període UTC: 09:30 - 10:00 | TX: 12.4 | TN: 11.7 | Pluja: 0.0
2025-12-21 23:40:39 -    ✅ Període UTC: 10:00 - 10:30 | TX: 13.5 | TN: 12.5 | Pluja: 0.0
2025-12-21 23:40:39 -    ✅ Període UTC: 10:30 - 11:00 | TX: 14.4 | TN: 13.4 | Pluja: 0.0
2025-12-21 23:40:39 -    ✅ Període UTC: 11:00 - 11:30 | TX: 15.0 | TN: 14.2 | Pluja: 0.0
2025-12-21 23:40:39 -    ✅ Període UTC: 11:30 - 12:00 | TX: 15.2 | TN: 14.6 | Pluja: 0.0
2025-12-21 23:40:39 -    ✅ Període UTC: 12:00 - 12:30 | TX: 15.2 | TN: 14.9 | Pluja: 0.0
2025-12-21 23:40:39 -    ✅ Període UTC: 12:30 - 13:00 | TX: 15.3 | TN: 14.6 | Pluja: 0.0
2025-12-21 23:40:39 -    ✅ Període UTC: 13:00 - 13:30 | TX: 15.3 | TN: 14.4 | Pluja: 0.0
2025-12-21 23:40:39 -    ✅ Període UTC: 13:30 - 14:00 | TX: 14.4 | TN: 14.1 | Pluja: 0.0
2025-12-21 23:40:39 -    ✅ Període UTC: 14:00 - 14:30 | TX: 14.8 | TN: 14.2 | Pluja: 0.0
2025-12-21 23:40:39 -    ✅ Període UTC: 14:30 - 15:00 | TX: 14.8 | TN: 14.3 | Pluja: 0.0
2025-12-21 23:40:39 -    ✅ Període UTC: 15:00 - 15:30 | TX: 14.2 | TN: 13.4 | Pluja: 0.0
2025-12-21 23:40:39 -    ✅ Període UTC: 15:30 - 16:00 | TX: 13.4 | TN: 12.9 | Pluja: 0.0
2025-12-21 23:40:39 -    ✅ Període UTC: 16:00 - 16:30 | TX: 12.9 | TN: 12.2 | Pluja: 0.0
2025-12-21 23:40:39 -    ✅ Període UTC: 16:30 - 17:00 | TX: 12.2 | TN: 11.7 | Pluja: 0.0
2025-12-21 23:40:39 -    ✅ Període UTC: 17:00 - 17:30 | TX: 11.9 | TN: 11.6 | Pluja: 0.0
2025-12-21 23:40:39 -    ✅ Període UTC: 17:30 - 18:00 | TX: 12.2 | TN: 11.8 | Pluja: 0.0
2025-12-21 23:40:39 -    ✅ Període UTC: 18:00 - 18:30 | TX: 11.8 | TN: 11.0 | Pluja: 0.0
2025-12-21 23:40:39 -    ✅ Període UTC: 18:30 - 19:00 | TX: 11.2 | TN: 10.8 | Pluja: 0.0
2025-12-21 23:40:39 -    ✅ Període UTC: 19:00 - 19:30 | TX: 10.8 | TN: 10.6 | Pluja: 0.0
2025-12-21 23:40:39 -    ✅ Període UTC: 19:30 - 20:00 | TX: 11.3 | TN: 10.6 | Pluja: 0.0
2025-12-21 23:40:39 -    ✅ Període UTC: 20:00 - 20:30 | TX: 11.3 | TN: 10.8 | Pluja: 0.0
2025-12-21 23:40:39 -    ✅ Període UTC: 20:30 - 21:00 | TX: 10.8 | TN: 10.3 | Pluja: 0.0
2025-12-21 23:40:39 -    ✅ Període UTC: 21:00 - 21:30 | TX: 10.2 | TN: 9.1 | Pluja: 0.0
2025-12-21 23:40:39 -    ✅ Període UTC: 21:30 - 22:00 | TX: 9.5 | TN: 9.1 | Pluja: 0.0
2025-12-21 23:40:39 -    ✅ Període UTC: 22:00 - 22:30 | TX: 9.3 | TN: 8.9 | Pluja: 0.0
2025-12-21 23:40:39 -    ✅ Període UTC: 22:30 - 23:00 | TX: 9.0 | TN: 8.6 | Pluja: 0.0
2025-12-21 23:40:39 -    ✅ Període UTC: 23:00 - 23:30 | TX: 9.1 | TN: 8.3 | Pluja: 0.0
2025-12-21 23:40:39 - 📈 Total períodes vàlids trobats: 47
2025-12-21 23:40:39 - 📊 RESUM CALCULAT:
2025-12-21 23:40:39 -    • Màxima del dia: 15.3°C
2025-12-21 23:40:39 -    • Mínima del dia: 8.3°C
2025-12-21 23:40:39 -    • Pluja acumulada: 26.100000000000005mm
2025-12-21 23:40:39 -    • Últim període: 23:00 - 23:30 UTC
2025-12-21 23:40:39 -    • Hora actualització: 23:40
2025-12-21 23:40:39 - 💾 Dades guardades a data/UO_20251221.csv (47 registres)
2025-12-21 23:40:39 - ✅ Fornells de la Selva: 47 períodes processats
2025-12-21 23:40:39 - 
==================================================
2025-12-21 23:40:39 - 📡 Processant: Girona [XJ]
2025-12-21 23:40:39 - 
🌐 Connectant a Girona...
2025-12-21 23:40:39 - 📊 Total files trobades a la taula: 48
2025-12-21 23:40:39 -    ✅ Període UTC: 00:00 - 00:30 | TX: 12.1 | TN: 12.1 | Pluja: 2.9
2025-12-21 23:40:39 -    ✅ Període UTC: 00:30 - 01:00 | TX: 12.1 | TN: 11.9 | Pluja: 1.9
2025-12-21 23:40:39 -    ✅ Període UTC: 01:00 - 01:30 | TX: 11.9 | TN: 11.8 | Pluja: 1.6
2025-12-21 23:40:39 -    ✅ Període UTC: 01:30 - 02:00 | TX: 11.9 | TN: 11.8 | Pluja: 0.4
2025-12-21 23:40:39 -    ✅ Període UTC: 02:00 - 02:30 | TX: 11.8 | TN: 11.7 | Pluja: 0.0
2025-12-21 23:40:39 -    ✅ Període UTC: 02:30 - 03:00 | TX: 11.8 | TN: 11.7 | Pluja: 0.0
2025-12-21 23:40:39 -    ✅ Període UTC: 03:00 - 03:30 | TX: 11.7 | TN: 11.6 | Pluja: 0.1
2025-12-21 23:40:39 -    ✅ Període UTC: 03:30 - 04:00 | TX: 11.7 | TN: 11.6 | Pluja: 1.1
2025-12-21 23:40:39 -    ✅ Període UTC: 04:00 - 04:30 | TX: 11.6 | TN: 11.5 | Pluja: 0.1
2025-12-21 23:40:39 -    ✅ Període UTC: 04:30 - 05:00 | TX: 11.6 | TN: 11.5 | Pluja: 0.1
2025-12-21 23:40:39 -    ✅ Període UTC: 05:00 - 05:30 | TX: 11.5 | TN: 11.4 | Pluja: 0.1
2025-12-21 23:40:39 -    ✅ Període UTC: 05:30 - 06:00 | TX: 11.3 | TN: 11.2 | Pluja: 0.1
2025-12-21 23:40:39 -    ✅ Període UTC: 06:00 - 06:30 | TX: 11.2 | TN: 11.1 | Pluja: 0.0
2025-12-21 23:40:39 -    ✅ Període UTC: 06:30 - 07:00 | TX: 11.1 | TN: 10.6 | Pluja: 0.0
2025-12-21 23:40:39 -    ✅ Període UTC: 07:00 - 07:30 | TX: 10.8 | TN: 10.7 | Pluja: 0.0
2025-12-21 23:40:39 -    ✅ Període UTC: 07:30 - 08:00 | TX: 11.1 | TN: 10.8 | Pluja: 0.0
2025-12-21 23:40:39 -    ✅ Període UTC: 08:00 - 08:30 | TX: 11.2 | TN: 11.1 | Pluja: 0.0
2025-12-21 23:40:39 -    ✅ Període UTC: 08:30 - 09:00 | TX: 11.5 | TN: 11.2 | Pluja: 0.0
2025-12-21 23:40:39 -    ✅ Període UTC: 09:00 - 09:30 | TX: 11.5 | TN: 11.3 | Pluja: 0.0
2025-12-21 23:40:39 -    ✅ Període UTC: 09:30 - 10:00 | TX: 11.9 | TN: 11.3 | Pluja: 0.0
2025-12-21 23:40:39 -    ✅ Període UTC: 10:00 - 10:30 | TX: 13.0 | TN: 11.8 | Pluja: 0.0
2025-12-21 23:40:39 -    ✅ Període UTC: 10:30 - 11:00 | TX: 13.4 | TN: 12.7 | Pluja: 0.0
2025-12-21 23:40:39 -    ✅ Període UTC: 11:00 - 11:30 | TX: 14.8 | TN: 13.4 | Pluja: 0.0
2025-12-21 23:40:39 -    ✅ Període UTC: 11:30 - 12:00 | TX: 15.3 | TN: 14.7 | Pluja: 0.0
2025-12-21 23:40:39 -    ✅ Període UTC: 12:00 - 12:30 | TX: 15.4 | TN: 15.1 | Pluja: 0.0
2025-12-21 23:40:39 -    ✅ Període UTC: 12:30 - 13:00 | TX: 15.2 | TN: 14.9 | Pluja: 0.0
2025-12-21 23:40:39 -    ✅ Període UTC: 13:00 - 13:30 | TX: 15.7 | TN: 14.9 | Pluja: 0.0
2025-12-21 23:40:39 -    ✅ Període UTC: 13:30 - 14:00 | TX: 15.6 | TN: 14.5 | Pluja: 0.0
2025-12-21 23:40:39 -    ✅ Període UTC: 14:00 - 14:30 | TX: 15.8 | TN: 14.7 | Pluja: 0.0
2025-12-21 23:40:39 -    ✅ Període UTC: 14:30 - 15:00 | TX: 15.7 | TN: 14.8 | Pluja: 0.0
2025-12-21 23:40:39 -    ✅ Període UTC: 15:00 - 15:30 | TX: 14.8 | TN: 14.0 | Pluja: 0.0
2025-12-21 23:40:39 -    ✅ Període UTC: 15:30 - 16:00 | TX: 14.0 | TN: 13.3 | Pluja: 0.0
2025-12-21 23:40:39 -    ✅ Període UTC: 16:00 - 16:30 | TX: 13.3 | TN: 12.8 | Pluja: 0.0
2025-12-21 23:40:39 -    ✅ Període UTC: 16:30 - 17:00 | TX: 12.8 | TN: 12.4 | Pluja: 0.0
2025-12-21 23:40:39 -    ✅ Període UTC: 17:00 - 17:30 | TX: 12.4 | TN: 12.1 | Pluja: 0.0
2025-12-21 23:40:39 -    ✅ Període UTC: 17:30 - 18:00 | TX: 12.3 | TN: 12.1 | Pluja: 0.0
2025-12-21 23:40:39 -    ✅ Període UTC: 18:00 - 18:30 | TX: 12.4 | TN: 12.2 | Pluja: 0.0
2025-12-21 23:40:39 -    ✅ Període UTC: 18:30 - 19:00 | TX: 12.2 | TN: 11.9 | Pluja: 0.0
2025-12-21 23:40:39 -    ✅ Període UTC: 19:00 - 19:30 | TX: 12.0 | TN: 10.6 | Pluja: 0.0
2025-12-21 23:40:39 -    ✅ Període UTC: 19:30 - 20:00 | TX: 10.6 | TN: 9.8 | Pluja: 0.0
2025-12-21 23:40:39 -    ✅ Període UTC: 20:00 - 20:30 | TX: 9.8 | TN: 9.6 | Pluja: 0.0
2025-12-21 23:40:39 -    ✅ Període UTC: 20:30 - 21:00 | TX: 9.7 | TN: 9.1 | Pluja: 0.0
2025-12-21 23:40:39 -    ✅ Període UTC: 21:00 - 21:30 | TX: 9.1 | TN: 8.4 | Pluja: 0.0
2025-12-21 23:40:39 -    ✅ Període UTC: 21:30 - 22:00 | TX: 8.4 | TN: 8.1 | Pluja: 0.0
2025-12-21 23:40:39 -    ✅ Període UTC: 22:00 - 22:30 | TX: 8.5 | TN: 8.1 | Pluja: 0.0
2025-12-21 23:40:39 -    ✅ Període UTC: 22:30 - 23:00 | TX: 8.7 | TN: 8.4 | Pluja: 0.0
2025-12-21 23:40:39 -    ✅ Període UTC: 23:00 - 23:30 | TX: 8.7 | TN: 8.3 | Pluja: 0.0
2025-12-21 23:40:39 - 📈 Total períodes vàlids trobats: 47
2025-12-21 23:40:39 - 📊 RESUM CALCULAT:
2025-12-21 23:40:39 -    • Màxima del dia: 15.8°C
2025-12-21 23:40:39 -    • Mínima del dia: 8.1°C
2025-12-21 23:40:39 -    • Pluja acumulada: 8.399999999999999mm
2025-12-21 23:40:39 -    • Últim període: 23:00 - 23:30 UTC
2025-12-21 23:40:39 -    • Hora actualització: 23:40
2025-12-21 23:40:39 - 💾 Dades guardades a data/XJ_20251221.csv (47 registres)
2025-12-21 23:40:39 - ✅ Girona: 47 períodes processats
2025-12-21 23:40:39 - 💾 Dades guardades a data/weather_daily_20251221.json
2025-12-21 23:40:39 - 💾 Dades guardades a data/weather_summary.json
2025-12-21 23:40:39 - 
============================================================
2025-12-21 23:40:39 - 📋 RESUM FINAL DEL DIA (UTC)
2025-12-21 23:40:39 - ============================================================
2025-12-21 23:40:39 - 
📍 Fornells de la Selva:
2025-12-21 23:40:39 -    • Períodes: 47
2025-12-21 23:40:39 -    • Màxima: 15.3°C
2025-12-21 23:40:39 -    • Mínima: 8.3°C
2025-12-21 23:40:39 -    • Pluja: 26.100000000000005mm
2025-12-21 23:40:39 -    • Últim període: 23:00 - 23:30 UTC
2025-12-21 23:40:39 -    • Actualització: 23:40
2025-12-21 23:40:39 - 
📍 Girona:
2025-12-21 23:40:39 -    • Períodes: 47
2025-12-21 23:40:39 -    • Màxima: 15.8°C
2025-12-21 23:40:39 -    • Mínima: 8.1°C
2025-12-21 23:40:39 -    • Pluja: 8.399999999999999mm
2025-12-21 23:40:39 -    • Últim període: 23:00 - 23:30 UTC
2025-12-21 23:40:39 -    • Actualització: 23:40
2025-12-21 23:40:39 - 
💾 Fitxers generats:
2025-12-21 23:40:39 -    • data/weather_summary.json (per HTML)
2025-12-21 23:40:39 -    • data/weather_daily_YYYYMMDD.json (complet)
2025-12-21 23:40:39 -    • data/XX_YYYYMMDD.csv (per estació)
2025-12-21 23:40:39 - 
✅ PROCÉS COMPLETAT
2025-12-21 23:40:39 - ============================================================
