=== INICI DAILY SCRAPER (UTC): 2025-12-30 19:20:17 ===
2025-12-30 19:20:17 - ============================================================
2025-12-30 19:20:17 - 🌤️  DAILY WEATHER SCRAPER - VERSIÓ UTC
2025-12-30 19:20:17 - ============================================================
2025-12-30 19:20:17 - 
==================================================
2025-12-30 19:20:17 - 📡 Processant: Fornells de la Selva [UO]
2025-12-30 19:20:17 - 
🌐 Connectant a Fornells de la Selva...
2025-12-30 19:20:19 - 📊 Total files trobades a la taula: 39
2025-12-30 19:20:19 -    ✅ Període UTC: 00:00 - 00:30 | TX: 3.1 | TN: 2.8 | Pluja: 0.0
2025-12-30 19:20:19 -    ✅ Període UTC: 00:30 - 01:00 | TX: 3.0 | TN: 2.4 | Pluja: 0.0
2025-12-30 19:20:19 -    ✅ Període UTC: 01:00 - 01:30 | TX: 2.8 | TN: 2.7 | Pluja: 0.0
2025-12-30 19:20:19 -    ✅ Període UTC: 01:30 - 02:00 | TX: 2.7 | TN: 2.4 | Pluja: 0.0
2025-12-30 19:20:19 -    ✅ Període UTC: 02:00 - 02:30 | TX: 2.5 | TN: 2.1 | Pluja: 0.0
2025-12-30 19:20:19 -    ✅ Període UTC: 02:30 - 03:00 | TX: 2.4 | TN: 2.2 | Pluja: 0.0
2025-12-30 19:20:19 -    ✅ Període UTC: 03:00 - 03:30 | TX: 2.3 | TN: 2.0 | Pluja: 0.0
2025-12-30 19:20:19 -    ✅ Període UTC: 03:30 - 04:00 | TX: 2.3 | TN: 2.1 | Pluja: 0.0
2025-12-30 19:20:19 -    ✅ Període UTC: 04:00 - 04:30 | TX: 2.3 | TN: 1.6 | Pluja: 0.0
2025-12-30 19:20:19 -    ✅ Període UTC: 04:30 - 05:00 | TX: 1.8 | TN: 1.7 | Pluja: 0.0
2025-12-30 19:20:19 -    ✅ Període UTC: 05:00 - 05:30 | TX: 1.8 | TN: 1.7 | Pluja: 0.0
2025-12-30 19:20:19 -    ✅ Període UTC: 05:30 - 06:00 | TX: 1.7 | TN: 1.6 | Pluja: 0.0
2025-12-30 19:20:19 -    ✅ Període UTC: 06:00 - 06:30 | TX: 1.7 | TN: 1.5 | Pluja: 0.0
2025-12-30 19:20:19 -    ✅ Període UTC: 06:30 - 07:00 | TX: 1.5 | TN: 1.3 | Pluja: 0.0
2025-12-30 19:20:19 -    ✅ Període UTC: 07:00 - 07:30 | TX: 1.3 | TN: 1.2 | Pluja: 0.1
2025-12-30 19:20:19 -    ✅ Període UTC: 07:30 - 08:00 | TX: 1.5 | TN: 1.2 | Pluja: 0.0
2025-12-30 19:20:19 -    ✅ Període UTC: 08:00 - 08:30 | TX: 2.0 | TN: 1.5 | Pluja: 0.0
2025-12-30 19:20:19 -    ✅ Període UTC: 08:30 - 09:00 | TX: 2.9 | TN: 2.0 | Pluja: 0.0
2025-12-30 19:20:19 -    ✅ Període UTC: 09:00 - 09:30 | TX: 4.1 | TN: 3.0 | Pluja: 0.0
2025-12-30 19:20:19 -    ✅ Període UTC: 09:30 - 10:00 | TX: 6.0 | TN: 4.2 | Pluja: 0.0
2025-12-30 19:20:19 -    ✅ Període UTC: 10:00 - 10:30 | TX: 7.9 | TN: 6.1 | Pluja: 0.0
2025-12-30 19:20:19 -    ✅ Període UTC: 10:30 - 11:00 | TX: 9.7 | TN: 7.9 | Pluja: 0.0
2025-12-30 19:20:19 -    ✅ Període UTC: 11:00 - 11:30 | TX: 11.8 | TN: 9.5 | Pluja: 0.0
2025-12-30 19:20:19 -    ✅ Període UTC: 11:30 - 12:00 | TX: 13.5 | TN: 11.9 | Pluja: 0.0
2025-12-30 19:20:19 -    ✅ Període UTC: 12:00 - 12:30 | TX: 14.3 | TN: 13.2 | Pluja: 0.0
2025-12-30 19:20:19 -    ✅ Període UTC: 12:30 - 13:00 | TX: 15.1 | TN: 13.9 | Pluja: 0.0
2025-12-30 19:20:19 -    ✅ Període UTC: 13:00 - 13:30 | TX: 15.5 | TN: 14.5 | Pluja: 0.0
2025-12-30 19:20:19 -    ✅ Període UTC: 13:30 - 14:00 | TX: 16.2 | TN: 14.3 | Pluja: 0.0
2025-12-30 19:20:19 -    ✅ Període UTC: 14:00 - 14:30 | TX: 16.2 | TN: 14.3 | Pluja: 0.0
2025-12-30 19:20:19 -    ✅ Període UTC: 14:30 - 15:00 | TX: 16.2 | TN: 14.3 | Pluja: 0.0
2025-12-30 19:20:19 -    ✅ Període UTC: 15:00 - 15:30 | TX: 14.8 | TN: 12.7 | Pluja: 0.0
2025-12-30 19:20:19 -    ✅ Període UTC: 15:30 - 16:00 | TX: 12.6 | TN: 11.4 | Pluja: 0.0
2025-12-30 19:20:19 -    ✅ Període UTC: 16:00 - 16:30 | TX: 11.6 | TN: 10.2 | Pluja: 0.0
2025-12-30 19:20:19 -    ✅ Període UTC: 16:30 - 17:00 | TX: 10.0 | TN: 7.7 | Pluja: 0.0
2025-12-30 19:20:19 -    ✅ Període UTC: 17:00 - 17:30 | TX: 7.9 | TN: 6.2 | Pluja: 0.0
2025-12-30 19:20:19 -    ✅ Període UTC: 17:30 - 18:00 | TX: 6.9 | TN: 5.0 | Pluja: 0.0
2025-12-30 19:20:19 -    ✅ Període UTC: 18:00 - 18:30 | TX: 5.8 | TN: 4.7 | Pluja: 0.0
2025-12-30 19:20:19 -    ✅ Període UTC: 18:30 - 19:00 | TX: 5.1 | TN: 4.4 | Pluja: 0.0
2025-12-30 19:20:19 - 📈 Total períodes vàlids trobats: 38
2025-12-30 19:20:19 - 📊 RESUM CALCULAT:
2025-12-30 19:20:19 -    • Màxima del dia: 16.2°C
2025-12-30 19:20:19 -    • Mínima del dia: 1.2°C
2025-12-30 19:20:19 -    • Pluja acumulada: 0.1mm
2025-12-30 19:20:19 -    • Últim període: 18:30 - 19:00 UTC
2025-12-30 19:20:19 -    • Hora actualització: 19:20
2025-12-30 19:20:19 - 💾 Dades guardades a data/UO_20251230.csv (38 registres)
2025-12-30 19:20:19 - ✅ Fornells de la Selva: 38 períodes processats
2025-12-30 19:20:19 - 
==================================================
2025-12-30 19:20:19 - 📡 Processant: Girona [XJ]
2025-12-30 19:20:19 - 
🌐 Connectant a Girona...
2025-12-30 19:20:21 - 📊 Total files trobades a la taula: 39
2025-12-30 19:20:21 -    ✅ Període UTC: 00:00 - 00:30 | TX: 2.8 | TN: 2.5 | Pluja: 0.0
2025-12-30 19:20:21 -    ✅ Període UTC: 00:30 - 01:00 | TX: 2.7 | TN: 2.0 | Pluja: 0.0
2025-12-30 19:20:21 -    ✅ Període UTC: 01:00 - 01:30 | TX: 2.1 | TN: 1.7 | Pluja: 0.0
2025-12-30 19:20:21 -    ✅ Període UTC: 01:30 - 02:00 | TX: 2.0 | TN: 1.6 | Pluja: 0.0
2025-12-30 19:20:21 -    ✅ Període UTC: 02:00 - 02:30 | TX: 1.9 | TN: 1.5 | Pluja: 0.0
2025-12-30 19:20:21 -    ✅ Període UTC: 02:30 - 03:00 | TX: 1.9 | TN: 1.4 | Pluja: 0.0
2025-12-30 19:20:21 -    ✅ Període UTC: 03:00 - 03:30 | TX: 1.6 | TN: 1.3 | Pluja: 0.0
2025-12-30 19:20:21 -    ✅ Període UTC: 03:30 - 04:00 | TX: 1.6 | TN: 1.4 | Pluja: 0.0
2025-12-30 19:20:21 -    ✅ Període UTC: 04:00 - 04:30 | TX: 1.6 | TN: 1.3 | Pluja: 0.0
2025-12-30 19:20:21 -    ✅ Període UTC: 04:30 - 05:00 | TX: 1.3 | TN: 0.9 | Pluja: 0.0
2025-12-30 19:20:21 -    ✅ Període UTC: 05:00 - 05:30 | TX: 1.1 | TN: 0.9 | Pluja: 0.0
2025-12-30 19:20:21 -    ✅ Període UTC: 05:30 - 06:00 | TX: 1.1 | TN: 0.7 | Pluja: 0.0
2025-12-30 19:20:21 -    ✅ Període UTC: 06:00 - 06:30 | TX: 0.8 | TN: 0.5 | Pluja: 0.0
2025-12-30 19:20:21 -    ✅ Període UTC: 06:30 - 07:00 | TX: 0.6 | TN: 0.3 | Pluja: 0.0
2025-12-30 19:20:21 -    ✅ Període UTC: 07:00 - 07:30 | TX: 0.3 | TN: 0.1 | Pluja: 0.0
2025-12-30 19:20:21 -    ✅ Període UTC: 07:30 - 08:00 | TX: 0.9 | TN: 0.2 | Pluja: 0.0
2025-12-30 19:20:21 -    ✅ Període UTC: 08:00 - 08:30 | TX: 3.4 | TN: 0.9 | Pluja: 0.0
2025-12-30 19:20:21 -    ✅ Període UTC: 08:30 - 09:00 | TX: 5.2 | TN: 3.2 | Pluja: 0.0
2025-12-30 19:20:21 -    ✅ Període UTC: 09:00 - 09:30 | TX: 6.8 | TN: 5.0 | Pluja: 0.0
2025-12-30 19:20:21 -    ✅ Període UTC: 09:30 - 10:00 | TX: 8.4 | TN: 6.5 | Pluja: 0.0
2025-12-30 19:20:21 -    ✅ Període UTC: 10:00 - 10:30 | TX: 9.7 | TN: 8.4 | Pluja: 0.0
2025-12-30 19:20:21 -    ✅ Període UTC: 10:30 - 11:00 | TX: 11.9 | TN: 9.8 | Pluja: 0.0
2025-12-30 19:20:21 -    ✅ Període UTC: 11:00 - 11:30 | TX: 13.0 | TN: 11.5 | Pluja: 0.0
2025-12-30 19:20:21 -    ✅ Període UTC: 11:30 - 12:00 | TX: 14.1 | TN: 12.5 | Pluja: 0.0
2025-12-30 19:20:21 -    ✅ Període UTC: 12:00 - 12:30 | TX: 14.9 | TN: 13.9 | Pluja: 0.0
2025-12-30 19:20:21 -    ✅ Període UTC: 12:30 - 13:00 | TX: 15.1 | TN: 14.3 | Pluja: 0.0
2025-12-30 19:20:21 -    ✅ Període UTC: 13:00 - 13:30 | TX: 15.3 | TN: 14.8 | Pluja: 0.0
2025-12-30 19:20:21 -    ✅ Període UTC: 13:30 - 14:00 | TX: 15.1 | TN: 14.8 | Pluja: 0.0
2025-12-30 19:20:21 -    ✅ Període UTC: 14:00 - 14:30 | TX: 15.0 | TN: 14.6 | Pluja: 0.0
2025-12-30 19:20:21 -    ✅ Període UTC: 14:30 - 15:00 | TX: 14.6 | TN: 13.9 | Pluja: 0.0
2025-12-30 19:20:21 -    ✅ Període UTC: 15:00 - 15:30 | TX: 13.9 | TN: 12.9 | Pluja: 0.0
2025-12-30 19:20:21 -    ✅ Període UTC: 15:30 - 16:00 | TX: 12.8 | TN: 11.1 | Pluja: 0.0
2025-12-30 19:20:21 -    ✅ Període UTC: 16:00 - 16:30 | TX: 11.1 | TN: 9.3 | Pluja: 0.0
2025-12-30 19:20:21 -    ✅ Període UTC: 16:30 - 17:00 | TX: 9.3 | TN: 8.8 | Pluja: 0.0
2025-12-30 19:20:21 -    ✅ Període UTC: 17:00 - 17:30 | TX: 8.7 | TN: 8.2 | Pluja: 0.0
2025-12-30 19:20:21 -    ✅ Període UTC: 17:30 - 18:00 | TX: 8.3 | TN: 7.0 | Pluja: 0.0
2025-12-30 19:20:21 -    ✅ Període UTC: 18:00 - 18:30 | TX: 6.8 | TN: 6.0 | Pluja: 0.0
2025-12-30 19:20:21 -    ✅ Període UTC: 18:30 - 19:00 | TX: 6.2 | TN: 5.3 | Pluja: 0.0
2025-12-30 19:20:21 - 📈 Total períodes vàlids trobats: 38
2025-12-30 19:20:21 - 📊 RESUM CALCULAT:
2025-12-30 19:20:21 -    • Màxima del dia: 15.3°C
2025-12-30 19:20:21 -    • Mínima del dia: 0.1°C
2025-12-30 19:20:21 -    • Pluja acumulada: 0.0mm
2025-12-30 19:20:21 -    • Últim període: 18:30 - 19:00 UTC
2025-12-30 19:20:21 -    • Hora actualització: 19:20
2025-12-30 19:20:21 - 💾 Dades guardades a data/XJ_20251230.csv (38 registres)
2025-12-30 19:20:21 - ✅ Girona: 38 períodes processats
2025-12-30 19:20:21 - 💾 Dades guardades a data/weather_daily_20251230.json
2025-12-30 19:20:21 - 💾 Dades guardades a data/weather_summary.json
2025-12-30 19:20:21 - 
============================================================
2025-12-30 19:20:21 - 📋 RESUM FINAL DEL DIA (UTC)
2025-12-30 19:20:21 - ============================================================
2025-12-30 19:20:21 - 
📍 Fornells de la Selva:
2025-12-30 19:20:21 -    • Períodes: 38
2025-12-30 19:20:21 -    • Màxima: 16.2°C
2025-12-30 19:20:21 -    • Mínima: 1.2°C
2025-12-30 19:20:21 -    • Pluja: 0.1mm
2025-12-30 19:20:21 -    • Últim període: 18:30 - 19:00 UTC
2025-12-30 19:20:21 -    • Actualització: 19:20
2025-12-30 19:20:21 - 
📍 Girona:
2025-12-30 19:20:21 -    • Períodes: 38
2025-12-30 19:20:21 -    • Màxima: 15.3°C
2025-12-30 19:20:21 -    • Mínima: 0.1°C
2025-12-30 19:20:21 -    • Pluja: 0.0mm
2025-12-30 19:20:21 -    • Últim període: 18:30 - 19:00 UTC
2025-12-30 19:20:21 -    • Actualització: 19:20
2025-12-30 19:20:21 - 
💾 Fitxers generats:
2025-12-30 19:20:21 -    • data/weather_summary.json (per HTML)
2025-12-30 19:20:21 -    • data/weather_daily_YYYYMMDD.json (complet)
2025-12-30 19:20:21 -    • data/XX_YYYYMMDD.csv (per estació)
2025-12-30 19:20:21 - 
✅ PROCÉS COMPLETAT
2025-12-30 19:20:21 - ============================================================
