=== INICI DAILY SCRAPER (UTC): 2026-01-04 19:32:43 ===
2026-01-04 19:32:43 - ============================================================
2026-01-04 19:32:43 - 🌤️  DAILY WEATHER SCRAPER - VERSIÓ UTC
2026-01-04 19:32:43 - ============================================================
2026-01-04 19:32:43 - 
==================================================
2026-01-04 19:32:43 - 📡 Processant: Fornells de la Selva [UO]
2026-01-04 19:32:43 - 
🌐 Connectant a Fornells de la Selva...
2026-01-04 19:32:45 - 📊 Total files trobades a la taula: 40
2026-01-04 19:32:45 -    ✅ Període UTC: 00:00 - 00:30 | TX: 6.4 | TN: 6.3 | Pluja: 0.0
2026-01-04 19:32:45 -    ✅ Període UTC: 00:30 - 01:00 | TX: 6.3 | TN: 6.1 | Pluja: 0.0
2026-01-04 19:32:45 -    ✅ Període UTC: 01:00 - 01:30 | TX: 6.1 | TN: 6.0 | Pluja: 0.0
2026-01-04 19:32:45 -    ✅ Període UTC: 01:30 - 02:00 | TX: 6.1 | TN: 5.9 | Pluja: 0.0
2026-01-04 19:32:45 -    ✅ Període UTC: 02:00 - 02:30 | TX: 6.1 | TN: 5.8 | Pluja: 0.0
2026-01-04 19:32:45 -    ✅ Període UTC: 02:30 - 03:00 | TX: 5.8 | TN: 5.5 | Pluja: 0.0
2026-01-04 19:32:45 -    ✅ Període UTC: 03:00 - 03:30 | TX: 5.5 | TN: 5.2 | Pluja: 0.0
2026-01-04 19:32:45 -    ✅ Període UTC: 03:30 - 04:00 | TX: 5.1 | TN: 4.9 | Pluja: 0.0
2026-01-04 19:32:45 -    ✅ Període UTC: 04:00 - 04:30 | TX: 5.2 | TN: 4.9 | Pluja: 0.0
2026-01-04 19:32:45 -    ✅ Període UTC: 04:30 - 05:00 | TX: 5.4 | TN: 5.1 | Pluja: 0.0
2026-01-04 19:32:45 -    ✅ Període UTC: 05:00 - 05:30 | TX: 5.5 | TN: 5.3 | Pluja: 0.0
2026-01-04 19:32:45 -    ✅ Període UTC: 05:30 - 06:00 | TX: 5.3 | TN: 5.0 | Pluja: 0.0
2026-01-04 19:32:45 -    ✅ Període UTC: 06:00 - 06:30 | TX: 5.1 | TN: 4.6 | Pluja: 0.0
2026-01-04 19:32:45 -    ✅ Període UTC: 06:30 - 07:00 | TX: 4.7 | TN: 4.6 | Pluja: 0.0
2026-01-04 19:32:45 -    ✅ Període UTC: 07:00 - 07:30 | TX: 4.7 | TN: 4.5 | Pluja: 0.0
2026-01-04 19:32:45 -    ✅ Període UTC: 07:30 - 08:00 | TX: 4.6 | TN: 4.4 | Pluja: 0.0
2026-01-04 19:32:45 -    ✅ Període UTC: 08:00 - 08:30 | TX: 4.5 | TN: 4.4 | Pluja: 0.0
2026-01-04 19:32:45 -    ✅ Període UTC: 08:30 - 09:00 | TX: 4.4 | TN: 4.3 | Pluja: 0.0
2026-01-04 19:32:45 -    ✅ Període UTC: 09:00 - 09:30 | TX: 4.6 | TN: 4.4 | Pluja: 0.0
2026-01-04 19:32:45 -    ✅ Període UTC: 09:30 - 10:00 | TX: 4.9 | TN: 4.6 | Pluja: 0.0
2026-01-04 19:32:45 -    ✅ Període UTC: 10:00 - 10:30 | TX: 5.5 | TN: 5.0 | Pluja: 0.0
2026-01-04 19:32:45 -    ✅ Període UTC: 10:30 - 11:00 | TX: 6.6 | TN: 5.5 | Pluja: 0.0
2026-01-04 19:32:45 -    ✅ Període UTC: 11:00 - 11:30 | TX: 6.8 | TN: 6.3 | Pluja: 0.0
2026-01-04 19:32:45 -    ✅ Període UTC: 11:30 - 12:00 | TX: 6.4 | TN: 6.3 | Pluja: 0.0
2026-01-04 19:32:45 -    ✅ Període UTC: 12:00 - 12:30 | TX: 6.6 | TN: 6.3 | Pluja: 0.0
2026-01-04 19:32:45 -    ✅ Període UTC: 12:30 - 13:00 | TX: 6.9 | TN: 6.6 | Pluja: 0.0
2026-01-04 19:32:45 -    ✅ Període UTC: 13:00 - 13:30 | TX: 7.0 | TN: 6.9 | Pluja: 0.0
2026-01-04 19:32:45 -    ✅ Període UTC: 13:30 - 14:00 | TX: 7.1 | TN: 6.9 | Pluja: 0.0
2026-01-04 19:32:45 -    ✅ Període UTC: 14:00 - 14:30 | TX: 7.1 | TN: 6.8 | Pluja: 0.0
2026-01-04 19:32:45 -    ✅ Període UTC: 14:30 - 15:00 | TX: 6.8 | TN: 6.6 | Pluja: 0.0
2026-01-04 19:32:45 -    ✅ Període UTC: 15:00 - 15:30 | TX: 6.7 | TN: 6.5 | Pluja: 0.0
2026-01-04 19:32:45 -    ✅ Període UTC: 15:30 - 16:00 | TX: 6.7 | TN: 6.3 | Pluja: 0.0
2026-01-04 19:32:45 -    ✅ Període UTC: 16:00 - 16:30 | TX: 6.4 | TN: 6.2 | Pluja: 0.0
2026-01-04 19:32:45 -    ✅ Període UTC: 16:30 - 17:00 | TX: 6.1 | TN: 5.7 | Pluja: 0.0
2026-01-04 19:32:45 -    ✅ Període UTC: 17:00 - 17:30 | TX: 5.8 | TN: 5.5 | Pluja: 0.0
2026-01-04 19:32:45 -    ✅ Període UTC: 17:30 - 18:00 | TX: 5.5 | TN: 4.9 | Pluja: 0.0
2026-01-04 19:32:45 -    ✅ Període UTC: 18:00 - 18:30 | TX: 5.0 | TN: 4.5 | Pluja: 0.0
2026-01-04 19:32:45 -    ✅ Període UTC: 18:30 - 19:00 | TX: 4.6 | TN: 4.2 | Pluja: 0.0
2026-01-04 19:32:45 - 📈 Total períodes vàlids trobats: 38
2026-01-04 19:32:45 - 📊 RESUM CALCULAT:
2026-01-04 19:32:45 -    • Màxima del dia: 7.1°C
2026-01-04 19:32:45 -    • Mínima del dia: 4.2°C
2026-01-04 19:32:45 -    • Pluja acumulada: 0.0mm
2026-01-04 19:32:45 -    • Últim període: 18:30 - 19:00 UTC
2026-01-04 19:32:45 -    • Hora actualització: 19:32
2026-01-04 19:32:45 - 💾 Dades guardades a data/UO_20260104.csv (38 registres)
2026-01-04 19:32:45 - ✅ Fornells de la Selva: 38 períodes processats
2026-01-04 19:32:45 - 
==================================================
2026-01-04 19:32:45 - 📡 Processant: Girona [XJ]
2026-01-04 19:32:45 - 
🌐 Connectant a Girona...
2026-01-04 19:32:47 - 📊 Total files trobades a la taula: 40
2026-01-04 19:32:47 -    ✅ Període UTC: 00:00 - 00:30 | TX: 6.5 | TN: 6.3 | Pluja: 0.0
2026-01-04 19:32:47 -    ✅ Període UTC: 00:30 - 01:00 | TX: 6.3 | TN: 6.2 | Pluja: 0.0
2026-01-04 19:32:47 -    ✅ Període UTC: 01:00 - 01:30 | TX: 6.2 | TN: 6.1 | Pluja: 0.0
2026-01-04 19:32:47 -    ✅ Període UTC: 01:30 - 02:00 | TX: 6.2 | TN: 6.2 | Pluja: 0.0
2026-01-04 19:32:47 -    ✅ Període UTC: 02:00 - 02:30 | TX: 6.2 | TN: 5.8 | Pluja: 0.0
2026-01-04 19:32:47 -    ✅ Període UTC: 02:30 - 03:00 | TX: 5.8 | TN: 5.2 | Pluja: 0.0
2026-01-04 19:32:47 -    ✅ Període UTC: 03:00 - 03:30 | TX: 5.2 | TN: 5.0 | Pluja: 0.0
2026-01-04 19:32:47 -    ✅ Període UTC: 03:30 - 04:00 | TX: 5.0 | TN: 4.9 | Pluja: 0.1
2026-01-04 19:32:47 -    ✅ Període UTC: 04:00 - 04:30 | TX: 5.2 | TN: 4.8 | Pluja: 0.0
2026-01-04 19:32:47 -    ✅ Període UTC: 04:30 - 05:00 | TX: 5.3 | TN: 5.1 | Pluja: 0.0
2026-01-04 19:32:47 -    ✅ Període UTC: 05:00 - 05:30 | TX: 5.4 | TN: 5.3 | Pluja: 0.0
2026-01-04 19:32:47 -    ✅ Període UTC: 05:30 - 06:00 | TX: 5.4 | TN: 5.2 | Pluja: 0.0
2026-01-04 19:32:47 -    ✅ Període UTC: 06:00 - 06:30 | TX: 5.2 | TN: 4.8 | Pluja: 0.0
2026-01-04 19:32:47 -    ✅ Període UTC: 06:30 - 07:00 | TX: 4.9 | TN: 4.7 | Pluja: 0.0
2026-01-04 19:32:47 -    ✅ Període UTC: 07:00 - 07:30 | TX: 4.9 | TN: 4.7 | Pluja: 0.0
2026-01-04 19:32:47 -    ✅ Període UTC: 07:30 - 08:00 | TX: 4.9 | TN: 4.8 | Pluja: 0.0
2026-01-04 19:32:47 -    ✅ Període UTC: 08:00 - 08:30 | TX: 4.8 | TN: 4.5 | Pluja: 0.0
2026-01-04 19:32:47 -    ✅ Període UTC: 08:30 - 09:00 | TX: 5.5 | TN: 4.4 | Pluja: 0.0
2026-01-04 19:32:47 -    ✅ Període UTC: 09:00 - 09:30 | TX: 5.5 | TN: 4.8 | Pluja: 0.0
2026-01-04 19:32:47 -    ✅ Període UTC: 09:30 - 10:00 | TX: 5.5 | TN: 5.0 | Pluja: 0.0
2026-01-04 19:32:47 -    ✅ Període UTC: 10:00 - 10:30 | TX: 6.4 | TN: 5.5 | Pluja: 0.0
2026-01-04 19:32:47 -    ✅ Període UTC: 10:30 - 11:00 | TX: 6.8 | TN: 6.4 | Pluja: 0.0
2026-01-04 19:32:47 -    ✅ Període UTC: 11:00 - 11:30 | TX: 6.8 | TN: 6.3 | Pluja: 0.0
2026-01-04 19:32:47 -    ✅ Període UTC: 11:30 - 12:00 | TX: 6.8 | TN: 6.3 | Pluja: 0.0
2026-01-04 19:32:47 -    ✅ Període UTC: 12:00 - 12:30 | TX: 7.8 | TN: 6.8 | Pluja: 0.0
2026-01-04 19:32:47 -    ✅ Període UTC: 12:30 - 13:00 | TX: 7.8 | TN: 7.4 | Pluja: 0.0
2026-01-04 19:32:47 -    ✅ Període UTC: 13:00 - 13:30 | TX: 7.6 | TN: 7.4 | Pluja: 0.0
2026-01-04 19:32:47 -    ✅ Període UTC: 13:30 - 14:00 | TX: 7.5 | TN: 7.4 | Pluja: 0.0
2026-01-04 19:32:47 -    ✅ Període UTC: 14:00 - 14:30 | TX: 7.4 | TN: 7.4 | Pluja: 0.0
2026-01-04 19:32:47 -    ✅ Període UTC: 14:30 - 15:00 | TX: 7.4 | TN: 7.2 | Pluja: 0.0
2026-01-04 19:32:47 -    ✅ Període UTC: 15:00 - 15:30 | TX: 7.2 | TN: 7.2 | Pluja: 0.0
2026-01-04 19:32:47 -    ✅ Període UTC: 15:30 - 16:00 | TX: 7.2 | TN: 7.0 | Pluja: 0.0
2026-01-04 19:32:47 -    ✅ Període UTC: 16:00 - 16:30 | TX: 6.9 | TN: 6.5 | Pluja: 0.0
2026-01-04 19:32:47 -    ✅ Període UTC: 16:30 - 17:00 | TX: 6.5 | TN: 5.9 | Pluja: 0.0
2026-01-04 19:32:47 -    ✅ Període UTC: 17:00 - 17:30 | TX: 5.9 | TN: 5.5 | Pluja: 0.0
2026-01-04 19:32:47 -    ✅ Període UTC: 17:30 - 18:00 | TX: 5.4 | TN: 4.9 | Pluja: 0.0
2026-01-04 19:32:47 -    ✅ Període UTC: 18:00 - 18:30 | TX: 4.9 | TN: 4.5 | Pluja: 0.0
2026-01-04 19:32:47 -    ✅ Període UTC: 18:30 - 19:00 | TX: 4.5 | TN: 4.3 | Pluja: 0.0
2026-01-04 19:32:47 - 📈 Total períodes vàlids trobats: 38
2026-01-04 19:32:47 - 📊 RESUM CALCULAT:
2026-01-04 19:32:47 -    • Màxima del dia: 7.8°C
2026-01-04 19:32:47 -    • Mínima del dia: 4.3°C
2026-01-04 19:32:47 -    • Pluja acumulada: 0.1mm
2026-01-04 19:32:47 -    • Últim període: 18:30 - 19:00 UTC
2026-01-04 19:32:47 -    • Hora actualització: 19:32
2026-01-04 19:32:47 - 💾 Dades guardades a data/XJ_20260104.csv (38 registres)
2026-01-04 19:32:47 - ✅ Girona: 38 períodes processats
2026-01-04 19:32:47 - 💾 Dades guardades a data/weather_daily_20260104.json
2026-01-04 19:32:47 - 💾 Dades guardades a data/weather_summary.json
2026-01-04 19:32:47 - 
============================================================
2026-01-04 19:32:47 - 📋 RESUM FINAL DEL DIA (UTC)
2026-01-04 19:32:47 - ============================================================
2026-01-04 19:32:47 - 
📍 Fornells de la Selva:
2026-01-04 19:32:47 -    • Períodes: 38
2026-01-04 19:32:47 -    • Màxima: 7.1°C
2026-01-04 19:32:47 -    • Mínima: 4.2°C
2026-01-04 19:32:47 -    • Pluja: 0.0mm
2026-01-04 19:32:47 -    • Últim període: 18:30 - 19:00 UTC
2026-01-04 19:32:47 -    • Actualització: 19:32
2026-01-04 19:32:47 - 
📍 Girona:
2026-01-04 19:32:47 -    • Períodes: 38
2026-01-04 19:32:47 -    • Màxima: 7.8°C
2026-01-04 19:32:47 -    • Mínima: 4.3°C
2026-01-04 19:32:47 -    • Pluja: 0.1mm
2026-01-04 19:32:47 -    • Últim període: 18:30 - 19:00 UTC
2026-01-04 19:32:47 -    • Actualització: 19:32
2026-01-04 19:32:47 - 
💾 Fitxers generats:
2026-01-04 19:32:47 -    • data/weather_summary.json (per HTML)
2026-01-04 19:32:47 -    • data/weather_daily_YYYYMMDD.json (complet)
2026-01-04 19:32:47 -    • data/XX_YYYYMMDD.csv (per estació)
2026-01-04 19:32:47 - 
✅ PROCÉS COMPLETAT
2026-01-04 19:32:47 - ============================================================
