=== INICI DAILY SCRAPER (UTC): 2026-01-11 15:33:38 ===
2026-01-11 15:33:38 - ============================================================
2026-01-11 15:33:38 - 🌤️  DAILY WEATHER SCRAPER - VERSIÓ UTC
2026-01-11 15:33:38 - ============================================================
2026-01-11 15:33:38 - 
==================================================
2026-01-11 15:33:38 - 📡 Processant: Fornells de la Selva [UO]
2026-01-11 15:33:38 - 
🌐 Connectant a Fornells de la Selva...
2026-01-11 15:33:40 - 📊 Total files trobades a la taula: 32
2026-01-11 15:33:40 -    ✅ Període UTC: 00:00 - 00:30 | TX: -0.2 | TN: -0.6 | Pluja: 0.0
2026-01-11 15:33:40 -    ✅ Període UTC: 00:30 - 01:00 | TX: -0.4 | TN: -0.9 | Pluja: 0.0
2026-01-11 15:33:40 -    ✅ Període UTC: 01:00 - 01:30 | TX: 0.0 | TN: -0.9 | Pluja: 0.0
2026-01-11 15:33:40 -    ✅ Període UTC: 01:30 - 02:00 | TX: 0.2 | TN: 0.0 | Pluja: 0.0
2026-01-11 15:33:40 -    ✅ Període UTC: 02:00 - 02:30 | TX: 0.0 | TN: -0.5 | Pluja: 0.0
2026-01-11 15:33:40 -    ✅ Període UTC: 02:30 - 03:00 | TX: -0.4 | TN: -1.1 | Pluja: 0.0
2026-01-11 15:33:40 -    ✅ Període UTC: 03:00 - 03:30 | TX: -1.0 | TN: -1.4 | Pluja: 0.0
2026-01-11 15:33:40 -    ✅ Període UTC: 03:30 - 04:00 | TX: -1.3 | TN: -1.7 | Pluja: 0.0
2026-01-11 15:33:40 -    ✅ Període UTC: 04:00 - 04:30 | TX: -1.6 | TN: -1.9 | Pluja: 0.0
2026-01-11 15:33:40 -    ✅ Període UTC: 04:30 - 05:00 | TX: -1.7 | TN: -2.1 | Pluja: 0.0
2026-01-11 15:33:40 -    ✅ Període UTC: 05:00 - 05:30 | TX: -1.6 | TN: -2.1 | Pluja: 0.0
2026-01-11 15:33:40 -    ✅ Període UTC: 05:30 - 06:00 | TX: -1.6 | TN: -2.0 | Pluja: 0.0
2026-01-11 15:33:40 -    ✅ Període UTC: 06:00 - 06:30 | TX: -1.7 | TN: -2.1 | Pluja: 0.0
2026-01-11 15:33:40 -    ✅ Període UTC: 06:30 - 07:00 | TX: -1.5 | TN: -2.1 | Pluja: 0.0
2026-01-11 15:33:40 -    ✅ Període UTC: 07:00 - 07:30 | TX: -1.9 | TN: -2.3 | Pluja: 0.0
2026-01-11 15:33:40 -    ✅ Període UTC: 07:30 - 08:00 | TX: -1.2 | TN: -2.3 | Pluja: 0.0
2026-01-11 15:33:40 -    ✅ Període UTC: 08:00 - 08:30 | TX: -0.2 | TN: -1.2 | Pluja: 0.0
2026-01-11 15:33:40 -    ✅ Període UTC: 08:30 - 09:00 | TX: 3.0 | TN: -0.3 | Pluja: 0.0
2026-01-11 15:33:40 -    ✅ Període UTC: 09:00 - 09:30 | TX: 4.6 | TN: 2.3 | Pluja: 0.0
2026-01-11 15:33:40 -    ✅ Període UTC: 09:30 - 10:00 | TX: 6.3 | TN: 4.4 | Pluja: 0.0
2026-01-11 15:33:40 -    ✅ Període UTC: 10:00 - 10:30 | TX: 7.6 | TN: 6.0 | Pluja: 0.0
2026-01-11 15:33:40 -    ✅ Període UTC: 10:30 - 11:00 | TX: 9.2 | TN: 7.8 | Pluja: 0.0
2026-01-11 15:33:40 -    ✅ Període UTC: 11:00 - 11:30 | TX: 11.0 | TN: 9.2 | Pluja: 0.0
2026-01-11 15:33:40 -    ✅ Període UTC: 11:30 - 12:00 | TX: 11.6 | TN: 10.5 | Pluja: 0.0
2026-01-11 15:33:40 -    ✅ Període UTC: 12:00 - 12:30 | TX: 12.6 | TN: 11.6 | Pluja: 0.0
2026-01-11 15:33:40 -    ✅ Període UTC: 12:30 - 13:00 | TX: 12.6 | TN: 12.3 | Pluja: 0.0
2026-01-11 15:33:40 -    ✅ Període UTC: 13:00 - 13:30 | TX: 12.5 | TN: 12.2 | Pluja: 0.0
2026-01-11 15:33:40 -    ✅ Període UTC: 13:30 - 14:00 | TX: 12.9 | TN: 12.4 | Pluja: 0.0
2026-01-11 15:33:40 -    ✅ Període UTC: 14:00 - 14:30 | TX: 12.6 | TN: 12.2 | Pluja: 0.0
2026-01-11 15:33:40 -    ✅ Període UTC: 14:30 - 15:00 | TX: 12.3 | TN: 11.9 | Pluja: 0.0
2026-01-11 15:33:40 - 📈 Total períodes vàlids trobats: 30
2026-01-11 15:33:40 - 📊 RESUM CALCULAT:
2026-01-11 15:33:40 -    • Màxima del dia: 12.9°C
2026-01-11 15:33:40 -    • Mínima del dia: -2.3°C
2026-01-11 15:33:40 -    • Pluja acumulada: 0.0mm
2026-01-11 15:33:40 -    • Últim període: 14:30 - 15:00 UTC
2026-01-11 15:33:40 -    • Hora actualització: 15:33
2026-01-11 15:33:40 - 💾 Dades guardades a data/UO_20260111.csv (30 registres)
2026-01-11 15:33:40 - ✅ Fornells de la Selva: 30 períodes processats
2026-01-11 15:33:40 - 
==================================================
2026-01-11 15:33:40 - 📡 Processant: Girona [XJ]
2026-01-11 15:33:40 - 
🌐 Connectant a Girona...
2026-01-11 15:33:41 - 📊 Total files trobades a la taula: 32
2026-01-11 15:33:41 -    ✅ Període UTC: 00:00 - 00:30 | TX: 0.6 | TN: 0.0 | Pluja: 0.0
2026-01-11 15:33:41 -    ✅ Període UTC: 00:30 - 01:00 | TX: 0.2 | TN: -0.2 | Pluja: 0.0
2026-01-11 15:33:41 -    ✅ Període UTC: 01:00 - 01:30 | TX: 0.6 | TN: -0.1 | Pluja: 0.0
2026-01-11 15:33:41 -    ✅ Període UTC: 01:30 - 02:00 | TX: 0.6 | TN: 0.5 | Pluja: 0.0
2026-01-11 15:33:41 -    ✅ Període UTC: 02:00 - 02:30 | TX: 0.5 | TN: -0.4 | Pluja: 0.0
2026-01-11 15:33:41 -    ✅ Període UTC: 02:30 - 03:00 | TX: -0.4 | TN: -0.8 | Pluja: 0.0
2026-01-11 15:33:41 -    ✅ Període UTC: 03:00 - 03:30 | TX: -0.8 | TN: -1.3 | Pluja: 0.0
2026-01-11 15:33:41 -    ✅ Període UTC: 03:30 - 04:00 | TX: -1.3 | TN: -1.5 | Pluja: 0.0
2026-01-11 15:33:41 -    ✅ Període UTC: 04:00 - 04:30 | TX: -1.3 | TN: -1.7 | Pluja: 0.0
2026-01-11 15:33:41 -    ✅ Període UTC: 04:30 - 05:00 | TX: -1.5 | TN: -1.9 | Pluja: 0.0
2026-01-11 15:33:41 -    ✅ Període UTC: 05:00 - 05:30 | TX: -1.7 | TN: -2.0 | Pluja: 0.0
2026-01-11 15:33:41 -    ✅ Període UTC: 05:30 - 06:00 | TX: -1.6 | TN: -1.9 | Pluja: 0.0
2026-01-11 15:33:41 -    ✅ Període UTC: 06:00 - 06:30 | TX: -1.9 | TN: -2.2 | Pluja: 0.0
2026-01-11 15:33:41 -    ✅ Període UTC: 06:30 - 07:00 | TX: -2.0 | TN: -2.3 | Pluja: 0.0
2026-01-11 15:33:41 -    ✅ Període UTC: 07:00 - 07:30 | TX: -2.0 | TN: -2.4 | Pluja: 0.0
2026-01-11 15:33:41 -    ✅ Període UTC: 07:30 - 08:00 | TX: -0.7 | TN: -2.5 | Pluja: 0.0
2026-01-11 15:33:41 -    ✅ Període UTC: 08:00 - 08:30 | TX: 1.1 | TN: -0.7 | Pluja: 0.0
2026-01-11 15:33:41 -    ✅ Període UTC: 08:30 - 09:00 | TX: 3.0 | TN: 0.9 | Pluja: 0.0
2026-01-11 15:33:41 -    ✅ Període UTC: 09:00 - 09:30 | TX: 5.5 | TN: 3.0 | Pluja: 0.0
2026-01-11 15:33:41 -    ✅ Període UTC: 09:30 - 10:00 | TX: 6.6 | TN: 5.4 | Pluja: 0.1
2026-01-11 15:33:41 -    ✅ Període UTC: 10:00 - 10:30 | TX: 8.6 | TN: 6.4 | Pluja: 0.2
2026-01-11 15:33:41 -    ✅ Període UTC: 10:30 - 11:00 | TX: 9.7 | TN: 8.7 | Pluja: 0.0
2026-01-11 15:33:41 -    ✅ Període UTC: 11:00 - 11:30 | TX: 11.0 | TN: 9.6 | Pluja: 0.0
2026-01-11 15:33:41 -    ✅ Període UTC: 11:30 - 12:00 | TX: 12.2 | TN: 10.9 | Pluja: 0.0
2026-01-11 15:33:41 -    ✅ Període UTC: 12:00 - 12:30 | TX: 12.6 | TN: 11.9 | Pluja: 0.0
2026-01-11 15:33:41 -    ✅ Període UTC: 12:30 - 13:00 | TX: 13.0 | TN: 12.4 | Pluja: 0.0
2026-01-11 15:33:41 -    ✅ Període UTC: 13:00 - 13:30 | TX: 13.1 | TN: 12.6 | Pluja: 0.0
2026-01-11 15:33:41 -    ✅ Període UTC: 13:30 - 14:00 | TX: 13.7 | TN: 13.1 | Pluja: 0.0
2026-01-11 15:33:41 -    ✅ Període UTC: 14:00 - 14:30 | TX: 13.1 | TN: 12.8 | Pluja: 0.0
2026-01-11 15:33:41 -    ✅ Període UTC: 14:30 - 15:00 | TX: 13.2 | TN: 12.7 | Pluja: 0.0
2026-01-11 15:33:41 - 📈 Total períodes vàlids trobats: 30
2026-01-11 15:33:41 - 📊 RESUM CALCULAT:
2026-01-11 15:33:41 -    • Màxima del dia: 13.7°C
2026-01-11 15:33:41 -    • Mínima del dia: -2.5°C
2026-01-11 15:33:41 -    • Pluja acumulada: 0.30000000000000004mm
2026-01-11 15:33:41 -    • Últim període: 14:30 - 15:00 UTC
2026-01-11 15:33:41 -    • Hora actualització: 15:33
2026-01-11 15:33:42 - 💾 Dades guardades a data/XJ_20260111.csv (30 registres)
2026-01-11 15:33:42 - ✅ Girona: 30 períodes processats
2026-01-11 15:33:42 - 💾 Dades guardades a data/weather_daily_20260111.json
2026-01-11 15:33:42 - 💾 Dades guardades a data/weather_summary.json
2026-01-11 15:33:42 - 
============================================================
2026-01-11 15:33:42 - 📋 RESUM FINAL DEL DIA (UTC)
2026-01-11 15:33:42 - ============================================================
2026-01-11 15:33:42 - 
📍 Fornells de la Selva:
2026-01-11 15:33:42 -    • Períodes: 30
2026-01-11 15:33:42 -    • Màxima: 12.9°C
2026-01-11 15:33:42 -    • Mínima: -2.3°C
2026-01-11 15:33:42 -    • Pluja: 0.0mm
2026-01-11 15:33:42 -    • Últim període: 14:30 - 15:00 UTC
2026-01-11 15:33:42 -    • Actualització: 15:33
2026-01-11 15:33:42 - 
📍 Girona:
2026-01-11 15:33:42 -    • Períodes: 30
2026-01-11 15:33:42 -    • Màxima: 13.7°C
2026-01-11 15:33:42 -    • Mínima: -2.5°C
2026-01-11 15:33:42 -    • Pluja: 0.30000000000000004mm
2026-01-11 15:33:42 -    • Últim període: 14:30 - 15:00 UTC
2026-01-11 15:33:42 -    • Actualització: 15:33
2026-01-11 15:33:42 - 
💾 Fitxers generats:
2026-01-11 15:33:42 -    • data/weather_summary.json (per HTML)
2026-01-11 15:33:42 -    • data/weather_daily_YYYYMMDD.json (complet)
2026-01-11 15:33:42 -    • data/XX_YYYYMMDD.csv (per estació)
2026-01-11 15:33:42 - 
✅ PROCÉS COMPLETAT
2026-01-11 15:33:42 - ============================================================
