=== INICI DAILY SCRAPER (UTC): 2025-12-25 20:15:21 ===
2025-12-25 20:15:21 - ============================================================
2025-12-25 20:15:21 - 🌤️  DAILY WEATHER SCRAPER - VERSIÓ UTC
2025-12-25 20:15:21 - ============================================================
2025-12-25 20:15:21 - 
==================================================
2025-12-25 20:15:21 - 📡 Processant: Fornells de la Selva [UO]
2025-12-25 20:15:21 - 
🌐 Connectant a Fornells de la Selva...
2025-12-25 20:15:22 - 📊 Total files trobades a la taula: 41
2025-12-25 20:15:22 -    ✅ Període UTC: 00:00 - 00:30 | TX: 6.5 | TN: 6.1 | Pluja: 0.0
2025-12-25 20:15:22 -    ✅ Període UTC: 00:30 - 01:00 | TX: 6.1 | TN: 5.9 | Pluja: 0.0
2025-12-25 20:15:22 -    ✅ Període UTC: 01:00 - 01:30 | TX: 6.0 | TN: 5.9 | Pluja: 0.0
2025-12-25 20:15:22 -    ✅ Període UTC: 01:30 - 02:00 | TX: 6.0 | TN: 5.9 | Pluja: 0.0
2025-12-25 20:15:22 -    ✅ Període UTC: 02:00 - 02:30 | TX: 6.1 | TN: 5.9 | Pluja: 0.0
2025-12-25 20:15:22 -    ✅ Període UTC: 02:30 - 03:00 | TX: 5.9 | TN: 5.8 | Pluja: 0.0
2025-12-25 20:15:22 -    ✅ Període UTC: 03:00 - 03:30 | TX: 5.8 | TN: 5.7 | Pluja: 0.0
2025-12-25 20:15:22 -    ✅ Període UTC: 03:30 - 04:00 | TX: 5.7 | TN: 5.4 | Pluja: 0.0
2025-12-25 20:15:22 -    ✅ Període UTC: 04:00 - 04:30 | TX: 5.5 | TN: 5.4 | Pluja: 0.0
2025-12-25 20:15:22 -    ✅ Període UTC: 04:30 - 05:00 | TX: 5.5 | TN: 5.1 | Pluja: 0.0
2025-12-25 20:15:22 -    ✅ Període UTC: 05:00 - 05:30 | TX: 5.2 | TN: 4.9 | Pluja: 0.0
2025-12-25 20:15:22 -    ✅ Període UTC: 05:30 - 06:00 | TX: 5.2 | TN: 5.1 | Pluja: 0.0
2025-12-25 20:15:22 -    ✅ Període UTC: 06:00 - 06:30 | TX: 5.3 | TN: 5.2 | Pluja: 0.0
2025-12-25 20:15:22 -    ✅ Període UTC: 06:30 - 07:00 | TX: 5.4 | TN: 5.3 | Pluja: 0.0
2025-12-25 20:15:22 -    ✅ Període UTC: 07:00 - 07:30 | TX: 5.4 | TN: 5.3 | Pluja: 0.0
2025-12-25 20:15:22 -    ✅ Període UTC: 07:30 - 08:00 | TX: 5.3 | TN: 5.1 | Pluja: 0.0
2025-12-25 20:15:22 -    ✅ Període UTC: 08:00 - 08:30 | TX: 5.5 | TN: 5.1 | Pluja: 0.0
2025-12-25 20:15:22 -    ✅ Període UTC: 08:30 - 09:00 | TX: 5.5 | TN: 5.4 | Pluja: 0.6
2025-12-25 20:15:22 -    ✅ Període UTC: 09:00 - 09:30 | TX: 5.5 | TN: 5.4 | Pluja: 0.9
2025-12-25 20:15:22 -    ✅ Període UTC: 09:30 - 10:00 | TX: 5.8 | TN: 5.5 | Pluja: 0.0
2025-12-25 20:15:22 -    ✅ Període UTC: 10:00 - 10:30 | TX: 6.5 | TN: 5.9 | Pluja: 0.0
2025-12-25 20:15:22 -    ✅ Període UTC: 10:30 - 11:00 | TX: 7.1 | TN: 6.5 | Pluja: 0.0
2025-12-25 20:15:22 -    ✅ Període UTC: 11:00 - 11:30 | TX: 7.5 | TN: 7.1 | Pluja: 0.0
2025-12-25 20:15:22 -    ✅ Període UTC: 11:30 - 12:00 | TX: 8.2 | TN: 7.6 | Pluja: 0.0
2025-12-25 20:15:22 -    ✅ Període UTC: 12:00 - 12:30 | TX: 9.1 | TN: 8.2 | Pluja: 0.0
2025-12-25 20:15:22 -    ✅ Període UTC: 12:30 - 13:00 | TX: 9.3 | TN: 9.0 | Pluja: 0.0
2025-12-25 20:15:22 -    ✅ Període UTC: 13:00 - 13:30 | TX: 9.2 | TN: 9.0 | Pluja: 0.0
2025-12-25 20:15:22 -    ✅ Període UTC: 13:30 - 14:00 | TX: 9.1 | TN: 8.7 | Pluja: 0.0
2025-12-25 20:15:22 -    ✅ Període UTC: 14:00 - 14:30 | TX: 8.8 | TN: 8.7 | Pluja: 0.0
2025-12-25 20:15:22 -    ✅ Període UTC: 14:30 - 15:00 | TX: 9.0 | TN: 8.9 | Pluja: 0.0
2025-12-25 20:15:22 -    ✅ Període UTC: 15:00 - 15:30 | TX: 8.9 | TN: 8.5 | Pluja: 0.0
2025-12-25 20:15:22 -    ✅ Període UTC: 15:30 - 16:00 | TX: 8.6 | TN: 8.2 | Pluja: 0.0
2025-12-25 20:15:22 -    ✅ Període UTC: 16:00 - 16:30 | TX: 8.2 | TN: 8.2 | Pluja: 0.1
2025-12-25 20:15:22 -    ✅ Període UTC: 16:30 - 17:00 | TX: 8.2 | TN: 8.1 | Pluja: 0.1
2025-12-25 20:15:22 -    ✅ Període UTC: 17:00 - 17:30 | TX: 8.1 | TN: 8.1 | Pluja: 0.4
2025-12-25 20:15:22 -    ✅ Període UTC: 17:30 - 18:00 | TX: 8.1 | TN: 8.1 | Pluja: 0.9
2025-12-25 20:15:22 -    ✅ Període UTC: 18:00 - 18:30 | TX: 8.3 | TN: 8.1 | Pluja: 0.8
2025-12-25 20:15:22 -    ✅ Període UTC: 18:30 - 19:00 | TX: 8.3 | TN: 8.3 | Pluja: 1.7
2025-12-25 20:15:22 -    ✅ Període UTC: 19:00 - 19:30 | TX: 8.3 | TN: 8.3 | Pluja: 1.4
2025-12-25 20:15:22 -    ✅ Període UTC: 19:30 - 20:00 | TX: 8.4 | TN: 8.3 | Pluja: 0.7
2025-12-25 20:15:22 - 📈 Total períodes vàlids trobats: 40
2025-12-25 20:15:22 - 📊 RESUM CALCULAT:
2025-12-25 20:15:22 -    • Màxima del dia: 9.3°C
2025-12-25 20:15:22 -    • Mínima del dia: 4.9°C
2025-12-25 20:15:22 -    • Pluja acumulada: 7.6000000000000005mm
2025-12-25 20:15:22 -    • Últim període: 19:30 - 20:00 UTC
2025-12-25 20:15:22 -    • Hora actualització: 20:15
2025-12-25 20:15:22 - 💾 Dades guardades a data/UO_20251225.csv (40 registres)
2025-12-25 20:15:22 - ✅ Fornells de la Selva: 40 períodes processats
2025-12-25 20:15:22 - 
==================================================
2025-12-25 20:15:22 - 📡 Processant: Girona [XJ]
2025-12-25 20:15:22 - 
🌐 Connectant a Girona...
2025-12-25 20:15:24 - 📊 Total files trobades a la taula: 41
2025-12-25 20:15:24 -    ✅ Període UTC: 00:00 - 00:30 | TX: 6.1 | TN: 5.9 | Pluja: 0.0
2025-12-25 20:15:24 -    ✅ Període UTC: 00:30 - 01:00 | TX: 5.9 | TN: 5.8 | Pluja: 0.0
2025-12-25 20:15:24 -    ✅ Període UTC: 01:00 - 01:30 | TX: 5.9 | TN: 5.8 | Pluja: 0.0
2025-12-25 20:15:24 -    ✅ Període UTC: 01:30 - 02:00 | TX: 6.0 | TN: 5.9 | Pluja: 0.0
2025-12-25 20:15:24 -    ✅ Període UTC: 02:00 - 02:30 | TX: 6.0 | TN: 5.9 | Pluja: 0.0
2025-12-25 20:15:24 -    ✅ Període UTC: 02:30 - 03:00 | TX: 5.9 | TN: 5.9 | Pluja: 0.0
2025-12-25 20:15:24 -    ✅ Període UTC: 03:00 - 03:30 | TX: 5.9 | TN: 5.8 | Pluja: 0.0
2025-12-25 20:15:24 -    ✅ Període UTC: 03:30 - 04:00 | TX: 5.8 | TN: 5.6 | Pluja: 0.0
2025-12-25 20:15:24 -    ✅ Període UTC: 04:00 - 04:30 | TX: 5.6 | TN: 5.4 | Pluja: 0.0
2025-12-25 20:15:24 -    ✅ Període UTC: 04:30 - 05:00 | TX: 5.4 | TN: 5.3 | Pluja: 0.0
2025-12-25 20:15:24 -    ✅ Període UTC: 05:00 - 05:30 | TX: 5.4 | TN: 5.3 | Pluja: 0.0
2025-12-25 20:15:24 -    ✅ Període UTC: 05:30 - 06:00 | TX: 5.3 | TN: 4.9 | Pluja: 0.0
2025-12-25 20:15:24 -    ✅ Període UTC: 06:00 - 06:30 | TX: 4.9 | TN: 4.7 | Pluja: 0.0
2025-12-25 20:15:24 -    ✅ Període UTC: 06:30 - 07:00 | TX: 5.3 | TN: 4.9 | Pluja: 0.0
2025-12-25 20:15:24 -    ✅ Període UTC: 07:00 - 07:30 | TX: 5.3 | TN: 5.2 | Pluja: 0.0
2025-12-25 20:15:24 -    ✅ Període UTC: 07:30 - 08:00 | TX: 5.3 | TN: 5.1 | Pluja: 0.1
2025-12-25 20:15:24 -    ✅ Període UTC: 08:00 - 08:30 | TX: 5.2 | TN: 5.0 | Pluja: 0.1
2025-12-25 20:15:24 -    ✅ Període UTC: 08:30 - 09:00 | TX: 5.4 | TN: 5.2 | Pluja: 0.3
2025-12-25 20:15:24 -    ✅ Període UTC: 09:00 - 09:30 | TX: 5.5 | TN: 5.4 | Pluja: 0.1
2025-12-25 20:15:24 -    ✅ Període UTC: 09:30 - 10:00 | TX: 5.7 | TN: 5.4 | Pluja: 0.0
2025-12-25 20:15:24 -    ✅ Període UTC: 10:00 - 10:30 | TX: 6.3 | TN: 5.7 | Pluja: 0.0
2025-12-25 20:15:24 -    ✅ Període UTC: 10:30 - 11:00 | TX: 7.0 | TN: 6.4 | Pluja: 0.0
2025-12-25 20:15:24 -    ✅ Període UTC: 11:00 - 11:30 | TX: 7.7 | TN: 6.9 | Pluja: 0.0
2025-12-25 20:15:24 -    ✅ Període UTC: 11:30 - 12:00 | TX: 8.4 | TN: 7.7 | Pluja: 0.0
2025-12-25 20:15:24 -    ✅ Període UTC: 12:00 - 12:30 | TX: 8.9 | TN: 8.3 | Pluja: 0.0
2025-12-25 20:15:24 -    ✅ Període UTC: 12:30 - 13:00 | TX: 9.5 | TN: 8.9 | Pluja: 0.0
2025-12-25 20:15:24 -    ✅ Període UTC: 13:00 - 13:30 | TX: 9.6 | TN: 9.4 | Pluja: 0.0
2025-12-25 20:15:24 -    ✅ Període UTC: 13:30 - 14:00 | TX: 9.4 | TN: 9.4 | Pluja: 0.0
2025-12-25 20:15:24 -    ✅ Període UTC: 14:00 - 14:30 | TX: 9.4 | TN: 9.4 | Pluja: 0.0
2025-12-25 20:15:24 -    ✅ Període UTC: 14:30 - 15:00 | TX: 9.5 | TN: 9.4 | Pluja: 0.0
2025-12-25 20:15:24 -    ✅ Període UTC: 15:00 - 15:30 | TX: 9.4 | TN: 8.9 | Pluja: 0.0
2025-12-25 20:15:24 -    ✅ Període UTC: 15:30 - 16:00 | TX: 8.9 | TN: 8.4 | Pluja: 0.1
2025-12-25 20:15:24 -    ✅ Període UTC: 16:00 - 16:30 | TX: 8.4 | TN: 8.4 | Pluja: 0.2
2025-12-25 20:15:24 -    ✅ Període UTC: 16:30 - 17:00 | TX: 8.4 | TN: 8.2 | Pluja: 0.3
2025-12-25 20:15:24 -    ✅ Període UTC: 17:00 - 17:30 | TX: 8.3 | TN: 8.2 | Pluja: 0.6
2025-12-25 20:15:24 -    ✅ Període UTC: 17:30 - 18:00 | TX: 8.4 | TN: 8.3 | Pluja: 0.9
2025-12-25 20:15:24 -    ✅ Període UTC: 18:00 - 18:30 | TX: 8.4 | TN: 8.3 | Pluja: 0.8
2025-12-25 20:15:24 -    ✅ Període UTC: 18:30 - 19:00 | TX: 8.5 | TN: 8.4 | Pluja: 0.8
2025-12-25 20:15:24 -    ✅ Període UTC: 19:00 - 19:30 | TX: 8.5 | TN: 8.4 | Pluja: 0.9
2025-12-25 20:15:24 -    ✅ Període UTC: 19:30 - 20:00 | TX: 8.5 | TN: 8.5 | Pluja: 1.0
2025-12-25 20:15:24 - 📈 Total períodes vàlids trobats: 40
2025-12-25 20:15:24 - 📊 RESUM CALCULAT:
2025-12-25 20:15:24 -    • Màxima del dia: 9.6°C
2025-12-25 20:15:24 -    • Mínima del dia: 4.7°C
2025-12-25 20:15:24 -    • Pluja acumulada: 6.2mm
2025-12-25 20:15:24 -    • Últim període: 19:30 - 20:00 UTC
2025-12-25 20:15:24 -    • Hora actualització: 20:15
2025-12-25 20:15:24 - 💾 Dades guardades a data/XJ_20251225.csv (40 registres)
2025-12-25 20:15:24 - ✅ Girona: 40 períodes processats
2025-12-25 20:15:24 - 💾 Dades guardades a data/weather_daily_20251225.json
2025-12-25 20:15:24 - 💾 Dades guardades a data/weather_summary.json
2025-12-25 20:15:24 - 
============================================================
2025-12-25 20:15:24 - 📋 RESUM FINAL DEL DIA (UTC)
2025-12-25 20:15:24 - ============================================================
2025-12-25 20:15:24 - 
📍 Fornells de la Selva:
2025-12-25 20:15:24 -    • Períodes: 40
2025-12-25 20:15:24 -    • Màxima: 9.3°C
2025-12-25 20:15:24 -    • Mínima: 4.9°C
2025-12-25 20:15:24 -    • Pluja: 7.6000000000000005mm
2025-12-25 20:15:24 -    • Últim període: 19:30 - 20:00 UTC
2025-12-25 20:15:24 -    • Actualització: 20:15
2025-12-25 20:15:24 - 
📍 Girona:
2025-12-25 20:15:24 -    • Períodes: 40
2025-12-25 20:15:24 -    • Màxima: 9.6°C
2025-12-25 20:15:24 -    • Mínima: 4.7°C
2025-12-25 20:15:24 -    • Pluja: 6.2mm
2025-12-25 20:15:24 -    • Últim període: 19:30 - 20:00 UTC
2025-12-25 20:15:24 -    • Actualització: 20:15
2025-12-25 20:15:24 - 
💾 Fitxers generats:
2025-12-25 20:15:24 -    • data/weather_summary.json (per HTML)
2025-12-25 20:15:24 -    • data/weather_daily_YYYYMMDD.json (complet)
2025-12-25 20:15:24 -    • data/XX_YYYYMMDD.csv (per estació)
2025-12-25 20:15:24 - 
✅ PROCÉS COMPLETAT
2025-12-25 20:15:24 - ============================================================
