=== INICI DAILY SCRAPER (UTC): 2025-12-20 16:55:16 ===
2025-12-20 16:55:16 - ============================================================
2025-12-20 16:55:16 - 🌤️  DAILY WEATHER SCRAPER - VERSIÓ UTC
2025-12-20 16:55:16 - ============================================================
2025-12-20 16:55:16 - 
==================================================
2025-12-20 16:55:16 - 📡 Processant: Fornells de la Selva [UO]
2025-12-20 16:55:16 - 
🌐 Connectant a Fornells de la Selva...
2025-12-20 16:55:18 - 📊 Total files trobades a la taula: 34
2025-12-20 16:55:18 -    ✅ Període UTC: 00:00 - 00:30 | TX: 11.6 | TN: 11.5 | Pluja: 1.8
2025-12-20 16:55:18 -    ✅ Període UTC: 00:30 - 01:00 | TX: 11.6 | TN: 11.5 | Pluja: 1.7
2025-12-20 16:55:18 -    ✅ Període UTC: 01:00 - 01:30 | TX: 11.5 | TN: 11.4 | Pluja: 1.9
2025-12-20 16:55:18 -    ✅ Període UTC: 01:30 - 02:00 | TX: 11.5 | TN: 11.3 | Pluja: 0.6
2025-12-20 16:55:18 -    ✅ Període UTC: 02:00 - 02:30 | TX: 11.3 | TN: 11.0 | Pluja: 0.1
2025-12-20 16:55:18 -    ✅ Període UTC: 02:30 - 03:00 | TX: 11.1 | TN: 11.0 | Pluja: 0.0
2025-12-20 16:55:18 -    ✅ Període UTC: 03:00 - 03:30 | TX: 11.1 | TN: 10.9 | Pluja: 0.0
2025-12-20 16:55:18 -    ✅ Període UTC: 03:30 - 04:00 | TX: 10.9 | TN: 10.8 | Pluja: 0.0
2025-12-20 16:55:18 -    ✅ Període UTC: 04:00 - 04:30 | TX: 10.9 | TN: 10.7 | Pluja: 0.0
2025-12-20 16:55:18 -    ✅ Període UTC: 04:30 - 05:00 | TX: 10.8 | TN: 10.5 | Pluja: 0.0
2025-12-20 16:55:18 -    ✅ Període UTC: 05:00 - 05:30 | TX: 10.5 | TN: 10.3 | Pluja: 0.0
2025-12-20 16:55:18 -    ✅ Període UTC: 05:30 - 06:00 | TX: 10.5 | TN: 10.1 | Pluja: 0.0
2025-12-20 16:55:18 -    ✅ Període UTC: 06:00 - 06:30 | TX: 10.7 | TN: 10.3 | Pluja: 0.0
2025-12-20 16:55:18 -    ✅ Període UTC: 06:30 - 07:00 | TX: 10.9 | TN: 10.7 | Pluja: 0.0
2025-12-20 16:55:18 -    ✅ Període UTC: 07:00 - 07:30 | TX: 11.0 | TN: 10.9 | Pluja: 0.0
2025-12-20 16:55:18 -    ✅ Període UTC: 07:30 - 08:00 | TX: 11.3 | TN: 11.0 | Pluja: 0.0
2025-12-20 16:55:18 -    ✅ Període UTC: 08:00 - 08:30 | TX: 11.5 | TN: 11.3 | Pluja: 0.0
2025-12-20 16:55:18 -    ✅ Període UTC: 08:30 - 09:00 | TX: 12.0 | TN: 11.5 | Pluja: 0.0
2025-12-20 16:55:18 -    ✅ Període UTC: 09:00 - 09:30 | TX: 12.4 | TN: 11.9 | Pluja: 0.0
2025-12-20 16:55:18 -    ✅ Període UTC: 09:30 - 10:00 | TX: 13.1 | TN: 12.3 | Pluja: 0.0
2025-12-20 16:55:18 -    ✅ Període UTC: 10:00 - 10:30 | TX: 13.6 | TN: 13.2 | Pluja: 0.0
2025-12-20 16:55:18 -    ✅ Període UTC: 10:30 - 11:00 | TX: 14.1 | TN: 13.5 | Pluja: 0.0
2025-12-20 16:55:18 -    ✅ Període UTC: 11:00 - 11:30 | TX: 14.5 | TN: 14.1 | Pluja: 0.0
2025-12-20 16:55:18 -    ✅ Període UTC: 11:30 - 12:00 | TX: 14.6 | TN: 14.1 | Pluja: 0.0
2025-12-20 16:55:18 -    ✅ Període UTC: 12:00 - 12:30 | TX: 15.5 | TN: 14.6 | Pluja: 0.0
2025-12-20 16:55:18 -    ✅ Període UTC: 12:30 - 13:00 | TX: 15.5 | TN: 15.0 | Pluja: 0.0
2025-12-20 16:55:18 -    ✅ Període UTC: 13:00 - 13:30 | TX: 15.6 | TN: 15.1 | Pluja: 0.0
2025-12-20 16:55:18 -    ✅ Període UTC: 13:30 - 14:00 | TX: 15.6 | TN: 15.4 | Pluja: 0.0
2025-12-20 16:55:18 -    ✅ Període UTC: 14:00 - 14:30 | TX: 15.5 | TN: 15.1 | Pluja: 0.0
2025-12-20 16:55:18 -    ✅ Període UTC: 14:30 - 15:00 | TX: 15.1 | TN: 14.7 | Pluja: 0.0
2025-12-20 16:55:18 -    ✅ Període UTC: 15:00 - 15:30 | TX: 14.7 | TN: 14.4 | Pluja: 0.0
2025-12-20 16:55:18 -    ✅ Període UTC: 15:30 - 16:00 | TX: 14.4 | TN: 14.1 | Pluja: 0.0
2025-12-20 16:55:18 -    ✅ Període UTC: 16:00 - 16:30 | TX: 14.1 | TN: 13.7 | Pluja: 0.0
2025-12-20 16:55:18 - 📈 Total períodes vàlids trobats: 33
2025-12-20 16:55:18 - 📊 RESUM CALCULAT:
2025-12-20 16:55:18 -    • Màxima del dia: 15.6°C
2025-12-20 16:55:18 -    • Mínima del dia: 10.1°C
2025-12-20 16:55:18 -    • Pluja acumulada: 6.1mm
2025-12-20 16:55:18 -    • Últim període: 16:00 - 16:30 UTC
2025-12-20 16:55:18 -    • Hora actualització: 16:55
2025-12-20 16:55:18 - 💾 Dades guardades a data/UO_20251220.csv (33 registres)
2025-12-20 16:55:18 - ✅ Fornells de la Selva: 33 períodes processats
2025-12-20 16:55:18 - 
==================================================
2025-12-20 16:55:18 - 📡 Processant: Girona [XJ]
2025-12-20 16:55:18 - 
🌐 Connectant a Girona...
2025-12-20 16:55:20 - 📊 Total files trobades a la taula: 34
2025-12-20 16:55:20 -    ✅ Període UTC: 00:00 - 00:30 | TX: 11.2 | TN: 10.9 | Pluja: 0.9
2025-12-20 16:55:20 -    ✅ Període UTC: 00:30 - 01:00 | TX: 11.0 | TN: 10.9 | Pluja: 2.5
2025-12-20 16:55:20 -    ✅ Període UTC: 01:00 - 01:30 | TX: 11.0 | TN: 10.9 | Pluja: 5.5
2025-12-20 16:55:20 -    ✅ Període UTC: 01:30 - 02:00 | TX: 11.2 | TN: 11.0 | Pluja: 4.1
2025-12-20 16:55:20 -    ✅ Període UTC: 02:00 - 02:30 | TX: 11.2 | TN: 11.0 | Pluja: 0.3
2025-12-20 16:55:20 -    ✅ Període UTC: 02:30 - 03:00 | TX: 11.0 | TN: 10.8 | Pluja: 0.0
2025-12-20 16:55:20 -    ✅ Període UTC: 03:00 - 03:30 | TX: 11.1 | TN: 10.9 | Pluja: 0.0
2025-12-20 16:55:20 -    ✅ Període UTC: 03:30 - 04:00 | TX: 11.0 | TN: 10.7 | Pluja: 0.0
2025-12-20 16:55:20 -    ✅ Període UTC: 04:00 - 04:30 | TX: 10.7 | TN: 10.5 | Pluja: 0.0
2025-12-20 16:55:20 -    ✅ Període UTC: 04:30 - 05:00 | TX: 10.5 | TN: 10.3 | Pluja: 0.1
2025-12-20 16:55:20 -    ✅ Període UTC: 05:00 - 05:30 | TX: 10.3 | TN: 10.2 | Pluja: 0.0
2025-12-20 16:55:20 -    ✅ Període UTC: 05:30 - 06:00 | TX: 10.2 | TN: 10.1 | Pluja: 0.0
2025-12-20 16:55:20 -    ✅ Període UTC: 06:00 - 06:30 | TX: 10.3 | TN: 10.0 | Pluja: 0.0
2025-12-20 16:55:20 -    ✅ Període UTC: 06:30 - 07:00 | TX: 10.5 | TN: 10.3 | Pluja: 0.0
2025-12-20 16:55:20 -    ✅ Període UTC: 07:00 - 07:30 | TX: 10.7 | TN: 10.5 | Pluja: 0.0
2025-12-20 16:55:20 -    ✅ Període UTC: 07:30 - 08:00 | TX: 11.0 | TN: 10.7 | Pluja: 0.0
2025-12-20 16:55:20 -    ✅ Període UTC: 08:00 - 08:30 | TX: 11.4 | TN: 11.0 | Pluja: 0.0
2025-12-20 16:55:20 -    ✅ Període UTC: 08:30 - 09:00 | TX: 11.9 | TN: 11.4 | Pluja: 0.0
2025-12-20 16:55:20 -    ✅ Període UTC: 09:00 - 09:30 | TX: 12.2 | TN: 11.8 | Pluja: 0.0
2025-12-20 16:55:20 -    ✅ Període UTC: 09:30 - 10:00 | TX: 12.8 | TN: 12.2 | Pluja: 0.0
2025-12-20 16:55:20 -    ✅ Període UTC: 10:00 - 10:30 | TX: 13.3 | TN: 12.8 | Pluja: 0.0
2025-12-20 16:55:20 -    ✅ Període UTC: 10:30 - 11:00 | TX: 13.6 | TN: 13.2 | Pluja: 0.0
2025-12-20 16:55:20 -    ✅ Període UTC: 11:00 - 11:30 | TX: 14.3 | TN: 13.6 | Pluja: 0.0
2025-12-20 16:55:20 -    ✅ Període UTC: 11:30 - 12:00 | TX: 14.5 | TN: 14.2 | Pluja: 0.0
2025-12-20 16:55:20 -    ✅ Període UTC: 12:00 - 12:30 | TX: 14.8 | TN: 14.5 | Pluja: 0.0
2025-12-20 16:55:20 -    ✅ Període UTC: 12:30 - 13:00 | TX: 15.0 | TN: 14.8 | Pluja: 0.0
2025-12-20 16:55:20 -    ✅ Període UTC: 13:00 - 13:30 | TX: 15.2 | TN: 15.0 | Pluja: 0.0
2025-12-20 16:55:20 -    ✅ Període UTC: 13:30 - 14:00 | TX: 15.4 | TN: 15.2 | Pluja: 0.0
2025-12-20 16:55:20 -    ✅ Període UTC: 14:00 - 14:30 | TX: 15.4 | TN: 15.2 | Pluja: 0.0
2025-12-20 16:55:20 -    ✅ Període UTC: 14:30 - 15:00 | TX: 15.4 | TN: 15.3 | Pluja: 0.0
2025-12-20 16:55:20 -    ✅ Període UTC: 15:00 - 15:30 | TX: 15.3 | TN: 14.9 | Pluja: 0.0
2025-12-20 16:55:20 -    ✅ Període UTC: 15:30 - 16:00 | TX: 14.9 | TN: 14.5 | Pluja: 0.0
2025-12-20 16:55:20 -    ✅ Període UTC: 16:00 - 16:30 | TX: 14.5 | TN: 14.1 | Pluja: 0.0
2025-12-20 16:55:20 - 📈 Total períodes vàlids trobats: 33
2025-12-20 16:55:20 - 📊 RESUM CALCULAT:
2025-12-20 16:55:20 -    • Màxima del dia: 15.4°C
2025-12-20 16:55:20 -    • Mínima del dia: 10.0°C
2025-12-20 16:55:20 -    • Pluja acumulada: 13.4mm
2025-12-20 16:55:20 -    • Últim període: 16:00 - 16:30 UTC
2025-12-20 16:55:20 -    • Hora actualització: 16:55
2025-12-20 16:55:20 - 💾 Dades guardades a data/XJ_20251220.csv (33 registres)
2025-12-20 16:55:20 - ✅ Girona: 33 períodes processats
2025-12-20 16:55:20 - 💾 Dades guardades a data/weather_daily_20251220.json
2025-12-20 16:55:20 - 💾 Dades guardades a data/weather_summary.json
2025-12-20 16:55:20 - 
============================================================
2025-12-20 16:55:20 - 📋 RESUM FINAL DEL DIA (UTC)
2025-12-20 16:55:20 - ============================================================
2025-12-20 16:55:20 - 
📍 Fornells de la Selva:
2025-12-20 16:55:20 -    • Períodes: 33
2025-12-20 16:55:20 -    • Màxima: 15.6°C
2025-12-20 16:55:20 -    • Mínima: 10.1°C
2025-12-20 16:55:20 -    • Pluja: 6.1mm
2025-12-20 16:55:20 -    • Últim període: 16:00 - 16:30 UTC
2025-12-20 16:55:20 -    • Actualització: 16:55
2025-12-20 16:55:20 - 
📍 Girona:
2025-12-20 16:55:20 -    • Períodes: 33
2025-12-20 16:55:20 -    • Màxima: 15.4°C
2025-12-20 16:55:20 -    • Mínima: 10.0°C
2025-12-20 16:55:20 -    • Pluja: 13.4mm
2025-12-20 16:55:20 -    • Últim període: 16:00 - 16:30 UTC
2025-12-20 16:55:20 -    • Actualització: 16:55
2025-12-20 16:55:20 - 
💾 Fitxers generats:
2025-12-20 16:55:20 -    • data/weather_summary.json (per HTML)
2025-12-20 16:55:20 -    • data/weather_daily_YYYYMMDD.json (complet)
2025-12-20 16:55:20 -    • data/XX_YYYYMMDD.csv (per estació)
2025-12-20 16:55:20 - 
✅ PROCÉS COMPLETAT
2025-12-20 16:55:20 - ============================================================
