=== INICI DAILY SCRAPER (UTC): 2026-02-14 17:50:19 ===
2026-02-14 17:50:19 - ============================================================
2026-02-14 17:50:19 - 🌤️  DAILY WEATHER SCRAPER - VERSIÓ UTC
2026-02-14 17:50:19 - ============================================================
2026-02-14 17:50:19 - 
==================================================
2026-02-14 17:50:19 - 📡 Processant: Fornells de la Selva [UO]
2026-02-14 17:50:19 - 
🌐 Connectant a Fornells de la Selva...
2026-02-14 17:50:20 - 📊 Total files trobades a la taula: 36
2026-02-14 17:50:20 -    ✅ Període UTC: 00:00 - 00:30 | TX: 8.1 | TN: 7.8 | Pluja: 0.0
2026-02-14 17:50:20 -    ✅ Període UTC: 00:30 - 01:00 | TX: 7.9 | TN: 7.5 | Pluja: 0.0
2026-02-14 17:50:20 -    ✅ Període UTC: 01:00 - 01:30 | TX: 7.6 | TN: 7.4 | Pluja: 0.0
2026-02-14 17:50:20 -    ✅ Període UTC: 01:30 - 02:00 | TX: 7.5 | TN: 7.2 | Pluja: 0.0
2026-02-14 17:50:20 -    ✅ Període UTC: 02:00 - 02:30 | TX: 7.4 | TN: 7.1 | Pluja: 0.0
2026-02-14 17:50:20 -    ✅ Període UTC: 02:30 - 03:00 | TX: 7.2 | TN: 6.6 | Pluja: 0.0
2026-02-14 17:50:20 -    ✅ Període UTC: 03:00 - 03:30 | TX: 6.9 | TN: 6.4 | Pluja: 0.0
2026-02-14 17:50:20 -    ✅ Període UTC: 03:30 - 04:00 | TX: 6.5 | TN: 6.1 | Pluja: 0.0
2026-02-14 17:50:20 -    ✅ Període UTC: 04:00 - 04:30 | TX: 6.5 | TN: 6.2 | Pluja: 0.0
2026-02-14 17:50:20 -    ✅ Període UTC: 04:30 - 05:00 | TX: 6.4 | TN: 6.1 | Pluja: 0.0
2026-02-14 17:50:20 -    ✅ Període UTC: 05:00 - 05:30 | TX: 6.4 | TN: 6.1 | Pluja: 0.0
2026-02-14 17:50:20 -    ✅ Període UTC: 05:30 - 06:00 | TX: 6.6 | TN: 6.4 | Pluja: 0.0
2026-02-14 17:50:20 -    ✅ Període UTC: 06:00 - 06:30 | TX: 6.4 | TN: 6.0 | Pluja: 0.0
2026-02-14 17:50:20 -    ✅ Període UTC: 06:30 - 07:00 | TX: 6.4 | TN: 6.1 | Pluja: 0.0
2026-02-14 17:50:20 -    ✅ Període UTC: 07:00 - 07:30 | TX: 6.2 | TN: 5.8 | Pluja: 0.0
2026-02-14 17:50:20 -    ✅ Període UTC: 07:30 - 08:00 | TX: 6.3 | TN: 5.7 | Pluja: 0.0
2026-02-14 17:50:20 -    ✅ Període UTC: 08:00 - 08:30 | TX: 6.8 | TN: 6.4 | Pluja: 0.0
2026-02-14 17:50:20 -    ✅ Període UTC: 08:30 - 09:00 | TX: 7.4 | TN: 6.8 | Pluja: 0.1
2026-02-14 17:50:20 -    ✅ Període UTC: 09:00 - 09:30 | TX: 8.5 | TN: 7.5 | Pluja: 0.0
2026-02-14 17:50:20 -    ✅ Període UTC: 09:30 - 10:00 | TX: 9.3 | TN: 8.5 | Pluja: 0.0
2026-02-14 17:50:20 -    ✅ Període UTC: 10:00 - 10:30 | TX: 11.2 | TN: 9.5 | Pluja: 0.0
2026-02-14 17:50:20 -    ✅ Període UTC: 10:30 - 11:00 | TX: 13.3 | TN: 11.2 | Pluja: 0.0
2026-02-14 17:50:20 -    ✅ Període UTC: 11:00 - 11:30 | TX: 13.7 | TN: 12.9 | Pluja: 0.0
2026-02-14 17:50:20 -    ✅ Període UTC: 11:30 - 12:00 | TX: 14.9 | TN: 13.1 | Pluja: 0.0
2026-02-14 17:50:20 -    ✅ Període UTC: 12:00 - 12:30 | TX: 14.8 | TN: 13.9 | Pluja: 0.0
2026-02-14 17:50:20 -    ✅ Període UTC: 12:30 - 13:00 | TX: 16.1 | TN: 14.5 | Pluja: 0.0
2026-02-14 17:50:20 -    ✅ Període UTC: 13:00 - 13:30 | TX: 16.9 | TN: 15.9 | Pluja: 0.0
2026-02-14 17:50:20 -    ✅ Període UTC: 13:30 - 14:00 | TX: 16.9 | TN: 16.0 | Pluja: 0.0
2026-02-14 17:50:20 -    ✅ Període UTC: 14:00 - 14:30 | TX: 17.0 | TN: 16.6 | Pluja: 0.0
2026-02-14 17:50:20 -    ✅ Període UTC: 14:30 - 15:00 | TX: 17.2 | TN: 16.6 | Pluja: 0.0
2026-02-14 17:50:20 -    ✅ Període UTC: 15:00 - 15:30 | TX: 17.3 | TN: 16.4 | Pluja: 0.0
2026-02-14 17:50:20 -    ✅ Període UTC: 15:30 - 16:00 | TX: 17.2 | TN: 15.0 | Pluja: 0.0
2026-02-14 17:50:20 -    ✅ Període UTC: 16:00 - 16:30 | TX: 15.2 | TN: 14.0 | Pluja: 0.0
2026-02-14 17:50:20 -    ✅ Període UTC: 16:30 - 17:00 | TX: 13.9 | TN: 12.5 | Pluja: 0.0
2026-02-14 17:50:20 -    ✅ Període UTC: 17:00 - 17:30 | TX: 12.5 | TN: 11.7 | Pluja: 0.0
2026-02-14 17:50:20 - 📈 Total períodes vàlids trobats: 35
2026-02-14 17:50:20 - 📊 RESUM CALCULAT:
2026-02-14 17:50:20 -    • Màxima del dia: 17.3°C
2026-02-14 17:50:20 -    • Mínima del dia: 5.7°C
2026-02-14 17:50:20 -    • Pluja acumulada: 0.1mm
2026-02-14 17:50:20 -    • Últim període: 17:00 - 17:30 UTC
2026-02-14 17:50:20 -    • Hora actualització: 17:50
2026-02-14 17:50:20 - 💾 Dades guardades a data/UO_20260214.csv (35 registres)
2026-02-14 17:50:20 - ✅ Fornells de la Selva: 35 períodes processats
2026-02-14 17:50:20 - 
==================================================
2026-02-14 17:50:20 - 📡 Processant: Girona [XJ]
2026-02-14 17:50:20 - 
🌐 Connectant a Girona...
2026-02-14 17:50:22 - 📊 Total files trobades a la taula: 36
2026-02-14 17:50:22 -    ✅ Període UTC: 00:00 - 00:30 | TX: 9.1 | TN: 8.8 | Pluja: 0.1
2026-02-14 17:50:22 -    ✅ Període UTC: 00:30 - 01:00 | TX: 8.8 | TN: 8.4 | Pluja: 0.0
2026-02-14 17:50:22 -    ✅ Període UTC: 01:00 - 01:30 | TX: 8.4 | TN: 7.9 | Pluja: 0.0
2026-02-14 17:50:22 -    ✅ Període UTC: 01:30 - 02:00 | TX: 8.0 | TN: 7.9 | Pluja: 0.0
2026-02-14 17:50:22 -    ✅ Període UTC: 02:00 - 02:30 | TX: 7.8 | TN: 7.5 | Pluja: 0.0
2026-02-14 17:50:22 -    ✅ Període UTC: 02:30 - 03:00 | TX: 7.6 | TN: 7.0 | Pluja: 0.0
2026-02-14 17:50:22 -    ✅ Període UTC: 03:00 - 03:30 | TX: 7.1 | TN: 6.7 | Pluja: 0.0
2026-02-14 17:50:22 -    ✅ Període UTC: 03:30 - 04:00 | TX: 6.8 | TN: 6.5 | Pluja: 0.0
2026-02-14 17:50:22 -    ✅ Període UTC: 04:00 - 04:30 | TX: 6.7 | TN: 6.5 | Pluja: 0.0
2026-02-14 17:50:22 -    ✅ Període UTC: 04:30 - 05:00 | TX: 7.0 | TN: 6.5 | Pluja: 0.0
2026-02-14 17:50:22 -    ✅ Període UTC: 05:00 - 05:30 | TX: 7.0 | TN: 6.5 | Pluja: 0.0
2026-02-14 17:50:22 -    ✅ Període UTC: 05:30 - 06:00 | TX: 6.8 | TN: 6.4 | Pluja: 0.0
2026-02-14 17:50:22 -    ✅ Període UTC: 06:00 - 06:30 | TX: 6.7 | TN: 6.3 | Pluja: 0.0
2026-02-14 17:50:22 -    ✅ Període UTC: 06:30 - 07:00 | TX: 6.4 | TN: 5.8 | Pluja: 0.0
2026-02-14 17:50:22 -    ✅ Període UTC: 07:00 - 07:30 | TX: 6.2 | TN: 5.7 | Pluja: 0.0
2026-02-14 17:50:22 -    ✅ Període UTC: 07:30 - 08:00 | TX: 6.4 | TN: 5.8 | Pluja: 0.0
2026-02-14 17:50:22 -    ✅ Període UTC: 08:00 - 08:30 | TX: 7.0 | TN: 6.4 | Pluja: 0.0
2026-02-14 17:50:22 -    ✅ Període UTC: 08:30 - 09:00 | TX: 8.2 | TN: 7.1 | Pluja: 0.0
2026-02-14 17:50:22 -    ✅ Període UTC: 09:00 - 09:30 | TX: 9.4 | TN: 8.3 | Pluja: 0.0
2026-02-14 17:50:22 -    ✅ Període UTC: 09:30 - 10:00 | TX: 10.3 | TN: 9.4 | Pluja: 0.0
2026-02-14 17:50:22 -    ✅ Període UTC: 10:00 - 10:30 | TX: 12.9 | TN: 10.3 | Pluja: 0.0
2026-02-14 17:50:22 -    ✅ Període UTC: 10:30 - 11:00 | TX: 13.4 | TN: 12.8 | Pluja: 0.0
2026-02-14 17:50:22 -    ✅ Període UTC: 11:00 - 11:30 | TX: 14.1 | TN: 12.6 | Pluja: 0.1
2026-02-14 17:50:22 -    ✅ Període UTC: 11:30 - 12:00 | TX: 14.9 | TN: 13.9 | Pluja: 0.2
2026-02-14 17:50:22 -    ✅ Període UTC: 12:00 - 12:30 | TX: 16.2 | TN: 14.3 | Pluja: 0.1
2026-02-14 17:50:22 -    ✅ Període UTC: 12:30 - 13:00 | TX: 17.0 | TN: 15.8 | Pluja: 0.1
2026-02-14 17:50:22 -    ✅ Període UTC: 13:00 - 13:30 | TX: 17.0 | TN: 16.0 | Pluja: 0.2
2026-02-14 17:50:22 -    ✅ Període UTC: 13:30 - 14:00 | TX: 17.6 | TN: 16.6 | Pluja: 0.1
2026-02-14 17:50:22 -    ✅ Període UTC: 14:00 - 14:30 | TX: 17.9 | TN: 17.1 | Pluja: 0.0
2026-02-14 17:50:22 -    ✅ Període UTC: 14:30 - 15:00 | TX: 17.6 | TN: 16.8 | Pluja: 0.0
2026-02-14 17:50:22 -    ✅ Període UTC: 15:00 - 15:30 | TX: 17.7 | TN: 17.1 | Pluja: 0.0
2026-02-14 17:50:22 -    ✅ Període UTC: 15:30 - 16:00 | TX: 17.8 | TN: 17.4 | Pluja: 0.0
2026-02-14 17:50:22 -    ✅ Període UTC: 16:00 - 16:30 | TX: 17.4 | TN: 14.5 | Pluja: 0.0
2026-02-14 17:50:22 -    ✅ Període UTC: 16:30 - 17:00 | TX: 14.4 | TN: 13.4 | Pluja: 0.0
2026-02-14 17:50:22 -    ✅ Període UTC: 17:00 - 17:30 | TX: 13.4 | TN: 12.8 | Pluja: 0.0
2026-02-14 17:50:22 - 📈 Total períodes vàlids trobats: 35
2026-02-14 17:50:22 - 📊 RESUM CALCULAT:
2026-02-14 17:50:22 -    • Màxima del dia: 17.9°C
2026-02-14 17:50:22 -    • Mínima del dia: 5.7°C
2026-02-14 17:50:22 -    • Pluja acumulada: 0.9mm
2026-02-14 17:50:22 -    • Últim període: 17:00 - 17:30 UTC
2026-02-14 17:50:22 -    • Hora actualització: 17:50
2026-02-14 17:50:22 - 💾 Dades guardades a data/XJ_20260214.csv (35 registres)
2026-02-14 17:50:22 - ✅ Girona: 35 períodes processats
2026-02-14 17:50:22 - 💾 Dades guardades a data/weather_daily_20260214.json
2026-02-14 17:50:22 - 💾 Dades guardades a data/weather_summary.json
2026-02-14 17:50:22 - 
============================================================
2026-02-14 17:50:22 - 📋 RESUM FINAL DEL DIA (UTC)
2026-02-14 17:50:22 - ============================================================
2026-02-14 17:50:22 - 
📍 Fornells de la Selva:
2026-02-14 17:50:22 -    • Períodes: 35
2026-02-14 17:50:22 -    • Màxima: 17.3°C
2026-02-14 17:50:22 -    • Mínima: 5.7°C
2026-02-14 17:50:22 -    • Pluja: 0.1mm
2026-02-14 17:50:22 -    • Últim període: 17:00 - 17:30 UTC
2026-02-14 17:50:22 -    • Actualització: 17:50
2026-02-14 17:50:22 - 
📍 Girona:
2026-02-14 17:50:22 -    • Períodes: 35
2026-02-14 17:50:22 -    • Màxima: 17.9°C
2026-02-14 17:50:22 -    • Mínima: 5.7°C
2026-02-14 17:50:22 -    • Pluja: 0.9mm
2026-02-14 17:50:22 -    • Últim període: 17:00 - 17:30 UTC
2026-02-14 17:50:22 -    • Actualització: 17:50
2026-02-14 17:50:22 - 
💾 Fitxers generats:
2026-02-14 17:50:22 -    • data/weather_summary.json (per HTML)
2026-02-14 17:50:22 -    • data/weather_daily_YYYYMMDD.json (complet)
2026-02-14 17:50:22 -    • data/XX_YYYYMMDD.csv (per estació)
2026-02-14 17:50:22 - 
✅ PROCÉS COMPLETAT
2026-02-14 17:50:22 - ============================================================
