=== INICI DAILY SCRAPER (UTC): 2026-01-09 18:48:09 ===
2026-01-09 18:48:09 - ============================================================
2026-01-09 18:48:09 - 🌤️  DAILY WEATHER SCRAPER - VERSIÓ UTC
2026-01-09 18:48:09 - ============================================================
2026-01-09 18:48:09 - 
==================================================
2026-01-09 18:48:09 - 📡 Processant: Fornells de la Selva [UO]
2026-01-09 18:48:09 - 
🌐 Connectant a Fornells de la Selva...
2026-01-09 18:48:11 - 📊 Total files trobades a la taula: 38
2026-01-09 18:48:11 -    ✅ Període UTC: 00:00 - 00:30 | TX: 13.4 | TN: 11.5 | Pluja: 0.0
2026-01-09 18:48:11 -    ✅ Període UTC: 00:30 - 01:00 | TX: 12.8 | TN: 11.5 | Pluja: 0.0
2026-01-09 18:48:11 -    ✅ Període UTC: 01:00 - 01:30 | TX: 12.2 | TN: 9.9 | Pluja: 0.0
2026-01-09 18:48:11 -    ✅ Període UTC: 01:30 - 02:00 | TX: 11.9 | TN: 10.4 | Pluja: 0.0
2026-01-09 18:48:11 -    ✅ Període UTC: 02:00 - 02:30 | TX: 11.1 | TN: 9.3 | Pluja: 0.0
2026-01-09 18:48:11 -    ✅ Període UTC: 02:30 - 03:00 | TX: 10.9 | TN: 9.4 | Pluja: 0.0
2026-01-09 18:48:11 -    ✅ Període UTC: 03:00 - 03:30 | TX: 10.3 | TN: 8.2 | Pluja: 0.0
2026-01-09 18:48:11 -    ✅ Període UTC: 03:30 - 04:00 | TX: 9.0 | TN: 6.9 | Pluja: 0.0
2026-01-09 18:48:11 -    ✅ Període UTC: 04:00 - 04:30 | TX: 8.0 | TN: 6.0 | Pluja: 0.0
2026-01-09 18:48:11 -    ✅ Període UTC: 04:30 - 05:00 | TX: 6.8 | TN: 4.9 | Pluja: 0.0
2026-01-09 18:48:11 -    ✅ Període UTC: 05:00 - 05:30 | TX: 5.6 | TN: 4.3 | Pluja: 0.0
2026-01-09 18:48:11 -    ✅ Període UTC: 05:30 - 06:00 | TX: 5.0 | TN: 3.5 | Pluja: 0.0
2026-01-09 18:48:11 -    ✅ Període UTC: 06:00 - 06:30 | TX: 8.2 | TN: 3.8 | Pluja: 0.0
2026-01-09 18:48:11 -    ✅ Període UTC: 06:30 - 07:00 | TX: 9.3 | TN: 8.0 | Pluja: 0.0
2026-01-09 18:48:11 -    ✅ Període UTC: 07:00 - 07:30 | TX: 10.5 | TN: 9.2 | Pluja: 0.0
2026-01-09 18:48:11 -    ✅ Període UTC: 07:30 - 08:00 | TX: 10.5 | TN: 10.0 | Pluja: 0.0
2026-01-09 18:48:11 -    ✅ Període UTC: 08:00 - 08:30 | TX: 11.2 | TN: 10.4 | Pluja: 0.0
2026-01-09 18:48:11 -    ✅ Període UTC: 08:30 - 09:00 | TX: 11.3 | TN: 9.6 | Pluja: 0.0
2026-01-09 18:48:11 -    ✅ Període UTC: 09:00 - 09:30 | TX: 12.1 | TN: 9.7 | Pluja: 0.0
2026-01-09 18:48:11 -    ✅ Període UTC: 09:30 - 10:00 | TX: 12.6 | TN: 12.2 | Pluja: 0.0
2026-01-09 18:48:11 -    ✅ Període UTC: 10:00 - 10:30 | TX: 13.1 | TN: 12.3 | Pluja: 0.0
2026-01-09 18:48:11 -    ✅ Període UTC: 10:30 - 11:00 | TX: 13.3 | TN: 12.8 | Pluja: 0.0
2026-01-09 18:48:11 -    ✅ Període UTC: 11:00 - 11:30 | TX: 13.7 | TN: 13.2 | Pluja: 0.0
2026-01-09 18:48:11 -    ✅ Període UTC: 11:30 - 12:00 | TX: 14.0 | TN: 13.6 | Pluja: 0.0
2026-01-09 18:48:11 -    ✅ Període UTC: 12:00 - 12:30 | TX: 14.5 | TN: 14.0 | Pluja: 0.0
2026-01-09 18:48:11 -    ✅ Període UTC: 12:30 - 13:00 | TX: 14.6 | TN: 14.1 | Pluja: 0.0
2026-01-09 18:48:11 -    ✅ Període UTC: 13:00 - 13:30 | TX: 14.6 | TN: 13.8 | Pluja: 0.0
2026-01-09 18:48:11 -    ✅ Període UTC: 13:30 - 14:00 | TX: 14.4 | TN: 13.6 | Pluja: 0.0
2026-01-09 18:48:11 -    ✅ Període UTC: 14:00 - 14:30 | TX: 15.1 | TN: 14.0 | Pluja: 0.0
2026-01-09 18:48:11 -    ✅ Període UTC: 14:30 - 15:00 | TX: 14.9 | TN: 14.2 | Pluja: 0.0
2026-01-09 18:48:11 -    ✅ Període UTC: 15:00 - 15:30 | TX: 14.6 | TN: 12.6 | Pluja: 0.0
2026-01-09 18:48:11 -    ✅ Període UTC: 15:30 - 16:00 | TX: 12.6 | TN: 11.7 | Pluja: 0.0
2026-01-09 18:48:11 -    ✅ Període UTC: 16:00 - 16:30 | TX: 11.7 | TN: 10.3 | Pluja: 0.0
2026-01-09 18:48:11 -    ✅ Període UTC: 16:30 - 17:00 | TX: 10.3 | TN: 9.3 | Pluja: 0.0
2026-01-09 18:48:11 -    ✅ Període UTC: 17:00 - 17:30 | TX: 9.2 | TN: 8.1 | Pluja: 0.0
2026-01-09 18:48:11 -    ✅ Període UTC: 17:30 - 18:00 | TX: 8.1 | TN: 5.6 | Pluja: 0.0
2026-01-09 18:48:11 -    ✅ Període UTC: 18:00 - 18:30 | TX: 5.5 | TN: 4.5 | Pluja: 0.0
2026-01-09 18:48:11 - 📈 Total períodes vàlids trobats: 37
2026-01-09 18:48:11 - 📊 RESUM CALCULAT:
2026-01-09 18:48:11 -    • Màxima del dia: 15.1°C
2026-01-09 18:48:11 -    • Mínima del dia: 3.5°C
2026-01-09 18:48:11 -    • Pluja acumulada: 0.0mm
2026-01-09 18:48:11 -    • Últim període: 18:00 - 18:30 UTC
2026-01-09 18:48:11 -    • Hora actualització: 18:48
2026-01-09 18:48:11 - 💾 Dades guardades a data/UO_20260109.csv (37 registres)
2026-01-09 18:48:11 - ✅ Fornells de la Selva: 37 períodes processats
2026-01-09 18:48:11 - 
==================================================
2026-01-09 18:48:11 - 📡 Processant: Girona [XJ]
2026-01-09 18:48:11 - 
🌐 Connectant a Girona...
2026-01-09 18:48:12 - 📊 Total files trobades a la taula: 38
2026-01-09 18:48:12 -    ✅ Període UTC: 00:00 - 00:30 | TX: 12.3 | TN: 11.9 | Pluja: 0.0
2026-01-09 18:48:12 -    ✅ Període UTC: 00:30 - 01:00 | TX: 12.0 | TN: 11.8 | Pluja: 0.0
2026-01-09 18:48:12 -    ✅ Període UTC: 01:00 - 01:30 | TX: 12.0 | TN: 11.8 | Pluja: 0.0
2026-01-09 18:48:12 -    ✅ Període UTC: 01:30 - 02:00 | TX: 12.1 | TN: 11.2 | Pluja: 0.0
2026-01-09 18:48:12 -    ✅ Període UTC: 02:00 - 02:30 | TX: 11.8 | TN: 11.1 | Pluja: 0.0
2026-01-09 18:48:12 -    ✅ Període UTC: 02:30 - 03:00 | TX: 11.5 | TN: 10.3 | Pluja: 0.0
2026-01-09 18:48:12 -    ✅ Període UTC: 03:00 - 03:30 | TX: 11.3 | TN: 10.2 | Pluja: 0.0
2026-01-09 18:48:12 -    ✅ Període UTC: 03:30 - 04:00 | TX: 11.0 | TN: 10.5 | Pluja: 0.0
2026-01-09 18:48:12 -    ✅ Període UTC: 04:00 - 04:30 | TX: 12.0 | TN: 11.0 | Pluja: 0.0
2026-01-09 18:48:12 -    ✅ Període UTC: 04:30 - 05:00 | TX: 11.8 | TN: 9.3 | Pluja: 0.0
2026-01-09 18:48:12 -    ✅ Període UTC: 05:00 - 05:30 | TX: 10.9 | TN: 8.4 | Pluja: 0.0
2026-01-09 18:48:12 -    ✅ Període UTC: 05:30 - 06:00 | TX: 11.6 | TN: 10.7 | Pluja: 0.0
2026-01-09 18:48:12 -    ✅ Període UTC: 06:00 - 06:30 | TX: 11.5 | TN: 10.1 | Pluja: 0.0
2026-01-09 18:48:12 -    ✅ Període UTC: 06:30 - 07:00 | TX: 10.6 | TN: 9.2 | Pluja: 0.0
2026-01-09 18:48:12 -    ✅ Període UTC: 07:00 - 07:30 | TX: 9.6 | TN: 8.5 | Pluja: 0.0
2026-01-09 18:48:12 -    ✅ Període UTC: 07:30 - 08:00 | TX: 9.8 | TN: 8.8 | Pluja: 0.0
2026-01-09 18:48:12 -    ✅ Període UTC: 08:00 - 08:30 | TX: 12.9 | TN: 9.1 | Pluja: 0.0
2026-01-09 18:48:12 -    ✅ Període UTC: 08:30 - 09:00 | TX: 13.3 | TN: 12.4 | Pluja: 0.0
2026-01-09 18:48:12 -    ✅ Període UTC: 09:00 - 09:30 | TX: 13.5 | TN: 12.7 | Pluja: 0.0
2026-01-09 18:48:12 -    ✅ Període UTC: 09:30 - 10:00 | TX: 13.7 | TN: 13.0 | Pluja: 0.0
2026-01-09 18:48:12 -    ✅ Període UTC: 10:00 - 10:30 | TX: 13.9 | TN: 13.1 | Pluja: 0.0
2026-01-09 18:48:12 -    ✅ Període UTC: 10:30 - 11:00 | TX: 14.2 | TN: 13.5 | Pluja: 0.0
2026-01-09 18:48:12 -    ✅ Període UTC: 11:00 - 11:30 | TX: 14.4 | TN: 13.9 | Pluja: 0.0
2026-01-09 18:48:12 -    ✅ Període UTC: 11:30 - 12:00 | TX: 14.8 | TN: 14.0 | Pluja: 0.0
2026-01-09 18:48:12 -    ✅ Període UTC: 12:00 - 12:30 | TX: 14.9 | TN: 14.5 | Pluja: 0.0
2026-01-09 18:48:12 -    ✅ Període UTC: 12:30 - 13:00 | TX: 15.1 | TN: 14.1 | Pluja: 0.0
2026-01-09 18:48:12 -    ✅ Període UTC: 13:00 - 13:30 | TX: 15.5 | TN: 15.0 | Pluja: 0.0
2026-01-09 18:48:12 -    ✅ Període UTC: 13:30 - 14:00 | TX: 15.9 | TN: 15.2 | Pluja: 0.0
2026-01-09 18:48:12 -    ✅ Període UTC: 14:00 - 14:30 | TX: 15.9 | TN: 15.0 | Pluja: 0.0
2026-01-09 18:48:12 -    ✅ Període UTC: 14:30 - 15:00 | TX: 15.4 | TN: 13.0 | Pluja: 0.0
2026-01-09 18:48:12 -    ✅ Període UTC: 15:00 - 15:30 | TX: 13.0 | TN: 12.1 | Pluja: 0.0
2026-01-09 18:48:12 -    ✅ Període UTC: 15:30 - 16:00 | TX: 12.6 | TN: 12.2 | Pluja: 0.0
2026-01-09 18:48:12 -    ✅ Període UTC: 16:00 - 16:30 | TX: 12.1 | TN: 9.9 | Pluja: 0.0
2026-01-09 18:48:12 -    ✅ Període UTC: 16:30 - 17:00 | TX: 9.8 | TN: 9.2 | Pluja: 0.0
2026-01-09 18:48:12 -    ✅ Període UTC: 17:00 - 17:30 | TX: 9.1 | TN: 8.5 | Pluja: 0.2
2026-01-09 18:48:12 -    ✅ Període UTC: 17:30 - 18:00 | TX: 8.3 | TN: 6.0 | Pluja: 0.0
2026-01-09 18:48:12 -    ✅ Període UTC: 18:00 - 18:30 | TX: 6.7 | TN: 5.0 | Pluja: 0.0
2026-01-09 18:48:12 - 📈 Total períodes vàlids trobats: 37
2026-01-09 18:48:12 - 📊 RESUM CALCULAT:
2026-01-09 18:48:12 -    • Màxima del dia: 15.9°C
2026-01-09 18:48:12 -    • Mínima del dia: 5.0°C
2026-01-09 18:48:12 -    • Pluja acumulada: 0.2mm
2026-01-09 18:48:12 -    • Últim període: 18:00 - 18:30 UTC
2026-01-09 18:48:12 -    • Hora actualització: 18:48
2026-01-09 18:48:12 - 💾 Dades guardades a data/XJ_20260109.csv (37 registres)
2026-01-09 18:48:12 - ✅ Girona: 37 períodes processats
2026-01-09 18:48:12 - 💾 Dades guardades a data/weather_daily_20260109.json
2026-01-09 18:48:12 - 💾 Dades guardades a data/weather_summary.json
2026-01-09 18:48:12 - 
============================================================
2026-01-09 18:48:12 - 📋 RESUM FINAL DEL DIA (UTC)
2026-01-09 18:48:12 - ============================================================
2026-01-09 18:48:12 - 
📍 Fornells de la Selva:
2026-01-09 18:48:12 -    • Períodes: 37
2026-01-09 18:48:12 -    • Màxima: 15.1°C
2026-01-09 18:48:12 -    • Mínima: 3.5°C
2026-01-09 18:48:12 -    • Pluja: 0.0mm
2026-01-09 18:48:12 -    • Últim període: 18:00 - 18:30 UTC
2026-01-09 18:48:12 -    • Actualització: 18:48
2026-01-09 18:48:12 - 
📍 Girona:
2026-01-09 18:48:12 -    • Períodes: 37
2026-01-09 18:48:12 -    • Màxima: 15.9°C
2026-01-09 18:48:12 -    • Mínima: 5.0°C
2026-01-09 18:48:12 -    • Pluja: 0.2mm
2026-01-09 18:48:12 -    • Últim període: 18:00 - 18:30 UTC
2026-01-09 18:48:12 -    • Actualització: 18:48
2026-01-09 18:48:12 - 
💾 Fitxers generats:
2026-01-09 18:48:12 -    • data/weather_summary.json (per HTML)
2026-01-09 18:48:12 -    • data/weather_daily_YYYYMMDD.json (complet)
2026-01-09 18:48:12 -    • data/XX_YYYYMMDD.csv (per estació)
2026-01-09 18:48:12 - 
✅ PROCÉS COMPLETAT
2026-01-09 18:48:12 - ============================================================
