=== INICI DAILY SCRAPER (UTC): 2026-01-19 14:15:23 ===
2026-01-19 14:15:23 - ============================================================
2026-01-19 14:15:23 - 🌤️  DAILY WEATHER SCRAPER - VERSIÓ UTC
2026-01-19 14:15:23 - ============================================================
2026-01-19 14:15:23 - 
==================================================
2026-01-19 14:15:23 - 📡 Processant: Fornells de la Selva [UO]
2026-01-19 14:15:23 - 
🌐 Connectant a Fornells de la Selva...
2026-01-19 14:15:25 - 📊 Total files trobades a la taula: 29
2026-01-19 14:15:25 - 📈 Total períodes vàlids trobats: 0
2026-01-19 14:15:25 - ❌ No s'han trobat dades vàlides per al dia d'avui
2026-01-19 14:15:25 - ❌ Fornells de la Selva: No s'han pogut obtenir dades
2026-01-19 14:15:25 - 
==================================================
2026-01-19 14:15:25 - 📡 Processant: Girona [XJ]
2026-01-19 14:15:25 - 
🌐 Connectant a Girona...
2026-01-19 14:15:27 - 📊 Total files trobades a la taula: 29
2026-01-19 14:15:27 -    ✅ Període UTC: 00:00 - 00:30 | TX: 9.9 | TN: 9.8 | Pluja: 0.0
2026-01-19 14:15:27 -    ✅ Període UTC: 00:30 - 01:00 | TX: 9.9 | TN: 9.9 | Pluja: 0.1
2026-01-19 14:15:27 -    ✅ Període UTC: 01:00 - 01:30 | TX: 9.9 | TN: 9.8 | Pluja: 0.1
2026-01-19 14:15:27 -    ✅ Període UTC: 01:30 - 02:00 | TX: 9.8 | TN: 9.6 | Pluja: 0.0
2026-01-19 14:15:27 -    ✅ Període UTC: 02:00 - 02:30 | TX: 9.7 | TN: 9.6 | Pluja: 0.0
2026-01-19 14:15:27 -    ✅ Període UTC: 02:30 - 03:00 | TX: 9.7 | TN: 8.9 | Pluja: 0.0
2026-01-19 14:15:27 -    ✅ Període UTC: 03:00 - 03:30 | TX: 9.0 | TN: 8.6 | Pluja: 0.1
2026-01-19 14:15:27 -    ✅ Període UTC: 03:30 - 04:00 | TX: 9.2 | TN: 8.6 | Pluja: 0.0
2026-01-19 14:15:27 -    ✅ Període UTC: 04:00 - 04:30 | TX: 9.3 | TN: 9.2 | Pluja: 0.0
2026-01-19 14:15:27 -    ✅ Període UTC: 04:30 - 05:00 | TX: 9.3 | TN: 9.2 | Pluja: 0.0
2026-01-19 14:15:27 -    ✅ Període UTC: 05:00 - 05:30 | TX: 9.2 | TN: 9.1 | Pluja: 0.0
2026-01-19 14:15:27 -    ✅ Període UTC: 05:30 - 06:00 | TX: 9.1 | TN: 9.0 | Pluja: 0.2
2026-01-19 14:15:27 -    ✅ Període UTC: 06:00 - 06:30 | TX: 9.2 | TN: 9.0 | Pluja: 0.9
2026-01-19 14:15:27 -    ✅ Període UTC: 06:30 - 07:00 | TX: 9.0 | TN: 8.8 | Pluja: 0.6
2026-01-19 14:15:27 -    ✅ Període UTC: 07:00 - 07:30 | TX: 8.7 | TN: 8.6 | Pluja: 0.9
2026-01-19 14:15:27 -    ✅ Període UTC: 07:30 - 08:00 | TX: 8.6 | TN: 8.5 | Pluja: 1.4
2026-01-19 14:15:27 -    ✅ Període UTC: 08:00 - 08:30 | TX: 8.5 | TN: 8.5 | Pluja: 3.7
2026-01-19 14:15:27 -    ✅ Període UTC: 08:30 - 09:00 | TX: 8.5 | TN: 8.5 | Pluja: 3.0
2026-01-19 14:15:27 -    ✅ Període UTC: 09:00 - 09:30 | TX: 8.6 | TN: 8.5 | Pluja: 0.7
2026-01-19 14:15:27 -    ✅ Període UTC: 09:30 - 10:00 | TX: 8.7 | TN: 8.6 | Pluja: 3.9
2026-01-19 14:15:27 -    ✅ Període UTC: 10:00 - 10:30 | TX: 8.9 | TN: 8.7 | Pluja: 2.5
2026-01-19 14:15:27 -    ✅ Període UTC: 10:30 - 11:00 | TX: 8.9 | TN: 8.9 | Pluja: 1.8
2026-01-19 14:15:27 -    ✅ Període UTC: 11:00 - 11:30 | TX: 9.0 | TN: 8.9 | Pluja: 2.9
2026-01-19 14:15:27 -    ✅ Període UTC: 11:30 - 12:00 | TX: 8.9 | TN: 8.9 | Pluja: 0.7
2026-01-19 14:15:27 -    ✅ Període UTC: 12:00 - 12:30 | TX: 9.0 | TN: 8.9 | Pluja: 0.7
2026-01-19 14:15:27 -    ✅ Període UTC: 12:30 - 13:00 | TX: 9.0 | TN: 8.9 | Pluja: 2.4
2026-01-19 14:15:27 -    ✅ Període UTC: 13:00 - 13:30 | TX: 8.9 | TN: 8.9 | Pluja: 2.2
2026-01-19 14:15:27 -    ✅ Període UTC: 13:30 - 14:00 | TX: 8.9 | TN: 8.8 | Pluja: 1.2
2026-01-19 14:15:27 - 📈 Total períodes vàlids trobats: 28
2026-01-19 14:15:27 - 📊 RESUM CALCULAT:
2026-01-19 14:15:27 -    • Màxima del dia: 9.9°C
2026-01-19 14:15:27 -    • Mínima del dia: 8.5°C
2026-01-19 14:15:27 -    • Pluja acumulada: 29.999999999999996mm
2026-01-19 14:15:27 -    • Últim període: 13:30 - 14:00 UTC
2026-01-19 14:15:27 -    • Hora actualització: 14:15
2026-01-19 14:15:27 - 💾 Dades guardades a data/XJ_20260119.csv (28 registres)
2026-01-19 14:15:27 - ✅ Girona: 28 períodes processats
2026-01-19 14:15:27 - 💾 Dades guardades a data/weather_daily_20260119.json
2026-01-19 14:15:27 - 💾 Dades guardades a data/weather_summary.json
2026-01-19 14:15:27 - 
============================================================
2026-01-19 14:15:27 - 📋 RESUM FINAL DEL DIA (UTC)
2026-01-19 14:15:27 - ============================================================
2026-01-19 14:15:27 - 
⚠️  UO: Sense dades
2026-01-19 14:15:27 - 
📍 Girona:
2026-01-19 14:15:27 -    • Períodes: 28
2026-01-19 14:15:27 -    • Màxima: 9.9°C
2026-01-19 14:15:27 -    • Mínima: 8.5°C
2026-01-19 14:15:27 -    • Pluja: 29.999999999999996mm
2026-01-19 14:15:27 -    • Últim període: 13:30 - 14:00 UTC
2026-01-19 14:15:27 -    • Actualització: 14:15
2026-01-19 14:15:27 - 
💾 Fitxers generats:
2026-01-19 14:15:27 -    • data/weather_summary.json (per HTML)
2026-01-19 14:15:27 -    • data/weather_daily_YYYYMMDD.json (complet)
2026-01-19 14:15:27 -    • data/XX_YYYYMMDD.csv (per estació)
2026-01-19 14:15:27 - 
✅ PROCÉS COMPLETAT
2026-01-19 14:15:27 - ============================================================
