=== INICI DAILY SCRAPER (UTC): 2026-01-16 18:20:20 ===
2026-01-16 18:20:20 - ============================================================
2026-01-16 18:20:20 - 🌤️  DAILY WEATHER SCRAPER - VERSIÓ UTC
2026-01-16 18:20:20 - ============================================================
2026-01-16 18:20:20 - 
==================================================
2026-01-16 18:20:20 - 📡 Processant: Fornells de la Selva [UO]
2026-01-16 18:20:20 - 
🌐 Connectant a Fornells de la Selva...
2026-01-16 18:20:21 - 📊 Total files trobades a la taula: 37
2026-01-16 18:20:21 -    ✅ Període UTC: 00:00 - 00:30 | TX: 9.1 | TN: 8.1 | Pluja: 0.0
2026-01-16 18:20:21 -    ✅ Període UTC: 00:30 - 01:00 | TX: 7.8 | TN: 6.7 | Pluja: 0.0
2026-01-16 18:20:21 -    ✅ Període UTC: 01:00 - 01:30 | TX: 6.9 | TN: 4.5 | Pluja: 0.0
2026-01-16 18:20:21 -    ✅ Període UTC: 01:30 - 02:00 | TX: 4.8 | TN: 4.0 | Pluja: 0.0
2026-01-16 18:20:21 -    ✅ Període UTC: 02:00 - 02:30 | TX: 4.0 | TN: 3.0 | Pluja: 0.0
2026-01-16 18:20:21 -    ✅ Període UTC: 02:30 - 03:00 | TX: 3.6 | TN: 2.9 | Pluja: 0.0
2026-01-16 18:20:21 -    ✅ Període UTC: 03:00 - 03:30 | TX: 3.4 | TN: 2.5 | Pluja: 0.0
2026-01-16 18:20:21 -    ✅ Període UTC: 03:30 - 04:00 | TX: 2.5 | TN: 1.7 | Pluja: 0.0
2026-01-16 18:20:21 -    ✅ Període UTC: 04:00 - 04:30 | TX: 2.0 | TN: 1.7 | Pluja: 0.0
2026-01-16 18:20:21 -    ✅ Període UTC: 04:30 - 05:00 | TX: 1.8 | TN: 1.4 | Pluja: 0.0
2026-01-16 18:20:21 -    ✅ Període UTC: 05:00 - 05:30 | TX: 1.6 | TN: 1.1 | Pluja: 0.0
2026-01-16 18:20:21 -    ✅ Període UTC: 05:30 - 06:00 | TX: 1.5 | TN: 0.5 | Pluja: 0.0
2026-01-16 18:20:21 -    ✅ Període UTC: 06:00 - 06:30 | TX: 0.9 | TN: 0.5 | Pluja: 0.0
2026-01-16 18:20:21 -    ✅ Període UTC: 06:30 - 07:00 | TX: 0.9 | TN: 0.6 | Pluja: 0.0
2026-01-16 18:20:21 -    ✅ Període UTC: 07:00 - 07:30 | TX: 1.0 | TN: 0.2 | Pluja: 0.0
2026-01-16 18:20:21 -    ✅ Període UTC: 07:30 - 08:00 | TX: 2.0 | TN: 0.4 | Pluja: 0.0
2026-01-16 18:20:21 -    ✅ Període UTC: 08:00 - 08:30 | TX: 2.7 | TN: 1.6 | Pluja: 0.0
2026-01-16 18:20:21 -    ✅ Període UTC: 08:30 - 09:00 | TX: 4.4 | TN: 2.5 | Pluja: 0.0
2026-01-16 18:20:21 -    ✅ Període UTC: 09:00 - 09:30 | TX: 6.4 | TN: 4.5 | Pluja: 0.0
2026-01-16 18:20:21 -    ✅ Període UTC: 09:30 - 10:00 | TX: 8.1 | TN: 6.4 | Pluja: 0.0
2026-01-16 18:20:21 -    ✅ Període UTC: 10:00 - 10:30 | TX: 10.2 | TN: 8.1 | Pluja: 0.0
2026-01-16 18:20:21 -    ✅ Període UTC: 10:30 - 11:00 | TX: 11.3 | TN: 10.1 | Pluja: 0.0
2026-01-16 18:20:21 -    ✅ Període UTC: 11:00 - 11:30 | TX: 13.3 | TN: 11.4 | Pluja: 0.0
2026-01-16 18:20:21 -    ✅ Període UTC: 11:30 - 12:00 | TX: 14.0 | TN: 13.0 | Pluja: 0.0
2026-01-16 18:20:21 -    ✅ Període UTC: 12:00 - 12:30 | TX: 14.5 | TN: 13.7 | Pluja: 0.0
2026-01-16 18:20:21 -    ✅ Període UTC: 12:30 - 13:00 | TX: 14.3 | TN: 14.0 | Pluja: 0.0
2026-01-16 18:20:21 -    ✅ Període UTC: 13:00 - 13:30 | TX: 14.6 | TN: 14.0 | Pluja: 0.0
2026-01-16 18:20:21 -    ✅ Període UTC: 13:30 - 14:00 | TX: 14.3 | TN: 14.0 | Pluja: 0.0
2026-01-16 18:20:21 -    ✅ Període UTC: 14:00 - 14:30 | TX: 14.1 | TN: 13.5 | Pluja: 0.0
2026-01-16 18:20:21 -    ✅ Període UTC: 14:30 - 15:00 | TX: 13.5 | TN: 13.0 | Pluja: 0.0
2026-01-16 18:20:21 -    ✅ Període UTC: 15:00 - 15:30 | TX: 13.0 | TN: 12.9 | Pluja: 0.0
2026-01-16 18:20:21 -    ✅ Període UTC: 15:30 - 16:00 | TX: 12.9 | TN: 12.5 | Pluja: 0.0
2026-01-16 18:20:21 -    ✅ Període UTC: 16:00 - 16:30 | TX: 12.5 | TN: 12.1 | Pluja: 0.0
2026-01-16 18:20:21 -    ✅ Període UTC: 16:30 - 17:00 | TX: 12.1 | TN: 11.6 | Pluja: 0.0
2026-01-16 18:20:21 -    ✅ Període UTC: 17:00 - 17:30 | TX: 11.6 | TN: 11.3 | Pluja: 0.0
2026-01-16 18:20:21 -    ✅ Període UTC: 17:30 - 18:00 | TX: 11.4 | TN: 10.9 | Pluja: 0.0
2026-01-16 18:20:21 - 📈 Total períodes vàlids trobats: 36
2026-01-16 18:20:21 - 📊 RESUM CALCULAT:
2026-01-16 18:20:21 -    • Màxima del dia: 14.6°C
2026-01-16 18:20:21 -    • Mínima del dia: 0.2°C
2026-01-16 18:20:21 -    • Pluja acumulada: 0.0mm
2026-01-16 18:20:21 -    • Últim període: 17:30 - 18:00 UTC
2026-01-16 18:20:21 -    • Hora actualització: 18:20
2026-01-16 18:20:21 - 💾 Dades guardades a data/UO_20260116.csv (36 registres)
2026-01-16 18:20:21 - ✅ Fornells de la Selva: 36 períodes processats
2026-01-16 18:20:21 - 
==================================================
2026-01-16 18:20:21 - 📡 Processant: Girona [XJ]
2026-01-16 18:20:21 - 
🌐 Connectant a Girona...
2026-01-16 18:20:23 - 📊 Total files trobades a la taula: 37
2026-01-16 18:20:23 -    ✅ Període UTC: 00:00 - 00:30 | TX: 3.7 | TN: 2.8 | Pluja: 0.0
2026-01-16 18:20:23 -    ✅ Període UTC: 00:30 - 01:00 | TX: 3.4 | TN: 2.8 | Pluja: 0.0
2026-01-16 18:20:23 -    ✅ Període UTC: 01:00 - 01:30 | TX: 2.9 | TN: 2.4 | Pluja: 0.0
2026-01-16 18:20:23 -    ✅ Període UTC: 01:30 - 02:00 | TX: 2.4 | TN: 1.8 | Pluja: 0.0
2026-01-16 18:20:23 -    ✅ Període UTC: 02:00 - 02:30 | TX: 1.8 | TN: 1.4 | Pluja: 0.0
2026-01-16 18:20:23 -    ✅ Període UTC: 02:30 - 03:00 | TX: 1.7 | TN: 1.3 | Pluja: 0.0
2026-01-16 18:20:23 -    ✅ Període UTC: 03:00 - 03:30 | TX: 1.5 | TN: 0.8 | Pluja: 0.0
2026-01-16 18:20:23 -    ✅ Període UTC: 03:30 - 04:00 | TX: 0.7 | TN: 0.4 | Pluja: 0.0
2026-01-16 18:20:23 -    ✅ Període UTC: 04:00 - 04:30 | TX: 0.5 | TN: -0.1 | Pluja: 0.0
2026-01-16 18:20:23 -    ✅ Període UTC: 04:30 - 05:00 | TX: 0.2 | TN: -0.1 | Pluja: 0.0
2026-01-16 18:20:23 -    ✅ Període UTC: 05:00 - 05:30 | TX: 0.3 | TN: 0.1 | Pluja: 0.0
2026-01-16 18:20:23 -    ✅ Període UTC: 05:30 - 06:00 | TX: 0.1 | TN: -0.3 | Pluja: 0.0
2026-01-16 18:20:23 -    ✅ Període UTC: 06:00 - 06:30 | TX: -0.3 | TN: -0.6 | Pluja: 0.0
2026-01-16 18:20:23 -    ✅ Període UTC: 06:30 - 07:00 | TX: -0.1 | TN: -0.7 | Pluja: 0.0
2026-01-16 18:20:23 -    ✅ Període UTC: 07:00 - 07:30 | TX: -0.2 | TN: -0.5 | Pluja: 0.0
2026-01-16 18:20:23 -    ✅ Període UTC: 07:30 - 08:00 | TX: 1.1 | TN: -0.2 | Pluja: 0.0
2026-01-16 18:20:23 -    ✅ Període UTC: 08:00 - 08:30 | TX: 2.6 | TN: 1.1 | Pluja: 0.0
2026-01-16 18:20:23 -    ✅ Període UTC: 08:30 - 09:00 | TX: 4.2 | TN: 2.7 | Pluja: 0.0
2026-01-16 18:20:23 -    ✅ Període UTC: 09:00 - 09:30 | TX: 6.6 | TN: 4.2 | Pluja: 0.0
2026-01-16 18:20:23 -    ✅ Període UTC: 09:30 - 10:00 | TX: 9.5 | TN: 6.6 | Pluja: 0.0
2026-01-16 18:20:23 -    ✅ Període UTC: 10:00 - 10:30 | TX: 11.3 | TN: 9.1 | Pluja: 0.3
2026-01-16 18:20:23 -    ✅ Període UTC: 10:30 - 11:00 | TX: 12.2 | TN: 11.2 | Pluja: 0.1
2026-01-16 18:20:23 -    ✅ Període UTC: 11:00 - 11:30 | TX: 13.1 | TN: 12.3 | Pluja: 0.0
2026-01-16 18:20:23 -    ✅ Període UTC: 11:30 - 12:00 | TX: 13.5 | TN: 12.5 | Pluja: 0.0
2026-01-16 18:20:23 -    ✅ Període UTC: 12:00 - 12:30 | TX: 13.6 | TN: 13.1 | Pluja: 0.0
2026-01-16 18:20:23 -    ✅ Període UTC: 12:30 - 13:00 | TX: 14.3 | TN: 13.4 | Pluja: 0.0
2026-01-16 18:20:23 -    ✅ Període UTC: 13:00 - 13:30 | TX: 15.1 | TN: 14.4 | Pluja: 0.0
2026-01-16 18:20:23 -    ✅ Període UTC: 13:30 - 14:00 | TX: 14.8 | TN: 14.6 | Pluja: 0.0
2026-01-16 18:20:23 -    ✅ Període UTC: 14:00 - 14:30 | TX: 14.6 | TN: 14.1 | Pluja: 0.0
2026-01-16 18:20:23 -    ✅ Període UTC: 14:30 - 15:00 | TX: 14.1 | TN: 13.7 | Pluja: 0.0
2026-01-16 18:20:23 -    ✅ Període UTC: 15:00 - 15:30 | TX: 13.8 | TN: 13.6 | Pluja: 0.0
2026-01-16 18:20:23 -    ✅ Període UTC: 15:30 - 16:00 | TX: 13.6 | TN: 13.0 | Pluja: 0.0
2026-01-16 18:20:23 -    ✅ Període UTC: 16:00 - 16:30 | TX: 13.0 | TN: 12.7 | Pluja: 0.0
2026-01-16 18:20:23 -    ✅ Període UTC: 16:30 - 17:00 | TX: 12.6 | TN: 12.5 | Pluja: 0.0
2026-01-16 18:20:23 -    ✅ Període UTC: 17:00 - 17:30 | TX: 12.5 | TN: 12.2 | Pluja: 0.0
2026-01-16 18:20:23 -    ✅ Període UTC: 17:30 - 18:00 | TX: 12.2 | TN: 12.0 | Pluja: 0.0
2026-01-16 18:20:23 - 📈 Total períodes vàlids trobats: 36
2026-01-16 18:20:23 - 📊 RESUM CALCULAT:
2026-01-16 18:20:23 -    • Màxima del dia: 15.1°C
2026-01-16 18:20:23 -    • Mínima del dia: -0.7°C
2026-01-16 18:20:23 -    • Pluja acumulada: 0.4mm
2026-01-16 18:20:23 -    • Últim període: 17:30 - 18:00 UTC
2026-01-16 18:20:23 -    • Hora actualització: 18:20
2026-01-16 18:20:23 - 💾 Dades guardades a data/XJ_20260116.csv (36 registres)
2026-01-16 18:20:23 - ✅ Girona: 36 períodes processats
2026-01-16 18:20:23 - 💾 Dades guardades a data/weather_daily_20260116.json
2026-01-16 18:20:23 - 💾 Dades guardades a data/weather_summary.json
2026-01-16 18:20:23 - 
============================================================
2026-01-16 18:20:23 - 📋 RESUM FINAL DEL DIA (UTC)
2026-01-16 18:20:23 - ============================================================
2026-01-16 18:20:23 - 
📍 Fornells de la Selva:
2026-01-16 18:20:23 -    • Períodes: 36
2026-01-16 18:20:23 -    • Màxima: 14.6°C
2026-01-16 18:20:23 -    • Mínima: 0.2°C
2026-01-16 18:20:23 -    • Pluja: 0.0mm
2026-01-16 18:20:23 -    • Últim període: 17:30 - 18:00 UTC
2026-01-16 18:20:23 -    • Actualització: 18:20
2026-01-16 18:20:23 - 
📍 Girona:
2026-01-16 18:20:23 -    • Períodes: 36
2026-01-16 18:20:23 -    • Màxima: 15.1°C
2026-01-16 18:20:23 -    • Mínima: -0.7°C
2026-01-16 18:20:23 -    • Pluja: 0.4mm
2026-01-16 18:20:23 -    • Últim període: 17:30 - 18:00 UTC
2026-01-16 18:20:23 -    • Actualització: 18:20
2026-01-16 18:20:23 - 
💾 Fitxers generats:
2026-01-16 18:20:23 -    • data/weather_summary.json (per HTML)
2026-01-16 18:20:23 -    • data/weather_daily_YYYYMMDD.json (complet)
2026-01-16 18:20:23 -    • data/XX_YYYYMMDD.csv (per estació)
2026-01-16 18:20:23 - 
✅ PROCÉS COMPLETAT
2026-01-16 18:20:23 - ============================================================
