=== INICI DAILY SCRAPER (UTC): 2025-12-24 17:35:18 ===
2025-12-24 17:35:18 - ============================================================
2025-12-24 17:35:18 - 🌤️  DAILY WEATHER SCRAPER - VERSIÓ UTC
2025-12-24 17:35:18 - ============================================================
2025-12-24 17:35:18 - 
==================================================
2025-12-24 17:35:18 - 📡 Processant: Fornells de la Selva [UO]
2025-12-24 17:35:18 - 
🌐 Connectant a Fornells de la Selva...
2025-12-24 17:35:19 - 📊 Total files trobades a la taula: 36
2025-12-24 17:35:19 -    ✅ Període UTC: 00:00 - 00:30 | TX: 7.6 | TN: 6.3 | Pluja: 0.0
2025-12-24 17:35:19 -    ✅ Període UTC: 00:30 - 01:00 | TX: 7.8 | TN: 6.1 | Pluja: 0.0
2025-12-24 17:35:19 -    ✅ Període UTC: 01:00 - 01:30 | TX: 8.2 | TN: 7.7 | Pluja: 0.0
2025-12-24 17:35:19 -    ✅ Període UTC: 01:30 - 02:00 | TX: 8.3 | TN: 8.2 | Pluja: 0.0
2025-12-24 17:35:19 -    ✅ Període UTC: 02:00 - 02:30 | TX: 8.4 | TN: 8.2 | Pluja: 0.0
2025-12-24 17:35:19 -    ✅ Període UTC: 02:30 - 03:00 | TX: 8.4 | TN: 8.2 | Pluja: 0.0
2025-12-24 17:35:19 -    ✅ Període UTC: 03:00 - 03:30 | TX: 8.6 | TN: 8.3 | Pluja: 0.0
2025-12-24 17:35:19 -    ✅ Període UTC: 03:30 - 04:00 | TX: 8.6 | TN: 8.2 | Pluja: 0.0
2025-12-24 17:35:19 -    ✅ Període UTC: 04:00 - 04:30 | TX: 8.6 | TN: 7.9 | Pluja: 0.0
2025-12-24 17:35:19 -    ✅ Període UTC: 04:30 - 05:00 | TX: 8.8 | TN: 8.4 | Pluja: 0.0
2025-12-24 17:35:19 -    ✅ Període UTC: 05:00 - 05:30 | TX: 8.4 | TN: 7.7 | Pluja: 0.0
2025-12-24 17:35:19 -    ✅ Període UTC: 05:30 - 06:00 | TX: 7.7 | TN: 7.2 | Pluja: 0.0
2025-12-24 17:35:19 -    ✅ Període UTC: 06:00 - 06:30 | TX: 7.3 | TN: 6.9 | Pluja: 0.0
2025-12-24 17:35:19 -    ✅ Període UTC: 06:30 - 07:00 | TX: 6.9 | TN: 6.6 | Pluja: 0.0
2025-12-24 17:35:19 -    ✅ Període UTC: 07:00 - 07:30 | TX: 6.8 | TN: 6.6 | Pluja: 0.0
2025-12-24 17:35:19 -    ✅ Període UTC: 07:30 - 08:00 | TX: 6.6 | TN: 6.2 | Pluja: 0.0
2025-12-24 17:35:19 -    ✅ Període UTC: 08:00 - 08:30 | TX: 7.4 | TN: 6.4 | Pluja: 0.0
2025-12-24 17:35:19 -    ✅ Període UTC: 08:30 - 09:00 | TX: 11.7 | TN: 7.5 | Pluja: 0.0
2025-12-24 17:35:19 -    ✅ Període UTC: 09:00 - 09:30 | TX: 11.8 | TN: 10.8 | Pluja: 0.0
2025-12-24 17:35:19 -    ✅ Període UTC: 09:30 - 10:00 | TX: 11.3 | TN: 10.6 | Pluja: 0.0
2025-12-24 17:35:19 -    ✅ Període UTC: 10:00 - 10:30 | TX: 11.6 | TN: 10.6 | Pluja: 0.0
2025-12-24 17:35:19 -    ✅ Període UTC: 10:30 - 11:00 | TX: 13.2 | TN: 11.6 | Pluja: 0.0
2025-12-24 17:35:19 -    ✅ Període UTC: 11:00 - 11:30 | TX: 13.8 | TN: 13.0 | Pluja: 0.0
2025-12-24 17:35:19 -    ✅ Període UTC: 11:30 - 12:00 | TX: 14.1 | TN: 13.5 | Pluja: 0.0
2025-12-24 17:35:19 -    ✅ Període UTC: 12:00 - 12:30 | TX: 15.1 | TN: 14.1 | Pluja: 0.0
2025-12-24 17:35:19 -    ✅ Període UTC: 12:30 - 13:00 | TX: 16.3 | TN: 14.5 | Pluja: 0.0
2025-12-24 17:35:19 -    ✅ Període UTC: 13:00 - 13:30 | TX: 16.2 | TN: 14.6 | Pluja: 0.0
2025-12-24 17:35:19 -    ✅ Període UTC: 13:30 - 14:00 | TX: 14.4 | TN: 13.8 | Pluja: 0.0
2025-12-24 17:35:19 -    ✅ Període UTC: 14:00 - 14:30 | TX: 14.2 | TN: 13.8 | Pluja: 0.0
2025-12-24 17:35:19 -    ✅ Període UTC: 14:30 - 15:00 | TX: 14.2 | TN: 13.3 | Pluja: 0.0
2025-12-24 17:35:19 -    ✅ Període UTC: 15:00 - 15:30 | TX: 13.4 | TN: 12.7 | Pluja: 0.0
2025-12-24 17:35:19 -    ✅ Període UTC: 15:30 - 16:00 | TX: 12.7 | TN: 11.8 | Pluja: 0.0
2025-12-24 17:35:19 -    ✅ Període UTC: 16:00 - 16:30 | TX: 11.7 | TN: 11.2 | Pluja: 0.0
2025-12-24 17:35:19 -    ✅ Període UTC: 16:30 - 17:00 | TX: 11.1 | TN: 10.5 | Pluja: 0.0
2025-12-24 17:35:19 - 📈 Total períodes vàlids trobats: 34
2025-12-24 17:35:19 - 📊 RESUM CALCULAT:
2025-12-24 17:35:19 -    • Màxima del dia: 16.3°C
2025-12-24 17:35:19 -    • Mínima del dia: 6.1°C
2025-12-24 17:35:19 -    • Pluja acumulada: 0.0mm
2025-12-24 17:35:19 -    • Últim període: 16:30 - 17:00 UTC
2025-12-24 17:35:19 -    • Hora actualització: 17:35
2025-12-24 17:35:19 - 💾 Dades guardades a data/UO_20251224.csv (34 registres)
2025-12-24 17:35:19 - ✅ Fornells de la Selva: 34 períodes processats
2025-12-24 17:35:19 - 
==================================================
2025-12-24 17:35:19 - 📡 Processant: Girona [XJ]
2025-12-24 17:35:19 - 
🌐 Connectant a Girona...
2025-12-24 17:35:21 - 📊 Total files trobades a la taula: 36
2025-12-24 17:35:21 -    ✅ Període UTC: 00:00 - 00:30 | TX: 7.4 | TN: 6.9 | Pluja: 0.0
2025-12-24 17:35:21 -    ✅ Període UTC: 00:30 - 01:00 | TX: 7.0 | TN: 6.4 | Pluja: 0.0
2025-12-24 17:35:21 -    ✅ Període UTC: 01:00 - 01:30 | TX: 7.5 | TN: 7.1 | Pluja: 0.0
2025-12-24 17:35:21 -    ✅ Període UTC: 01:30 - 02:00 | TX: 8.4 | TN: 7.3 | Pluja: 0.0
2025-12-24 17:35:21 -    ✅ Període UTC: 02:00 - 02:30 | TX: 8.8 | TN: 8.4 | Pluja: 0.0
2025-12-24 17:35:21 -    ✅ Període UTC: 02:30 - 03:00 | TX: 8.6 | TN: 8.1 | Pluja: 0.0
2025-12-24 17:35:21 -    ✅ Període UTC: 03:00 - 03:30 | TX: 8.1 | TN: 7.8 | Pluja: 0.0
2025-12-24 17:35:21 -    ✅ Període UTC: 03:30 - 04:00 | TX: 7.8 | TN: 7.4 | Pluja: 0.0
2025-12-24 17:35:21 -    ✅ Període UTC: 04:00 - 04:30 | TX: 7.3 | TN: 6.1 | Pluja: 0.0
2025-12-24 17:35:21 -    ✅ Període UTC: 04:30 - 05:00 | TX: 6.5 | TN: 5.9 | Pluja: 0.0
2025-12-24 17:35:21 -    ✅ Període UTC: 05:00 - 05:30 | TX: 6.5 | TN: 6.3 | Pluja: 0.0
2025-12-24 17:35:21 -    ✅ Període UTC: 05:30 - 06:00 | TX: 6.6 | TN: 6.4 | Pluja: 0.0
2025-12-24 17:35:21 -    ✅ Període UTC: 06:00 - 06:30 | TX: 6.5 | TN: 5.9 | Pluja: 0.0
2025-12-24 17:35:21 -    ✅ Període UTC: 06:30 - 07:00 | TX: 6.2 | TN: 5.9 | Pluja: 0.0
2025-12-24 17:35:21 -    ✅ Període UTC: 07:00 - 07:30 | TX: 6.3 | TN: 6.1 | Pluja: 0.0
2025-12-24 17:35:21 -    ✅ Període UTC: 07:30 - 08:00 | TX: 6.2 | TN: 5.8 | Pluja: 0.0
2025-12-24 17:35:21 -    ✅ Període UTC: 08:00 - 08:30 | TX: 8.3 | TN: 6.1 | Pluja: 0.0
2025-12-24 17:35:21 -    ✅ Període UTC: 08:30 - 09:00 | TX: 9.8 | TN: 8.5 | Pluja: 0.0
2025-12-24 17:35:21 -    ✅ Període UTC: 09:00 - 09:30 | TX: 11.7 | TN: 9.8 | Pluja: 0.0
2025-12-24 17:35:21 -    ✅ Període UTC: 09:30 - 10:00 | TX: 11.7 | TN: 11.1 | Pluja: 0.0
2025-12-24 17:35:21 -    ✅ Període UTC: 10:00 - 10:30 | TX: 13.0 | TN: 11.3 | Pluja: 0.0
2025-12-24 17:35:21 -    ✅ Període UTC: 10:30 - 11:00 | TX: 13.7 | TN: 12.8 | Pluja: 0.0
2025-12-24 17:35:21 -    ✅ Període UTC: 11:00 - 11:30 | TX: 13.8 | TN: 13.0 | Pluja: 0.0
2025-12-24 17:35:21 -    ✅ Període UTC: 11:30 - 12:00 | TX: 13.6 | TN: 13.2 | Pluja: 0.0
2025-12-24 17:35:21 -    ✅ Període UTC: 12:00 - 12:30 | TX: 14.7 | TN: 13.5 | Pluja: 0.0
2025-12-24 17:35:21 -    ✅ Període UTC: 12:30 - 13:00 | TX: 15.4 | TN: 14.4 | Pluja: 0.0
2025-12-24 17:35:21 -    ✅ Període UTC: 13:00 - 13:30 | TX: 15.9 | TN: 15.4 | Pluja: 0.0
2025-12-24 17:35:21 -    ✅ Període UTC: 13:30 - 14:00 | TX: 16.5 | TN: 15.6 | Pluja: 0.0
2025-12-24 17:35:21 -    ✅ Període UTC: 14:00 - 14:30 | TX: 15.9 | TN: 14.5 | Pluja: 0.0
2025-12-24 17:35:21 -    ✅ Període UTC: 14:30 - 15:00 | TX: 14.7 | TN: 14.3 | Pluja: 0.0
2025-12-24 17:35:21 -    ✅ Període UTC: 15:00 - 15:30 | TX: 14.2 | TN: 13.6 | Pluja: 0.0
2025-12-24 17:35:21 -    ✅ Període UTC: 15:30 - 16:00 | TX: 13.5 | TN: 12.3 | Pluja: 0.0
2025-12-24 17:35:21 -    ✅ Període UTC: 16:00 - 16:30 | TX: 12.3 | TN: 10.9 | Pluja: 0.0
2025-12-24 17:35:21 -    ✅ Període UTC: 16:30 - 17:00 | TX: 10.9 | TN: 10.2 | Pluja: 0.0
2025-12-24 17:35:21 - 📈 Total períodes vàlids trobats: 34
2025-12-24 17:35:21 - 📊 RESUM CALCULAT:
2025-12-24 17:35:21 -    • Màxima del dia: 16.5°C
2025-12-24 17:35:21 -    • Mínima del dia: 5.8°C
2025-12-24 17:35:21 -    • Pluja acumulada: 0.0mm
2025-12-24 17:35:21 -    • Últim període: 16:30 - 17:00 UTC
2025-12-24 17:35:21 -    • Hora actualització: 17:35
2025-12-24 17:35:21 - 💾 Dades guardades a data/XJ_20251224.csv (34 registres)
2025-12-24 17:35:21 - ✅ Girona: 34 períodes processats
2025-12-24 17:35:21 - 💾 Dades guardades a data/weather_daily_20251224.json
2025-12-24 17:35:21 - 💾 Dades guardades a data/weather_summary.json
2025-12-24 17:35:21 - 
============================================================
2025-12-24 17:35:21 - 📋 RESUM FINAL DEL DIA (UTC)
2025-12-24 17:35:21 - ============================================================
2025-12-24 17:35:21 - 
📍 Fornells de la Selva:
2025-12-24 17:35:21 -    • Períodes: 34
2025-12-24 17:35:21 -    • Màxima: 16.3°C
2025-12-24 17:35:21 -    • Mínima: 6.1°C
2025-12-24 17:35:21 -    • Pluja: 0.0mm
2025-12-24 17:35:21 -    • Últim període: 16:30 - 17:00 UTC
2025-12-24 17:35:21 -    • Actualització: 17:35
2025-12-24 17:35:21 - 
📍 Girona:
2025-12-24 17:35:21 -    • Períodes: 34
2025-12-24 17:35:21 -    • Màxima: 16.5°C
2025-12-24 17:35:21 -    • Mínima: 5.8°C
2025-12-24 17:35:21 -    • Pluja: 0.0mm
2025-12-24 17:35:21 -    • Últim període: 16:30 - 17:00 UTC
2025-12-24 17:35:21 -    • Actualització: 17:35
2025-12-24 17:35:21 - 
💾 Fitxers generats:
2025-12-24 17:35:21 -    • data/weather_summary.json (per HTML)
2025-12-24 17:35:21 -    • data/weather_daily_YYYYMMDD.json (complet)
2025-12-24 17:35:21 -    • data/XX_YYYYMMDD.csv (per estació)
2025-12-24 17:35:21 - 
✅ PROCÉS COMPLETAT
2025-12-24 17:35:21 - ============================================================
