=== INICI DAILY SCRAPER (UTC): 2025-12-28 22:48:09 ===
2025-12-28 22:48:09 - ============================================================
2025-12-28 22:48:09 - 🌤️  DAILY WEATHER SCRAPER - VERSIÓ UTC
2025-12-28 22:48:09 - ============================================================
2025-12-28 22:48:09 - 
==================================================
2025-12-28 22:48:09 - 📡 Processant: Fornells de la Selva [UO]
2025-12-28 22:48:09 - 
🌐 Connectant a Fornells de la Selva...
2025-12-28 22:48:11 - 📊 Total files trobades a la taula: 46
2025-12-28 22:48:11 -    ✅ Període UTC: 00:00 - 00:30 | TX: 9.9 | TN: 9.8 | Pluja: 0.0
2025-12-28 22:48:11 -    ✅ Període UTC: 00:30 - 01:00 | TX: 10.2 | TN: 9.9 | Pluja: 0.0
2025-12-28 22:48:11 -    ✅ Període UTC: 01:00 - 01:30 | TX: 10.3 | TN: 10.2 | Pluja: 0.0
2025-12-28 22:48:11 -    ✅ Període UTC: 01:30 - 02:00 | TX: 10.2 | TN: 10.0 | Pluja: 0.0
2025-12-28 22:48:11 -    ✅ Període UTC: 02:00 - 02:30 | TX: 10.0 | TN: 9.5 | Pluja: 0.0
2025-12-28 22:48:11 -    ✅ Període UTC: 02:30 - 03:00 | TX: 9.5 | TN: 9.2 | Pluja: 0.0
2025-12-28 22:48:11 -    ✅ Període UTC: 03:00 - 03:30 | TX: 9.4 | TN: 8.8 | Pluja: 0.0
2025-12-28 22:48:11 -    ✅ Període UTC: 03:30 - 04:00 | TX: 9.0 | TN: 8.4 | Pluja: 0.0
2025-12-28 22:48:11 -    ✅ Període UTC: 04:00 - 04:30 | TX: 8.6 | TN: 8.0 | Pluja: 0.0
2025-12-28 22:48:11 -    ✅ Període UTC: 04:30 - 05:00 | TX: 9.3 | TN: 8.3 | Pluja: 0.0
2025-12-28 22:48:11 -    ✅ Període UTC: 05:00 - 05:30 | TX: 9.5 | TN: 8.3 | Pluja: 0.0
2025-12-28 22:48:11 -    ✅ Període UTC: 05:30 - 06:00 | TX: 9.7 | TN: 9.5 | Pluja: 0.0
2025-12-28 22:48:11 -    ✅ Període UTC: 06:00 - 06:30 | TX: 9.7 | TN: 9.7 | Pluja: 0.0
2025-12-28 22:48:11 -    ✅ Període UTC: 06:30 - 07:00 | TX: 9.8 | TN: 9.4 | Pluja: 0.0
2025-12-28 22:48:11 -    ✅ Període UTC: 07:00 - 07:30 | TX: 9.4 | TN: 9.2 | Pluja: 0.0
2025-12-28 22:48:11 -    ✅ Període UTC: 07:30 - 08:00 | TX: 9.8 | TN: 9.2 | Pluja: 0.0
2025-12-28 22:48:11 -    ✅ Període UTC: 08:00 - 08:30 | TX: 10.7 | TN: 9.8 | Pluja: 0.0
2025-12-28 22:48:11 -    ✅ Període UTC: 08:30 - 09:00 | TX: 11.8 | TN: 10.8 | Pluja: 0.0
2025-12-28 22:48:11 -    ✅ Període UTC: 09:00 - 09:30 | TX: 11.9 | TN: 11.7 | Pluja: 0.0
2025-12-28 22:48:11 -    ✅ Període UTC: 09:30 - 10:00 | TX: 12.4 | TN: 11.8 | Pluja: 0.0
2025-12-28 22:48:11 -    ✅ Període UTC: 10:00 - 10:30 | TX: 13.4 | TN: 12.4 | Pluja: 0.0
2025-12-28 22:48:11 -    ✅ Període UTC: 10:30 - 11:00 | TX: 13.4 | TN: 12.7 | Pluja: 0.0
2025-12-28 22:48:11 -    ✅ Període UTC: 11:00 - 11:30 | TX: 13.7 | TN: 13.2 | Pluja: 0.0
2025-12-28 22:48:11 -    ✅ Període UTC: 11:30 - 12:00 | TX: 14.5 | TN: 13.4 | Pluja: 0.0
2025-12-28 22:48:11 -    ✅ Període UTC: 12:00 - 12:30 | TX: 13.6 | TN: 13.0 | Pluja: 0.0
2025-12-28 22:48:11 -    ✅ Període UTC: 12:30 - 13:00 | TX: 13.5 | TN: 13.0 | Pluja: 0.0
2025-12-28 22:48:11 -    ✅ Període UTC: 13:00 - 13:30 | TX: 13.5 | TN: 13.1 | Pluja: 0.0
2025-12-28 22:48:11 -    ✅ Període UTC: 13:30 - 14:00 | TX: 13.6 | TN: 13.3 | Pluja: 0.0
2025-12-28 22:48:11 -    ✅ Període UTC: 14:00 - 14:30 | TX: 13.8 | TN: 13.6 | Pluja: 0.0
2025-12-28 22:48:11 -    ✅ Període UTC: 14:30 - 15:00 | TX: 13.6 | TN: 13.4 | Pluja: 0.0
2025-12-28 22:48:11 -    ✅ Període UTC: 15:00 - 15:30 | TX: 13.4 | TN: 13.0 | Pluja: 0.0
2025-12-28 22:48:11 -    ✅ Període UTC: 15:30 - 16:00 | TX: 12.9 | TN: 12.7 | Pluja: 0.0
2025-12-28 22:48:11 -    ✅ Període UTC: 16:00 - 16:30 | TX: 12.7 | TN: 11.5 | Pluja: 0.0
2025-12-28 22:48:11 -    ✅ Període UTC: 16:30 - 17:00 | TX: 11.5 | TN: 10.3 | Pluja: 0.0
2025-12-28 22:48:11 -    ✅ Període UTC: 17:00 - 17:30 | TX: 10.8 | TN: 10.0 | Pluja: 0.0
2025-12-28 22:48:11 -    ✅ Període UTC: 17:30 - 18:00 | TX: 10.1 | TN: 8.5 | Pluja: 0.0
2025-12-28 22:48:11 -    ✅ Període UTC: 18:00 - 18:30 | TX: 9.7 | TN: 8.9 | Pluja: 0.0
2025-12-28 22:48:11 -    ✅ Període UTC: 18:30 - 19:00 | TX: 9.3 | TN: 8.5 | Pluja: 0.0
2025-12-28 22:48:11 -    ✅ Període UTC: 19:00 - 19:30 | TX: 9.6 | TN: 9.1 | Pluja: 0.0
2025-12-28 22:48:11 -    ✅ Període UTC: 19:30 - 20:00 | TX: 9.4 | TN: 8.4 | Pluja: 0.0
2025-12-28 22:48:11 -    ✅ Període UTC: 20:00 - 20:30 | TX: 8.2 | TN: 7.5 | Pluja: 0.0
2025-12-28 22:48:11 -    ✅ Període UTC: 20:30 - 21:00 | TX: 8.0 | TN: 7.0 | Pluja: 0.0
2025-12-28 22:48:11 -    ✅ Període UTC: 21:00 - 21:30 | TX: 7.7 | TN: 6.5 | Pluja: 0.0
2025-12-28 22:48:11 -    ✅ Període UTC: 21:30 - 22:00 | TX: 7.4 | TN: 6.9 | Pluja: 0.0
2025-12-28 22:48:11 -    ✅ Període UTC: 22:00 - 22:30 | TX: 8.3 | TN: 7.5 | Pluja: 0.0
2025-12-28 22:48:11 - 📈 Total períodes vàlids trobats: 45
2025-12-28 22:48:11 - 📊 RESUM CALCULAT:
2025-12-28 22:48:11 -    • Màxima del dia: 14.5°C
2025-12-28 22:48:11 -    • Mínima del dia: 6.5°C
2025-12-28 22:48:11 -    • Pluja acumulada: 0.0mm
2025-12-28 22:48:11 -    • Últim període: 22:00 - 22:30 UTC
2025-12-28 22:48:11 -    • Hora actualització: 22:48
2025-12-28 22:48:11 - 💾 Dades guardades a data/UO_20251228.csv (45 registres)
2025-12-28 22:48:11 - ✅ Fornells de la Selva: 45 períodes processats
2025-12-28 22:48:11 - 
==================================================
2025-12-28 22:48:11 - 📡 Processant: Girona [XJ]
2025-12-28 22:48:11 - 
🌐 Connectant a Girona...
2025-12-28 22:48:12 - 📊 Total files trobades a la taula: 46
2025-12-28 22:48:12 -    ✅ Període UTC: 00:00 - 00:30 | TX: 10.0 | TN: 9.9 | Pluja: 0.0
2025-12-28 22:48:12 -    ✅ Període UTC: 00:30 - 01:00 | TX: 10.0 | TN: 9.9 | Pluja: 0.0
2025-12-28 22:48:12 -    ✅ Període UTC: 01:00 - 01:30 | TX: 10.1 | TN: 10.0 | Pluja: 0.0
2025-12-28 22:48:12 -    ✅ Període UTC: 01:30 - 02:00 | TX: 10.1 | TN: 9.8 | Pluja: 0.0
2025-12-28 22:48:12 -    ✅ Període UTC: 02:00 - 02:30 | TX: 9.9 | TN: 9.6 | Pluja: 0.0
2025-12-28 22:48:12 -    ✅ Període UTC: 02:30 - 03:00 | TX: 9.7 | TN: 9.6 | Pluja: 0.0
2025-12-28 22:48:12 -    ✅ Període UTC: 03:00 - 03:30 | TX: 9.7 | TN: 9.6 | Pluja: 0.0
2025-12-28 22:48:12 -    ✅ Període UTC: 03:30 - 04:00 | TX: 9.6 | TN: 9.4 | Pluja: 0.0
2025-12-28 22:48:12 -    ✅ Període UTC: 04:00 - 04:30 | TX: 9.5 | TN: 9.4 | Pluja: 0.0
2025-12-28 22:48:12 -    ✅ Període UTC: 04:30 - 05:00 | TX: 9.6 | TN: 9.5 | Pluja: 0.0
2025-12-28 22:48:12 -    ✅ Període UTC: 05:00 - 05:30 | TX: 9.6 | TN: 9.6 | Pluja: 0.0
2025-12-28 22:48:12 -    ✅ Període UTC: 05:30 - 06:00 | TX: 9.6 | TN: 9.1 | Pluja: 0.0
2025-12-28 22:48:12 -    ✅ Període UTC: 06:00 - 06:30 | TX: 9.4 | TN: 9.2 | Pluja: 0.0
2025-12-28 22:48:12 -    ✅ Període UTC: 06:30 - 07:00 | TX: 9.4 | TN: 9.2 | Pluja: 0.0
2025-12-28 22:48:12 -    ✅ Període UTC: 07:00 - 07:30 | TX: 9.5 | TN: 9.2 | Pluja: 0.0
2025-12-28 22:48:12 -    ✅ Període UTC: 07:30 - 08:00 | TX: 9.9 | TN: 9.5 | Pluja: 0.0
2025-12-28 22:48:12 -    ✅ Període UTC: 08:00 - 08:30 | TX: 10.0 | TN: 9.9 | Pluja: 0.0
2025-12-28 22:48:12 -    ✅ Període UTC: 08:30 - 09:00 | TX: 10.6 | TN: 10.0 | Pluja: 0.0
2025-12-28 22:48:12 -    ✅ Període UTC: 09:00 - 09:30 | TX: 11.5 | TN: 10.6 | Pluja: 0.0
2025-12-28 22:48:12 -    ✅ Període UTC: 09:30 - 10:00 | TX: 12.0 | TN: 11.3 | Pluja: 0.0
2025-12-28 22:48:12 -    ✅ Període UTC: 10:00 - 10:30 | TX: 13.0 | TN: 12.0 | Pluja: 0.0
2025-12-28 22:48:12 -    ✅ Període UTC: 10:30 - 11:00 | TX: 13.8 | TN: 12.8 | Pluja: 0.0
2025-12-28 22:48:12 -    ✅ Període UTC: 11:00 - 11:30 | TX: 13.5 | TN: 13.2 | Pluja: 0.1
2025-12-28 22:48:12 -    ✅ Període UTC: 11:30 - 12:00 | TX: 13.5 | TN: 13.1 | Pluja: 0.0
2025-12-28 22:48:12 -    ✅ Període UTC: 12:00 - 12:30 | TX: 13.1 | TN: 12.7 | Pluja: 0.0
2025-12-28 22:48:12 -    ✅ Període UTC: 12:30 - 13:00 | TX: 13.1 | TN: 12.7 | Pluja: 0.0
2025-12-28 22:48:12 -    ✅ Període UTC: 13:00 - 13:30 | TX: 13.2 | TN: 12.8 | Pluja: 0.0
2025-12-28 22:48:12 -    ✅ Període UTC: 13:30 - 14:00 | TX: 13.3 | TN: 13.0 | Pluja: 0.0
2025-12-28 22:48:12 -    ✅ Període UTC: 14:00 - 14:30 | TX: 14.2 | TN: 13.2 | Pluja: 0.0
2025-12-28 22:48:12 -    ✅ Període UTC: 14:30 - 15:00 | TX: 14.3 | TN: 13.9 | Pluja: 0.0
2025-12-28 22:48:12 -    ✅ Període UTC: 15:00 - 15:30 | TX: 14.0 | TN: 13.3 | Pluja: 0.0
2025-12-28 22:48:12 -    ✅ Període UTC: 15:30 - 16:00 | TX: 13.3 | TN: 12.7 | Pluja: 0.0
2025-12-28 22:48:12 -    ✅ Període UTC: 16:00 - 16:30 | TX: 12.7 | TN: 11.5 | Pluja: 0.0
2025-12-28 22:48:12 -    ✅ Període UTC: 16:30 - 17:00 | TX: 11.5 | TN: 11.2 | Pluja: 0.0
2025-12-28 22:48:12 -    ✅ Període UTC: 17:00 - 17:30 | TX: 11.5 | TN: 11.0 | Pluja: 0.0
2025-12-28 22:48:12 -    ✅ Període UTC: 17:30 - 18:00 | TX: 10.9 | TN: 9.8 | Pluja: 0.0
2025-12-28 22:48:12 -    ✅ Període UTC: 18:00 - 18:30 | TX: 9.8 | TN: 9.0 | Pluja: 0.0
2025-12-28 22:48:12 -    ✅ Període UTC: 18:30 - 19:00 | TX: 9.4 | TN: 8.8 | Pluja: 0.0
2025-12-28 22:48:12 -    ✅ Període UTC: 19:00 - 19:30 | TX: 9.5 | TN: 9.1 | Pluja: 0.0
2025-12-28 22:48:12 -    ✅ Període UTC: 19:30 - 20:00 | TX: 9.6 | TN: 9.2 | Pluja: 0.0
2025-12-28 22:48:12 -    ✅ Període UTC: 20:00 - 20:30 | TX: 9.2 | TN: 8.3 | Pluja: 0.0
2025-12-28 22:48:12 -    ✅ Període UTC: 20:30 - 21:00 | TX: 8.5 | TN: 7.6 | Pluja: 0.0
2025-12-28 22:48:12 -    ✅ Període UTC: 21:00 - 21:30 | TX: 8.2 | TN: 7.6 | Pluja: 0.0
2025-12-28 22:48:12 -    ✅ Període UTC: 21:30 - 22:00 | TX: 8.8 | TN: 8.2 | Pluja: 0.0
2025-12-28 22:48:12 -    ✅ Període UTC: 22:00 - 22:30 | TX: 8.7 | TN: 8.6 | Pluja: 0.0
2025-12-28 22:48:12 - 📈 Total períodes vàlids trobats: 45
2025-12-28 22:48:12 - 📊 RESUM CALCULAT:
2025-12-28 22:48:12 -    • Màxima del dia: 14.3°C
2025-12-28 22:48:12 -    • Mínima del dia: 7.6°C
2025-12-28 22:48:12 -    • Pluja acumulada: 0.1mm
2025-12-28 22:48:12 -    • Últim període: 22:00 - 22:30 UTC
2025-12-28 22:48:12 -    • Hora actualització: 22:48
2025-12-28 22:48:12 - 💾 Dades guardades a data/XJ_20251228.csv (45 registres)
2025-12-28 22:48:12 - ✅ Girona: 45 períodes processats
2025-12-28 22:48:12 - 💾 Dades guardades a data/weather_daily_20251228.json
2025-12-28 22:48:12 - 💾 Dades guardades a data/weather_summary.json
2025-12-28 22:48:12 - 
============================================================
2025-12-28 22:48:12 - 📋 RESUM FINAL DEL DIA (UTC)
2025-12-28 22:48:12 - ============================================================
2025-12-28 22:48:12 - 
📍 Fornells de la Selva:
2025-12-28 22:48:12 -    • Períodes: 45
2025-12-28 22:48:12 -    • Màxima: 14.5°C
2025-12-28 22:48:12 -    • Mínima: 6.5°C
2025-12-28 22:48:12 -    • Pluja: 0.0mm
2025-12-28 22:48:12 -    • Últim període: 22:00 - 22:30 UTC
2025-12-28 22:48:12 -    • Actualització: 22:48
2025-12-28 22:48:12 - 
📍 Girona:
2025-12-28 22:48:12 -    • Períodes: 45
2025-12-28 22:48:12 -    • Màxima: 14.3°C
2025-12-28 22:48:12 -    • Mínima: 7.6°C
2025-12-28 22:48:12 -    • Pluja: 0.1mm
2025-12-28 22:48:12 -    • Últim període: 22:00 - 22:30 UTC
2025-12-28 22:48:12 -    • Actualització: 22:48
2025-12-28 22:48:12 - 
💾 Fitxers generats:
2025-12-28 22:48:12 -    • data/weather_summary.json (per HTML)
2025-12-28 22:48:12 -    • data/weather_daily_YYYYMMDD.json (complet)
2025-12-28 22:48:12 -    • data/XX_YYYYMMDD.csv (per estació)
2025-12-28 22:48:12 - 
✅ PROCÉS COMPLETAT
2025-12-28 22:48:12 - ============================================================
