=== INICI DAILY SCRAPER (UTC): 2026-01-21 19:40:50 ===
2026-01-21 19:40:50 - ============================================================
2026-01-21 19:40:50 - 🌤️  DAILY WEATHER SCRAPER - VERSIÓ UTC
2026-01-21 19:40:50 - ============================================================
2026-01-21 19:40:50 - 
==================================================
2026-01-21 19:40:50 - 📡 Processant: Fornells de la Selva [UO]
2026-01-21 19:40:50 - 
🌐 Connectant a Fornells de la Selva...
2026-01-21 19:40:52 - 📊 Total files trobades a la taula: 40
2026-01-21 19:40:52 -    ✅ Període UTC: 00:00 - 00:30 | TX: 9.1 | TN: 9.0 | Pluja: 0.0
2026-01-21 19:40:52 -    ✅ Període UTC: 00:30 - 01:00 | TX: 9.0 | TN: 8.9 | Pluja: 0.0
2026-01-21 19:40:52 -    ✅ Període UTC: 01:00 - 01:30 | TX: 9.0 | TN: 8.8 | Pluja: 0.0
2026-01-21 19:40:52 -    ✅ Període UTC: 01:30 - 02:00 | TX: 8.9 | TN: 8.7 | Pluja: 0.0
2026-01-21 19:40:52 -    ✅ Període UTC: 02:00 - 02:30 | TX: 8.9 | TN: 8.6 | Pluja: 0.0
2026-01-21 19:40:52 -    ✅ Període UTC: 02:30 - 03:00 | TX: 8.8 | TN: 8.3 | Pluja: 0.0
2026-01-21 19:40:52 -    ✅ Període UTC: 03:00 - 03:30 | TX: 8.5 | TN: 8.3 | Pluja: 0.0
2026-01-21 19:40:52 -    ✅ Període UTC: 03:30 - 04:00 | TX: 8.4 | TN: 7.7 | Pluja: 0.0
2026-01-21 19:40:52 -    ✅ Període UTC: 04:00 - 04:30 | TX: 7.7 | TN: 6.7 | Pluja: 0.0
2026-01-21 19:40:52 -    ✅ Període UTC: 04:30 - 05:00 | TX: 7.1 | TN: 6.7 | Pluja: 0.0
2026-01-21 19:40:52 -    ✅ Període UTC: 05:00 - 05:30 | TX: 7.1 | TN: 6.7 | Pluja: 0.0
2026-01-21 19:40:52 -    ✅ Període UTC: 05:30 - 06:00 | TX: 7.3 | TN: 7.2 | Pluja: 0.0
2026-01-21 19:40:52 -    ✅ Període UTC: 06:00 - 06:30 | TX: 7.4 | TN: 7.1 | Pluja: 0.0
2026-01-21 19:40:52 -    ✅ Període UTC: 06:30 - 07:00 | TX: 7.7 | TN: 7.3 | Pluja: 0.0
2026-01-21 19:40:52 -    ✅ Període UTC: 07:00 - 07:30 | TX: 7.7 | TN: 7.7 | Pluja: 0.0
2026-01-21 19:40:52 -    ✅ Període UTC: 07:30 - 08:00 | TX: 7.9 | TN: 7.6 | Pluja: 0.0
2026-01-21 19:40:52 -    ✅ Període UTC: 08:00 - 08:30 | TX: 8.6 | TN: 7.8 | Pluja: 0.0
2026-01-21 19:40:52 -    ✅ Període UTC: 08:30 - 09:00 | TX: 9.4 | TN: 8.7 | Pluja: 0.0
2026-01-21 19:40:52 -    ✅ Període UTC: 09:00 - 09:30 | TX: 10.9 | TN: 9.4 | Pluja: 0.0
2026-01-21 19:40:52 -    ✅ Període UTC: 09:30 - 10:00 | TX: 12.2 | TN: 10.9 | Pluja: 0.0
2026-01-21 19:40:52 -    ✅ Període UTC: 10:00 - 10:30 | TX: 12.8 | TN: 12.2 | Pluja: 0.0
2026-01-21 19:40:52 -    ✅ Període UTC: 10:30 - 11:00 | TX: 13.2 | TN: 12.8 | Pluja: 0.0
2026-01-21 19:40:52 -    ✅ Període UTC: 11:00 - 11:30 | TX: 13.7 | TN: 13.2 | Pluja: 0.0
2026-01-21 19:40:52 -    ✅ Període UTC: 11:30 - 12:00 | TX: 14.0 | TN: 13.5 | Pluja: 0.0
2026-01-21 19:40:52 -    ✅ Període UTC: 12:00 - 12:30 | TX: 14.3 | TN: 13.6 | Pluja: 0.0
2026-01-21 19:40:52 -    ✅ Període UTC: 12:30 - 13:00 | TX: 14.6 | TN: 13.9 | Pluja: 0.0
2026-01-21 19:40:52 -    ✅ Període UTC: 13:00 - 13:30 | TX: 14.6 | TN: 14.3 | Pluja: 0.0
2026-01-21 19:40:52 -    ✅ Període UTC: 13:30 - 14:00 | TX: 14.4 | TN: 13.8 | Pluja: 0.0
2026-01-21 19:40:52 -    ✅ Període UTC: 14:00 - 14:30 | TX: 14.1 | TN: 13.5 | Pluja: 0.0
2026-01-21 19:40:52 -    ✅ Període UTC: 14:30 - 15:00 | TX: 13.8 | TN: 13.5 | Pluja: 0.0
2026-01-21 19:40:52 -    ✅ Període UTC: 15:00 - 15:30 | TX: 13.5 | TN: 13.1 | Pluja: 0.0
2026-01-21 19:40:52 -    ✅ Període UTC: 15:30 - 16:00 | TX: 13.0 | TN: 12.5 | Pluja: 0.0
2026-01-21 19:40:52 -    ✅ Període UTC: 16:00 - 16:30 | TX: 12.6 | TN: 12.4 | Pluja: 0.0
2026-01-21 19:40:52 -    ✅ Període UTC: 16:30 - 17:00 | TX: 12.5 | TN: 11.6 | Pluja: 0.0
2026-01-21 19:40:52 -    ✅ Període UTC: 17:00 - 17:30 | TX: 11.5 | TN: 11.0 | Pluja: 0.0
2026-01-21 19:40:52 -    ✅ Període UTC: 17:30 - 18:00 | TX: 11.7 | TN: 11.0 | Pluja: 0.0
2026-01-21 19:40:52 -    ✅ Període UTC: 18:00 - 18:30 | TX: 11.8 | TN: 11.4 | Pluja: 0.0
2026-01-21 19:40:52 -    ✅ Període UTC: 18:30 - 19:00 | TX: 12.0 | TN: 11.7 | Pluja: 0.0
2026-01-21 19:40:52 -    ✅ Període UTC: 19:00 - 19:30 | TX: 11.9 | TN: 11.6 | Pluja: 0.0
2026-01-21 19:40:52 - 📈 Total períodes vàlids trobats: 39
2026-01-21 19:40:52 - 📊 RESUM CALCULAT:
2026-01-21 19:40:52 -    • Màxima del dia: 14.6°C
2026-01-21 19:40:52 -    • Mínima del dia: 6.7°C
2026-01-21 19:40:52 -    • Pluja acumulada: 0.0mm
2026-01-21 19:40:52 -    • Últim període: 19:00 - 19:30 UTC
2026-01-21 19:40:52 -    • Hora actualització: 19:40
2026-01-21 19:40:52 - 💾 Dades guardades a data/UO_20260121.csv (39 registres)
2026-01-21 19:40:52 - ✅ Fornells de la Selva: 39 períodes processats
2026-01-21 19:40:52 - 
==================================================
2026-01-21 19:40:52 - 📡 Processant: Girona [XJ]
2026-01-21 19:40:52 - 
🌐 Connectant a Girona...
2026-01-21 19:40:53 - 📊 Total files trobades a la taula: 40
2026-01-21 19:40:53 -    ✅ Període UTC: 00:00 - 00:30 | TX: 8.7 | TN: 8.4 | Pluja: 0.0
2026-01-21 19:40:53 -    ✅ Període UTC: 00:30 - 01:00 | TX: 8.5 | TN: 8.5 | Pluja: 0.0
2026-01-21 19:40:53 -    ✅ Període UTC: 01:00 - 01:30 | TX: 8.5 | TN: 8.3 | Pluja: 0.0
2026-01-21 19:40:53 -    ✅ Període UTC: 01:30 - 02:00 | TX: 8.3 | TN: 8.2 | Pluja: 0.0
2026-01-21 19:40:53 -    ✅ Període UTC: 02:00 - 02:30 | TX: 8.3 | TN: 8.1 | Pluja: 0.0
2026-01-21 19:40:53 -    ✅ Període UTC: 02:30 - 03:00 | TX: 8.2 | TN: 8.1 | Pluja: 0.0
2026-01-21 19:40:53 -    ✅ Període UTC: 03:00 - 03:30 | TX: 8.2 | TN: 7.6 | Pluja: 0.0
2026-01-21 19:40:53 -    ✅ Període UTC: 03:30 - 04:00 | TX: 7.7 | TN: 7.1 | Pluja: 0.0
2026-01-21 19:40:53 -    ✅ Període UTC: 04:00 - 04:30 | TX: 7.1 | TN: 6.2 | Pluja: 0.0
2026-01-21 19:40:53 -    ✅ Període UTC: 04:30 - 05:00 | TX: 6.3 | TN: 6.1 | Pluja: 0.0
2026-01-21 19:40:53 -    ✅ Període UTC: 05:00 - 05:30 | TX: 6.4 | TN: 6.2 | Pluja: 0.0
2026-01-21 19:40:53 -    ✅ Període UTC: 05:30 - 06:00 | TX: 6.9 | TN: 6.4 | Pluja: 0.0
2026-01-21 19:40:53 -    ✅ Període UTC: 06:00 - 06:30 | TX: 7.4 | TN: 6.9 | Pluja: 0.0
2026-01-21 19:40:53 -    ✅ Període UTC: 06:30 - 07:00 | TX: 7.4 | TN: 7.2 | Pluja: 0.0
2026-01-21 19:40:53 -    ✅ Període UTC: 07:00 - 07:30 | TX: 8.1 | TN: 7.4 | Pluja: 0.0
2026-01-21 19:40:53 -    ✅ Període UTC: 07:30 - 08:00 | TX: 8.1 | TN: 7.9 | Pluja: 0.0
2026-01-21 19:40:53 -    ✅ Període UTC: 08:00 - 08:30 | TX: 8.3 | TN: 8.2 | Pluja: 0.0
2026-01-21 19:40:53 -    ✅ Període UTC: 08:30 - 09:00 | TX: 9.4 | TN: 8.3 | Pluja: 0.0
2026-01-21 19:40:53 -    ✅ Període UTC: 09:00 - 09:30 | TX: 9.9 | TN: 9.4 | Pluja: 0.0
2026-01-21 19:40:53 -    ✅ Període UTC: 09:30 - 10:00 | TX: 11.4 | TN: 9.7 | Pluja: 0.0
2026-01-21 19:40:53 -    ✅ Període UTC: 10:00 - 10:30 | TX: 12.4 | TN: 11.4 | Pluja: 0.0
2026-01-21 19:40:53 -    ✅ Període UTC: 10:30 - 11:00 | TX: 13.4 | TN: 12.4 | Pluja: 0.0
2026-01-21 19:40:53 -    ✅ Període UTC: 11:00 - 11:30 | TX: 14.1 | TN: 13.4 | Pluja: 0.1
2026-01-21 19:40:53 -    ✅ Període UTC: 11:30 - 12:00 | TX: 14.6 | TN: 14.2 | Pluja: 0.0
2026-01-21 19:40:53 -    ✅ Període UTC: 12:00 - 12:30 | TX: 14.7 | TN: 14.0 | Pluja: 0.1
2026-01-21 19:40:53 -    ✅ Període UTC: 12:30 - 13:00 | TX: 14.9 | TN: 14.3 | Pluja: 0.0
2026-01-21 19:40:53 -    ✅ Període UTC: 13:00 - 13:30 | TX: 15.1 | TN: 14.3 | Pluja: 0.0
2026-01-21 19:40:53 -    ✅ Període UTC: 13:30 - 14:00 | TX: 14.6 | TN: 13.8 | Pluja: 0.0
2026-01-21 19:40:53 -    ✅ Període UTC: 14:00 - 14:30 | TX: 14.3 | TN: 13.8 | Pluja: 0.0
2026-01-21 19:40:53 -    ✅ Període UTC: 14:30 - 15:00 | TX: 14.1 | TN: 13.9 | Pluja: 0.0
2026-01-21 19:40:53 -    ✅ Període UTC: 15:00 - 15:30 | TX: 13.9 | TN: 13.4 | Pluja: 0.0
2026-01-21 19:40:53 -    ✅ Període UTC: 15:30 - 16:00 | TX: 13.4 | TN: 12.7 | Pluja: 0.0
2026-01-21 19:40:53 -    ✅ Període UTC: 16:00 - 16:30 | TX: 12.8 | TN: 12.5 | Pluja: 0.0
2026-01-21 19:40:53 -    ✅ Període UTC: 16:30 - 17:00 | TX: 12.4 | TN: 12.2 | Pluja: 0.0
2026-01-21 19:40:53 -    ✅ Període UTC: 17:00 - 17:30 | TX: 12.1 | TN: 11.6 | Pluja: 0.0
2026-01-21 19:40:53 -    ✅ Període UTC: 17:30 - 18:00 | TX: 11.9 | TN: 11.5 | Pluja: 0.0
2026-01-21 19:40:53 -    ✅ Període UTC: 18:00 - 18:30 | TX: 11.9 | TN: 11.8 | Pluja: 0.0
2026-01-21 19:40:53 -    ✅ Període UTC: 18:30 - 19:00 | TX: 12.1 | TN: 11.9 | Pluja: 0.0
2026-01-21 19:40:53 -    ✅ Període UTC: 19:00 - 19:30 | TX: 12.0 | TN: 11.9 | Pluja: 0.0
2026-01-21 19:40:53 - 📈 Total períodes vàlids trobats: 39
2026-01-21 19:40:53 - 📊 RESUM CALCULAT:
2026-01-21 19:40:53 -    • Màxima del dia: 15.1°C
2026-01-21 19:40:53 -    • Mínima del dia: 6.1°C
2026-01-21 19:40:53 -    • Pluja acumulada: 0.2mm
2026-01-21 19:40:53 -    • Últim període: 19:00 - 19:30 UTC
2026-01-21 19:40:53 -    • Hora actualització: 19:40
2026-01-21 19:40:53 - 💾 Dades guardades a data/XJ_20260121.csv (39 registres)
2026-01-21 19:40:53 - ✅ Girona: 39 períodes processats
2026-01-21 19:40:53 - 💾 Dades guardades a data/weather_daily_20260121.json
2026-01-21 19:40:53 - 💾 Dades guardades a data/weather_summary.json
2026-01-21 19:40:53 - 
============================================================
2026-01-21 19:40:53 - 📋 RESUM FINAL DEL DIA (UTC)
2026-01-21 19:40:53 - ============================================================
2026-01-21 19:40:53 - 
📍 Fornells de la Selva:
2026-01-21 19:40:53 -    • Períodes: 39
2026-01-21 19:40:53 -    • Màxima: 14.6°C
2026-01-21 19:40:53 -    • Mínima: 6.7°C
2026-01-21 19:40:53 -    • Pluja: 0.0mm
2026-01-21 19:40:53 -    • Últim període: 19:00 - 19:30 UTC
2026-01-21 19:40:53 -    • Actualització: 19:40
2026-01-21 19:40:53 - 
📍 Girona:
2026-01-21 19:40:53 -    • Períodes: 39
2026-01-21 19:40:53 -    • Màxima: 15.1°C
2026-01-21 19:40:53 -    • Mínima: 6.1°C
2026-01-21 19:40:53 -    • Pluja: 0.2mm
2026-01-21 19:40:53 -    • Últim període: 19:00 - 19:30 UTC
2026-01-21 19:40:53 -    • Actualització: 19:40
2026-01-21 19:40:53 - 
💾 Fitxers generats:
2026-01-21 19:40:53 -    • data/weather_summary.json (per HTML)
2026-01-21 19:40:53 -    • data/weather_daily_YYYYMMDD.json (complet)
2026-01-21 19:40:53 -    • data/XX_YYYYMMDD.csv (per estació)
2026-01-21 19:40:53 - 
✅ PROCÉS COMPLETAT
2026-01-21 19:40:53 - ============================================================
