=== INICI DAILY SCRAPER (UTC): 2026-01-13 17:41:05 ===
2026-01-13 17:41:05 - ============================================================
2026-01-13 17:41:05 - 🌤️  DAILY WEATHER SCRAPER - VERSIÓ UTC
2026-01-13 17:41:05 - ============================================================
2026-01-13 17:41:05 - 
==================================================
2026-01-13 17:41:05 - 📡 Processant: Fornells de la Selva [UO]
2026-01-13 17:41:05 - 
🌐 Connectant a Fornells de la Selva...
2026-01-13 17:41:07 - 📊 Total files trobades a la taula: 36
2026-01-13 17:41:07 -    ✅ Període UTC: 00:00 - 00:30 | TX: 3.8 | TN: 2.3 | Pluja: 0.0
2026-01-13 17:41:07 -    ✅ Període UTC: 00:30 - 01:00 | TX: 4.0 | TN: 2.9 | Pluja: 0.0
2026-01-13 17:41:07 -    ✅ Període UTC: 01:00 - 01:30 | TX: 8.4 | TN: 3.6 | Pluja: 0.0
2026-01-13 17:41:07 -    ✅ Període UTC: 01:30 - 02:00 | TX: 9.7 | TN: 8.4 | Pluja: 0.0
2026-01-13 17:41:07 -    ✅ Període UTC: 02:00 - 02:30 | TX: 10.0 | TN: 9.7 | Pluja: 0.0
2026-01-13 17:41:07 -    ✅ Període UTC: 02:30 - 03:00 | TX: 10.3 | TN: 9.8 | Pluja: 0.0
2026-01-13 17:41:07 -    ✅ Període UTC: 03:00 - 03:30 | TX: 10.5 | TN: 10.0 | Pluja: 0.0
2026-01-13 17:41:07 -    ✅ Període UTC: 03:30 - 04:00 | TX: 10.9 | TN: 10.5 | Pluja: 0.0
2026-01-13 17:41:07 -    ✅ Període UTC: 04:00 - 04:30 | TX: 11.2 | TN: 10.7 | Pluja: 0.0
2026-01-13 17:41:07 -    ✅ Període UTC: 04:30 - 05:00 | TX: 11.3 | TN: 10.6 | Pluja: 0.0
2026-01-13 17:41:07 -    ✅ Període UTC: 05:00 - 05:30 | TX: 11.5 | TN: 11.0 | Pluja: 0.0
2026-01-13 17:41:07 -    ✅ Període UTC: 05:30 - 06:00 | TX: 11.7 | TN: 11.4 | Pluja: 0.0
2026-01-13 17:41:07 -    ✅ Període UTC: 06:00 - 06:30 | TX: 11.7 | TN: 11.3 | Pluja: 0.0
2026-01-13 17:41:07 -    ✅ Període UTC: 06:30 - 07:00 | TX: 11.6 | TN: 11.3 | Pluja: 0.0
2026-01-13 17:41:07 -    ✅ Període UTC: 07:00 - 07:30 | TX: 11.7 | TN: 11.4 | Pluja: 0.0
2026-01-13 17:41:07 -    ✅ Període UTC: 07:30 - 08:00 | TX: 11.7 | TN: 11.4 | Pluja: 0.0
2026-01-13 17:41:07 -    ✅ Període UTC: 08:00 - 08:30 | TX: 12.5 | TN: 11.8 | Pluja: 0.0
2026-01-13 17:41:07 -    ✅ Període UTC: 08:30 - 09:00 | TX: 13.1 | TN: 12.5 | Pluja: 0.0
2026-01-13 17:41:07 -    ✅ Període UTC: 09:00 - 09:30 | TX: 13.8 | TN: 13.1 | Pluja: 0.0
2026-01-13 17:41:07 -    ✅ Període UTC: 09:30 - 10:00 | TX: 14.2 | TN: 13.8 | Pluja: 0.0
2026-01-13 17:41:07 -    ✅ Període UTC: 10:00 - 10:30 | TX: 14.4 | TN: 14.2 | Pluja: 0.0
2026-01-13 17:41:07 -    ✅ Període UTC: 10:30 - 11:00 | TX: 15.1 | TN: 14.5 | Pluja: 0.0
2026-01-13 17:41:07 -    ✅ Període UTC: 11:00 - 11:30 | TX: 15.8 | TN: 15.0 | Pluja: 0.0
2026-01-13 17:41:07 -    ✅ Període UTC: 11:30 - 12:00 | TX: 16.3 | TN: 15.7 | Pluja: 0.0
2026-01-13 17:41:07 -    ✅ Període UTC: 12:00 - 12:30 | TX: 17.0 | TN: 16.2 | Pluja: 0.0
2026-01-13 17:41:07 -    ✅ Període UTC: 12:30 - 13:00 | TX: 17.2 | TN: 16.8 | Pluja: 0.0
2026-01-13 17:41:07 -    ✅ Període UTC: 13:00 - 13:30 | TX: 17.1 | TN: 16.8 | Pluja: 0.0
2026-01-13 17:41:07 -    ✅ Període UTC: 13:30 - 14:00 | TX: 17.1 | TN: 16.7 | Pluja: 0.0
2026-01-13 17:41:07 -    ✅ Període UTC: 14:00 - 14:30 | TX: 16.8 | TN: 16.5 | Pluja: 0.0
2026-01-13 17:41:07 -    ✅ Període UTC: 14:30 - 15:00 | TX: 16.8 | TN: 16.5 | Pluja: 0.0
2026-01-13 17:41:07 -    ✅ Període UTC: 15:00 - 15:30 | TX: 16.5 | TN: 15.3 | Pluja: 0.0
2026-01-13 17:41:07 -    ✅ Període UTC: 15:30 - 16:00 | TX: 15.3 | TN: 14.3 | Pluja: 0.0
2026-01-13 17:41:07 -    ✅ Període UTC: 16:00 - 16:30 | TX: 14.5 | TN: 13.4 | Pluja: 0.0
2026-01-13 17:41:07 -    ✅ Període UTC: 16:30 - 17:00 | TX: 13.4 | TN: 12.5 | Pluja: 0.0
2026-01-13 17:41:07 -    ✅ Període UTC: 17:00 - 17:30 | TX: 12.5 | TN: 12.0 | Pluja: 0.0
2026-01-13 17:41:07 - 📈 Total períodes vàlids trobats: 35
2026-01-13 17:41:07 - 📊 RESUM CALCULAT:
2026-01-13 17:41:07 -    • Màxima del dia: 17.2°C
2026-01-13 17:41:07 -    • Mínima del dia: 2.3°C
2026-01-13 17:41:07 -    • Pluja acumulada: 0.0mm
2026-01-13 17:41:07 -    • Últim període: 17:00 - 17:30 UTC
2026-01-13 17:41:07 -    • Hora actualització: 17:41
2026-01-13 17:41:07 - 💾 Dades guardades a data/UO_20260113.csv (35 registres)
2026-01-13 17:41:07 - ✅ Fornells de la Selva: 35 períodes processats
2026-01-13 17:41:07 - 
==================================================
2026-01-13 17:41:07 - 📡 Processant: Girona [XJ]
2026-01-13 17:41:07 - 
🌐 Connectant a Girona...
2026-01-13 17:41:08 - 📊 Total files trobades a la taula: 36
2026-01-13 17:41:08 -    ✅ Període UTC: 00:00 - 00:30 | TX: 1.0 | TN: 0.5 | Pluja: 0.0
2026-01-13 17:41:08 -    ✅ Període UTC: 00:30 - 01:00 | TX: 0.6 | TN: 0.1 | Pluja: 0.0
2026-01-13 17:41:08 -    ✅ Període UTC: 01:00 - 01:30 | TX: 0.3 | TN: 0.0 | Pluja: 0.0
2026-01-13 17:41:08 -    ✅ Període UTC: 01:30 - 02:00 | TX: 0.3 | TN: -0.1 | Pluja: 0.0
2026-01-13 17:41:08 -    ✅ Període UTC: 02:00 - 02:30 | TX: 0.0 | TN: -0.3 | Pluja: 0.0
2026-01-13 17:41:08 -    ✅ Període UTC: 02:30 - 03:00 | TX: 0.1 | TN: -0.2 | Pluja: 0.0
2026-01-13 17:41:08 -    ✅ Període UTC: 03:00 - 03:30 | TX: 0.1 | TN: -0.4 | Pluja: 0.0
2026-01-13 17:41:08 -    ✅ Període UTC: 03:30 - 04:00 | TX: -0.4 | TN: -0.6 | Pluja: 0.0
2026-01-13 17:41:08 -    ✅ Període UTC: 04:00 - 04:30 | TX: 3.5 | TN: -0.6 | Pluja: 0.0
2026-01-13 17:41:08 -    ✅ Període UTC: 04:30 - 05:00 | TX: 4.9 | TN: 2.9 | Pluja: 0.0
2026-01-13 17:41:08 -    ✅ Període UTC: 05:00 - 05:30 | TX: 4.1 | TN: 3.1 | Pluja: 0.0
2026-01-13 17:41:08 -    ✅ Període UTC: 05:30 - 06:00 | TX: 6.3 | TN: 2.9 | Pluja: 0.0
2026-01-13 17:41:08 -    ✅ Període UTC: 06:00 - 06:30 | TX: 7.4 | TN: 6.2 | Pluja: 0.0
2026-01-13 17:41:08 -    ✅ Període UTC: 06:30 - 07:00 | TX: 8.2 | TN: 7.2 | Pluja: 0.0
2026-01-13 17:41:08 -    ✅ Període UTC: 07:00 - 07:30 | TX: 8.2 | TN: 7.8 | Pluja: 0.0
2026-01-13 17:41:08 -    ✅ Període UTC: 07:30 - 08:00 | TX: 8.4 | TN: 7.5 | Pluja: 0.0
2026-01-13 17:41:08 -    ✅ Període UTC: 08:00 - 08:30 | TX: 9.3 | TN: 7.6 | Pluja: 0.0
2026-01-13 17:41:08 -    ✅ Període UTC: 08:30 - 09:00 | TX: 11.0 | TN: 9.3 | Pluja: 0.0
2026-01-13 17:41:08 -    ✅ Període UTC: 09:00 - 09:30 | TX: 12.6 | TN: 11.1 | Pluja: 0.0
2026-01-13 17:41:08 -    ✅ Període UTC: 09:30 - 10:00 | TX: 13.7 | TN: 12.6 | Pluja: 0.2
2026-01-13 17:41:08 -    ✅ Període UTC: 10:00 - 10:30 | TX: 14.1 | TN: 13.7 | Pluja: 0.0
2026-01-13 17:41:08 -    ✅ Període UTC: 10:30 - 11:00 | TX: 15.2 | TN: 14.2 | Pluja: 0.0
2026-01-13 17:41:08 -    ✅ Període UTC: 11:00 - 11:30 | TX: 16.1 | TN: 15.2 | Pluja: 0.0
2026-01-13 17:41:08 -    ✅ Període UTC: 11:30 - 12:00 | TX: 16.4 | TN: 15.9 | Pluja: 0.0
2026-01-13 17:41:08 -    ✅ Període UTC: 12:00 - 12:30 | TX: 16.9 | TN: 16.0 | Pluja: 0.0
2026-01-13 17:41:08 -    ✅ Període UTC: 12:30 - 13:00 | TX: 17.6 | TN: 16.7 | Pluja: 0.0
2026-01-13 17:41:08 -    ✅ Període UTC: 13:00 - 13:30 | TX: 18.2 | TN: 17.7 | Pluja: 0.0
2026-01-13 17:41:08 -    ✅ Període UTC: 13:30 - 14:00 | TX: 18.1 | TN: 17.9 | Pluja: 0.0
2026-01-13 17:41:08 -    ✅ Període UTC: 14:00 - 14:30 | TX: 18.2 | TN: 17.4 | Pluja: 0.0
2026-01-13 17:41:08 -    ✅ Període UTC: 14:30 - 15:00 | TX: 18.1 | TN: 17.4 | Pluja: 0.0
2026-01-13 17:41:08 -    ✅ Període UTC: 15:00 - 15:30 | TX: 17.6 | TN: 16.8 | Pluja: 0.0
2026-01-13 17:41:08 -    ✅ Període UTC: 15:30 - 16:00 | TX: 16.8 | TN: 15.9 | Pluja: 0.0
2026-01-13 17:41:08 -    ✅ Període UTC: 16:00 - 16:30 | TX: 15.9 | TN: 14.1 | Pluja: 0.0
2026-01-13 17:41:08 -    ✅ Període UTC: 16:30 - 17:00 | TX: 14.4 | TN: 13.5 | Pluja: 0.0
2026-01-13 17:41:08 -    ✅ Període UTC: 17:00 - 17:30 | TX: 13.3 | TN: 12.7 | Pluja: 0.0
2026-01-13 17:41:08 - 📈 Total períodes vàlids trobats: 35
2026-01-13 17:41:08 - 📊 RESUM CALCULAT:
2026-01-13 17:41:08 -    • Màxima del dia: 18.2°C
2026-01-13 17:41:08 -    • Mínima del dia: -0.6°C
2026-01-13 17:41:08 -    • Pluja acumulada: 0.2mm
2026-01-13 17:41:08 -    • Últim període: 17:00 - 17:30 UTC
2026-01-13 17:41:08 -    • Hora actualització: 17:41
2026-01-13 17:41:08 - 💾 Dades guardades a data/XJ_20260113.csv (35 registres)
2026-01-13 17:41:08 - ✅ Girona: 35 períodes processats
2026-01-13 17:41:08 - 💾 Dades guardades a data/weather_daily_20260113.json
2026-01-13 17:41:08 - 💾 Dades guardades a data/weather_summary.json
2026-01-13 17:41:08 - 
============================================================
2026-01-13 17:41:08 - 📋 RESUM FINAL DEL DIA (UTC)
2026-01-13 17:41:08 - ============================================================
2026-01-13 17:41:08 - 
📍 Fornells de la Selva:
2026-01-13 17:41:08 -    • Períodes: 35
2026-01-13 17:41:08 -    • Màxima: 17.2°C
2026-01-13 17:41:08 -    • Mínima: 2.3°C
2026-01-13 17:41:08 -    • Pluja: 0.0mm
2026-01-13 17:41:08 -    • Últim període: 17:00 - 17:30 UTC
2026-01-13 17:41:08 -    • Actualització: 17:41
2026-01-13 17:41:08 - 
📍 Girona:
2026-01-13 17:41:08 -    • Períodes: 35
2026-01-13 17:41:08 -    • Màxima: 18.2°C
2026-01-13 17:41:08 -    • Mínima: -0.6°C
2026-01-13 17:41:08 -    • Pluja: 0.2mm
2026-01-13 17:41:08 -    • Últim període: 17:00 - 17:30 UTC
2026-01-13 17:41:08 -    • Actualització: 17:41
2026-01-13 17:41:08 - 
💾 Fitxers generats:
2026-01-13 17:41:08 -    • data/weather_summary.json (per HTML)
2026-01-13 17:41:08 -    • data/weather_daily_YYYYMMDD.json (complet)
2026-01-13 17:41:08 -    • data/XX_YYYYMMDD.csv (per estació)
2026-01-13 17:41:08 - 
✅ PROCÉS COMPLETAT
2026-01-13 17:41:08 - ============================================================
