=== INICI DAILY SCRAPER (UTC): 2026-01-20 21:15:21 ===
2026-01-20 21:15:21 - ============================================================
2026-01-20 21:15:21 - 🌤️  DAILY WEATHER SCRAPER - VERSIÓ UTC
2026-01-20 21:15:21 - ============================================================
2026-01-20 21:15:21 - 
==================================================
2026-01-20 21:15:21 - 📡 Processant: Fornells de la Selva [UO]
2026-01-20 21:15:21 - 
🌐 Connectant a Fornells de la Selva...
2026-01-20 21:15:22 - 📊 Total files trobades a la taula: 43
2026-01-20 21:15:22 -    ✅ Període UTC: 00:00 - 00:30 | TX: 8.8 | TN: 8.7 | Pluja: 3.1
2026-01-20 21:15:22 -    ✅ Període UTC: 00:30 - 01:00 | TX: 8.7 | TN: 8.7 | Pluja: 5.0
2026-01-20 21:15:22 -    ✅ Període UTC: 01:00 - 01:30 | TX: 8.7 | TN: 8.5 | Pluja: 5.1
2026-01-20 21:15:22 -    ✅ Període UTC: 01:30 - 02:00 | TX: 8.5 | TN: 8.4 | Pluja: 3.9
2026-01-20 21:15:22 -    ✅ Període UTC: 02:00 - 02:30 | TX: 8.4 | TN: 8.2 | Pluja: 5.2
2026-01-20 21:15:22 -    ✅ Període UTC: 02:30 - 03:00 | TX: 8.2 | TN: 8.1 | Pluja: 4.3
2026-01-20 21:15:22 -    ✅ Període UTC: 03:00 - 03:30 | TX: 8.1 | TN: 8.0 | Pluja: 5.3
2026-01-20 21:15:22 -    ✅ Període UTC: 03:30 - 04:00 | TX: 8.0 | TN: 7.8 | Pluja: 3.5
2026-01-20 21:15:22 -    ✅ Període UTC: 04:00 - 04:30 | TX: 7.8 | TN: 7.5 | Pluja: 3.4
2026-01-20 21:15:22 -    ✅ Període UTC: 04:30 - 05:00 | TX: 7.5 | TN: 7.1 | Pluja: 3.3
2026-01-20 21:15:22 -    ✅ Període UTC: 05:00 - 05:30 | TX: 7.1 | TN: 6.7 | Pluja: 3.1
2026-01-20 21:15:22 -    ✅ Període UTC: 05:30 - 06:00 | TX: 6.7 | TN: 6.3 | Pluja: 3.6
2026-01-20 21:15:22 -    ✅ Període UTC: 06:00 - 06:30 | TX: 6.3 | TN: 6.2 | Pluja: 3.1
2026-01-20 21:15:22 -    ✅ Període UTC: 06:30 - 07:00 | TX: 6.2 | TN: 6.2 | Pluja: 2.2
2026-01-20 21:15:22 -    ✅ Període UTC: 07:00 - 07:30 | TX: 6.3 | TN: 6.2 | Pluja: 2.5
2026-01-20 21:15:22 -    ✅ Període UTC: 07:30 - 08:00 | TX: 6.5 | TN: 6.3 | Pluja: 2.6
2026-01-20 21:15:22 -    ✅ Període UTC: 08:00 - 08:30 | TX: 6.5 | TN: 6.5 | Pluja: 2.4
2026-01-20 21:15:22 -    ✅ Període UTC: 08:30 - 09:00 | TX: 6.7 | TN: 6.5 | Pluja: 2.5
2026-01-20 21:15:22 -    ✅ Període UTC: 09:00 - 09:30 | TX: 6.7 | TN: 6.7 | Pluja: 2.6
2026-01-20 21:15:22 -    ✅ Període UTC: 09:30 - 10:00 | TX: 6.8 | TN: 6.7 | Pluja: 3.1
2026-01-20 21:15:22 -    ✅ Període UTC: 10:00 - 10:30 | TX: 6.9 | TN: 6.8 | Pluja: 3.2
2026-01-20 21:15:22 -    ✅ Període UTC: 10:30 - 11:00 | TX: 7.1 | TN: 6.9 | Pluja: 2.2
2026-01-20 21:15:22 -    ✅ Període UTC: 11:00 - 11:30 | TX: 7.1 | TN: 7.1 | Pluja: 2.1
2026-01-20 21:15:22 -    ✅ Període UTC: 11:30 - 12:00 | TX: 7.4 | TN: 7.1 | Pluja: 1.2
2026-01-20 21:15:22 -    ✅ Període UTC: 12:00 - 12:30 | TX: 7.6 | TN: 7.4 | Pluja: 0.9
2026-01-20 21:15:22 -    ✅ Període UTC: 12:30 - 13:00 | TX: 7.7 | TN: 7.6 | Pluja: 0.7
2026-01-20 21:15:22 -    ✅ Període UTC: 13:00 - 13:30 | TX: 7.8 | TN: 7.7 | Pluja: 0.6
2026-01-20 21:15:22 -    ✅ Període UTC: 13:30 - 14:00 | TX: 7.9 | TN: 7.8 | Pluja: 0.3
2026-01-20 21:15:22 -    ✅ Període UTC: 14:00 - 14:30 | TX: 8.0 | TN: 7.9 | Pluja: 0.9
2026-01-20 21:15:22 -    ✅ Període UTC: 14:30 - 15:00 | TX: 7.9 | TN: 7.9 | Pluja: 0.4
2026-01-20 21:15:22 -    ✅ Període UTC: 15:00 - 15:30 | TX: 8.0 | TN: 7.9 | Pluja: 1.0
2026-01-20 21:15:22 -    ✅ Període UTC: 15:30 - 16:00 | TX: 8.1 | TN: 8.0 | Pluja: 0.6
2026-01-20 21:15:22 -    ✅ Període UTC: 16:00 - 16:30 | TX: 8.4 | TN: 8.1 | Pluja: 0.5
2026-01-20 21:15:22 -    ✅ Període UTC: 16:30 - 17:00 | TX: 8.5 | TN: 8.4 | Pluja: 0.3
2026-01-20 21:15:22 -    ✅ Període UTC: 17:00 - 17:30 | TX: 8.6 | TN: 8.5 | Pluja: 0.1
2026-01-20 21:15:22 -    ✅ Període UTC: 17:30 - 18:00 | TX: 8.7 | TN: 8.6 | Pluja: 0.0
2026-01-20 21:15:22 -    ✅ Període UTC: 18:00 - 18:30 | TX: 8.8 | TN: 8.6 | Pluja: 0.1
2026-01-20 21:15:22 -    ✅ Període UTC: 18:30 - 19:00 | TX: 8.8 | TN: 8.7 | Pluja: 0.1
2026-01-20 21:15:22 -    ✅ Període UTC: 19:00 - 19:30 | TX: 8.9 | TN: 8.8 | Pluja: 0.0
2026-01-20 21:15:22 -    ✅ Període UTC: 19:30 - 20:00 | TX: 9.0 | TN: 8.8 | Pluja: 0.0
2026-01-20 21:15:22 -    ✅ Període UTC: 20:00 - 20:30 | TX: 9.0 | TN: 8.9 | Pluja: 0.0
2026-01-20 21:15:22 -    ✅ Període UTC: 20:30 - 21:00 | TX: 9.1 | TN: 9.0 | Pluja: 0.0
2026-01-20 21:15:22 - 📈 Total períodes vàlids trobats: 42
2026-01-20 21:15:22 - 📊 RESUM CALCULAT:
2026-01-20 21:15:22 -    • Màxima del dia: 9.1°C
2026-01-20 21:15:22 -    • Mínima del dia: 6.2°C
2026-01-20 21:15:22 -    • Pluja acumulada: 84.99999999999997mm
2026-01-20 21:15:22 -    • Últim període: 20:30 - 21:00 UTC
2026-01-20 21:15:22 -    • Hora actualització: 21:15
2026-01-20 21:15:22 - 💾 Dades guardades a data/UO_20260120.csv (42 registres)
2026-01-20 21:15:22 - ✅ Fornells de la Selva: 42 períodes processats
2026-01-20 21:15:22 - 
==================================================
2026-01-20 21:15:22 - 📡 Processant: Girona [XJ]
2026-01-20 21:15:22 - 
🌐 Connectant a Girona...
2026-01-20 21:15:24 - 📊 Total files trobades a la taula: 43
2026-01-20 21:15:24 -    ✅ Període UTC: 00:00 - 00:30 | TX: 8.7 | TN: 8.5 | Pluja: 2.9
2026-01-20 21:15:24 -    ✅ Període UTC: 00:30 - 01:00 | TX: 8.5 | TN: 8.5 | Pluja: 3.4
2026-01-20 21:15:24 -    ✅ Període UTC: 01:00 - 01:30 | TX: 8.5 | TN: 8.4 | Pluja: 4.6
2026-01-20 21:15:24 -    ✅ Període UTC: 01:30 - 02:00 | TX: 8.4 | TN: 8.4 | Pluja: 3.4
2026-01-20 21:15:24 -    ✅ Període UTC: 02:00 - 02:30 | TX: 8.4 | TN: 8.2 | Pluja: 3.9
2026-01-20 21:15:24 -    ✅ Període UTC: 02:30 - 03:00 | TX: 8.2 | TN: 8.1 | Pluja: 3.7
2026-01-20 21:15:24 -    ✅ Període UTC: 03:00 - 03:30 | TX: 8.1 | TN: 7.8 | Pluja: 4.2
2026-01-20 21:15:24 -    ✅ Període UTC: 03:30 - 04:00 | TX: 7.8 | TN: 7.6 | Pluja: 3.9
2026-01-20 21:15:24 -    ✅ Període UTC: 04:00 - 04:30 | TX: 7.6 | TN: 7.1 | Pluja: 3.6
2026-01-20 21:15:24 -    ✅ Període UTC: 04:30 - 05:00 | TX: 7.1 | TN: 6.7 | Pluja: 3.2
2026-01-20 21:15:24 -    ✅ Període UTC: 05:00 - 05:30 | TX: 6.7 | TN: 6.3 | Pluja: 3.3
2026-01-20 21:15:24 -    ✅ Període UTC: 05:30 - 06:00 | TX: 6.3 | TN: 6.1 | Pluja: 3.7
2026-01-20 21:15:24 -    ✅ Període UTC: 06:00 - 06:30 | TX: 6.1 | TN: 6.0 | Pluja: 3.4
2026-01-20 21:15:24 -    ✅ Període UTC: 06:30 - 07:00 | TX: 6.2 | TN: 6.0 | Pluja: 2.6
2026-01-20 21:15:24 -    ✅ Període UTC: 07:00 - 07:30 | TX: 6.3 | TN: 6.2 | Pluja: 2.9
2026-01-20 21:15:24 -    ✅ Període UTC: 07:30 - 08:00 | TX: 6.5 | TN: 6.3 | Pluja: 3.3
2026-01-20 21:15:24 -    ✅ Període UTC: 08:00 - 08:30 | TX: 6.5 | TN: 6.4 | Pluja: 2.6
2026-01-20 21:15:24 -    ✅ Període UTC: 08:30 - 09:00 | TX: 6.7 | TN: 6.5 | Pluja: 2.9
2026-01-20 21:15:24 -    ✅ Període UTC: 09:00 - 09:30 | TX: 6.8 | TN: 6.7 | Pluja: 2.9
2026-01-20 21:15:24 -    ✅ Període UTC: 09:30 - 10:00 | TX: 6.9 | TN: 6.8 | Pluja: 3.1
2026-01-20 21:15:24 -    ✅ Període UTC: 10:00 - 10:30 | TX: 7.0 | TN: 6.9 | Pluja: 3.4
2026-01-20 21:15:24 -    ✅ Període UTC: 10:30 - 11:00 | TX: 7.2 | TN: 7.0 | Pluja: 3.0
2026-01-20 21:15:24 -    ✅ Període UTC: 11:00 - 11:30 | TX: 7.3 | TN: 7.2 | Pluja: 3.1
2026-01-20 21:15:24 -    ✅ Període UTC: 11:30 - 12:00 | TX: 7.6 | TN: 7.3 | Pluja: 1.8
2026-01-20 21:15:24 -    ✅ Període UTC: 12:00 - 12:30 | TX: 7.7 | TN: 7.5 | Pluja: 1.2
2026-01-20 21:15:24 -    ✅ Període UTC: 12:30 - 13:00 | TX: 7.8 | TN: 7.6 | Pluja: 1.2
2026-01-20 21:15:24 -    ✅ Període UTC: 13:00 - 13:30 | TX: 8.0 | TN: 7.8 | Pluja: 0.9
2026-01-20 21:15:24 -    ✅ Període UTC: 13:30 - 14:00 | TX: 8.2 | TN: 8.0 | Pluja: 0.5
2026-01-20 21:15:24 -    ✅ Període UTC: 14:00 - 14:30 | TX: 8.3 | TN: 8.1 | Pluja: 0.5
2026-01-20 21:15:24 -    ✅ Període UTC: 14:30 - 15:00 | TX: 8.2 | TN: 8.1 | Pluja: 0.7
2026-01-20 21:15:24 -    ✅ Període UTC: 15:00 - 15:30 | TX: 8.3 | TN: 8.2 | Pluja: 0.2
2026-01-20 21:15:24 -    ✅ Període UTC: 15:30 - 16:00 | TX: 8.4 | TN: 8.3 | Pluja: 0.1
2026-01-20 21:15:24 -    ✅ Període UTC: 16:00 - 16:30 | TX: 8.6 | TN: 8.4 | Pluja: 0.2
2026-01-20 21:15:24 -    ✅ Període UTC: 16:30 - 17:00 | TX: 8.7 | TN: 8.6 | Pluja: 0.1
2026-01-20 21:15:24 -    ✅ Període UTC: 17:00 - 17:30 | TX: 8.8 | TN: 8.7 | Pluja: 0.1
2026-01-20 21:15:24 -    ✅ Període UTC: 17:30 - 18:00 | TX: 8.8 | TN: 8.7 | Pluja: 0.1
2026-01-20 21:15:24 -    ✅ Període UTC: 18:00 - 18:30 | TX: 8.9 | TN: 8.8 | Pluja: 0.1
2026-01-20 21:15:24 -    ✅ Període UTC: 18:30 - 19:00 | TX: 8.9 | TN: 8.9 | Pluja: 0.1
2026-01-20 21:15:24 -    ✅ Període UTC: 19:00 - 19:30 | TX: 9.0 | TN: 8.9 | Pluja: 0.1
2026-01-20 21:15:24 -    ✅ Període UTC: 19:30 - 20:00 | TX: 9.0 | TN: 9.0 | Pluja: 0.0
2026-01-20 21:15:24 -    ✅ Període UTC: 20:00 - 20:30 | TX: 9.0 | TN: 9.0 | Pluja: 0.1
2026-01-20 21:15:24 -    ✅ Període UTC: 20:30 - 21:00 | TX: 9.0 | TN: 8.9 | Pluja: 0.0
2026-01-20 21:15:24 - 📈 Total períodes vàlids trobats: 42
2026-01-20 21:15:24 - 📊 RESUM CALCULAT:
2026-01-20 21:15:24 -    • Màxima del dia: 9.0°C
2026-01-20 21:15:24 -    • Mínima del dia: 6.0°C
2026-01-20 21:15:24 -    • Pluja acumulada: 84.99999999999996mm
2026-01-20 21:15:24 -    • Últim període: 20:30 - 21:00 UTC
2026-01-20 21:15:24 -    • Hora actualització: 21:15
2026-01-20 21:15:24 - 💾 Dades guardades a data/XJ_20260120.csv (42 registres)
2026-01-20 21:15:24 - ✅ Girona: 42 períodes processats
2026-01-20 21:15:24 - 💾 Dades guardades a data/weather_daily_20260120.json
2026-01-20 21:15:24 - 💾 Dades guardades a data/weather_summary.json
2026-01-20 21:15:24 - 
============================================================
2026-01-20 21:15:24 - 📋 RESUM FINAL DEL DIA (UTC)
2026-01-20 21:15:24 - ============================================================
2026-01-20 21:15:24 - 
📍 Fornells de la Selva:
2026-01-20 21:15:24 -    • Períodes: 42
2026-01-20 21:15:24 -    • Màxima: 9.1°C
2026-01-20 21:15:24 -    • Mínima: 6.2°C
2026-01-20 21:15:24 -    • Pluja: 84.99999999999997mm
2026-01-20 21:15:24 -    • Últim període: 20:30 - 21:00 UTC
2026-01-20 21:15:24 -    • Actualització: 21:15
2026-01-20 21:15:24 - 
📍 Girona:
2026-01-20 21:15:24 -    • Períodes: 42
2026-01-20 21:15:24 -    • Màxima: 9.0°C
2026-01-20 21:15:24 -    • Mínima: 6.0°C
2026-01-20 21:15:24 -    • Pluja: 84.99999999999996mm
2026-01-20 21:15:24 -    • Últim període: 20:30 - 21:00 UTC
2026-01-20 21:15:24 -    • Actualització: 21:15
2026-01-20 21:15:24 - 
💾 Fitxers generats:
2026-01-20 21:15:24 -    • data/weather_summary.json (per HTML)
2026-01-20 21:15:24 -    • data/weather_daily_YYYYMMDD.json (complet)
2026-01-20 21:15:24 -    • data/XX_YYYYMMDD.csv (per estació)
2026-01-20 21:15:24 - 
✅ PROCÉS COMPLETAT
2026-01-20 21:15:24 - ============================================================
