=== INICI DAILY SCRAPER (UTC): 2026-01-30 19:50:20 ===
2026-01-30 19:50:20 - ============================================================
2026-01-30 19:50:20 - 🌤️  DAILY WEATHER SCRAPER - VERSIÓ UTC
2026-01-30 19:50:20 - ============================================================
2026-01-30 19:50:20 - 
==================================================
2026-01-30 19:50:20 - 📡 Processant: Fornells de la Selva [UO]
2026-01-30 19:50:20 - 
🌐 Connectant a Fornells de la Selva...
2026-01-30 19:50:23 - 📊 Total files trobades a la taula: 40
2026-01-30 19:50:23 -    ✅ Període UTC: 00:00 - 00:30 | TX: 2.6 | TN: 2.3 | Pluja: 0.0
2026-01-30 19:50:23 -    ✅ Període UTC: 00:30 - 01:00 | TX: 3.3 | TN: 2.3 | Pluja: 0.0
2026-01-30 19:50:23 -    ✅ Període UTC: 01:00 - 01:30 | TX: 3.8 | TN: 3.3 | Pluja: 0.0
2026-01-30 19:50:23 -    ✅ Període UTC: 01:30 - 02:00 | TX: 4.2 | TN: 3.8 | Pluja: 0.0
2026-01-30 19:50:23 -    ✅ Període UTC: 02:00 - 02:30 | TX: 4.0 | TN: 3.3 | Pluja: 0.0
2026-01-30 19:50:23 -    ✅ Període UTC: 02:30 - 03:00 | TX: 4.2 | TN: 3.7 | Pluja: 0.0
2026-01-30 19:50:23 -    ✅ Període UTC: 03:00 - 03:30 | TX: 4.6 | TN: 3.8 | Pluja: 0.0
2026-01-30 19:50:23 -    ✅ Període UTC: 03:30 - 04:00 | TX: 4.7 | TN: 4.4 | Pluja: 0.0
2026-01-30 19:50:23 -    ✅ Període UTC: 04:00 - 04:30 | TX: 4.6 | TN: 3.9 | Pluja: 0.0
2026-01-30 19:50:23 -    ✅ Període UTC: 04:30 - 05:00 | TX: 4.0 | TN: 2.5 | Pluja: 0.0
2026-01-30 19:50:23 -    ✅ Període UTC: 05:00 - 05:30 | TX: 2.6 | TN: 2.0 | Pluja: 0.0
2026-01-30 19:50:23 -    ✅ Període UTC: 05:30 - 06:00 | TX: 2.3 | TN: 1.6 | Pluja: 0.0
2026-01-30 19:50:23 -    ✅ Període UTC: 06:00 - 06:30 | TX: 2.0 | TN: 1.2 | Pluja: 0.0
2026-01-30 19:50:23 -    ✅ Període UTC: 06:30 - 07:00 | TX: 1.9 | TN: 1.1 | Pluja: 0.0
2026-01-30 19:50:23 -    ✅ Període UTC: 07:00 - 07:30 | TX: 1.9 | TN: 1.1 | Pluja: 0.0
2026-01-30 19:50:23 -    ✅ Període UTC: 07:30 - 08:00 | TX: 3.1 | TN: 1.8 | Pluja: 0.0
2026-01-30 19:50:23 -    ✅ Període UTC: 08:00 - 08:30 | TX: 5.5 | TN: 3.2 | Pluja: 0.0
2026-01-30 19:50:23 -    ✅ Període UTC: 08:30 - 09:00 | TX: 8.2 | TN: 5.6 | Pluja: 0.0
2026-01-30 19:50:23 -    ✅ Període UTC: 09:00 - 09:30 | TX: 10.8 | TN: 8.4 | Pluja: 0.1
2026-01-30 19:50:23 -    ✅ Període UTC: 09:30 - 10:00 | TX: 12.8 | TN: 10.4 | Pluja: 0.0
2026-01-30 19:50:23 -    ✅ Període UTC: 10:00 - 10:30 | TX: 12.7 | TN: 11.6 | Pluja: 0.0
2026-01-30 19:50:23 -    ✅ Període UTC: 10:30 - 11:00 | TX: 13.3 | TN: 12.6 | Pluja: 0.0
2026-01-30 19:50:23 -    ✅ Període UTC: 11:00 - 11:30 | TX: 13.2 | TN: 12.6 | Pluja: 0.0
2026-01-30 19:50:23 -    ✅ Període UTC: 11:30 - 12:00 | TX: 15.0 | TN: 13.1 | Pluja: 0.0
2026-01-30 19:50:23 -    ✅ Període UTC: 12:00 - 12:30 | TX: 15.8 | TN: 14.9 | Pluja: 0.0
2026-01-30 19:50:23 -    ✅ Període UTC: 12:30 - 13:00 | TX: 16.0 | TN: 15.5 | Pluja: 0.0
2026-01-30 19:50:23 -    ✅ Període UTC: 13:00 - 13:30 | TX: 16.8 | TN: 15.3 | Pluja: 0.0
2026-01-30 19:50:23 -    ✅ Període UTC: 13:30 - 14:00 | TX: 16.3 | TN: 15.6 | Pluja: 0.0
2026-01-30 19:50:23 -    ✅ Període UTC: 14:00 - 14:30 | TX: 16.9 | TN: 15.7 | Pluja: 0.0
2026-01-30 19:50:23 -    ✅ Període UTC: 14:30 - 15:00 | TX: 17.5 | TN: 15.9 | Pluja: 0.0
2026-01-30 19:50:23 -    ✅ Període UTC: 15:00 - 15:30 | TX: 17.6 | TN: 15.7 | Pluja: 0.0
2026-01-30 19:50:23 -    ✅ Període UTC: 15:30 - 16:00 | TX: 16.4 | TN: 15.5 | Pluja: 0.0
2026-01-30 19:50:23 -    ✅ Període UTC: 16:00 - 16:30 | TX: 15.6 | TN: 13.9 | Pluja: 0.0
2026-01-30 19:50:23 -    ✅ Període UTC: 16:30 - 17:00 | TX: 14.0 | TN: 12.5 | Pluja: 0.0
2026-01-30 19:50:23 -    ✅ Període UTC: 17:00 - 17:30 | TX: 12.5 | TN: 11.2 | Pluja: 0.0
2026-01-30 19:50:23 -    ✅ Període UTC: 17:30 - 18:00 | TX: 11.9 | TN: 11.3 | Pluja: 0.0
2026-01-30 19:50:23 -    ✅ Període UTC: 18:00 - 18:30 | TX: 12.6 | TN: 11.4 | Pluja: 0.0
2026-01-30 19:50:23 -    ✅ Període UTC: 18:30 - 19:00 | TX: 13.6 | TN: 11.1 | Pluja: 0.0
2026-01-30 19:50:23 -    ✅ Període UTC: 19:00 - 19:30 | TX: 12.9 | TN: 11.5 | Pluja: 0.0
2026-01-30 19:50:23 - 📈 Total períodes vàlids trobats: 39
2026-01-30 19:50:23 - 📊 RESUM CALCULAT:
2026-01-30 19:50:23 -    • Màxima del dia: 17.6°C
2026-01-30 19:50:23 -    • Mínima del dia: 1.1°C
2026-01-30 19:50:23 -    • Pluja acumulada: 0.1mm
2026-01-30 19:50:23 -    • Últim període: 19:00 - 19:30 UTC
2026-01-30 19:50:23 -    • Hora actualització: 19:50
2026-01-30 19:50:23 - 💾 Dades guardades a data/UO_20260130.csv (39 registres)
2026-01-30 19:50:23 - ✅ Fornells de la Selva: 39 períodes processats
2026-01-30 19:50:23 - 
==================================================
2026-01-30 19:50:23 - 📡 Processant: Girona [XJ]
2026-01-30 19:50:23 - 
🌐 Connectant a Girona...
2026-01-30 19:50:25 - 📊 Total files trobades a la taula: 40
2026-01-30 19:50:25 -    ✅ Període UTC: 00:00 - 00:30 | TX: 3.1 | TN: 2.5 | Pluja: 0.0
2026-01-30 19:50:25 -    ✅ Període UTC: 00:30 - 01:00 | TX: 3.3 | TN: 2.7 | Pluja: 0.0
2026-01-30 19:50:25 -    ✅ Període UTC: 01:00 - 01:30 | TX: 4.9 | TN: 3.3 | Pluja: 0.2
2026-01-30 19:50:25 -    ✅ Període UTC: 01:30 - 02:00 | TX: 5.0 | TN: 4.4 | Pluja: 0.0
2026-01-30 19:50:25 -    ✅ Període UTC: 02:00 - 02:30 | TX: 5.5 | TN: 4.9 | Pluja: 0.1
2026-01-30 19:50:25 -    ✅ Període UTC: 02:30 - 03:00 | TX: 5.0 | TN: 4.4 | Pluja: 0.0
2026-01-30 19:50:25 -    ✅ Període UTC: 03:00 - 03:30 | TX: 5.0 | TN: 4.5 | Pluja: 0.0
2026-01-30 19:50:25 -    ✅ Període UTC: 03:30 - 04:00 | TX: 5.8 | TN: 4.9 | Pluja: 0.0
2026-01-30 19:50:25 -    ✅ Període UTC: 04:00 - 04:30 | TX: 5.6 | TN: 4.8 | Pluja: 0.0
2026-01-30 19:50:25 -    ✅ Període UTC: 04:30 - 05:00 | TX: 5.3 | TN: 4.9 | Pluja: 0.0
2026-01-30 19:50:25 -    ✅ Període UTC: 05:00 - 05:30 | TX: 5.2 | TN: 4.6 | Pluja: 0.0
2026-01-30 19:50:25 -    ✅ Període UTC: 05:30 - 06:00 | TX: 6.2 | TN: 5.1 | Pluja: 0.0
2026-01-30 19:50:25 -    ✅ Període UTC: 06:00 - 06:30 | TX: 6.1 | TN: 5.6 | Pluja: 0.0
2026-01-30 19:50:25 -    ✅ Període UTC: 06:30 - 07:00 | TX: 5.7 | TN: 5.4 | Pluja: 0.0
2026-01-30 19:50:25 -    ✅ Període UTC: 07:00 - 07:30 | TX: 5.4 | TN: 4.0 | Pluja: 0.0
2026-01-30 19:50:25 -    ✅ Període UTC: 07:30 - 08:00 | TX: 7.1 | TN: 4.4 | Pluja: 0.0
2026-01-30 19:50:25 -    ✅ Període UTC: 08:00 - 08:30 | TX: 9.2 | TN: 7.2 | Pluja: 0.0
2026-01-30 19:50:25 -    ✅ Període UTC: 08:30 - 09:00 | TX: 11.2 | TN: 9.1 | Pluja: 0.0
2026-01-30 19:50:25 -    ✅ Període UTC: 09:00 - 09:30 | TX: 11.5 | TN: 10.5 | Pluja: 0.1
2026-01-30 19:50:25 -    ✅ Període UTC: 09:30 - 10:00 | TX: 12.9 | TN: 11.4 | Pluja: 0.0
2026-01-30 19:50:25 -    ✅ Període UTC: 10:00 - 10:30 | TX: 13.9 | TN: 13.0 | Pluja: 0.0
2026-01-30 19:50:25 -    ✅ Període UTC: 10:30 - 11:00 | TX: 14.5 | TN: 13.9 | Pluja: 0.0
2026-01-30 19:50:25 -    ✅ Període UTC: 11:00 - 11:30 | TX: 15.6 | TN: 14.1 | Pluja: 0.0
2026-01-30 19:50:25 -    ✅ Període UTC: 11:30 - 12:00 | TX: 15.8 | TN: 15.1 | Pluja: 0.0
2026-01-30 19:50:25 -    ✅ Període UTC: 12:00 - 12:30 | TX: 15.8 | TN: 15.3 | Pluja: 0.0
2026-01-30 19:50:25 -    ✅ Període UTC: 12:30 - 13:00 | TX: 16.1 | TN: 15.7 | Pluja: 0.0
2026-01-30 19:50:25 -    ✅ Període UTC: 13:00 - 13:30 | TX: 16.2 | TN: 15.7 | Pluja: 0.0
2026-01-30 19:50:25 -    ✅ Període UTC: 13:30 - 14:00 | TX: 16.3 | TN: 15.8 | Pluja: 0.0
2026-01-30 19:50:25 -    ✅ Període UTC: 14:00 - 14:30 | TX: 16.6 | TN: 16.1 | Pluja: 0.0
2026-01-30 19:50:25 -    ✅ Període UTC: 14:30 - 15:00 | TX: 16.4 | TN: 16.1 | Pluja: 0.0
2026-01-30 19:50:25 -    ✅ Període UTC: 15:00 - 15:30 | TX: 16.5 | TN: 16.2 | Pluja: 0.0
2026-01-30 19:50:25 -    ✅ Període UTC: 15:30 - 16:00 | TX: 17.0 | TN: 16.2 | Pluja: 0.0
2026-01-30 19:50:25 -    ✅ Període UTC: 16:00 - 16:30 | TX: 16.5 | TN: 14.5 | Pluja: 0.0
2026-01-30 19:50:25 -    ✅ Període UTC: 16:30 - 17:00 | TX: 14.5 | TN: 12.9 | Pluja: 0.0
2026-01-30 19:50:25 -    ✅ Període UTC: 17:00 - 17:30 | TX: 12.7 | TN: 11.1 | Pluja: 0.0
2026-01-30 19:50:25 -    ✅ Període UTC: 17:30 - 18:00 | TX: 12.9 | TN: 11.1 | Pluja: 0.0
2026-01-30 19:50:25 -    ✅ Període UTC: 18:00 - 18:30 | TX: 13.1 | TN: 12.2 | Pluja: 0.0
2026-01-30 19:50:25 -    ✅ Període UTC: 18:30 - 19:00 | TX: 13.0 | TN: 12.4 | Pluja: 0.0
2026-01-30 19:50:25 -    ✅ Període UTC: 19:00 - 19:30 | TX: 13.3 | TN: 12.9 | Pluja: 0.0
2026-01-30 19:50:25 - 📈 Total períodes vàlids trobats: 39
2026-01-30 19:50:25 - 📊 RESUM CALCULAT:
2026-01-30 19:50:25 -    • Màxima del dia: 17.0°C
2026-01-30 19:50:25 -    • Mínima del dia: 2.5°C
2026-01-30 19:50:25 -    • Pluja acumulada: 0.4mm
2026-01-30 19:50:25 -    • Últim període: 19:00 - 19:30 UTC
2026-01-30 19:50:25 -    • Hora actualització: 19:50
2026-01-30 19:50:25 - 💾 Dades guardades a data/XJ_20260130.csv (39 registres)
2026-01-30 19:50:25 - ✅ Girona: 39 períodes processats
2026-01-30 19:50:25 - 💾 Dades guardades a data/weather_daily_20260130.json
2026-01-30 19:50:25 - 💾 Dades guardades a data/weather_summary.json
2026-01-30 19:50:25 - 
============================================================
2026-01-30 19:50:25 - 📋 RESUM FINAL DEL DIA (UTC)
2026-01-30 19:50:25 - ============================================================
2026-01-30 19:50:25 - 
📍 Fornells de la Selva:
2026-01-30 19:50:25 -    • Períodes: 39
2026-01-30 19:50:25 -    • Màxima: 17.6°C
2026-01-30 19:50:25 -    • Mínima: 1.1°C
2026-01-30 19:50:25 -    • Pluja: 0.1mm
2026-01-30 19:50:25 -    • Últim període: 19:00 - 19:30 UTC
2026-01-30 19:50:25 -    • Actualització: 19:50
2026-01-30 19:50:25 - 
📍 Girona:
2026-01-30 19:50:25 -    • Períodes: 39
2026-01-30 19:50:25 -    • Màxima: 17.0°C
2026-01-30 19:50:25 -    • Mínima: 2.5°C
2026-01-30 19:50:25 -    • Pluja: 0.4mm
2026-01-30 19:50:25 -    • Últim període: 19:00 - 19:30 UTC
2026-01-30 19:50:25 -    • Actualització: 19:50
2026-01-30 19:50:25 - 
💾 Fitxers generats:
2026-01-30 19:50:25 -    • data/weather_summary.json (per HTML)
2026-01-30 19:50:25 -    • data/weather_daily_YYYYMMDD.json (complet)
2026-01-30 19:50:25 -    • data/XX_YYYYMMDD.csv (per estació)
2026-01-30 19:50:25 - 
✅ PROCÉS COMPLETAT
2026-01-30 19:50:25 - ============================================================
