=== INICI DAILY SCRAPER (UTC): 2026-02-03 14:20:24 ===
2026-02-03 14:20:24 - ============================================================
2026-02-03 14:20:24 - 🌤️  DAILY WEATHER SCRAPER - VERSIÓ UTC
2026-02-03 14:20:24 - ============================================================
2026-02-03 14:20:24 - 
==================================================
2026-02-03 14:20:24 - 📡 Processant: Fornells de la Selva [UO]
2026-02-03 14:20:24 - 
🌐 Connectant a Fornells de la Selva...
2026-02-03 14:20:25 - 📊 Total files trobades a la taula: 29
2026-02-03 14:20:25 -    ✅ Període UTC: 00:00 - 00:30 | TX: 9.9 | TN: 9.4 | Pluja: 0.0
2026-02-03 14:20:25 -    ✅ Període UTC: 00:30 - 01:00 | TX: 9.5 | TN: 9.3 | Pluja: 0.0
2026-02-03 14:20:25 -    ✅ Període UTC: 01:00 - 01:30 | TX: 9.8 | TN: 8.9 | Pluja: 0.0
2026-02-03 14:20:25 -    ✅ Període UTC: 01:30 - 02:00 | TX: 9.6 | TN: 8.4 | Pluja: 0.0
2026-02-03 14:20:25 -    ✅ Període UTC: 02:00 - 02:30 | TX: 8.4 | TN: 6.5 | Pluja: 0.0
2026-02-03 14:20:25 -    ✅ Període UTC: 02:30 - 03:00 | TX: 6.9 | TN: 5.6 | Pluja: 0.0
2026-02-03 14:20:25 -    ✅ Període UTC: 03:00 - 03:30 | TX: 6.6 | TN: 5.6 | Pluja: 0.0
2026-02-03 14:20:25 -    ✅ Període UTC: 03:30 - 04:00 | TX: 6.5 | TN: 4.2 | Pluja: 0.0
2026-02-03 14:20:25 -    ✅ Període UTC: 04:00 - 04:30 | TX: 4.3 | TN: 3.3 | Pluja: 0.0
2026-02-03 14:20:25 -    ✅ Període UTC: 04:30 - 05:00 | TX: 3.8 | TN: 3.0 | Pluja: 0.0
2026-02-03 14:20:25 -    ✅ Període UTC: 05:00 - 05:30 | TX: 6.3 | TN: 4.2 | Pluja: 0.0
2026-02-03 14:20:25 -    ✅ Període UTC: 05:30 - 06:00 | TX: 5.8 | TN: 4.3 | Pluja: 0.0
2026-02-03 14:20:25 -    ✅ Període UTC: 06:00 - 06:30 | TX: 4.3 | TN: 3.0 | Pluja: 0.0
2026-02-03 14:20:25 -    ✅ Període UTC: 06:30 - 07:00 | TX: 4.2 | TN: 2.8 | Pluja: 0.0
2026-02-03 14:20:25 -    ✅ Període UTC: 07:00 - 07:30 | TX: 3.1 | TN: 2.6 | Pluja: 0.0
2026-02-03 14:20:25 -    ✅ Període UTC: 07:30 - 08:00 | TX: 5.1 | TN: 3.0 | Pluja: 0.0
2026-02-03 14:20:25 -    ✅ Període UTC: 08:00 - 08:30 | TX: 8.5 | TN: 5.2 | Pluja: 0.0
2026-02-03 14:20:25 -    ✅ Període UTC: 08:30 - 09:00 | TX: 10.1 | TN: 8.4 | Pluja: 0.0
2026-02-03 14:20:25 -    ✅ Període UTC: 09:00 - 09:30 | TX: 11.5 | TN: 10.2 | Pluja: 0.0
2026-02-03 14:20:25 -    ✅ Període UTC: 09:30 - 10:00 | TX: 12.2 | TN: 11.5 | Pluja: 0.0
2026-02-03 14:20:25 -    ✅ Període UTC: 10:00 - 10:30 | TX: 13.4 | TN: 12.3 | Pluja: 0.0
2026-02-03 14:20:25 -    ✅ Període UTC: 10:30 - 11:00 | TX: 14.6 | TN: 13.4 | Pluja: 0.0
2026-02-03 14:20:25 -    ✅ Període UTC: 11:00 - 11:30 | TX: 15.5 | TN: 14.2 | Pluja: 0.0
2026-02-03 14:20:25 -    ✅ Període UTC: 11:30 - 12:00 | TX: 15.8 | TN: 15.5 | Pluja: 0.0
2026-02-03 14:20:25 -    ✅ Període UTC: 12:00 - 12:30 | TX: 16.0 | TN: 15.5 | Pluja: 0.0
2026-02-03 14:20:25 -    ✅ Període UTC: 12:30 - 13:00 | TX: 15.9 | TN: 15.3 | Pluja: 0.0
2026-02-03 14:20:25 -    ✅ Període UTC: 13:00 - 13:30 | TX: 16.3 | TN: 15.6 | Pluja: 0.0
2026-02-03 14:20:25 -    ✅ Període UTC: 13:30 - 14:00 | TX: 16.1 | TN: 15.6 | Pluja: 0.0
2026-02-03 14:20:25 - 📈 Total períodes vàlids trobats: 28
2026-02-03 14:20:25 - 📊 RESUM CALCULAT:
2026-02-03 14:20:25 -    • Màxima del dia: 16.3°C
2026-02-03 14:20:25 -    • Mínima del dia: 2.6°C
2026-02-03 14:20:25 -    • Pluja acumulada: 0.0mm
2026-02-03 14:20:25 -    • Últim període: 13:30 - 14:00 UTC
2026-02-03 14:20:25 -    • Hora actualització: 14:20
2026-02-03 14:20:25 - 💾 Dades guardades a data/UO_20260203.csv (28 registres)
2026-02-03 14:20:25 - ✅ Fornells de la Selva: 28 períodes processats
2026-02-03 14:20:25 - 
==================================================
2026-02-03 14:20:25 - 📡 Processant: Girona [XJ]
2026-02-03 14:20:25 - 
🌐 Connectant a Girona...
2026-02-03 14:20:27 - 📊 Total files trobades a la taula: 29
2026-02-03 14:20:27 -    ✅ Període UTC: 00:00 - 00:30 | TX: 10.1 | TN: 9.9 | Pluja: 0.0
2026-02-03 14:20:27 -    ✅ Període UTC: 00:30 - 01:00 | TX: 10.2 | TN: 9.6 | Pluja: 0.0
2026-02-03 14:20:27 -    ✅ Període UTC: 01:00 - 01:30 | TX: 9.6 | TN: 8.1 | Pluja: 0.0
2026-02-03 14:20:27 -    ✅ Període UTC: 01:30 - 02:00 | TX: 8.7 | TN: 7.7 | Pluja: 0.0
2026-02-03 14:20:27 -    ✅ Període UTC: 02:00 - 02:30 | TX: 7.6 | TN: 6.6 | Pluja: 0.0
2026-02-03 14:20:27 -    ✅ Període UTC: 02:30 - 03:00 | TX: 9.8 | TN: 7.2 | Pluja: 0.0
2026-02-03 14:20:27 -    ✅ Període UTC: 03:00 - 03:30 | TX: 7.6 | TN: 5.7 | Pluja: 0.0
2026-02-03 14:20:27 -    ✅ Període UTC: 03:30 - 04:00 | TX: 5.9 | TN: 5.0 | Pluja: 0.0
2026-02-03 14:20:27 -    ✅ Període UTC: 04:00 - 04:30 | TX: 5.4 | TN: 4.1 | Pluja: 0.0
2026-02-03 14:20:27 -    ✅ Període UTC: 04:30 - 05:00 | TX: 5.9 | TN: 3.7 | Pluja: 0.0
2026-02-03 14:20:27 -    ✅ Període UTC: 05:00 - 05:30 | TX: 5.4 | TN: 5.0 | Pluja: 0.0
2026-02-03 14:20:27 -    ✅ Període UTC: 05:30 - 06:00 | TX: 6.4 | TN: 4.9 | Pluja: 0.0
2026-02-03 14:20:27 -    ✅ Període UTC: 06:00 - 06:30 | TX: 6.3 | TN: 4.3 | Pluja: 0.0
2026-02-03 14:20:27 -    ✅ Període UTC: 06:30 - 07:00 | TX: 5.5 | TN: 4.5 | Pluja: 0.0
2026-02-03 14:20:27 -    ✅ Període UTC: 07:00 - 07:30 | TX: 6.0 | TN: 4.4 | Pluja: 0.0
2026-02-03 14:20:27 -    ✅ Període UTC: 07:30 - 08:00 | TX: 7.5 | TN: 6.0 | Pluja: 0.0
2026-02-03 14:20:27 -    ✅ Període UTC: 08:00 - 08:30 | TX: 8.9 | TN: 7.6 | Pluja: 0.0
2026-02-03 14:20:27 -    ✅ Període UTC: 08:30 - 09:00 | TX: 10.0 | TN: 8.8 | Pluja: 0.0
2026-02-03 14:20:27 -    ✅ Període UTC: 09:00 - 09:30 | TX: 11.4 | TN: 10.0 | Pluja: 0.0
2026-02-03 14:20:27 -    ✅ Període UTC: 09:30 - 10:00 | TX: 12.8 | TN: 11.5 | Pluja: 0.0
2026-02-03 14:20:27 -    ✅ Període UTC: 10:00 - 10:30 | TX: 13.9 | TN: 12.8 | Pluja: 0.0
2026-02-03 14:20:27 -    ✅ Període UTC: 10:30 - 11:00 | TX: 14.2 | TN: 13.9 | Pluja: 0.0
2026-02-03 14:20:27 -    ✅ Període UTC: 11:00 - 11:30 | TX: 14.9 | TN: 14.2 | Pluja: 0.0
2026-02-03 14:20:27 -    ✅ Període UTC: 11:30 - 12:00 | TX: 15.2 | TN: 14.7 | Pluja: 0.0
2026-02-03 14:20:27 -    ✅ Període UTC: 12:00 - 12:30 | TX: 15.9 | TN: 15.2 | Pluja: 0.0
2026-02-03 14:20:27 -    ✅ Període UTC: 12:30 - 13:00 | TX: 16.9 | TN: 15.7 | Pluja: 0.0
2026-02-03 14:20:27 -    ✅ Període UTC: 13:00 - 13:30 | TX: 16.9 | TN: 16.4 | Pluja: 0.0
2026-02-03 14:20:27 -    ✅ Període UTC: 13:30 - 14:00 | TX: 17.1 | TN: 16.6 | Pluja: 0.0
2026-02-03 14:20:27 - 📈 Total períodes vàlids trobats: 28
2026-02-03 14:20:27 - 📊 RESUM CALCULAT:
2026-02-03 14:20:27 -    • Màxima del dia: 17.1°C
2026-02-03 14:20:27 -    • Mínima del dia: 3.7°C
2026-02-03 14:20:27 -    • Pluja acumulada: 0.0mm
2026-02-03 14:20:27 -    • Últim període: 13:30 - 14:00 UTC
2026-02-03 14:20:27 -    • Hora actualització: 14:20
2026-02-03 14:20:27 - 💾 Dades guardades a data/XJ_20260203.csv (28 registres)
2026-02-03 14:20:27 - ✅ Girona: 28 períodes processats
2026-02-03 14:20:27 - 💾 Dades guardades a data/weather_daily_20260203.json
2026-02-03 14:20:27 - 💾 Dades guardades a data/weather_summary.json
2026-02-03 14:20:27 - 
============================================================
2026-02-03 14:20:27 - 📋 RESUM FINAL DEL DIA (UTC)
2026-02-03 14:20:27 - ============================================================
2026-02-03 14:20:27 - 
📍 Fornells de la Selva:
2026-02-03 14:20:27 -    • Períodes: 28
2026-02-03 14:20:27 -    • Màxima: 16.3°C
2026-02-03 14:20:27 -    • Mínima: 2.6°C
2026-02-03 14:20:27 -    • Pluja: 0.0mm
2026-02-03 14:20:27 -    • Últim període: 13:30 - 14:00 UTC
2026-02-03 14:20:27 -    • Actualització: 14:20
2026-02-03 14:20:27 - 
📍 Girona:
2026-02-03 14:20:27 -    • Períodes: 28
2026-02-03 14:20:27 -    • Màxima: 17.1°C
2026-02-03 14:20:27 -    • Mínima: 3.7°C
2026-02-03 14:20:27 -    • Pluja: 0.0mm
2026-02-03 14:20:27 -    • Últim període: 13:30 - 14:00 UTC
2026-02-03 14:20:27 -    • Actualització: 14:20
2026-02-03 14:20:27 - 
💾 Fitxers generats:
2026-02-03 14:20:27 -    • data/weather_summary.json (per HTML)
2026-02-03 14:20:27 -    • data/weather_daily_YYYYMMDD.json (complet)
2026-02-03 14:20:27 -    • data/XX_YYYYMMDD.csv (per estació)
2026-02-03 14:20:27 - 
✅ PROCÉS COMPLETAT
2026-02-03 14:20:27 - ============================================================
